,drug,condition,rating,duration,review_date,upvotes,review,username
0,Gabapentin,Alcohol Withdrawal,8.0,Taken for 1 to 6 months,"December 18, 2021",4,"Every time I tried to detox from alcohol before taking gabapentin, my nerves would feel like lightning+fire and all my muscles would feel tense while anxiety and irritability ruled my mood. I would sometimes deal with that detox but usually not for long. Without gabapentin I was struggling to even get sober, let alone stay that way.Gabapentin didn't get rid of my alcohol cravings long term by helping me break lifestyle habits or by addressing what was wrong in my life that made me want to drink, but it got rid of short term detox symptoms well enough to where I could make enough progress on long term craving causes.I tapered off gabapentin after a few months because it was having a mild but noticeable and increasing negative effect on sex drive, and I didn't like how it made my vision blur just a tiny bit.I'm about 40 years old and 185 lb and took 200 mg 3x per day.",Austin
1,Gabapentin,Alcohol Withdrawal,9.0,Taken for less than 1 month,"November 3, 2021",6,"I had been drinking 4-6 drinks every night and binge drinking even more on the weekends for about 3 years due to situational stress/anxiety. When I tried to stop recently, I'd try to just have one but would sneakily chug 6 instead before I could curb the impulse. I was having regular hangovers, mood swings and difficulty focusing. This was concerning so I asked my psychiatrist what I should do. He told me to take 200mg of gabapentin before bed (when I would usually binge) and to reduce my alcohol consumption to 2 light beers per night, then only 1 per night until I can go with just having one or two once in awhile. So far, it's worked! I don't crave more and more booze when I take the gabapentin. Drinking one beer feels just fine and I'm able to go without drinking at all if I want.I'd recommend giving it a go if you have a doctor who can recommend the right dose for you. The only side effect I have is morning drowsiness and some weirdly elaborate dreams at night.",Anonymous
2,Gabapentin,Alcohol Withdrawal,10.0,,"August 5, 2021",15,"I was drinking about a 750ml a night and then a couple quarts on the weekend. I had 4 seizures due to alcohol withdrawal, have been in detox 4 times, hospitalized a bunch and had severe liver Cirrhosis and kidney failure. I tried naltrexone but just kept drinking, tried therapy, anti-depressants, and some AA meetings but nothing helped. When not intoxicated I had horrible anxiety, insomnia, depression and thought about killing myself. I drank not to feel happy but to basically survive. I finally saw an amazing compassionate doctor during my latest hospitalization from withdrawal. He prescribed me gabapentin and have been sober 6 months. Gabapentin has changed my life. I never thought I could go this long without drinking. I take it 3 times a day at 300mg and I’m ridiculously happy. My anxiety is basically gone and I can sleep again. I feel almost normal is social situations. Gone is the feeling of impending doom. I would highly recommend this to anyone, it was a miracle drug for me.",Freedom
3,Gabapentin,Alcohol Withdrawal,10.0,Taken for 6 months to 1 year,"April 12, 2021",16,"I've been a chronic alcoholic for over thirty years, but this drug really helps. It's odd: it does have an anxiolytic effect (not as much as the benzos), but it takes away the cravings (and I mean it REALLY takes them away). I have no idea what the mechanism is, but I I'm glad that it works!",JustABlokeFromEngland
4,Gabapentin,Alcohol Withdrawal,10.0,Taken for less than 1 month,"April 11, 2021",17,"I got gabapentin after a binge episode that landed me in the hospital. It worked immediately at a low dose. No thoughts of drinking. I would typically binge on 24 tall cans a day. After three days of this medication, I've had one beer, and I think it will be my last - and my home is fully stocked to the point I could destroy myself. It just works. It's likely saved my life.",bill
5,Gabapentin,Alcohol Withdrawal,10.0,Taken for 1 to 2 years,"March 6, 2021",17,"Please try Gabapentin if you want to stop drinking. I know nothing is guaranteed to work, but it does help to take way those horrible feelings of anxiety.Good luck!",Sleeping Jim
6,Gabapentin,Alcohol Withdrawal,10.0,,"January 19, 2021",76,"Started off innocently enough by just having a few beers on the weekend with my under age pals in the basement playing pool. Four decades later, was jugging vodka all day and messed up my bp and heart rate. Was 170 over 110 and bpm of 120 while resting. Ambulance took me to the hospital twice for chest pain. Went to get help for my alcohol issues a few months back. Was put on gabapentin 300 mg per day with a schedule to increase to 1800mg over the day.  Believe it or not, I felt better day one and quit booze by day three with no wicked withdrawal or the usual cravings. I had tried to quit a zillion times before. My mind feels like I am 25 again. Please see your doctor!  You do not need to live recklessly and damage your health and relationships further. I was spending 6 to 7 hundred a month for vodka.  Now, well after Covid, I am going to take 3 vacations a year with the money I will save. Good luck all!  Also I almost forgot to add Once on gabapentin my bp and heart rate  went from 170 over 110, 120 heart rate resting to 118 over 88 and 66 heart rate resting.  No more chest pain and trips to the hospital. Call your doctor or a rehab facility.  I went to a confidential regional clinic. I was on course for a heart attack.",Finally Free
7,Gabapentin,Alcohol Withdrawal,10.0,,"December 28, 2020",35,"I am only a few days into my abstinence from alcohol, but I'm beyond thrilled/baffled that I'm here at all.    I was drinking nearly a bottle of wine at night to soothe stress and anxiety, but the fall out was mood swings and hang-overs.    I read in an article how gabapentin  helped with alcohol withdrawal and/or cravings. By way of experiment, I tried it, and as if by magic, I had no cravings for drinking.    Gabapentin seems like a miracle drug to me. It truly is the game-changer I never even imagined existed. If you're looking to quit or reduce your alcohol dependence, try it. You'll be dazzled.    Suddenly, I feel so much more positive about myself and my future. Good luck and power to you all.","Caution, but Thrilled"
8,Gabapentin,Alcohol Withdrawal,9.0,,"December 16, 2020",17,"Hi,I have had alcohol problems for 40 years and was never able to stop for more then a few weeks. I have been taken gabapentin 100mg, 3 times a day and 15 mg of mirtazapine at bedtime gabapentin amazing. I can finally sleep and think before I drink, like my mind is not running all the time at 100 miles an hour. Its been 6 months now and I can finally say, I have a life.",Guylaine
9,Gabapentin,Alcohol Withdrawal,10.0,,"October 2, 2020",78,"I have been drinking a bottle of alcohol every day from the time I woke up so the time I went to sleep, and that is for over 20 years. If I didn't have a drink by noon I would go into withdrawal. My wife would have to go to the store for me right away because of my shakes were so bad I couldn't even get the ATM card in the machine. Last year I was shot in the neck and back and this is one of the many medication I would prescribed. I put it to the side and I've never touched it although they send it to me in the mail for a month every month for a year. I just stuck to drinking. I decided to Google it and notice it works for alcohol withdrawal. So I decided to give it a try. The first day I didn't even have a drink with no withdrawals. It's been a month now and haven't touched a drink. I highly recommend this for anybody that wants to get off alcohol.",Danny
10,Gabapentin,Alcohol Withdrawal,10.0,,"September 24, 2020",31,"Gabapentin has been a godsend for me. It has kept me sober from alcohol for over 2 years. Introduced to it when I went in to detox and 28-day rehab. Had dual diagnosis alcohol abuse/anxiety. I could not believe that I would ever quit my daily heavy wine drinking for 20+ years but here I am and so happy, proud and truly know gabapentin got me sober and no cravings ever after 2 years. Please consider it if you were like me who never knew about it.  And it is not a controlled medication.",Dianey
11,Gabapentin,Alcohol Withdrawal,10.0,Taken for less than 1 month,"August 21, 2020",53,"Binge drank for 37 yrs, stopped 1000 times. Itook gabapentin 100mg 3 times a day. No more nausea that in the past only booze took away. It helped with my anti social behavior and severe anxiety. I can finally stop and talk to people and feel calm doing it. I am so happy I can finally stop drinking and live a bit of a normal life.",GuyGuy
12,Gabapentin,Alcohol Withdrawal,10.0,Taken for less than 1 month,"August 15, 2020",23,"Been on the Gabapentin for a couple weeks now to help with Alcohol Withdrawal. I believe I have hereditary AUD and have been a strong with my alcohol intake for roughly 15 years. My psychiatrist recommended the doses of 900 3x/ day. I take only 300 at around the typical time I would have a drink and it really does work. I tried the full recommendation of dose but The side effects where to powerful... sleepiness being a major one and not being able to sleep a full cycle at night. I find 30mg at dinner time is good for me, along with some will power. I’m sensitive to medication also so it will be different for everyone. Give it a try it does work.",Anonymous
13,Gabapentin,Alcohol Withdrawal,10.0,,"July 26, 2020",43,"Not alcohol withdrawal, Abuse. I've lived with having to argue with myself every day saying ""Don't drink today"" "" I must not drink today"" my days were consumed with me arguing with myself and not having the mental band width to deal with other things. and of course I mostly lost the arguments to not drink. Until.... until Gabapentin. I started taking it 6 weeks ago for nerve pain. I denounce any doctor that does not offer this to any patient that they suspect alcohol abuse, as gabapentin is MAGIC. I still argue with myself to not drink but I have begun to realize it is just a 50 year old habit. I have no desire to drink. NONE... I did however go out shooting pool with my son and friends and had a beer just one beer with my son and friends, was fantastic.  If you drink and hate yourself half as much as I did, you must try gabapentin for your problem - it is magic, pure and simple. Doctors, shame on you for not offering if off-label to anyone you suspect of having AUD.",Toombstone
14,Gabapentin,Alcohol Withdrawal,1.0,Taken for 1 to 6 months,"June 8, 2020",18,"I actually started taking Gabapentin about 6 months ago for nerve pain, not for alcohol withdrawal. I didn't know this medication has proven, in some people, to be an effective treatment for alcohol withdrawal. I've had issues with alcohol for a number of years where I would drink steadily then stop for a long period of time. I've gone through the 12 step program a few times now, but relapsed. When I ran across this information on Gabapentin I was quite surprised since it's had NO effect, absolutely NONE, in terms of reducing my craving for alcohol even though I'm taking 2,000 mg/per day . Glad to hear it works for some people ... keep up the good work.",Joseph G.
15,Gabapentin,Alcohol Withdrawal,9.0,Taken for less than 1 month,"April 28, 2020",27,"I've been on several drugs for AUD, among them topiramate and naltrexone, both drugs worked very well for the craving and I could quit drinking but because of the side effects I had to quit taking them in the short term, which caused me to  drink again, this time for recommendation from a friend I started taking 300mg 3x day, and I have seen the results from day one, almost 0 craving.  I have had some drink while on it but min quantities compare to how I was  before taking the med, I and having almost all week alcohol free, worth trying for AUD.",kwhile
16,Gabapentin,Alcohol Withdrawal,10.0,Taken for 2 to 5 years,"March 11, 2020",72,"I’m not sure how gabapentin works, but when it comes to keeping me sober from booze, it is a magic pill. I endured 22 years of heavy drinking with a few weeks of sobriety sprinkled in (usually after a hospitalization for detox) but could never keep it going. Started gabapentin 2 years ago and the cravings just disappeared. I would advise any heavy alcoholic who wants to change to give it a shot.",Homer81
17,Gabapentin,Alcohol Withdrawal,10.0,Taken for 1 to 2 years,"January 18, 2020",51,"I've been taking Gabapentin for exactly 16 months as of today for AUD (alcohol use disorder).  I no longer have alcohol cravings at all after being a very heavy drinker for 25 years.  My dr increased my dose gradually up to 400mg/3 times/day.  He's had to back me off back to 200mg as I was too ""foggy headed"" and dizzy at that dosage.But I have not touched any alcohol since day 1 and abstinence has been relatively easy.I cannot recommend this treatment enough -- it's been awesome!  Finally sober after 25 years!!!",TulsaTown
18,Gabapentin,Alcohol Withdrawal,10.0,Taken for less than 1 month,"December 31, 2019",90,I'm not exactly sure why I have had little to no alcohol cravings. Spent 2 days in the hospital to deal with the shakes and initial horrible alcohol withdrawal. Was prescribed librium and 100 mg Gabapentin x 3 times a day. I'm off the librium and down to gabapentin once per day after 8 days out from being in the hospital. However...I've had little to no withdrawal symptoms. I don't crave alcohol at all and it seems that the combination of librium and gabapentin have staved off the worst. I'm forever grateful at this second shot at life. It's miserable being a barely functioning alcoholic destroying your own life...,Jay
19,Gabapentin,Alcohol Withdrawal,10.0,Taken for 1 to 6 months,"November 18, 2019",56,"The short term use of gabapentin assisted me through alcohol withdrawal and recovery.  I also found that it helped with my shoulder and minor back pain. It also helps as a mood stabilizer for me. In the past things like going to the mall or being in large crowds used to cause anxiety and anger, so I would avoid these and any similar situations. I’ve always run on the hot tempered side(no outbursts, just the internal struggle).  Gabapentin has made a huge difference for me and I feel peaceful and for now the only side effects are minor swelling in my ankles and I can feel a little sluggish in the am.",CW
20,Gabapentin,Alcohol Withdrawal,10.0,Taken for 1 to 6 months,"November 1, 2019",246,"Been a cop for 25 years.  Also worked for private contractors in Afghanistan.  Needless to say, I retired with two gifts.  PTSD and Alcohol abuse.  Up to 1.75 (a handle as we drunks call it) a day.  Gabapentin came to the rescue (800 mg twice a day.)  at first there was dizziness and I had to walk with a cane.  On day 3, I normalized.  No cravings.  Shakes disappeared.  Nausea gone.  Went to AA but that made me have cravings again after hearing the stories so, luckily, I stopped going.  Miracle drug?  It was for me.  Did not stop the PTSD though, but found that medical THC did the trick at night before bed.  Sober for a month now.  A first.",Warren P.
21,Gabapentin,Alcohol Withdrawal,9.0,Taken for 5 to 10 years,"August 28, 2019",49,"It was a miracle for me I on highest dose a day.  I got it for my neuropathy and  it helped a lot to deal with my alcoholism which was an unexpected bonus, but I have to say I've detoxed from pretty much everything so if you want to go off it taper! Cause withdrawal  off gabapentin is right up there for severe terrible withdrawal symptoms, they told me it was non narcotic and non addictive well I challange my doc to start a regiment and try to stop then he'll find out! Non addictive - my ass lol",Neil1212
22,Gabapentin,Alcohol Withdrawal,10.0,Taken for 1 to 6 months,"June 1, 2019",93,"I was prescribed Gabapentin for acute alcohol withdrawal, benzodiazepine withdrawal and anxiety. Currently taking 300mg x3 a day it has been working great, the withdrawals were bearable and now I’m finding the anxiety which once crippled me is completely gone. I can finally live in peace.",Cyndy
23,Gabapentin,Alcohol Withdrawal,10.0,Taken for 5 to 10 years,"May 18, 2019",107,"For my entire adult life, I've quit drinking a 100 times. AA, rehab, sober partners: all the methods worked, and l quit. But not for good! Finally, 14 years ago, l was prescribed neurontin for my brand new menopause-sponsored hot flashes, I took it for 2 years and quit drinking completely, I just didn't want drinks anymore. At all. When l went off the drug, it was obvious to me within a week: neurontin stops me from drinking and helped keeps me sober, I can't believe how well it works. I've been taking it ever since. I'm sober, and THIN! Opinions are of no value to me, because this is how my Neurontin took away my obsession.",Nellah
24,Gabapentin,Alcohol Withdrawal,,Taken for less than 1 month,"March 19, 2019",48,Dr. recommended Gabapentin for alcohol withdrawal starting with one 100mg at night for 3 nights and it is working. Then twice a day for 3 days.  Will increase to three times per day (300 mg per day).  Helped cut down on wine consumption.  I feel the effects of the alcohol much sooner so don't need/want to drink as much.  Seems to be really helping!  I do notice that I feel a little confused though. Very happy with it otherwise.,Trying
25,Gabapentin,Alcohol Withdrawal,10.0,Taken for 1 to 6 months,"January 9, 2019",96,"I have tried and failed soo many times trying to quit drinking and they always failed , finally I ended up in a lock rehab ward . I was prescribed the Gabapentin( 300mg 3x a day) , I cannot explain the change in me it was like over night my desire\need for alcohol was gone . I am now into my 5 th month alcohol free life. I am very happy with the fact my automatic reaction to the need for alcohol is gone. I would encourage some one that has failed to stop drinking to give this a try it beats dying .",seabee
26,Gabapentin,Alcohol Withdrawal,10.0,Taken for 1 to 6 months,"October 11, 2018",99,I am now coming up to 6 months and alcohol free after taking this drug. I am 54 and I was a very heavy drinker. Spirits were my drink of choice and I started early in the morning and easily polish a litre bottle off. I went to see a specialist and she prescribed me Gabapentin/Nuerontin. I took my first pill (300mg) in the evening before going to bed and actually slept all through the night without waking early. No night sweats and grabbing for the bottle to get my first drink of the day. I was a bit fuzzy headed for a few days but that faded however my alcohol cravings had gone. I still have problems with being in groups of people socialising when its booze related so I tend to leave early. I am now the official taxi driver!  I am going back to see my specialist next month so I can cut down slowly on the pills if needed. Currently I am on 300mg x 3 a day. Good luck to you all and hope this helps and gives some encouragement and hope.,Anthony UK
27,Gabapentin,Alcohol Withdrawal,8.0,Taken for 5 to 10 years,"October 4, 2018",37,"I used 1800mg per day for several years  while in recovery from opiates, then alcohol abuse.  I was shocked to find extremely minimal withdrawal symptoms on a very fast, doctor prescribed and monitored taper.  The taper began at 900mg per day, and went down 300mg every 3 days, going from 300mg to 0.  I've had a few sleep disturbances, but I experienced those from time to time on the 1800mg per day prescription as well.",dres
28,Gabapentin,Alcohol Withdrawal,9.0,,"September 30, 2018",53,Prescribed 600mg four times a day for alcohol withdrawal.  Helps me so much with cravings from day one!  I sincerely hope more doctors prescribe this.,Pk
29,Gabapentin,Alcohol Withdrawal,10.0,Taken for less than 1 month,"September 9, 2018",92,This drug was a life saver for me. I strongly recommend it. I'm 25 years old and went through a 4 year binge drinking everyday. I suffered from withdrawals I had panic attacks and my anxiety was through the roof. Alcohol was destroying my health and relationships. This medication even lifts your mood and calms you down. I have been alcohol free and no cravings what so ever. It Worked the first day. I'm so thankful for this. More doctors should prescribe it. It is great. God bless everyone -  you got this.,Kingzeus
30,Gabapentin,Alcohol Withdrawal,,Taken for 6 months to 1 year,"August 24, 2018",19,Gabapentin helped me horrible back issues due to a car accident and also with suboxone withdrawals when I started tapering off. But unfortunately when I stopped taking them I experienced horrible horrible withdrawals. My doctor is helping me taper off of them and it's gonna take awhile.  Rapid weight gain is one of its side effects.,Bella830
31,Gabapentin,Alcohol Withdrawal,9.0,Taken for 1 to 6 months,"August 4, 2018",33,Kills alcohol cravings. On 500mg three times a day.,Bronx
32,Gabapentin,Alcohol Withdrawal,8.0,Taken for less than 1 month,"April 21, 2018",32,"Oddly, I was prescribed gabapentin for nerve pain caused by Shingles. A few months later I was prescribed it by a psych for alcohol withdrawal.",Moon
33,Gabapentin,Alcohol Withdrawal,,Taken for less than 1 month,"April 7, 2018",10,"I was started on this medication while detoxing from many years of taking Norco for multiple pain issues. Within a couple days, I noticed remarkable improvement of my fibromyalgia pain. It has however made me tremendously dizzy headed.",slnorton
34,Gabapentin,Alcohol Withdrawal,10.0,,"December 15, 2017",30,"The only medicine I've tried for my benzodiazepine withdrawal, out of countless psychiatric meds and supplements, to help at all versus benzo withdrawal. Helps me feel more like myself. Also calms my anxiety quite a bit. Hoping this doesn't backfire like benzos themselves did, but so far, a life-saver. Taking just 100mg every 4-5 hours.",deeteepee
35,Gabapentin,Alcohol Withdrawal,4.0,,"November 30, 2017",18,"This started helping me with my alcohol problems (at the beginning), but after a few months I started feeling side affects that were unbearable so I started tapering off. My hair felt more brittle, I had this constant headache in the right-central lobe of my brain ( THIS WAS HORRIBLE ). Those were the main concerns. I just didn't feel right. Was on 300mg a few times a day. Others obviously have great results for this but perhaps it's just an individual reaction to it.",PoundTown
36,Gabapentin,Alcohol Withdrawal,10.0,Taken for less than 1 month,"November 17, 2017",71,"My husband has been an alcoholic for 16 years. He has struggled with depression, severe anxiety with disassociation, and seizures. Alcohol was the only thing that helped. Yesterday he was prescribed gabapentin at a starting dose of 100mg 3 times daily.  About an hour after his first dose he stated that he felt different and better and he didn't feel the need to drink. A couple of hours later he stated that for the first time since puberty he felt like himself. He has only taken one dose, but if you're thinking about trying this medication for alcohol dependance, there's strong research that it is beneficial, and can help fix the imbalance in your brain that makes you need alcohol. It's worth a try. Blessings to you",Sidewalk chalk
37,Gabapentin,Alcohol Withdrawal,10.0,,"October 26, 2017",37,"I have a boyfriend who has been drinking alcohol for years, he's 51 & drinks the 20% alcohol, and he got gabapentin 600 mg 3x day and it worked the FIRST day! I'm hoping he stays sober. Thanks for this site. Good luck to all.",Sissy56
38,Gabapentin,Alcohol Withdrawal,10.0,Taken for 1 to 6 months,"October 19, 2017",29,"This was like the light switch flipped to off for me.  I never thought there would be a medication that stopped craving for drinking. 1200 mg per day and I am not thinking about drinking at all!  The obsession is simply lifted!  I also attend AA and many there are skeptical, but they do say.  ""Science may one day acheive this, but it hasn't done so yet.""  Maybe now it has.  I even had a drink the other day, and I didn't fall back into the mental obsession as in previous relapses.  Lets hope more doctors prescribe this for alcohol dependance.",G Peretti
39,Gabapentin,Alcohol Withdrawal,10.0,,"January 28, 2017",84,"I agree with that is written on this site. I was drinking about a bottle of wine each evening? Why? I would just feel anxious in the evenings. Wine calmed that. Since I started taking neurotin 5 days ago, I have not even looked at a bottle of wine. For me, it's just like an ""off"" switch. Really amazing. Good luck, everyone!",Anonymous
40,Gabapentin,Alcohol Withdrawal,9.0,Taken for 1 to 6 months,"January 21, 2017",62,I've struggled with alcoholism for over 20 Years. I've recently began taking Gabapentin & found that it does seem to alleviate &/or calm the  nervousness associated with alcohol withdrawal.,Tutu_yvonne
41,Gabapentin,Alcohol Withdrawal,6.0,Taken for 6 months to 1 year,"December 18, 2016",15,Helps somewhat with cravings I guess.,Anonymous
42,Gabapentin,Alcohol Withdrawal,9.0,Taken for 6 months to 1 year,"November 17, 2016",107,"Im a 53 yr old PunkRocker. I drank for Forty Years and have been Sober 7 months, I take Gabapentin 300mg. 3x a day and I no longer have alcohol cravings with the help of this medicine and staying positive. Good Luck Everyone.Peace.",PunkerJoe
