,drug,condition,rating,duration,review_date,upvotes,review,username
40,Plaquenil,Rheumatoid Arthritis,6.0,Taken for 1 to 6 months,"March 1, 2016",61,I'm 18 and was told I have arthritis about 10 months ago Plaquenil worked after the first couple of weeks but one major side effect is Mouth Ulcers and at times I've been in so much pain with them I couldn't eat. But then the alternative one said it could make my hair fall out (and that is not an option at my age),Miss Johnston
41,Plaquenil,Rheumatoid Arthritis,,Taken for 2 to 5 years,"February 22, 2016",62,I'm a 30 year old mother of 2. I have been taking plaquenil for about 2 years now. Initially it helped a great deal. I'm noticing my pain levels rising and now I've developed tinnitus. I'm told that plaquenil can cause permanent deafness. So I'm going to have to seek other options. Methotrexate is not an option due to the damage to my lungs pre diagnosis. I'm honestly scared about the cancer risks of other medications but now I don't have a choice.,Sewbizmom
42,Plaquenil,Rheumatoid Arthritis,10.0,,"January 22, 2016",285,"I have been on Plaquenil since 1996 when I was diagnosed with RA.  When I was diagnosed I was in severe pain, unable to hold my infant child or drive.  My rheumatologist injected me with steroids to get me immediate relief and started me on Plaquenil. I don't remember my initial dosage but I take 200mg once per day and have been in remission since 1996 and I have had no side effects that I am aware of. I have regular eye exams and periodic screenings by a retinologist and my eyes have had no issues at all.",TJT1
43,Plaquenil,Rheumatoid Arthritis,7.0,Taken for 1 to 6 months,"November 13, 2015",59,"I have been on Plaquenil for two months to treat newly diagnosed RA.  The duration and intensity of the flares have been reduced, but I am still suffering with aches and swelling in my small joints and elbows.  I have had mild nausea and am having my eyes monitored by my optometrist.",Science Teacher
44,Plaquenil,Rheumatoid Arthritis,8.0,Taken for 6 months to 1 year,"October 28, 2015",117,"Started Plaquenil 8 months ago-200mg 2x/day- to treat Psoriatic arthritis and sjogrens. Learned to NOT take it in the morning with my Meloxicam 15mg because of strong nausea. If I take one after a big lunch and one after dinner, I have no problems at all. Joints and hands, wrists are doing so much better. One worry is that I am too tired to do anything at all. If I do laundry, I sweat. If I cook dinner or rake the yard, I sweat. I seem to even have trouble sleeping on my side at night because of trouble getting enough air into my lungs. Weird, I know. I rated it an 8 because I do not feel sick after taking it and it does seem to work. The last but not least worry is heavy hair loss. I have thin and fine hair anyway, but it comes out like crazy",langteach
45,Plaquenil,Rheumatoid Arthritis,3.0,Taken for 10 years or more,"October 27, 2015",134,"This medication did wonders for my soreness and pain from Rheumatoid Arthritis but if someone would have told me I would have devastating and irreversible eye damage due to taking it, I would have chosen a different drug for sure (at least after the 5-7 year mark when it is known to cause major problems that will be with you for life!)",cjgriff
46,Plaquenil,Rheumatoid Arthritis,8.0,,"September 9, 2015",68,"I had Lyme disease and a subsequent RA dx, I have been on Plaquenil for 7 months. 200mg 2x a day and now 1x day, It has helped a great deal.I was also taking Collagen and a few herbs for inflammation, I am doing much much better and able to do a lot of things I thought I never would again, I have occasional stiffness but it's hardly an issue,,, On the downside, I do have bad nightmares, not all the time but they are something I am not happy about, Anecdotally, they may be correlated to Alcohol, I occasionally get nausea and headaches as well but the headaches are mild and only once a week or so.Fingers crossed that the side effects diminish and that this drug keeps on keeping on,,, I am 55 ...best to you all  D",Dante21
47,Plaquenil,Rheumatoid Arthritis,8.0,Taken for 5 to 10 years,"August 29, 2015",54,"I live in Uk and having all treatment under the National Health Service.I have RA, fibromyalgia and osteoarthritis, blepharitis and interstitial lung disease ! Blimey I hear you say quite rightly. I say it every day.I take hydroxychloraquine in conjunction with methatrexate and etanercept and they seem to work well together. However since my methatrexate was reduced ( due to continual chest infections ) I have notice recurrance of swelling and pain has increased. I am now on 80 mg of morphine ( MST slow release ) x 2 per day and oramorph ( instant effect morphine ) for breakout pain. Docs told me that they know the three meds work in conjunction with each other but they don't know why ! Who cares - give me the drugs. Hope this helps.",unamatrix0
48,Plaquenil,Rheumatoid Arthritis,1.0,,"July 9, 2015",130,I had very bad experiences  with this medication .  I now have permanent toxicity of my system and I also develop medically induced cataracts from this medication even though I have stopped taking the medication it will continue to try and rob me of my sight. eyes always swollen running very painful. every morning when I rise I look like a monster face full of fluid input all around my eyeslike a little Sacks  of fluid.  is there is help out there I would like some and I will like to know if there's a manufacturer lawsuit the information for this medication does not tell you about the damage that it does. now they are warning doctors to let patients know about this medication and the bad side effe and let them know if they want to take it.,cherired
49,Plaquenil,Rheumatoid Arthritis,9.0,,"May 1, 2015",90,"I started this medication a week ago and have had very vivid dreams. I used to wake up with rib and hip pain/stiffness. I also couldn't relax and lay in bed because my body just felt restless. I would say that on day 2, I woke up almost completely relaxed and nearly no stiffness. I also started taking Celebrex on the same day, so I'm not sure if it's the combination of the two or one or the other, but I feel so much better. I am a 31 year old female and mom of a 1.5 year old.",Vet mom
50,Plaquenil,Rheumatoid Arthritis,9.0,,"April 21, 2015",103,Feel so much better since being on Plaquenil since 2013. Always have reg eye tests.  My inflammation level is only a 2 now and it was 39.  Still feel a little tired now and then but I blame it on working 30 hrs a week. Hope this drug helps you too.,Mrs. S
51,Plaquenil,Rheumatoid Arthritis,1.0,Taken for less than 1 month,"March 20, 2014",124,"I was diagnosed a month ago with rheumatoid arthritis. My doctor started me on Plaquenil 2 weeks ago. 300 mg 2x a day. I had to stop taking it after a week because it upset my stomach causing vomiting, nausea, and extreme diarrhea. My doctor tried lowering my dose to 150 mg 1x a day to no avail. I'm hoping that she can put me on something that will work better as I have been in extreme pain for over a year. I am 30 years old.",Stephanie R
52,Plaquenil,Rheumatoid Arthritis,7.0,Taken for 1 to 6 months,"July 2, 2013",175,I was told that I have rheumatoid arthritis a few months back.  I have been on Plaquenil now for almost 2 months.  It has helped with the pain in my hands and feet.  I still have swollen fingers but am waiting for the full affects of the drug.  I do not know how common this is but the side effect that I am having is hair loss.  I am guessing it wouldn't be as bad if I was a male but being a female.  I am hoping this stops after my body gets used to the medicine because I am very discouraged with that aspect.,The Law
53,Plaquenil,Rheumatoid Arthritis,7.0,Taken for 2 to 5 years,"April 16, 2013",155,"I had very few side effects with this medicine in the beginning, but it didn't provide enough relief on days when I had to be on my feet for a few hours a day. It didn't remove all inflammation so I was taken off and tried on methotrexate, a lot worse side effects and no relief at all. I had no vision changes with Plaquenil and I would much rather have some relief than none. I was able to function with minimum pain with Plaquenil.",peanut61
54,Plaquenil,Rheumatoid Arthritis,6.0,,"March 9, 2013",128,"I have been taking Plaquenil for about 2 months. I started out with 200 mg/1x day along with Prednisone to treat my RA, slowly tapering off the steroids. Now I am just on Plaquenil.I have to say that the pain is still there, especially in the morning and late evening. Sometimes it is difficult to fall asleep, but I gave it a 6 because it is nothing like before when I took no medication.  Perhaps it works better for others?  I still have the swelling and stiffness in the mornings, but, as I said, nothing like before.It also only gets a 6 because the headaches I get while taking it are debilitating.  I sometimes wonder if the trade off is worth it?  They start about 30 minutes after taking it and last until I manage to fall asleep. Sigh.",RA Mom
55,Plaquenil,Rheumatoid Arthritis,10.0,Taken for 1 to 6 months,"December 21, 2012",282,"My 19 yr old daughter was diagnosed with rheumatoid arthritis this past year...her inflammation markers were off the charts. She took meloxicam for a couple of months, but it really hurt her stomach to where she couldn't eat. They put her on Plaquenil about 6 months ago...she is doing great. Recently had blood work and her inflammation is almost all gone...no side effects for her. I hope this medicine can help other people.",Daughter #5
56,Plaquenil,Rheumatoid Arthritis,3.0,,"September 25, 2012",110,I was diagnosed with rheumatoid arthritis in February 2012.  Plaquenil has been the second medication we've tried.  I've only taken it 1 week and have a horrible rash on both arms and on the backs of my legs.  It has caused diarrhea and headaches.  I have stopped taking this medication and am currently waiting to see what medication we will try next.,luster38
57,Plaquenil,Rheumatoid Arthritis,9.0,Taken for 6 months to 1 year,"July 3, 2012",150,"My Rheumatologist prescribed this for my rheumatoid arthritis and it is like a miracle for me. For the first time in several years I actually feel like getting out and doing things without restrictions. The joint pain has lessened and my rash subsided!  I do plan on making an appointment for an eye Dr. due to some irritations I recently have been experiencing. All in all, I would highly recommend Plaquenil and hope you can see and feel the difference.",NC Gal
58,Plaquenil,Rheumatoid Arthritis,6.0,,"June 4, 2012",112,I have had rheumatoid arthritis for 11 years and have been taking 400 mg a day. It is now causing skin discoloration in my lower shin now grayish back. I will be going off this. Have had no eye problems while taking this medicine.,Anonymous
59,Plaquenil,Rheumatoid Arthritis,3.0,,"September 3, 2011",86,The doctor tried it twice for my rheumatoid arthritis and it didn't help at all after taking it for 6 months. ,Anonymous
60,Plaquenil,Rheumatoid Arthritis,7.0,,"July 31, 2011",137,"I have been on Plaquenil for 11 months. It took 6 months to the day for it to start working and then, heaven set in. The pain diminished significantly. I have a flare up now, for the first time and wondering what to do. I've taken Aleeve, but no luck. I only seem to have a flare up during that particular time of the month, maybe something to do with water retention or hormones. Only side effect so far is upset stomach, take with food and in the middle of the day and much better.",Anonymous
61,Plaquenil,Rheumatoid Arthritis,4.0,,"May 11, 2011",85,Ineffective with my advanced disease.  Tried it because I've run out of options.,Anonymous
62,Plaquenil,Rheumatoid Arthritis,5.0,,"January 9, 2011",76,I was diagnosed with RA in October 2010 and have been on Plaquenil (200mg 2x/day) and Celebrex (200mg/day) for 3 months now.  I've noticed a slight improvement in my hands and fingers as far as morning/evening swelling goes but the stiffness and pain still persist.  I go back to see the RA doc next week and am hoping he can either increase the dose or add something else to the mix because I'm still not feeling all that great.,Anonymous
63,Plaquenil,Rheumatoid Arthritis,10.0,,"July 6, 2010",166,"Plaquenil has changed my life! I was diagnosed with rheumatoid arthritis three months ago. My rheumotologist started me on this 200mg twice a day and after about a week I noticed a dramatic effect in my hands and feet.  I used to wake up in the morning with swollen hands and feet and it took about a half an hour for the swelling/pain to subside.  No longer is this true! I am 37 years old and finally have enough energy to keep up with my 4 children and busy husband.  I sleep better, feel more focused in the daytime, and do not get tired from doing small tasks anymore.  I am hoping to reduce my dosage and see if I can still get the same results.",mfried2001
64,Plaquenil,Rheumatoid Arthritis,10.0,,"June 11, 2010",186,"I began taking Plaquenil 6 weeks ago and I am pleased with it.  I'm now seeing the benefits and my Rheumatologist says that I should continue to get even better over the next 3 months. Honestly I'm okay with where I'm already at.   The biggest surprise is that I'm receiving benefits that I didn't get from 20mg/day of Prednisone!  The hardest part was when I first began Plaquenil. You initially experience side effects without any benefit but you just have to hang in there.  The side effects start to improve significantly after 2 weeks. My side effects were nausea, loose stools, vomiting and temporary changes in vision (full eye exam confirmed that everything is fine.) I would highly recommend this medicine!",Anonymous
65,Plaquenil,Rheumatoid Arthritis,6.0,,"October 20, 2009",66,"This helped a lot at first, but I have been on this medicine for 7 years now. I think I may need something more now.",harleyhoney2130
66,Plaquenil,Rheumatoid Arthritis,8.0,,"December 31, 2008",90,I've been on this medicine since I was 12. I'm now 21. I have yet to experience any major side effects. Just recently I've noticed that it upsets my stomach if I don't eat with it but I guess it's because my doctor just upped the dose because I gained weight.,Anonymous
67,Plaquenil,Rheumatoid Arthritis,,,"January 21, 2008",176,I was recently diagnosed with Rhuematoid Arthritis. I have started to take plaquenil. I am having extreme nightmares like never before. I looked up the facts on the drug and it is a side effect.,attiamtech
