,drug,condition,rating,duration,review_date,upvotes,review,username
0,Plaquenil,Rheumatoid Arthritis,2.0,Taken for 1 to 6 months,"March 13, 2022",0,"I developed sudden paralysis in my right leg about a year ago.  After being hospitalized, and subjected to a variety of medications, my condition deteriorated until I needed a walker to even stand up - and was only staying awake about 3 hours per day. Finally,   I asked to be tested for RA. Very positive results. On my first visit to the rheumatologist, she prescribed hydroxychloroquine.   I had reacted severely to other medications, so I started with 1/2 prescribed dose - one 100 mg pill with supper daily.  Within two days, I could stand and walk independently for short distances.  Within a week, I was walking and driving and staying awake throughout the day.  This was like a wonder drug...and then I started to get serious cramps in my intercostal muscles so that I felt that I was being crushed and could not breath.  I ceased to be able to feel my hands and feet.  It took over two months for this to stop after quitting the pills, and I still show some liver/kidney damage.",bjaques
1,Plaquenil,Rheumatoid Arthritis,10.0,Taken for 10 years or more,"January 23, 2022",0,I have been on it for about 11 years. I haven't had any side effects at all. All I know is this. My disease is better . These reasons make me a fan of the drug. If you stop this drug your disease can get worse. The Mayo Clinic doctor I saw says it works with my Enbrel making it more effective.,Sherry
2,Plaquenil,Rheumatoid Arthritis,,Taken for 2 to 5 years,"August 1, 2021",1,"I have been on Plaquenil for over two years now for my moderate to severe RA. Having tried multiple medications that made little to no difference I was excited about the drug that finally helped. I am taking it in conjunction with a weekly injection of Actemra.Now I am dealing with vision problems that worsened in the past past two years and an uncontrollable irritability and low mood. Things are so bad mentally, that I lost all my social connections and having a very hard time communicating with the closest family members. I am in my late thirties and I feel like my life is falling apart because of the devastating effects this drug has on my mental health.",Olga
3,Plaquenil,Rheumatoid Arthritis,8.0,Taken for less than 1 month,"July 18, 2021",1,"I've been taking Plaquenil twice a day for erosive arthritis. It seems to make me extra drowsy when I work night shift. When I sleep I have VERY weird, detailed, and realistic dreams bordering on nightmares in a few cases, but just bizarre in the majority of cases. The dreams are so weird I don't share the details with anyone like I used to do. Last night's dream had me partially conscious and at one point I raised my arm to defend myself from an attacker (in the dream) and I was aware of doing it. Weird, huh? I've always had realistic dreams but the Plaquenil really took them to the next level! Also, the dream seemed like it went on for hours.",Leah
4,Plaquenil,Rheumatoid Arthritis,10.0,Taken for 10 years or more,"July 16, 2021",5,My wife had sudden onset RA in 2000 and plaquenil allowed her go on to finish her military career.  Twenty-one years later she’s able to still work through occasional flare ups. She gets her eyes checked and has seen no problems associated with some of the side effects. Her ophthalmologist says her eyes look great and her RA Dr seem to have her RA under control.,Olemiss
5,Plaquenil,Rheumatoid Arthritis,7.0,Taken for 6 months to 1 year,"August 2, 2020",20,"Hi, I was diagnosed with RA just recently in 2019 when I was 32.It started with fingers & toes then tender hotspots on arms & legs and upper back pain involvement a month after. I took Plaquenil with full adherence of 300mg/d dosage hence positive effect on fingers & toes and body tenders hit in only on month 6, however it did not help me with upper back pain at all. AS was ruled out with HLA-B27(-), movement capacity and clean spine MRI though.The side effects: skin rash (persisted during first 3 months), stomach pain (few times), diarrhea (persisted during first 3 months now occasionally) and muscle twitches (intensive first month, then milder and I ignore them, maybe not due to HCQ)Nevertheless I'm going to visit my rheumo in coming weeks to discuss my never relieved morning upper back pain.",George
6,Plaquenil,Rheumatoid Arthritis,1.0,Taken for 1 to 6 months,"June 24, 2020",30,"This Plaquenil is one of the drugs my arthritis doc put me on.  I was told by my eye care specialist that it was damaging my eyes and I needed to stop taking it.  My eyes may never recovered  I have been off Plaquenil for several years now, and my eyes still have not recovered.  I didn't notice any positive results, probably since I took it such a short time, but it didn't take long for it to damage my eyes.  DANGEROUS if you value your sight.",RRLE
7,Plaquenil,Rheumatoid Arthritis,10.0,Taken for 10 years or more,"May 20, 2020",121,"I am 76 year old female with Rheumatoid Arthritis for about 40 years. I have been on Plaquenil for about 30 years which has controlled pain and swelling of joints.  X-rays have shown decrease in joint destruction.  I have multiple drug reactions but have had none with Plaquenil. I do have occasional flare in rainy, cold weather which is gone in about 2 days with anti-inflammatory.  I see my ophthalmologist once a year for extensive eye exam. To date no problem. Very, very pleased with Plaquenil and love my Rheumatologist.",Hot Dog
8,Plaquenil,Rheumatoid Arthritis,8.0,Taken for 6 months to 1 year,"April 23, 2020",34,I have been taking plaquenil for the last 6 months. It has worked so well to reduce my inflammation. Along with methotrexate I have next to no RA symptoms. Do take this with water or food as it can upset your stomach. Also try to eat healthy as I have noticed increased appetite on this medication,sandy
9,Plaquenil,Rheumatoid Arthritis,8.0,Taken for 1 to 2 years,"April 8, 2020",27,"I have taken this medicine for 2 years it helped my hands so much more like 100 percent, but I can tell that my eyes and getting bad have a eye doctor appointment next month. What I didn’t know was it could cause your hair to fall out - it’s been falling out bad I just found out yesterday that this is one of the side effects so I am stopping this medicine. Hopefully I can take something up for all of you out there that have no side effects you are so blessed!!!!",Grandma
10,Plaquenil,Rheumatoid Arthritis,10.0,,"November 10, 2019",98,"Hi all.Been on Plaquenil for 30 years for rheumatoid arthritis.I don’t know if I have side effect from this drug as they are intermittent... Itching - weird times not consistent Eye watering - constant Headaches - hormonal, RA related Always had thin hair - never fell outNo stomach issues everGet eyes checked 1x a year.  My eye dr puts me through an hour+ battery of tests (4?) and takes a picture of my eye every year (cool machine ... don’t have to dilate). Blood work every three months to monitor kidneys. Starting to wonder if I need to increase because my shoulders starting to loose range of motion and had bursitis a few weeks ago in one. Or maybe I need to increase prednisone (also 30 years - 5 mg once a day).Been off the anti-inflammatory diet though ... will get back on it, too. Starting gym on Tuesday .... Stay healthy folks!",Anonymous
11,Plaquenil,Rheumatoid Arthritis,8.0,,"September 9, 2019",61,"Hi I am a 63 year old female who was diagnosed with RA after instigating a blood test for it out of desperation 3 weeks a go. My debilitating chronic pain in feet and random knee flare ups has a name. My rheumatologist  put me on prednisolone ( reduced doses over in 3 months ) until the methotrexate starts working (once a week of 15mg for 2 weeks , 20mg once a week indefinitely).  Plaquenil 300mg daily. I also take Vit D daily and 5mg folic acid once a week plus curcumin and fish oilI have been taking it all with breakfast for the last 8 days . I have had stomach cramps but no diarrhoea The prednisolone has been magic for pain free sleep and movement. will see in 2 months time with only the latter 2 . Trying to stay positive with yoga and strength exercises  Drugs , vitamins ,anti-inflammatory  supplements , eye tests and blood tests and maybe a nice wig are now part of my new reality",ithasaname
12,Plaquenil,Rheumatoid Arthritis,10.0,Taken for 5 to 10 years,"August 28, 2019",42,"I take it for Rheumatoid Arthritis, it has been good for me, but the generic form of it caused me problems, so I have to take the brand name. The brand name is extremely expensive and I cannot afford it. I stopped taking it because it is too expensive. I need help in order to keep on taking it, I don't know what to do? Any suggestions?",RINOSHKA
13,Plaquenil,Rheumatoid Arthritis,9.0,Taken for 6 months to 1 year,"August 25, 2019",26,"been taking Plaquenil for RA  for around 6 months then about 3 weeks ago started having muscular pain, not as bad as the joint pain I used to have but enough to be concerned. muscle weakness, painful, as if I worked out for 2 hours praying it is a dosage problem",batr441
14,Plaquenil,Rheumatoid Arthritis,10.0,Taken for 6 months to 1 year,"August 4, 2019",145,"It started as Palindromic Arthritis, then progressed to full fledged RA with frequent flares attacking my shoulders, elbows, wrists, knees and even my jaw.  Most attacks would severely limit my physical abilities. The doctor suggested Humira, I was little reluctant - too many side effects to think about. She said we could try Plaquenil - a milder drug. I was told it takes two months before patients feel any improvement, it took little less for the drug to kick in.  Now, it's been a year - I have no flares, no pain and no side effects I can think of. I take one pill in the morning, one in the evening.  This drug works well for me.",Mike
15,Plaquenil,Rheumatoid Arthritis,10.0,Taken for 10 years or more,"May 14, 2019",128,"Hi, I was taking the generic form of plaquenil for over 10 years for rheumatoid arthritis. It took a few weeks to see it work  but what a change for the better. Less painful joints and fatigue. Always have gotten retina checked and have been good. Then I started getting debilitating migraines. I went off my meds one by one and the GENERIC was to blame. My pharmacy switched to another foreign cheap manufacturing co. My doctor told me many generics change their fillers which cause side effects. Since I’ve been off I have declined rapidly. I’m trying to find assistance for original brand. It’s outrageous that we are forced to get generics! Especially if a person has a reaction we should be able to get brand at same or reasonable prices. Which they are not. This drug was so helpful for me and its worth a try, give it 2-6 months. Good luck!",Ace
16,Plaquenil,Rheumatoid Arthritis,1.0,Taken for less than 1 month,"February 16, 2019",66,"I was diagnosed with RA after a knee arthroscopy seemed to set it off in 2017. I had pains in both knees, left wrist, hips, groin area & jaw so my Rheumatologist prescribed Hydroxychloroquine. After only 10 days I developed a terrible lumpy rash on my legs which was hot & itchy. It spread quickly to my abdomen, bottom arms & back, then I got a sore throat & swollen top lip! I stopped the tablets on the 12th day but the rash still spread. My GP put me on Steroids & Antihistamines. Hopefully this will stop the rash. It's amazing they tell you it can take 3months for hydroxychloroquine to be effective ( but only 10days to cause side effects!)",Motown
17,Plaquenil,Rheumatoid Arthritis,8.0,Taken for 1 to 2 years,"January 19, 2019",50,"When first diagnosed with rheumatoid arthritis (RA)  plaquinel worked after a couple weeks. I was in remission soI stopped but Dr upset as he said it was important to keep damage to joints down. Anyway the RA flared and I'm back taking one a day. Hoping to feel better again but seems slow. Not sure if it is due to generic that I'm receiving.  Also, please get eye checkups. Had a scare but it is fine. This drug has less side effects than others! Good luck.",Glen88
18,Plaquenil,Rheumatoid Arthritis,,,"January 18, 2019",64,Have been on Plaquenil since 2012 and my hair is falling out by the hand full.  The doctor says it's not the medicine  but I know it is.,Evonne
19,Plaquenil,Rheumatoid Arthritis,5.0,Taken for 1 to 6 months,"December 12, 2018",40,Used plaquenil for 6 weeks until I developed a terrible full-body rash.  It was working for the inflammation and pain very well until the rash,mamabear
20,Plaquenil,Rheumatoid Arthritis,9.0,,"November 13, 2018",79,"I've been on a roller coaster for yrs w/Plaquenil for RA/Lupus. I take name brand to prevent side effects of red, warm, swollen, painful hands + nausea/dizziness, hair loss, etc. Each time I try going back to generic, side effects return immediately. I'm not one to comment but I read so many reviews that sounded like either my ups or downs, so I want to encourage ppl to stick w/this med & try name brand (though expensive) if having bad side effects w/generic. It could explain why some ppl have such opposite experiences. I get Plaquenil from international pharm & it's much cheaper. It works better than biologics that contributed to/sped up process leading to my cancer. I'm now ""cancer-free"" & refuse to go back on them. I might have to get vision checked & deal w/other mild side effects, but pain/swelling is gone on Plaquenil. Anyway, pls hang in there & give your body enough time to adjust to med before stopping it. It's a risk vs. reward scenario w/meds.",Holly
21,Plaquenil,Rheumatoid Arthritis,1.0,Taken for 1 to 6 months,"October 16, 2018",34,"When first diagnosed 3 yrs ago, my rheumy wanted to try Plaquenil first. He did tell me that some people develop allergies to the drug. Sure enough, three months in I developed hives all over my body. Had to stop the drug. Now I have Kenalog injections every 5-6 months which have worked well for me. No side effects and I am returned to my pre-RA self. Plaquenil is a great treatment for many; just not for me. Every person's physiology is different. My GP has also been researching some older drugs that he thinks were back-burnered due to new biologics. I'm researching as well.",Autumn
22,Plaquenil,Rheumatoid Arthritis,1.0,Taken for less than 1 month,"October 1, 2018",31,I tried this med for mild to moderate rhuematoid arthritis  and after a few days of stomach aches I started getting severe stomach pain that had me doubled over. I realized it had begun when I started taking the Plaquenil. I called my dr and we agreed I should  not be taking it. Less than 24 hours later my pain was gone. Not for me! Never again... it was a terrible experience!,kat
23,Plaquenil,Rheumatoid Arthritis,9.0,Taken for 1 to 6 months,"August 13, 2018",22,It is working for me.,Anonymous
24,Plaquenil,Rheumatoid Arthritis,9.0,Taken for 2 to 5 years,"March 23, 2018",51,I started on plaquenil for Psoriatic Arthritis in 2015. (200mg twice daily). I didn’t feel too bad but a huge bout of stress made my symptoms worse. I then started methotrexate in addition to plaquenil. My rheumatologist suggested once daily  Plaquenil and that seemed okay. After a while he said I coujd stop it as he was not sure if it was working. I tapered off the dose and I slowly began feeling dreadful. The fatigue was awful and I had weird signs akin to severe fibro. I then started back on twice daily plaquenil. Within two weeks I began to feel more human and six months later the fatigue is greatly improved. The small joints in my hand and my wrists are less sore: still painful but improved. I can do more now and feel like doing more. I still have some bad fatigue days and the rheumatologist is still talking about biologicals but for the moment I’m happy to see how I go. None of these drugs are perfect but  at this stage plaquenil is really helping me.,Amber2
25,Plaquenil,Rheumatoid Arthritis,10.0,Taken for 2 to 5 years,"February 15, 2018",106,"Well I posted once before, figured I would give another update for anyone who cares. It's been around 2 years now and I'm glad to say all side effects are long gone. So is my pain for the most part. Sometimes I forget I was even diagnosed with RA (Palindromic Rheumatism). Every once in awhile I will have a flare, my last one was in October of last year 2017, it is now Feb 2018 and still flare free. I've been seeing gaps of 6+ months without any pain. You can see why it's easy to forget lol.Again, this drug is worth it. It seems almost like a dream waking up and not being able to move, a horrible dream.",Enz
26,Plaquenil,Rheumatoid Arthritis,9.0,Taken for 1 to 6 months,"February 13, 2018",43,"I've been using Plaquenil 3 months. It has helped my RA pain subside a lot. While my Rheumatologist says I'm in the beginning stages of RA, she nonetheless put me on the Plaquenil. However, my hair is falling out rapidly so I have weened myself off of it and will never use it again.",Diane Schumacher
27,Plaquenil,Rheumatoid Arthritis,7.0,,"December 9, 2017",41,"I have been on Plaquenil for about 15 years without apparent side effects until this year.  But this year I have developed severe swelling of the face and red rash on the upper half of my face. This also includes very difficult itching in odd places on my body, my eyebrows and eyelashes, my earlobes, my lower legs and lower arms, my scalp and of course where the red rash was. This was twice cleared up with heavy doses of antibiotics and Cortisone.  However my rheumatologist took me off all arthritis drugs and we added them back little by little.  When plaquenil was finally included with the other drugs again, it took about three days and my My face started swelling and the rash and and itching. I can only assume that this was the cause of my allergic reaction, even after all the years of use.",C Wife
28,Plaquenil,Rheumatoid Arthritis,10.0,,"November 4, 2017",53,"I am a 72 year old female, diagnosed with RA 6 years ago.  I took Plaquenil (200x2) from 2012-2016, along with Prednisone to start.  Due to the fact, I could not use my hands because of the swelling, I risked the possible vision problems.  By 2012, symptom free and still fearful of vision loss, I stopped the drug.   I was pain and symptom free for one year, but now symptoms have returned, and I have been told to restart the drug(no prednisone.)  In the 4 years taking it, I went from 95 lbs. to 85 lbs., lost a significant amount of  hair, had cataract surgery and, now, macular degeneration.  The decision to restart is extremely emotionally stressful, weighing the benefits against the risk. (Dr. says neither eye problem was caused by the drug",Backside of 70
29,Plaquenil,Rheumatoid Arthritis,4.0,,"October 6, 2017",52,"I primarily treat my RA with CBD paste. While it does pretty good alone, my doctor suggested that Plaquenil might zero out the rest of my symptoms. Even though I have a fairly severe case of RA, the CBD Paste manages about 80% of the disease.But I've been taking the Plaquenil about 3 weeks, and honestly, I think I have more swelling. I've decided to stop for now and am wondering if Plaquenil can actually make the symptoms worse?",RA treatment
30,Plaquenil,Rheumatoid Arthritis,,Taken for 1 to 6 months,"August 27, 2017",41,I am still trying to figure out what this drug is suppose to do cause I still get the soreness in the joints and the swelling especially in the shoulders and hands some nites its hard to sleep unless I take something for the pain in both,spunkies
31,Plaquenil,Rheumatoid Arthritis,,,"June 6, 2017",124,"Haven't taken this. Just wanted to read some feedback. I was on methotrexate, but stopped, because it gave me chills, fatigue and shortness of breath, I even fainted at work. The doctor suggested Plaquenil as a possible alternative, but after reading some of the comments, I don't think so.  This is really frustrating and sad. The FDA should NOT be approving these crappy drugs which can cause worse problems than the one you have.  I honestly don't know what to do, let the RA turn me into a cripple or take my chances with one of these death drugs?",Darkchief99
32,Plaquenil,Rheumatoid Arthritis,,,"April 13, 2017",124,"Love this drug, compared to the others. I am 55 now, and first took it 30 years ago. My RA then came on lightening fast, nodules and all. I went from totally normal to almost wheel chair in weeks. The weight of a bed sheet on my toes was too much. Two plaquenil a day and  2400 mg of ibuprofen a day ( that's 12 regular dose!) and I went into total remission. Of course my stomach is crap now. After 25 years of remission, the RA returned. Different now that I'm older (55), more subtle. Chose plaquenil again, and working wonders, but for my permanent damage. Get your eyes checked, a must. Some hair will fall out, but hey, I'm glad I still have some to fall out. WEIRD dreams. Irritability. Will lose weight! TAKE WITH FOOD to avoid cramps.",RichEsq
33,Plaquenil,Rheumatoid Arthritis,7.0,,"March 26, 2017",123,"I've been on Plaquenil for over 3 months now. It works wonderfully! I combine my treatment with Curcumin & Magnesium baths and I feel like a new woman :-) Side effects I experienced: Nausea & dizziness for the first week or two (I found I needed to take it after a full meal to prevent the nausea). I have also noticed since starting the Plaquenil I seem to sweat profusely. It's annoying, but the benefits far outweigh this little problem. I just wear my gym gear about now... which I did mostly beforehand anyhow :-) Also, it take take a couple months for the Plaquenil to kick in & for me to feel the effects! Don't give up, just give it some time.",KittensAussiePrincess
34,Plaquenil,Rheumatoid Arthritis,9.0,Taken for 1 to 6 months,"March 3, 2017",149,"I began taking Plaquenil for RA 1 month ago. Despite information from my doctor that it would be at least 3 months before I see an appreciable effect, I am feeling better than I have in the last year. Prior to Plaquenil, I tried Mobic & Medrol, both with limited improvement. But over the last few weeks I have been able to play basketball with my son again, move without thinking or a 'warm up period', return to the gym, begin Pilates & I've lost 12 pounds! I did have some GI upset over the last month, but nothing I would consider stopping this medication for. I am able to enjoy things again & live life without discomfort.",Kat019
35,Plaquenil,Rheumatoid Arthritis,10.0,,"September 5, 2016",143,"I've been on this drug since 2003.  Before meds, I was so sick with RA symptoms.  Spent 19 hours a day in bed, couldn't dress or bath myself.  Seldom ate.  Doctor put me on 200 mg. plaquenil twice daily  and 10 mg. prednisone and I got my life back.  I've since drop prednisone and am down to 200 mg. once daily plaquenil.  About to go on the generic form of plaquenil.   A little concerned.  Is the quality the same?  My specialist said no.  RA drugs are so scary.  I've had friends die on biologics--and some go blind.  My advice as geezergirl.  When you find out what works for you, hold on tight to it.",geezergirl
36,Plaquenil,Rheumatoid Arthritis,9.0,Taken for 1 to 6 months,"July 25, 2016",120,"I started on Plaquenil for RA about two months ago so my experiences are fresh. I'm a large male at 6'2 250 pnd 30 years old. When I was diagnosed with RA I didn't know what to expect. I was quickly referred to a Rheumatologist who recommended this drug.The first three weeks I was having some side effects. Nose bleeds, ringing in my ears. But after the fourth week they just disappeared. As well as the excruciating pain in my feet, knee's and hands. It just poof like it never happened.I'm optimistic about now my third month as it has now been three months since my last flare up. It was too late for my feet, which now have permanent damage, but I can now walk and wear shoes almost perfectly normally.",Enz
37,Plaquenil,Rheumatoid Arthritis,,,"June 25, 2016",82,I have been taking plaquenil for about 4 years 200 mg twice a day . I have been having severe stomach cramps and nausea and vomiting just now realized it's the plaquenil. Because I didn't take it for 3 days because of the n/v just took it again today and got so sick had to throw up. Now realized it's the plaquenil have been to gastro dr and have done all kind of test .will not be taking this med again  my Ra is nothing as bad as n/v maybe this will help some one . Don't no what I will take for this Ra pain I feel so sorry for anyone who has this Ra was not diagnosed with this untill I was 65 years old.,Anonymous
38,Plaquenil,Rheumatoid Arthritis,3.0,,"March 2, 2016",102,"Helped with RA  It has affected my vision immensely.  So much, that I stopped taking it.",pattyannhorse
39,Plaquenil,Rheumatoid Arthritis,3.0,,"March 2, 2016",104,"I'm a 57 year old female that has just been diagnosed with RA about 6 weeks ago. My GP gave me Arthrotech to get me through until I could see the rheumatologist   The Arthrotech made me sick, for every 4 pills I took, I threw one up. Went to specialist yesterday and he gave me Plaquenil  - I've only taken it for 2 days so far (400 mg) daily but I'm feeling worse ( although the weather has changed - snow storm)   I can't believe how painful this disease is. Does it get any better? Will I have a pain free normal life one day soon? I don't go back to the specialist until May but I can't imagine being in this much pain until at least May. I'm feeling so sorry for myself and cry because I'm tired cry because I'm sore. When will it start working?",Sadiemybeagle
