,drug,condition,rating,duration,review_date,upvotes,review,username
47,Norvasc,High Blood Pressure,10.0,,"August 5, 2015",101,"Novask like all meds have side affects works great on me..lowered my stubborn pressure from 238/110 down to 140/90 in 4weeks. Its very effective. I found that taking 5mg in the am and 5mg at night are more effective with less side effectsNo results on lopressor after a year on that stuff. .bad side effects.",christinex
48,Norvasc,High Blood Pressure,2.0,Taken for 6 months to 1 year,"July 25, 2015",38,"Doesn't work to lower blood pressure. I started this medicine 8 months ago and it hasn't done anything. My dr added Benzepril on top of this and my blood pressure is still the same. Switching to a beta blocker next time I go to his office. Gave it 2 stars because although it doesn't work, I haven't experienced other adverse effects which is a plus!",bigjerm74
49,Norvasc,High Blood Pressure,1.0,,"July 25, 2015",112,I hate Norvasc! It made my blood pressure worse. I was always borderline with my blood pressure. It didn't help that I work nights and my diet isn't the greatest. My doctor wanted to me try this medication for a month to see if my blood pressure would lower. Within a week my blood pressure which usually hovers at 140/80 with a pulse of 80 shot to a ridiculous 200/98 with a pulse of 98. My blood pressure will always spike around the evening. My anxiety worsened and I got headaches. This medication does not work for me and I am not going to be tricked into staying on it longer.,coldnose
50,Norvasc,High Blood Pressure,1.0,,"July 25, 2015",64,I have this scorching pain in my legs and this is the only new med?,Mariar56
51,Norvasc,High Blood Pressure,2.0,Taken for 1 to 6 months,"February 22, 2015",123,Norvasc caused extreme leg and ankle edema and did not improve hypertension much. After 6 weeks of use I was put on lisinopril and within 2 days had no more leg swelling and blood pressure lowered greatly. So far so good on new medication.,Mcna
52,Norvasc,High Blood Pressure,,,"December 26, 2014",117,I've only been on Norvasc for a week and so far the only side effect is difficulty falling asleep and waking up periodically through the night. I know its the Norvasc since I work a very early shift and am generally exhausted by the time its ready for bed. If it continues I'll look into switching medications. However the first blood pressure medication I was on has a worse side effect. Uncontrollable coughing. I had to stop taking it after about a month.,PTBadman
53,Norvasc,High Blood Pressure,1.0,,"November 6, 2014",142,Very bad acid reflux and anxiety.,pipper1956
54,Norvasc,High Blood Pressure,,,"January 25, 2014",175,Going on three years of taking this medicine. Blood pressure is normal 118/66. Usually 118/70 sometimes 99/55.,tmichelle
55,Norvasc,High Blood Pressure,,Taken for 2 to 5 years,"December 28, 2013",228,"I'm 32 years old and at first Amlodopine made me feel depressed, dizzy and anxious. Now I am used to this medication. I have so much energy. Before this medication I was on the verge of a heart attack and stroke. My blood pressure is 110/70.",TMichelle
56,Norvasc,High Blood Pressure,7.0,,"December 10, 2013",160,"Keeps my blood pressure down. I have been taking it for 5 months, I now have muscle cramps, and have a problem sleeping. I am going to try a new medicine, I can't take the severe cramping in my body.",Sanricka
57,Norvasc,High Blood Pressure,4.0,,"February 28, 2013",264,"With the DASH diet and exercise my BP was still high and the doctor increased my daily 5mg of Norvasc to 10mg. It helps decrease my usual 170/104 to approx 150/70 but only for a few hours. I am fatigued, headaches and super cold feet and hands constantly. I also have muscle cramps. I feel as if I had a heart attack a few days ago but my doctor says its gastritis. The side effects are worse than hypertension itself! Maybe I need a new medicine and/or a new physician. Good health to you!",11Gs
58,Norvasc,High Blood Pressure,9.0,Taken for less than 1 month,"February 11, 2013",128,"I am 27 years old and I had blood pressure of 150/100, around the high range for a few days at the very least but within 2 hours of taking Norvasc 5g my BP dropped to around 128/86.  I have just taken this once in my life.",Sky24
59,Norvasc,High Blood Pressure,8.0,,"October 16, 2012",124,"Started on Norvasc about 1 wk ago and my bld pressure has gone from 180-200/100 to 120 /75, my heart rate has increased which is ok because I was on Bystolic for a short time and my heart rate dropped into the 40's. ",Anonymous
60,Norvasc,High Blood Pressure,10.0,Taken for 2 to 5 years,"August 2, 2012",119,No side effects.  Blood pressure fairly well controlled on 5 mg of this only.,Anonymous
61,Norvasc,High Blood Pressure,1.0,Taken for less than 1 month,"May 27, 2012",221,"Within a few days of starting this medicine, I became very aware of my heart beat and my heart seemed to be racing.  I attended a pre-operative assessment where I was given a routine ECG and this confirmed that I had become tachycardic while taking amlodipine.  My pulse was racing at over 100 BPM and my blood pressure actually went UP while I was taking this medicine.  I had to discontinue use to stop the adverse effects.",JHBARCLAY
62,Norvasc,High Blood Pressure,10.0,,"April 16, 2012",44,No side efects as of yet (taken for 4 weeks so far) only taken while on high doses of steroids (80mg daily but deceasing 10mg every 3 days.  Keeping my BP in my normal range of 110/60.,Ers
63,Norvasc,High Blood Pressure,8.0,,"April 16, 2012",75,I found it very effective to control high blood pressure.,Anonymous
64,Norvasc,High Blood Pressure,4.0,,"March 16, 2012",121,Norvasc has lowered my blood pressure from 160/102 to about 110/80 on 10 mg.  The side effects are debilitating for me.  I have horrible chest pains and unable to do much without exhaustion.  I have lost so much weight due to lack of appetite.  Dr. does not want to take me off because I have difficulty finding anything that lowers my blood pressure. I am also on Atenolol.,Kikzy
65,Norvasc,High Blood Pressure,7.0,,"March 1, 2012",147,"Norvasc worked fantastic for about a year then I started experiencing muscle twitching and cramps that got worse and worse. I have been trying to switch to another medicine and haven't had much luck. I pray I can find a medicine as good as Norvasc. I can tell you that numerous blood tests have been run and while this medicine MAY cause cramps, my blood sugar, cholesterol, liver panel, metabolic panel, CBC, creatinine, etc. are all perfect! I have a lot of faith to the fact that this medicine will not harm you other than possibly muscle cramps or fluid retention. I experienced no fluid retention BUT I exercise.",Anonymous
66,Norvasc,High Blood Pressure,,,"February 20, 2012",166,"I used Norvasc for years for blood pressure control, until I had sudden onset of swollen ankles/lower legs. ",Anonymous
67,Norvasc,High Blood Pressure,1.0,,"January 23, 2012",91,"I was on Norvasc for 2 weeks. I felt dizzy, tired, cold, and got headaches every night. Switched medicines now, still trying to get it out of my system.",Anonymous
68,Norvasc,High Blood Pressure,5.0,,"December 2, 2011",93,"I have been taking this medicine now for 6 weeks and am experiencing tremendous flushing with it. So far it hasn't helped my blood pressure go down much. Doctor says give it a little while longer. One day I almost passed out, got light headed and felt like I was in another dimension! Doctor says he can't say for sure it was a side effect of this medicine. I will keep trying it for awhile longer.",Anonymous
69,Norvasc,High Blood Pressure,4.0,,"November 29, 2011",177,I have been on Narvasc 5mg for about 4 months.  It doesn't control my blood pressure for the 24 hours and my pulse constantly stays elevated.  I have swelling in my feet and ankles and I'm tired all the time. I get flushing sensations and ringing in my ears sometimes.  Also feel dizzy at times and have dry mouth. All these medications are horrible. We have no choice but to suffer if we take them or not take them.  ,patsygirl
70,Norvasc,High Blood Pressure,5.0,,"November 8, 2011",183,"I have been taking Amlodipine (Norvasc) for about 2 months.Norvasc (Amlodipine Besylate 5 mg) did lower my blood pressure from 150's over 80's to 120's over 60's.  That's great.  Problem is with side effects every day.  Intestinal cramps, diarrhea, gas. Begins about 5 hours after I take the pill.  Stomach (intestines ?) roll constantly for about 3 hours. I am going to try splitting the pills in half and see if lower dosage stops the side effects.  If not, I guess I'll go back to the doctor and try something else for blood pressure.  It seems like all of these blood pressure pills have side effects of one kind or another.",Dann k
71,Norvasc,High Blood Pressure,3.0,,"August 17, 2011",113,"I'm 25 years old and I'm taking 10mg of Norvasc and 25mg of hydrochlorothiazide and at the moment I'm not liking either of the medicines. Between stuffy nose, sore throat, increased thirst, dry mouth, severely dry skin, blurred vision, it makes me feel like its worse than having high blood pressure. My side effects are symptoms of an allergic reaction so maybe someone else might have better luck than me.",live&amp;love
72,Norvasc,High Blood Pressure,3.0,,"August 1, 2011",65,I had sexual side effects from Norvasc and it only moderately controlled my hypertension.,Anonymous
73,Norvasc,High Blood Pressure,2.0,,"April 11, 2011",81,"After taking Norvasc 10mg for 3 months I found my feet ankles and hands were swelling up, also gained weight even though I walk every day. My Doctor has put me on Avapro and I will monitor it for the next 3 months. ",Anonymous
74,Norvasc,High Blood Pressure,7.0,,"December 13, 2010",77,I took Norvasc for approximately 7 years. It works fine lowering my blood pressure however it began to swell my gums and I was taken off it.,Ron 59
75,Norvasc,High Blood Pressure,8.0,,"October 2, 2010",106,My blood pressure went up to 220/150 and I was placed on Norvasc 10mg and Diovan 80mg. Been on this for over a year now and my blood pressure is currently 120/80 and I have had no side effects other than swelling on the lower leg which steady brisk walking has handled. The combination worked very well for me.,Anonymous
76,Norvasc,High Blood Pressure,9.0,,"July 18, 2010",59,"This drug has worked very fast in reducing high blood pressure. I was on lisinopril but developed hives, swollen lips and tongue so doctor switched me to Norvasc. I seem to still have occasional hives but not as severe and may be triggered by heat. AZ this time of year is quite hot.",Pixeljim
77,Norvasc,High Blood Pressure,9.0,,"June 18, 2010",140,Both my husband and I have been taking Norvasc for a period of approximately 6 months.  It has lowered both of our blood pressures into the normal range and we have suffered absolutely no side effects.,Anonymous
78,Norvasc,High Blood Pressure,3.0,,"December 7, 2009",87,I was switched to Norvasc from another blood pressure medicine about a week ago. I am not sure if its helping yet for my blood pressure but I am not liking the side effects. I have had a migraine everyday since I started taking it.,Anonymous
79,Norvasc,High Blood Pressure,3.0,,"December 1, 2009",119,"Took 5mg for almost a year.  It did a great job on blood pressure.  But I got progressively worse muscle cramps, especially in my calfs.  Could not run for more than a few minutes without intense pain.  Had to switch to another medication.",Anonymous
80,Norvasc,High Blood Pressure,3.0,,"November 16, 2009",300,"This medicine and I did not mix. I was really sick the whole time I took the medicine. I swelled up on my hands, feet and ankles. I was nauseous, extremely weak, my extremities were either numb, burning or painful. I heard my heartbeat constantly in my ears and had this awful crawling pain up my the back of my neck, itched, sweated and froze constantly, stuffy nose and so much more that I actual could not sleep. No, this is not a medication for all people. Dose changes did not help since the low dose promoted the majority of my ill effects. This medicine does well for some but, do speak up if you do not feel well on the medication.",aml11172
81,Norvasc,High Blood Pressure,1.0,,"July 17, 2009",108,"30 minutes after taking one 5MG tablet, I suffered chills and had to sleep in a jacket in an attempt to stay warm in July. The chills continued from 10PM to 6 AM the next morning. ",johnwwebb
82,Norvasc,High Blood Pressure,7.0,,"June 25, 2009",65,I've only been on Norvasc 10mg for about a week. It has lowered my blood pressure and so far no side effects. Will keep on monitoring it.,Anonymous
83,Norvasc,High Blood Pressure,3.0,,"June 25, 2009",124,"I have been taking Norvasc 5mg for 6 months. It makes me tired, have had weight gain, and now have palpitations when I take it. It hasn't lowered my blood pressure by much. I exercise daily and take vitamins.",Anonymous
84,Norvasc,High Blood Pressure,9.0,,"March 31, 2009",103,My doctor recommended me to take this medicine 5mg. My blood pressure became stable. Also I compare with other High Blood pressure medications. Not so much side effects and doesn't affect my work.,Middle age women
85,Norvasc,High Blood Pressure,1.0,,"March 27, 2009",67,This medication did not lower my blood pressure or pulse rate at all.,Samual
86,Norvasc,High Blood Pressure,7.0,,"February 16, 2009",156,Taking 10mg daily. Controls blood pressure to normal level. Only side effect experienced is swelling in ankles. Brisk walk for 1/2 hour daily reduces the swelling.,Anonymous
87,Norvasc,High Blood Pressure,8.0,,"August 3, 2008",69,"So far on 10 mg Norvasc and 80 mg Micardis.  Has proven to be an effective combination for my hypertension. Previsouly my readings were around 160/90 and now it is around 130/75.I am 39 years old, obese person (100kg) 5ft 6 inches in height.I have been having hihg blood pressure for about a few years now and have tried quite a few types of medicine until these two which has been ok so far.",FJC
88,Norvasc,High Blood Pressure,,,"June 22, 2008",133,"I take Norvasc half of a 5 mg daily and a l/2 fluid pill 3 times a week.  I added Vit.B complex for stress, Vit.A and D, Vit.E, and potassium.  This works well with me.",Anonymous
89,Norvasc,High Blood Pressure,7.0,,"June 4, 2008",122,"Riding a bicycle 30-40mins twice a day 3-6 days a week.  Had trouble witha high diastolic pressure but since dose was increased from 5mg to 10mg, it dropped and the exercise has definitely prevented any swelling.",ECrowley
90,Norvasc,High Blood Pressure,8.0,,"March 14, 2008",225,"ankles may swell if no exercise and possible nasal stuffiness and swelling.Very effective in reducing b.p.",Stubby
