,drug,condition,rating,duration,review_date,upvotes,review,username
665,Depo-Provera,Birth Control,9.0,Taken for 1 to 2 years,"October 2, 2015",9,"I am a teenage girl, and was told to go on the depo after my mother found out that I have been having sex with my boyfriend. I've been on it since I was 15, and I never even had to worry. I haven't gotten my period since then, and I have only gained 10 pounds. Slight irritability, Increase in my breast size by two cups. Keep in mind that the weight you gain is all body fat. I have an ample amount of stretch marks on my legs especially. If you do not care about the weight gain, this birth control is definitely for you.",Anonymous
666,Depo-Provera,Birth Control,1.0,Taken for 1 to 6 months,"September 29, 2015",6,"I was on this birth control for month two when I started noticing side effects. People say they never get a period? I got mine THREE times in the span of a month and a half. These were three FULL seven day periods with less than a week break in between. I became insanely depressed and had anxiety I could not handle. I spent every day crying because my emotions were out of control. I contemplated suicide many times but never tried. It took MONTHS to get back to some type of normal and even now, a year and a few months later, I still get AWFUL anxiety during my period and when I'm ovulating. Prior to the Depo Provera I never had depression or anxiety. This was my first time and I pray that this will be my last.Wouldn't wish it on an enemy.",Whywhywhywhywhy
667,Depo-Provera,Birth Control,1.0,Taken for 6 months to 1 year,"September 29, 2015",8,"Weight gain, mood swings, stomach pain, none existent libido, migraines -all this can be yours with a shot of depo",Erm84
668,Depo-Provera,Birth Control,5.0,,"September 29, 2015",6,"Consider something you like. Say, a favorite breakfast food or a place to go with friends. Now think about something you care nothing about, say, the painted lines on a road or the bottom of your kitchen table. Imagine that everything you like, instead of being something nice you enjoy, becomes as unimportant to you as the bottom of your table. Work. Favorite nephew. Friday night. Now you feel nothing either good or bad. That's depo provera. Yeah you won't get pregnant but that's because you won't care about sex or your mate or anything. Most awful 12 weeks ever. Good news though, you won't care about your three month period either. Or the enormous blood clots. Or the long term damage like bone density loss and anemia.",Clarkiecccc
669,Depo-Provera,Birth Control,1.0,,"September 23, 2015",2,"Im 25 years old and 5 feet tall 160.8 pounds. In August 2014 I had the Depo Shot (worst decision ever). A year later and I gained 30 pounds.When I was in middle school I was 160 pounds as well but in high school I dropped a lot of weight and was in the 120 most of the time until I got the depo shot! I have tried my regular ways of losing weight exercising, dieting, meal replacements, HCG diet and also Insanity. These all worked previously for me but not now.I started Isagenix and I'm optimistic because I have 6 friends that all used this product and lost weight. I think it might work on me too despite of the Depo Shot",KITA T
670,Depo-Provera,Birth Control,10.0,,"September 22, 2015",3,"I have been on depo since I was 16 and I am now 21 years old. I have had a great experience overall with the shot. When I first got the shot I did bleed/spot for almost a month straight. The bleeding did go away and now it only occurs when I am due for my shot. It has been awesome to not have a period and not worry about taking a pill, but I have heard it is not good for you after a certain amount of years so I am having to find another source of birth control.",BMSutton
671,Depo-Provera,Birth Control,3.0,,"September 21, 2015",3,"I loved the shot as far as having no periods at all! But that was the only good thing about it. My hair fell out like crazy, lots of hair loss while brushing my hair, shampooing and just touching it. And it didnt stop. I have only had one shot which lasted for the 3 months and since day one of the shot my hair has fallen out. It used to be so thick, now my hair is thin. Not only hair loss, I had terrible terrible mood swings. Mad for no reason all the time. I have spoken to other people that took this and they said the hair loss never gets better, only worse. I did not gain weight, I was hoping to as I weigh 112, but I did not gain in 3 months time.  I am not going back for my second shot, the hair loss and mood swings is not worth it.",BekahD
672,Depo-Provera,Birth Control,9.0,Taken for 1 to 6 months,"September 18, 2015",5,"I received my injection on July 29, 2015. I was on my last day of my period and since then I have only had mild spotting. I experienced some pain on the injection site that went away after a couple days to a week. Very few mood swings. I gained six pounds since then. I am considering not going in for the second injection because I fear I will gain more weight and have worse side effects. Also you are expected to take calcium supplements since it sucks the vitamin D and/or calcium out of you. Which is hard for me because if I wanted to take a pill everyday I would have just got that. I have had a pleasant experience on depo but I am worried about the future.",Luna Doombringer
673,Depo-Provera,Birth Control,4.0,,"September 13, 2015",4,"Iv been on depo for 3 years , and I can say its better than other birth controls you deffanitly won't get pregnant its probly hard to conceive even after you stop getting it. I have gained about 35 lbs mostly always hungry. I get acne on an off an have mood swings . I'm thinking about getting off of it cus I heard it decreases bone mass an putting that in your body for long time can't be healthy",Anonymous
674,Depo-Provera,Birth Control,1.0,,"September 11, 2015",5,The depo shot was convienent. Loved not having to take a pill everyday. At first things were fine then I slowely started to develop severe depression all the way to suicidal thoughts. And trust me I'm the happiest person alive I was so confused what was happeneing. I only got 2 shots and then I switched to sprintec pill. Within a week of being off the depo I felt like myself again. I would rather take 10000 pills a day then to feel what I felt on the depo.,Psugirlannie
675,Depo-Provera,Birth Control,10.0,,"August 31, 2015",13,I have been on the depo for 6 1/2 years. I love it! It works. AND No periods. No weight issues. No crazyness. About a week before I am due for my three month shot I will spot but it is no big deal. My doctor has recommended that I switch to a different birth control since I have been on this for so long and there is debate about bone mass being impacted after long term use. I am sad to switch honestly. I will be switching to mirena and am VERY nervous to try something different. I am only 22 so hopefully my body will adapt to mirena alright.,hellopeeps!
676,Depo-Provera,Birth Control,10.0,,"August 30, 2015",5,"I absolutely love being on the depo shot. I have never had and problems or side effects except one and that is I don't get periods any more at all. I love that and its every 3 months I'm not planning on having any more kids any time soon I have 2 already, both girls 11 & 6 yrs old. I'm 29 yrs old and been on the depo shot 6 yrs. Anyone thinking of getting it. Get it its the best",Lauriegreeneyes
677,Depo-Provera,Birth Control,5.0,Taken for 1 to 2 years,"August 28, 2015",3,I was on Depo for twoish years. The first year was great spotted 3 months in and then never had a period at all. And then beginning mid second year everything changed. My mood swings were though the roof I gained 10-15 lbs I felt depressed. It definitely does the job of preventing pregnancy but the side effects were through the roof. I live an active lifestyle work out 2-5x a week and have been doing weight watchers for 1 year my weight is always up and down but I feel like its a cycle. I get motivated for a few weeks lose a few pounds and then get depressed and stop caring. I talked to my doctor and she does believe it is from depo. So I went back on the pill.,Kriscat99
678,Depo-Provera,Birth Control,8.0,Taken for 2 to 5 years,"August 28, 2015",2,"I was on this method of birth control from age 16-20. I loved it! I never noticed a weight gain, no periods at all for this entire time. In retrospect that probably isn't healthy but at the time it didn't bother me in the slightest. I had pretty intense mood swings, but I was also In a very unstable relationship at the time so I'm not going to pin the mood swings entirely on the depo. I recently switched to Trinessa pills and absolutely hate them, I never realized how happy I was with the depo shot until I started something else. I'm slightly concerned with the long term effects of the shot, but I might end up switching back to it. I know it has a rep for making people gain crazy weight, but it didn't have that effect on me.",cassidylea
679,Depo-Provera,Birth Control,8.0,,"August 24, 2015",3,"I was on the depo shot for about a year. I loved it. I had no periods at all for the year. I decided to try to conceive so I stopped getting the shot. The month after I was due for my shot I got my period again. Two weeks later and I'm still bleeding. I had very normal periods before the shot, always 4-7 days, on time every month. I'm nervous about my fertility and the constant two weeks of bleeding. I just hope it ends soon. I'm giving the shot an 8/10 because I had no side effects or periods on the shot and I didn't get pregnant. So I guess the birth control did it's job.",DTaylo
680,Depo-Provera,Birth Control,1.0,,"August 22, 2015",1,"Had I seen this blog years ago I would have given the depo shot a 10+ rating. I loved it! I tried a few other BC methods prior to getting depo years ago and didn't care for any of them. Finally when I first found depo I loved it. No periods, no side effects. Everything was great. I too a break from depo for about 3 months and then when I got my first injection again (about 1 and a half months ago) everything went down hill. I got it while I was on my period and then 3 days later I stopped bleeding then about 2 weeks after I started spotting which lasted a week, now it's been almost 3 and a half weeks and I'm still bleeding I'm constantly tired because of the lack of iron from bleeding for so long.  I won't be getting the second injection!",Stephaniemarie94
681,Depo-Provera,Birth Control,10.0,Taken for 1 to 2 years,"August 20, 2015",5,"I loved the depo shot. I was on it for just under two years,  and had no problems.  I used this as my only form of protection since I am in a committed relationship.  My only slight issue is that I gained alot of weight (about 70 pounds). My doctor believes this is due to the stress of a new job,  a promotion,  And some life changes, not the depo.  I quit the shot in order to confirm, it's been almost three months and I'm still gaining weight,  so maybe the doctor was right. I had no other side affects,  And no period,  from the day I started. I haven't gotten my period back in the last three months. I plan to go back on the shot very soon.  It's the most convenient by far,  And despite the horror stories,  I've never had a problem.",Anonymous
682,Depo-Provera,Birth Control,1.0,Taken for 1 to 6 months,"August 19, 2015",8,"Its a great contraceptive, I cant possibly get pregnant Why? Because I've had my period for 6 weeks!This is seriously the worst thing I've ever had.",Rachaeld
683,Depo-Provera,Birth Control,5.0,,"August 17, 2015",3,"Depo was not for me, but that does not mean it won't work for you! It definitely did its job preventing pregnancy. I was told the shot lasted 3 months. After my three months, I didn't go back to get another shot because my husband and I wanted to have a baby. It didn't happen for over a year AFTER those three months passed. We had another child, so it wasn't because I'm not fertile. I was also suicidal after getting depo. Not your average depressed, but actually suicidal and so crazy depressed that I wanted to die and had no clue why. I lost a lot of hair when I would brush it. I didn't gain weight. My worst side effect was the depression. It was unbearable to the point that I almost took my own life.. But it surely can prevent pregnancy.",Maryelyse93
684,Depo-Provera,Birth Control,10.0,,"August 15, 2015",18,"I've been on this medicine for 2 years now and have not had any negative side effects. For those of you reading this you shouldn't let somebody else's review determine what her or not you take this medicine, that should be decided after a long talk between you and your doctor. Every body's body is different so these reviews can not give a completely accurate description of what's going to happen to your body. I'm my experience I had irregular bleeding for about 4 months but that is the time it took my body to adjust to the medication. If you have irregular or constant bleeding for more than six months, which is two cycles of the medication then you may want to talk to your doctor because the medication might not be the right one for you.",AshleyMay
685,Depo-Provera,Birth Control,10.0,,"August 14, 2015",5,"I have had no negative side effects wit this birth control. I have tried about ten different kinds of birth control pills before trying Depo and all of the pills made me an emotional mess. I have no complaints about Depo, I didn't gain weight, no periods, no crazy emotions.",Anonymous
686,Depo-Provera,Birth Control,2.0,Taken for 1 to 6 months,"August 14, 2015",9,"I didn't get pregnant, which is the only reason I'm rating this a 2. I have been bleeding for 56 days straight as of today. Since I got the shot, I have experienced severe fatigue, 1-3 hour long headaches, appetite issues, inability to get out of bed, and horrible cystic acne.",locogracie
687,Depo-Provera,Birth Control,10.0,,"August 10, 2015",2,Ive been on the shot for about a year now and i absolutely hate it!!!! Ive gained so much weight and were talking like 40 lbs. Its like i cant stop eating. My cravings are absolutely horrible. Im always hungry. I work out here and there but i cant seem to lose the weight. Im 17 years old. This birth control method is not something i would suggest to anyone except for the fact that it is very effective against pregnancy,Anonymous
688,Depo-Provera,Birth Control,4.0,Taken for 1 to 6 months,"August 10, 2015",2,"So I've been going back and forth between Sprintec and Depo for the last year. I was on Sprintec from the age of 16 because of horrible cramping. I loved the pill but could never remember to take it so I was on my period all of the time. I tried depo, I don't really remember the first time taking it except for having some vaginal dryness and I lost my boobs (at 20 years old not the most exciting combination). So I got back on the pill, same issues of forgetting to take it and went back to depo for some reason I can't explain to myself. It was a horrible decision. My mood swings are ridiculous, my anger is out of control, I'm constantly bloated, I've become very constipated, spotting comes out of no where, and I'm constantly exhausted.",Anonymous
689,Depo-Provera,Birth Control,6.0,Taken for 2 to 5 years,"August 10, 2015",2,"I have used many types of birth controls from the patch, the pill, the ring, and now the shot. I would always forget to take my pill so I decided to make the switch to depo. Although I love that I never have to think about taking my birth control, the depo shot makes me spot, a lot. To me it's not worth it. I  always spotting and have ruined countless underwear. I knew there would be some spotting but the spotting has not stopped. I would rather take the pill and have a regular period than have to spot every day.",The shot
690,Depo-Provera,Birth Control,2.0,,"August 6, 2015",6,"I have had 2 injections and am discontinuing the drug after 6 months. In my opinion it is just not worth it. I experienced extreme nausea for 2 or 3 days within the first 3 months of getting the injection. My periods came early and lasted 2 week. I had many anxiety episodes and mood swings. Nearing the time of my second injection I experienced extremely heavy bleeding for 5 days, (I'm talking new super tampons every 2 hours with a regular pad for inevitable leaks) and even fainted during this time. 6 months later and most of my symptoms have gone, but I've had my period since my second injection over 3 months ago. At least it has been effective in preventing pregnancy; the combination of these symptoms leave me with no desire for sex!",LNM
691,Depo-Provera,Birth Control,1.0,,"August 3, 2015",9,"Worst thing ever. Effective yes, but destroy ladies body, especially when you stop using it. I would never recommend it.  I wish I had never taken it. I took 3 shots, yet it was enough to mess up my whole cycle. Uncontrolled bleeding. Unaware when to expect blood or not. Z 100 percent bad!",Sila
692,Depo-Provera,Birth Control,8.0,,"August 1, 2015",8,"I've been on Depo twice. First time I was on it for about 3 years and now I'm on it again, and it's been 3 months. The first time I was on it absolutely loved it! No horrible side effects. This second round though, I have gained some weight which is no biggie because I do like my bigger butt lol. I think Depo is awesome, and it's really convenient and easy.",Phia
693,Depo-Provera,Birth Control,5.0,Taken for 2 to 5 years,"July 31, 2015",2,"I've been taking depo-provera since May 21, 2012. I haven't had a period since but very light spotting from time to time. This my 3rd year on birth control and after my last shot on July 21 I've been bleeding uncontrollably. I don't know what's wrong but its literally making me feel sick. Light headed due to low iron. I don't know if I should stay on it or not.",Anonymous
694,Depo-Provera,Birth Control,5.0,,"July 26, 2015",2,Well I've been taking depo for over a year now since I had my first child . I took my last shot in April 2015 and I've decided not to take another shot because of all the bleeding I've been doing . I was supposed to take another shot on July 17th but didn't and that didn't seem to help because I'm still bleeding like crazy . I have been bleeding for almost 1 month . It's crazy .,SlimmyMommy
695,Depo-Provera,Birth Control,9.0,Taken for 6 months to 1 year,"July 23, 2015",4,"I had a great experience on this medicine. I recently stopped because I got sick of the spotting. What makes me mad is as soon as I stopped, my body had finally got used to it. I was a pretty fit person too. I am 5'6 and I weight about 145 when starting, and then dropped down to 130. It's very, very rare to lose weight so don't think it will happen to you but I went to the gym in my spare time ( I mainly ran a lot) and I lost the weight. It was great and I never had to worry about being pregnant. I plan to go back on this bc again. Plus, it was free. I have tried plenty of bc and can't stand the pills, tried the nuvaring because that was free with my insurance too. Nope hated it. Everyone is different but overall this was the best BC I was on.",Jessica!
696,Depo-Provera,Birth Control,,,"July 19, 2015",7,"My experience on depo has been great so far , I been on it for one year I don't bleed for days , however I spot time to time.  (Not a lot at all ) yes I have gained weight (only in my thighs and butt)  I Get headaches but nothing extremely dreadful . mood swings!  Other then that I don't I any other side affects . I haven't got pregnant lol",skinny_mee3
697,Depo-Provera,Birth Control,10.0,,"July 19, 2015",6,Hello everyone I was 13 years old when I started the depo. I finally got off the depo at 28 then turned around and got the 10 year IUD at the age 29. Now I'm 30 years old turning 31 in July. I never been pregnant never had no abortion. Now I want a child and can't even get pregnant. I just don't know what to do. If you know any fertility pills let me know please.,loveme31
698,Depo-Provera,Birth Control,10.0,,"July 14, 2015",6,"I find the depo really good, as im still on it. I've been on it since November 2014 and havnt had my period since, no weight gain besides maybe 2 pounds (not bad at all seeing im only 100 lbs) and havnt had any other side effects. I find its very effective and happy i dont have to worry about ruining more underwear!",Unknown39
699,Depo-Provera,Birth Control,9.0,,"July 9, 2015",11,I love the depo shot.. I've been on it for over two years now. I have had no period or spotting until about two years on it. I only spot about 4 weeks before my next shot and have had a little bleeding lately. Other than that I really love it. And no weight gain.,Becky86
700,Depo-Provera,Birth Control,3.0,,"July 8, 2015",5,"I got this shot bc of a pregnancy scare and it's only been a week but I've had non stop brown spotting.  I read about the pill and it said no extreme things.  But now I'm reading reviews and I'm totally freaked out and now I can't get out of it.   The whole point was so I could have sex with no worries but now I don't have sex bc it would be nasty.  So don't do what I did,  pay attention to negative reviews!!!!",Anonymousnzb
701,Depo-Provera,Birth Control,2.0,,"July 7, 2015",12,"The amount of characters I can type is limited but my story is long, so I'll shorten it for you. I've almost had the injection for a full year. I have also almost had my period for a full year, August will be the anniversary, and also when I give up on this birth control. Not spotting, a full on period. Upon receiving my last shot, the technician severed a nerve, I've never had a good experience with the administration of this injection. If I do not strictly work out based on how much I eat every single day, I begin to gain immediately. I also have extreme, very extreme body odor, vaginal, oral, the worst is under my arms. It also completely ruined my libido. From start to finish, the experience has been nothing but awful.",cccccccccc
702,Depo-Provera,Birth Control,1.0,,"July 6, 2015",12,"I do not recommend this at all, at first it was great because you don't get your period for months and you don't have to worry a lot about condoms but then I realized that cant be good for your body, and when you did get your period after months it lasted a whole month also my bones started to feel weird this shot might be good for a short term thing but not a long term option it will destroy your body im sticking to condoms definitely ..you cant mess with the way your body functions",Agneris
703,Depo-Provera,Birth Control,10.0,Taken for 6 months to 1 year,"June 27, 2015",31,"I would recommend this to everyone,My experience on the shot has been great. This is about my 9th month now and I never had to deal with any crazy side effects like weight gain, acne, etc. However, In the first 3 months I did have mood swings but they were never worse than any normal mood swings (for example period mood swings.) and I never got my period, bleeding, or any sporting till 6 months after I started the shot! And even then.. My period was very light and quick. Be sure to drink a lot of milk or eat dairy to replace the calcium that gets stripped from your body by taking the shot. If you don't replace your calcium, your bones can become weak or you can experience more side effects. Just take care of yourself :)",MandaDelia
704,Depo-Provera,Birth Control,1.0,,"June 25, 2015",7,Do not get the shot. I got the shot a while ago at first everything was alright but then I got my period which I've had forever now it will not go away. I get the worst headaches that I've ever had before and they last all day and I get them everyday. I feel sick. And I also have started to feel super moody and sad out of no where. My body gets achey and I am starting to gain weight definitely will not be getting the shot again it's not worth it.,Cfischer157
705,Depo-Provera,Birth Control,10.0,Taken for 2 to 5 years,"June 25, 2015",7,This depo shot has been the best for me I have been on it a long time and I have had no side effects from it I feel full all the time and no pregnancy scares it's really good,Anonymous
706,Depo-Provera,Birth Control,8.0,Taken for 1 to 2 years,"June 24, 2015",12,"Everyone's body is different so I was unsure of how mine would react, but I've had a pretty good experience with depo. I started the beginning of my junior year in high school because my periods were so bad that I would miss school because of cramping. Just taking regular Tylenol or ibuprofen wouldn't lessen the pain. So we decided to go and see if could try something that would help. And the Depo has been amazing for me. I don't have periods although for the first month and a half I did spot on and off. I do sometimes get small cramps but they are nothing like they were and they're only around the time I should be on. My moods are pretty good, I'm not depressed although I do get angrier a little easier. Best of all I've lost 10lbs.",Kat1165
707,Depo-Provera,Birth Control,9.0,Taken for 6 months to 1 year,"June 22, 2015",6,"I've been on the shot for about seven months now, and haven't experienced any of negative side effects that I'd heard horror stories about (no weight gain, no unusual acne, no unusual hair growth, no significant appetite changes, etc). I did have pretty irregular spotting and bleeding for the first three months, but now I can't remember the last time I saw any blood, which suits me just fine! Overall the drug has treated me pretty well - I like not having to deal with my period each month - the only downside for me is having to schedule regular Dr.'s appointments to get the injection.",ail56neura
