,drug,condition,rating,duration,review_date,upvotes,review,username
223,Depo-Provera,Birth Control,6.0,,"February 5, 2019",3,"It did what it was supposed to which is stop my periods and prevent pregnancy, but it gave me some pretty bad side effects. I have only had 3 shots so far and I am definitely ending it and going to try an IUD.  1. Weight gain, I gained 15lbs even though I workout every day and I am pretty good about eating. I have been craving chocolate and ice cream a lot but this wasn’t a huge deal to me though. 2. My acne has gotten worse. I went on accutane 4 years ago and I didn’t break out til I started this birth control definitely sucks to have my acne back. 3. Constant headaches. 4. Dizziness. 5. Memory loss. This is the reason I am changing birth controls. I can’t remember anything. I work at a small restaurant and I used to be able to remember a table with 4 peoples orders and now I can’t even remember drinks. I can’t stay focused. I constantly feel emotionless. I feel like I am not all there. What sucks the most is I have to wait until it expires so feel better again.",Monica
224,Depo-Provera,Birth Control,5.0,Taken for 1 to 6 months,"February 3, 2019",6,"I got the shot once and it was TERRIBLE. I experienced crazy depression and mood swings, as well as acne that refused to go away no matter what I did. It was effective at birth control, but I wouldn't wish these side effects on my worst enemy.",onewithacoke
225,Depo-Provera,Birth Control,10.0,Taken for 2 to 5 years,"January 29, 2019",11,"My experience with this shot has been nothing but good, with the exception of irregular spotting for the first couple months; however, after that I was period free. This shot has NEVER made me depressed or anxious the women that are experiencing these feeling maybe  prone to these symptoms. I suggest you go to a psychologist if you encounter these feeling during the shot. Lastly I have been on this shot for 2 years and have not gained weight. Ladies if you are gaining weightprobably you should probably try  to eat healthy and work out, if all else fail go back to the Doctor for advise.",Cali
226,Depo-Provera,Birth Control,5.0,,"January 14, 2019",3,"I got on the Depo shot January 2016. I gained 20 pounds my first couple of months, but that was in combination with the fact it was my freshmen year of college & I ate a lot of fried food. For the first year everything was great- no periods at all! I got on depo because my body rejected contraceptive pills because of the estrogen levels. In February 2017 I had a ruptured ovarian cyst. I didn’t know they could hurt that bad! For the first 24 hours with the severe pain it was so bad on my right side I thought it was my appendix! But then I bled and yeah. Then March 2018 I got diagnosed with 3 more ovarian cysts, one being 10cm, so I had to get it surgically removed. I also get spotting every week before my depo shot is due. Overall, if you really don’t want to get pregnant, the shot is great because I never have to worry about remembering a pill & it is SUPER effective!!!! But it has caused a lot of problems with my ovaries & my OBGYN wants me off of it this year & on something else",absolutelyali
227,Depo-Provera,Birth Control,6.0,Taken for 1 to 2 years,"January 12, 2019",3,"So I got on the depo shot on the summer of 2017 and ended it in December 2018. I was suppose to go back for my shot but decided not to . When I first got it was great the thought of not having to deal with a period excited me . I spotted for a week then it went away, so I was like okay this is great since I’ve always had heavy periods . WRONG !! Acne bumps started on my thighs at first I thought I was allergic to my body wash so I switched body wash which helped a bit . But I noticed every time I was up for a shot my acne would clear up . Then in June 2018 I started spotting I’ve  been on my period since then it’s January 2019!!! Now. I hate it !!! So what sex life ? None because I’ve been on my period !!!! Plus side I didn’t gain weight it actually helped me loose weight while I was on it. It just didn’t work out for me .",Val
228,Depo-Provera,Birth Control,1.0,Taken for 1 to 2 years,"January 9, 2019",3,"Avoid this form of birth control! It made me gain 30 pounds, worsened my mood, and gave me severe abdominal cramps. Now that I have my period back, I cramp 3 weeks out of every month, as opposed to 1 week a month before starting Depo. Try any other form of birth control except the shot!",Otsutsuki
229,Depo-Provera,Birth Control,1.0,Taken for 1 to 6 months,"January 5, 2019",7,"The Depo shot is the worse birth control anyone can take. DO NOT TAKE!!!! When I first got my shot I immediately started feeling sick and was in and out of the hospital for two weeks due to throwing up everything I ate and not being able to function. I wish someone would’ve told me about the shot. However, it didn’t make me bleed for months like it does a lot of girls but the feeling that they shot caused me and the depression. I wouldn’t wish it on my worse enemy. Do yourself a favor and chose a different form of birth control PLEASE.",Jackie
230,Depo-Provera,Birth Control,1.0,Taken for less than 1 month,"January 5, 2019",4,Please avoid this medication. I had one injection. Which lead to 1 year of bleeding constantly. I became iron  deficient. After the bleeding finally finished I got really sore swollen breasts and breast milk. I went back to the Doctor. I finally decided that I wanted a baby. My first ended in a miscarriage. I feel this was because of this medication and what it did to my body. The worst thing is that you have to wait for this horrible medication to run it’s course. If you have a bad side effect the doctors can’t help you.,Deb
231,Depo-Provera,Birth Control,6.0,,"January 3, 2019",4,"I had 5 shots in total of the Depo. After my first shot I had no bleeding, no cramping, I was in bliss. After my third shot I experienced some random bleeding and also bleeding with sex. Before during or after. It wasn’t every time but it was enough to cause concern. After my 4th shot I noticed my anxiety skyrocket. I started think everything was wrong with me. Sort of being like a hypochondriac. I had a lot of joint pain and breast tenderness to the point I was thinking I might have breast cancer (I’m 19). I had periods after sex that lasted up to 2 weeks. After that happened I decided to stop the depo and haven’t gotten on a new birth control because I am worried about what’s really going on with my body.  I’ve only been off the depo for 3 weeks but have heard it can take up to 8 months for you body to get back to normal. It prevents pregnancy but I do not recommend due to the side effects.",Honey
232,Depo-Provera,Birth Control,1.0,Taken for 1 to 6 months,"November 29, 2018",6,"Absolutely hate it..I took the birth control shot have gained so much weight and can't loose my baby weight...I feel pregnant and super moody, literally have all the side effects weight gain , headaches, tierdness, etc.  Super moody so now  me and my husband are having more issues because of my hormones. Anyways I'm changing birth control method next month I'm considering IUD hormone free. I want to feel myself and birth control shot is by far the worst  I have tried.",Lucy
233,Depo-Provera,Birth Control,4.0,Taken for 1 to 6 months,"November 29, 2018",2,"The shot does what it supposed to do which is preventing pregnancy but the side effects are horrible. When I got my first shot 8 weeks after I had my first born my dr said it’s a good one and I probably won’t bleed at all but I ended up bleeding for the whole 3 months that I was on it so I decided to get off it. I experienced really bad cramps, my joints were hurting, my hair started falling out, I kept finding pimples on random spots all over my body especially the back of my neck, my depression and anxiety got really bad to the point where I became suicidal very moody starting fights with my partner and didn’t want to leave the house at all. And it sure does make you Hungry sometimes HANGRY. When I was on it I worked out 4-5 times a week hoping that the baby fat will slowly go but didn’t do anything you either put on weight or stay the same weight which was frustrating. It does work but I wouldn’t recommend it to anyone :(",Lenz
234,Depo-Provera,Birth Control,10.0,Taken for 2 to 5 years,"November 9, 2018",4,"I’ve been on the depo shot for 4 years now, never had a single problem with it! I bled for about two months straight and toughed it out, and then they went away completely! The only single time I ever spot a little bit, is if I’m really late on my shot. My sex drive is perfect, and I’ve tried to gain weight for years and still have only gained 10 lbs in 4 years of being on it! I was told by my cardiologist that I shouldn’t have another child or we will both likely die, and this is the most effective birth control I’ve ever had! Never had a scare, or a worry! I love it!!",Itsjustme
235,Depo-Provera,Birth Control,1.0,,"November 6, 2018",11,"I recommend no one ever tries this.  I had my first injection and felt fine for 3 month ( at least I thought I did).  After my second injection felt completely different. Since having my second injection I don’t feel like the same person I have had 4 panic attacks and am suffering with BAD anxiety. I am constantly worrying about my health and diagnosing myself with all sorts all side affects of the injection. I feel like a severe hypochondriac at the moment. Not only has it messed with my mental health making me constantly worried anxious and stressed it has caused me to get cystic acne 2 weeks into my second injection I saw 3 spots appear on my face ( I’ve never ever had spots in my life) how wrong was that causing them to get bigger and painful,  The more the injection wears off the smaller they seem to get. I have not yet been to my GP about my problem yet as I want to let it wear out of my body and pray I get back to my normal self and my skin gets better- DO NOT GET IT",Lou Lou
236,Depo-Provera,Birth Control,1.0,Taken for 2 to 5 years,"November 5, 2018",3,"I abhor the depo shot! I've been on it for a little over 2 years and it has been awful for my sex drive. I've been on a bunch of different birth controls in the past and I've NEVER experienced such a complete and total lack of sex drive. I'd much rather sleep than ""do it"". For 24 years old, that's just sad. It's ruined my relationship. I've gained more than 50 pounds despite a very active lifestyle. My acne is worse than ever before. I'm losing hair by the handful in the shower. It used to be that the depo was my only prescription, but now I have a prescription for almost every side effect. I'm so disheartened with this and would never recommend it for anyone.",Ellie
237,Depo-Provera,Birth Control,1.0,Taken for 1 to 6 months,"October 26, 2018",1,"I had the depo shot three times. The first one actually did help my awful cramps and I had a normal period, but the second and third shot ruined my skin. I had perfectly clear skin before starting the shot and 2 months in I had very painful cystic acne. I wish I would’ve never gotten the shot because months later I’m still dealing with the scars when I had perfectly clear skin before.",Bug
238,Depo-Provera,Birth Control,1.0,Taken for 6 months to 1 year,"October 23, 2018",3,"Don’t use this birth control. I went on birth control for the first time (at 18) and my doctor told me about Depo and I immediately said yes because it seemed amazing. One shot every 3 months? No forgetting a pill? The first 3 months I had a high sex drive and I starting losing weight, I was at 107 (I’m 5’3)! By the next shot I was at 130-140 and my sex drive had decreased immensely and I was also very irritable. I also didn’t mention that the first shot I was bleeding irregularly and by the second shot I stopped bleeding all together. I don’t think this medication should even be legal.",Izzy
239,Depo-Provera,Birth Control,2.0,,"October 22, 2018",9,I am due for my second shot this week and will NOT be getting it. I chose this BC due to its convenience and ability to stop my period. I’m 21 and have found depo to be extremely affective in the aspect that I am not pregnant. I WAS an extremely outgoing and happy 21 year old with absolutely no anxiety or depression before starting this BC. The depo shot has absolutely wrecked me as a person. I have experienced extreme anxiety attacks weekly and my mood has never been worse. I have become extremely unmotivated and sad at all times. This BC has caused so many mental and emotional breakdowns and is honestly ruining my life. I have no inclination to do anything anymore (I was a total social butterfly before) and these emotional episodes have even caused suicidal thoughts that I have never even been close to experiencing.  I WOULD NOT RECOMMEND THIS METHOD OF BIRTH CONTROL. I will be switching to a nonhormal IUD option and pray to god I start feeling like myself again soon.,Anonymous
240,Depo-Provera,Birth Control,1.0,Taken for 6 months to 1 year,"September 27, 2018",2,"Oh my goodness, I got such bad eczema as a result of the depo shot. It's been 3 months since my last shot and I'm never using it again. I started using it last year October. The side effects were awful: trouble sleeping, hair loss to the point where I had to shave my hair, eczema got so bad I was always scratching and doctors cream made it worse my skin felt like it's on fire, bad mood swings and dark thoughts, I became overly sensitive, short term memory loss, headaches, felt so much pain wearing high heels (probably the bone loss side effect), dry skin, I gained a bit of weight too,  the non-stop bleeding for first 3months after the first shot. NEVER GOING ON DEPO AGAIN!",Amber
241,Depo-Provera,Birth Control,1.0,Taken for less than 1 month,"September 22, 2018",8,"If you’re looking for something to tell you whether or not to get this shot. This is IT!! You are reading this review for a reason and the reason is that this shot ruins you. It’s literally toxic. 3 months ago I was an energetic, excited for life fun loving 20 year old. After about 10 weeks I have experienced every single physical side effect. Extreme dizziness, bleeding, nausea, paranoia, violent thoughts, mental breakdowns, severe anxiety, suicidal thoughts. It changed my entire life upside down. I have never experienced any of the side effects before ever in my life!!!! Do not even risk the chance of this drug working out for you. It should be banned in my opinion. So sickening that actual licensed professionals would willingly prescribe this to women knowing what it ~could~ do to someone’s physical and mental state. I have two weeks to go and hope I start to feel like myself soon after that but man don’t even mess with this toxic drug. Just remember once it has been injected you can't get it out!!!",DontDoIt
242,Depo-Provera,Birth Control,1.0,Taken for 1 to 6 months,"September 20, 2018",7,"Worst experience of my life, be SCARED of this drug!!!! I got one injection and slowly fell into a deep depression. 2 weeks before my second shot I was hit with every possible side effect. I quit my job, and had to seek help to become myself again. This drug is too good to be true, and not worth risking these side effects. It works great for some but if you are looking into Depo because of convenience like I did, it is NOT worth it. I have suffered from depression, anxiety, nausea, extreme dizziness, loss of appetite, prolonged periods, and many more. Please save yourself the trouble and don't even try it.",britta
243,Depo-Provera,Birth Control,4.0,Taken for 1 to 6 months,"September 15, 2018",3,"Horrible experience; I received my 1st shot in May to prepare for fibroid removal surgery in July, have bled since May and got my 2nd shot a few weeks ago for BC and to assist with additional fibroid growth. My dr never explained the bleeding on these shots could continue for years, and I will NOT be getting another one.",Ugh
244,Depo-Provera,Birth Control,1.0,Taken for 1 to 2 years,"August 31, 2018",4,"I have been on the depo for about a year, and I was told by my gyno that my bleeding should end by my 3rd or 4th shot. She didn't even tell me I would bleed in the first place. I have been bleeding nonstop since I started with the occasional day in between or even an hour. I have RUINED all my period underwear. I have ruined nice underwear because it picks and chooses when to bleed. My 3rd shot was the worst, as it went from spots to always having a tampon/pad. I plan on discontinuing by the time my full year is up. This was one of the worst mistakes of my life. Killed my sex drive because who wants to have sex when they're constantly bleeding. TL;DR: (Too long; didn't read) This is garbage. Don't take it. You'll regret it.",givemeblood
245,Depo-Provera,Birth Control,,Taken for 6 months to 1 year,"August 28, 2018",5,"Best ever after I had my first baby on July 7 2012 I was on the depo for a few months did not get my period at all, no symptoms at all then when I stop using it and in less than a month I got pregnant with my 2nd baby. After I had my second boy on September 2013 I was on the depo for almost 4 years never got my period except in  the 1st year I did get it for 3 days normally.  Anyway then I stop getting it again since I want it another baby and I got pregnant in a month with my 3rd baby...",Jess
246,Depo-Provera,Birth Control,8.0,Taken for 1 to 2 years,"August 27, 2018",5,"I have been using Depo for about two years now. I think I have stayed on it this long due to the convenience of it. I never experienced most of the side effects, but I did gain about 5 pounds that will not drop. My period lasted for almost a month when I first got the shot, but then went away completely. That is a huge bonus for me since I had extremely heavy, long, and painful periods. For me the depression and anxiety was definitely the worst part of it. I do believe circumstances played a part, but some of it was certainly due to hormone imbalance. I have experienced these side effects on and off for the duration of my use. I am looking to get off it now because of the threat of loss of bone density. I am at my two year mark. However, I do think if that was not a problem I would stay on it.",CJ
247,Depo-Provera,Birth Control,1.0,Taken for 10 years or more,"August 25, 2018",2,I was put on this for birth control over 20 years ago.  Now I been off it for 15 years my body has not recovered . I have pituitary tumor in my head and no period at all and it sucks if want ever have a baby this is not for u ...,Hate u
248,Depo-Provera,Birth Control,8.0,,"August 12, 2018",5,"I’ve been on this birth control for about a year now. I used to have extremely painful periods, the cramps were awful. I would get so nauseous on my period as well. When I first got on the shot I didn’t have my period for 2 months, it was great but the 3rd month I was bleeding lightly. After the first shot I stopped getting my period. The pros about this birth control is that is it very effective. I’ve been having unprotected sex without pull out ever since I’ve been on it and never got pregnant. I don’t recommend having unprotected sex but that’s just how I prefer to do it, and we are in a long term exclusive relationship. It also completely eliminated my painful cramps and I haven’t been getting any period symptoms at all. The cons about this birth control is that you will gain weight. I always struggled with my weight ever since I was a child so it was a no brainer that I would gain weight. Before the depo shot I weighed around 145 pounds and now I’m 160 pounds. This birth control will make you HUNGRY.",Meghan
249,Depo-Provera,Birth Control,1.0,Taken for 2 to 5 years,"August 7, 2018",3,"I started depo when I was 18 I was on it for 3 ½ years it did it's job, I didn't get pregnant. However I noticed my hair became really brittle and thin, I had increased anxiety and experienced a lot of weight loss. I took a break for 2 years and half way through the second year I got pregnant with my first child. I decided to resume with the depo after my pregnancy because I didn't want to get pregnant immediately after having my first child. I'm currently on it and have decided to discontinue it all together because symptoms have worsened. I have extremely achy bones in my back and knee joints, my hair is still brittle and I have extremely painful periods now. I consulted with my doctor and even she recommend not to use depo as a long-term contraceptive. I would like to say good things about depo but it's not good for your health or your bones and joints in the long run.",Jay
250,Depo-Provera,Birth Control,1.0,,"August 6, 2018",9,"Yes it keeps away the babies but the side effects are terrible. I was fine the first 6 months then  I would bleed up to 2 months, heavy everyday. It eventually just stopped. A couple months ago I started living EVERYDAY with horrible anxiety & panic attacks. I've checked myself into the ER about 8 times, just to find out I am totally fine. I never, ever used to deal with anxiety. I have a 15 month old son and my anxiety has stopped me from taking him places, because of fear of me falling over if I had an anxiety attack. Coming up our stairs triggers my anxiety. I do believe I have slipped into depression being that I'm scared to go anywhere. My shot will be ending at the end of this month and I'm literally praying I'm back to my self. This is NOT ME. I have always been a fun, strong minded female, and now I'm too scared to even take my son to the park. This depo shot had mentally & emotionally messed me up. I will be done with all birth controls after the DEPO experience.",Koda
251,Depo-Provera,Birth Control,6.0,,"August 4, 2018",7,"Honestly, I expected a lot worse with this shot. It’s pretty convenient. I understand a lot of people hate taking hormones and it doesn’t work well for them, but I’ve actually had an okay experience. No cramping AT ALL. For the first few shots I bled for weeks at a time but it was so light I didn’t need a pad. Now I have no periods. No mood swings either. My only complaint is odd joint pain every so often and I’ve gained 20 pounds since starting the shot! But honestly, Depo does what it is supposed to do.",cj
252,Depo-Provera,Birth Control,7.0,Taken for 10 years or more,"July 27, 2018",1,"Got the Depo shot starting at 16, had it until just this past either Nov17'. Loved it! NO period at all! Once in a RARE blue moon I'd get a random ""OW CRAMP"" for a hot 2 seconds then be fine again. No weight gain or worse acne, no change in moods. Only reason switched to the implant was cause my doc (same doc I've had since 16) advised to since my bones already aren't so great,& it's been shown that Depo can(like all medicines ""can"" have adverse reactions) make joint pain & ""bone pain"" more problematic. I'm almost 29 now, have had Nexplanon since the switch (Oct/Nov17') & I'm already wanting to go back to my good ol depo! Now see my cousin on the other hand won't go near depo ever again, says she felt like it ""literally made"" her go/feel crazy. To each their own, just like not everyone in the world has anxiety like I do, this medicine won't be for all! Just do as much research as you can &decide for yourself.",CatLady
253,Depo-Provera,Birth Control,1.0,Taken for 1 to 6 months,"July 26, 2018",7,"First time ever trying any type of birth control. I made a mistake of not doing research before getting the depo shot. While it is a convenient drug, it gave me a lot of side effects. It led me to depression and anxiety, which are two things I never felt before taking it. It also gave me night sweats, mood swings, and low libido. There were so many days where I felt so empty and dead inside. I hate the depo shot so much. Till this day, I still have depression, anxiety, low libido, and mood swings. Depo shot doesn't work for everyone, and it's going to stay in your system for a long time.",hatethedeposhot
254,Depo-Provera,Birth Control,10.0,Taken for 2 to 5 years,"July 26, 2018",2,Depo has been very good to me. My skin actually clears up when I'm on Depo and I my weight stays constant or I even lose a bit. I went from size 38 to 32 and now I'm on 34. I used the pill (triphasil) once because I wanted a regular period but the nausea and mood swings that came with that weren't pleasant at all.,Soso
255,Depo-Provera,Birth Control,7.0,Taken for 1 to 6 months,"July 25, 2018",7,"This drug is good for preventing pregnancy. But the side effects are TERRIBLE. I’m currently on my second shot, almost a month in. My first shot, I was moody as hell. Also had irregular spotting. I had even worse cramps than I had on my period before I got the shot. Pamprin and midol didn’t even help. The second shot gives me IBS symptoms and depression. It’s like certain foods trigger diarrhea and gas and bloating CONSTANTLY. But before I had no problem with this. I’m convinced it’s the hormones. Makes it difficult to get wet too. My sex drive is high as it’s always been but I just can't get wet and sex is painful. I’m not getting another shot. Can’t wait for the 13 weeks to be over!!",cielo
