,drug,condition,rating,duration,review_date,upvotes,review,username
0,Depo-Provera,Birth Control,9.0,Taken for 2 to 5 years,"April 1, 2022",0,So I was on the Depo-provera for 2 and a half years.. it really was a very reliable contraceptive. give it 9/10  for one simple reason.   Now that my partner and I are trying to conceive it seem almost impossible,goodie2shoes
1,Depo-Provera,Birth Control,1.0,Taken for 1 to 6 months,"March 16, 2022",0,"Worst decision ever. Took one injection Nov 29, 2021 and I’ve been sick since then!! Been off for 3 weeks now and I’m having stomachache and acid reflux, back and side pain… it’s not worth it one bit!!!",Kimmykb123
2,Depo-Provera,Birth Control,9.0,Taken for 1 to 2 years,"March 8, 2022",0,"I recently just stopped getting my depo Provera injections this past month. The only reason I have stopped is because I have been advised by my doctor that it is not a good long-term form of birth control due to the fact that it causes a loss in calcium in your bones. I was on the shot for a little over 2 years, and I had little to no side effects. I had almost no period at all the entire time I was on it, besides some spotting a couple days every couple months (which only lasted a couple days) ...I never experienced sudden heavy bleeding like others have mentioned, so I am not sure if there was a change in the injection formula but only some woman's bodies responded to it. Aside from my period, I did have a low sex drive. Overall, I had no extremely negative side effects. None that beat how good it was at preventing pregnancy at least. I had unprotected sex the whole time I was on it! That's a win in my opinion.",Anonymous
3,Depo-Provera,Birth Control,3.0,Taken for 2 to 5 years,"March 4, 2022",0,"I was on depo for 3 years. It will definitely prevent pregnancy because you will have no desire for sex in the first place. Also, I bled for months straight constantly.  As soon as I got off my sex drive came back, not as strong as it was before but it’s back. It was only a plus because it was every 3 months.",Don't recommend
4,Depo-Provera,Birth Control,1.0,Taken for 1 to 6 months,"February 26, 2022",0,This is awful. Has wrecked my hormones. Wanted to like it but I’ve been on my period off and on for the 4 months I’ve been on it.,AZ808
5,Depo-Provera,Birth Control,1.0,,"February 21, 2022",0,"My experience on the depo-provera injection was truly a nightmare. It made me moody and cry everyday. Sex became unbearably painful, no matter how much lube we used. One of the worst parts of it was that it made my hair fall out! I’ve been off of it for over 6 months and am still waiting for my hair to grow back, and I hope it does. Never again! This stuff ruined my life!",Mewkiki79
6,Depo-Provera,Birth Control,4.0,Taken for 1 to 2 years,"February 18, 2022",0,"It worked- I never did get pregnant while using this birth control, however, I would go two months without a period, the get a period for a month while actively using it. After I got my tubes tied, I stopped taking it, and my periods were semi normal. Cramping was worse, starting two weeks prior to every period, and akin to labor, accompanied by a whopping 20 lbs of water weight during my period. My cycles were 38 days at the time. I was actively trying to lose weight, ate healthy, got exercise, didn't shed a pound, and instead gained. My thyroid hormones were way off. A year out, I'm finally back to my normal cycle length, shedding pounds like I'm trying to, bloating a typical amount for me (half, at 10lbs), cramping and mood swings have reduced, and all of my hormones are finally back to normal with no medication, change of lifestyle, or any treatment whatsoever. You might not get pregnant, but it'll be at a cost. No, I have not changed anything else in my life.",Mrsmom444
7,Depo-Provera,Birth Control,,,"February 1, 2022",0,I was one of the first people to trial this contraception. I was on it for 10 years. I found it very good for a while my periods stop completely. Which I liked no more sanitary towels days..but then I was taken off because my ostrone level were very low and they were worried it would cause arthritis in my later days.  I enjoyed been on it but the problems I had after coming off were not good. Very heavy periods anemia.,Linda
8,Depo-Provera,Birth Control,3.0,Taken for 6 months to 1 year,"January 18, 2022",0,"I’ve been on the depo shot for a year. This January I was supposed to get another injection but I switched to the pill. The whole year I experienced bleeding every day…. EVERY day. Less than a normal period but more than spotting. I asked doctors multiple times if this was normal and they told me yes every time, nothing to worry about. I also realized my hair was falling out, didn’t alarm me at first because I have thick and long hair. I realized my hair was falling out and not growing back! Yay birth control. These are very rare side effects but it happened to me. My skin looks good, didn’t gain weight.",Anonymous
9,Depo-Provera,Birth Control,2.0,,"November 23, 2021",0,"Every body is different when it comes to birth control and it can take a while to find which one is right for you. Sharing a little bit of my experience with the depo shot might help someone out there in making their decision. I’ve gone through almost every birth control out there and am still struggling to find one that works for me. I was only on the depo shot for 3 months. During those 3 months I was okay nothing seemed off or out of the ordinary. I’ve struggled with acne for about 3 years now and my main reason for going on birth control was to help with my skin. If I could take back one thing I would have never done the shot. I've been off of it for around 3 months now and my skin has gotten severe, painful and my confidence has completely vanished. I read a couple other reviews about the shot and some of them did mention their skin got really bad. It happened immediately after I got off of it, and it’s been very hard to get back to where I was before I tried the shot.",Anonymous
10,Depo-Provera,Birth Control,2.0,Taken for 1 to 6 months,"November 22, 2021",0,"I have had 2 rounds of depo injections now. The first time, a week after I received the injection, I woke up in the middle of the night with mild waves of nausea. Got the injection next time and again a week later, woke up in the middle of the night with waves of nausea but this time I was profusely sweating and was physically weak and couldn’t make it back to bed so I had to lay on the bathroom floor for 10 minutes till it all passed. I also have not had my monthly cycle in over 100 days, since I received the very first one.",strawberrylover
11,Depo-Provera,Birth Control,1.0,Taken for 1 to 6 months,"November 19, 2021",1,"I have read other womens experiences on this drug obsessively to give me comfort with sensing when I may feel more like myself. So here is my experience coming off. This drug is said to last 12 weeks, approximately 15 weeks for it to no longer be detectable in your system. Prior to this I was on monofeme for approximately 8 months. No issues with the pill except when forgetting to take it. Limited space, you know the bad side effects so here's the withdrawal. All symptoms started to slowly ease up bit by bit. From week 5 I recorded improvements weekly. Most feeling I'm returning to my self around the 9 week mark. It's been 14 weeks and thinking clearer, joking and laughing again, mood/anxiety n energy improved but libido not fully, at least I can get wet and enjoy sex but it's not the same and masturbating feels impossible to start. Light period. Now for hormones to balance naturally w ginseng, primrose oil, and ashwaghanda daily. Cruciferous veg help w hormones too. Exercise/running also",Lilith
12,Depo-Provera,Birth Control,1.0,Taken for 1 to 6 months,"November 19, 2021",1,"This is one of the worst things I have ever experienced in my life. I had one injection.Fatigue so strong I felt like I was dying, bed ridden many days during the peak. Brain fog had me apathetic and extremely dissociated, unable to converse and could not feel in touch with the world around me. Mood swings very intense, at the peak cried at anything and felt extreme irritability. Libido completely gone, aside from debilitating psychological symptoms interrupting sexual desire I was physically unable to become aroused, my vagina was dry generally, and mentally it was impossible to have contact with what may usually influence arousal. So I was suffering and also had no ability to do what could help improve my state of wellbeing, there was a similar sensation to the loss of libido/external factors being ""far away"" in not being able to ""feel"" or be moved by music. Absolutely terrifying. THIS SHOULD NOT BE LEGAL",Lilith
13,Depo-Provera,Birth Control,1.0,Taken for 1 to 6 months,"November 4, 2021",0,"I got the Depo Shot just over 3 months ago. It was suggested to me by my Doctor because I had developed a stomach ulcer from the dangerous amount of Nurofen I used to take during my periods.I was super hesitant and I was battling with the decision for at least 2 weeks before my Partner just told me to do it. When I went to go get the needle, I needed to do a Pregnancy test first. I couldn't pee for well over 2 hours...... Maybe that was my body telling me to just give up, go home and not get it. I wish I listened!AS SOON as I got the injection, I immediately just felt off..... About a month in, I noticed that I was getting chronic constipation, which lead to pain, bloating and cramps. I constantly have a false urge to go to the toilet (Both number 1 and number 2) I developed urinary retention. I couldn't pee without physically pushing it out. I cannot do a number 2 unless I take laxatives daily. I NEVER suffered from any of this prior to the shot. It has ruined my  life.",Dee
14,Depo-Provera,Birth Control,3.0,Taken for 1 to 6 months,"October 26, 2021",2,"I started getting Depo Provera freshman year of college because I was looking for a form of birth control where I didn’t have to rely on myself for protection, i.e the pill. I had never tried BC before. The doctor recommended me the injection & I agreed that it was worth a try being that it seemed super easy just to get a injection in my butt every 3 months and have it be super protective. But I was dumb and did not do any outside research on my own to be sure that it would be right for me. You still do not know until you try, but now I know that the injection is a method I would NEVER get again! It took me months to realize that it was causing me severe depression to the point of me feeling suicidal. I remember being on the phone with my boyfriend crying on the floor saying I don’t know what’s wrong with me?! I am not prone to depression nor had I ever really dealt with it prior. After a few months of having no period, but mood swings and depression. It messed me up! I do not recommend.",Jsabs
15,Depo-Provera,Birth Control,1.0,Taken for 1 to 6 months,"October 25, 2021",1,"Please Read  !! I got depo provera 2 months after I had my daughter, for birth control. Worse decision ever.  I know everyone reacts different to a drug but trust me when I say stay away from this.  I got only one injection that lasts three months but that was enough to destroy my mental health.  It was horrible, made me gain 10 pounds in just  three months give me the worse depression and anxiety of my life. Two years later and still no recovery my doctor had to put me on antidepressant. Please read the reviews before you get the injection because after you get it will be too late !! This drug should be out of the market I give it one star. It is awful don’t do it",Leyla05
16,Depo-Provera,Birth Control,6.0,Taken for 5 to 10 years,"October 19, 2021",1,"I was on the Depo for 5+ years, found it to work great with minimal side effects but saw a bunch of articles saying it causes breast cancer and decided to come off it. It’s been 10 months since my last injection and my periods only just started to come back regularly, it’s taken me so long to come off it and I’m finally in a good spot but wouldn’t go back on it.",Depo - sam
17,Depo-Provera,Birth Control,,Taken for 6 months to 1 year,"October 3, 2021",2,"I been on this birth control since a good year now. When I first started it no bleeding at all for a whole month than the next month after it started to bleed like crazy it was annoying and it worried me too, till doctor said that is okay and it normal and some woman will bleed a full year till it fully stops and then no more bleeding. It has been a year now but still seeing some bleeding and I hope it stops but I was told once you reach two years  that you should come off of it or it will be hard to get pregnant.  I was told that this method is more used for woman on menopause which is probably  why they suggest us to only be on it for two years and done. I was also told it will take a while too see your period again after stopping the injection which idc - I don’t like my periods but the bleeding was pretty annoying",Lele
18,Depo-Provera,Birth Control,1.0,Taken for 1 to 6 months,"October 2, 2021",2,"At the time I was 35 and smoked one pack of cigarettes a week. I was told by my provider since I smoked I must use this birth control versus pill form (I had been on the lowest dose BC since 16). I got the first injection, not a problem, got the second injection and I started to feel odd.  All of my family and friends kept telling me how swollen I looked.  Never thought much of it, although I felt funky. LVN Nurse Mother said, you need to go to a Dr outside your provider, you are having a reaction.  Never got my monthly period the entire time, not pregnant either. Went to an outside OBGYN and he also noticed how bloated I appeared.  He gave me some hormone pills to try to get my period back, 9 months later, tons of meds I finally felt better and got my period.  I had no idea how horrible I looked and felt at 35 until I finally got my period after 15 months.  That OBGYN said he had seen many gals having this issue.  I never chose to take that shot again.",CMA
19,Depo-Provera,Birth Control,10.0,Taken for 2 to 5 years,"September 28, 2021",0,I have been on the depo shot for two years. When I quit it started off with hot flashes and nausea that turned into vomiting and severe diarrhea. I have cold sweats and dizzy spells. It’s been two months of these withdrawals and it’s making it impossible for me to work. The injection itself was great but this aftermath is not worth it in my opinion.,Tyler
20,Depo-Provera,Birth Control,8.0,Taken for 5 to 10 years,"September 21, 2021",0,"I’ve been on the depo shot on and off since the age 18. My first time getting the depo injection I was on it for 3 years never had a period. I got off the injection then, got back on in the year of 2016. I’ve been on it since 2016 and NEVER had a period not even a little period. All of sudden I start spotting. It’s making me nervous. This has never happened",Anonymous
21,Depo-Provera,Birth Control,1.0,Taken for 1 to 6 months,"August 25, 2021",5,What is the point of this depo injection. I wouldn't even inject my worst enemy with it. I took my first injection in June 9 ... I have no stop to bleeding at all.  I sometimes feel like I will faint. ......am soooo depressed.  I left my partner as I  found out he was married!!,Laa_a_joy
22,Depo-Provera,Birth Control,1.0,Taken for 1 to 6 months,"August 18, 2021",28,"The depo is the worst thing I have ever put in my body. Ladies please re-consider before using this. Along with so many physical symptoms (nausea, acne, fatigue, heart burn, bloating cramps, bleeding constantly) the emotional symptoms are very prominent and worse than the physical ones. I believe this drug is destroying my relationship, I have no interest in sex or physical touch, I’m irritable all the time, depressed and have a constant feeling of emptiness that was not there before the depo my personality and mood took a full 180 on the depo. I am not going back in for my next injection. Something to also note is that the FDA is trying to pull this drug off the shelves. Please if you’re considering the depo do your research! I wish that I did.",ARS
23,Depo-Provera,Birth Control,1.0,Taken for 6 months to 1 year,"August 18, 2021",1,"After 9 months of getting depo (3 injections), I started to develop hot flashes and just didn’t like how it made me feel. After stopping, the withdrawal symptoms are a nightmare. I would not wish this on my worst enemy.",c99
24,Depo-Provera,Birth Control,,Taken for less than 1 month,"July 25, 2021",3,"I’ve taken depo-provera on the June 23rd This is the worst birth control ever . I am always  angry don’t want to be around people. I keep eating a lot and I’ve lost a lot of weight on the drop shot. Light spotting nothing heavy. I’ve been depressed and sad, feeling tired like I don’t want to do anything at all. It causes issues in my relationship uuurrgggghhhh!!!!!!!!! I need to stop it",Kammy
25,Depo-Provera,Birth Control,1.0,Taken for 2 to 5 years,"July 25, 2021",1,This stuff ruined my life. No one told me it would permanently change my periods and hormones even years after the last dose. I was on this stuff for 2.5 years. When I was taken off of it I was told I should've never been given it longer than 2 years it can cause permanent bone loss.But the worst part is the periods. Before I had 3 day no cramp periods. Half the time I'd forget I was bleeding. Now I have to wear diapers and change them every hour. They come randomly too. Sometimes it'll be months with no period. Then sometimes it's 2 weeks apart. It's debilitating. I can't leave my home because walking causes gushes and massive clots to come out. I've been to the ER and many drs. They are all very dismissive but bleeding so much isn't normal. Its been 10 years since the last dose and I don't think I'll ever be the same,Samgravy
26,Depo-Provera,Birth Control,1.0,Taken for 1 to 6 months,"July 21, 2021",3,"I was on Depo Provera for 6 months. Prior to taking it, I was 130 pounds with a flat stomach and DDDs. I am a power lifter who exercises at least 3-4x a week for about 2 1/2 hours. I am now 175 pounds with H cup breasts, covered in acne in places I’ve never had it before, exponentially more tired and depressed, constantly nauseous, the gastrointestinal issues I had prior were made 100x worse, and now that I just passed the date I was supposed to get my 3rd injection, I’m on day 31 of my period. I was never warned about any of this except you may gain about 3 pounds in a year of taking this!  I’ve been on two other brands of birth control pills and never have I experienced this or anything similar. The depo injection has ruined my body and my mental health. If I could negatively rate, I would.",idk
27,Depo-Provera,Birth Control,5.0,Taken for 6 months to 1 year,"July 13, 2021",2,"I had very little problems on the Depo injection, was on it for 7 months and decided to come off for no other reason than the excessive weight gain. Had never had a stretch mark in my life now I’m covered in them and it has destroyed my self confidence. I’ve had no other issues however I did not get any bleeding at all for the whole 7 months which can be good for some people and scary for others. I enjoyed it but the weight was too much to deal with.",K
28,Depo-Provera,Birth Control,4.0,Taken for 1 to 6 months,"July 9, 2021",1,"This is just me but first I started on pills which  made me nauseous and gave me bad anxiety so I stop taking them for 3 months. May 10th I choose the depo provera injection, my doctor didn’t show all the side effects it says on google. I’ve been constantly nauseous everyday unable to do activities out because of how nauseous I feel sometimes to the point where I throw up, I’m miserable these birth controls don't mix well with my body. Now i’m just waiting for it to wear off so I can enjoy my summer. For some people its great tho, this just my experience .",lily
29,Depo-Provera,Birth Control,10.0,Taken for 5 to 10 years,"July 3, 2021",2,I have been on depo for nearly 8 years. I went on depo injections after having my daughter. I've only ever had bleeding when I was due my first period which was very light and haven't had a period since. Which is great news for me. Everyone is different and effects people in different ways.,Elizabeth
30,Depo-Provera,Birth Control,1.0,Taken for 6 months to 1 year,"June 5, 2021",5,"I would NOT recommend this birth control. I was not aware of the effects I would have when  coming off Depo-Provera. I did well on the  injections (I had 3 injections) but when I came off of it I was a completely different person. I am anxious, can’t think clear, and have major mood swings. I have never been the type to be anxious about anything. I’ve always been a happy person. The only good thing about it was that it completely prevents pregnancy. I would strongly suggest starting on the pill or any other contraceptive. Everyone’s body is different and can react in a different way, but I would not risk starting this method when there are much better options.",jma2112
31,Depo-Provera,Birth Control,1.0,,"May 14, 2021",12,"I do not recommend depo injection! I thought getting on it was going to help my period issues, also the fact I was told I had endometriosis (which turns out I don't).When I got on it I was fine for the first month and loved not having a period or the pain that came with it. By the second month my moods started to change and I got very mean and aggressive towards people and anything they say. By the third month I was a total train wreck! I would cry constantly, and I fought with literally anyone and everyone!. I decided to get off depo for the greater good of relationships with my family and my boyfriend. I thought getting off it was gonna be a problem solver but I got off it and it got worse!. Multiply the other issues I talked up by x10!. Which now also includes; cramps, terrible emotional problems and thoughts, questioning my relationship (it comes in waves I love him tremendously and then my brain goes do you?), and more unfortunately. Please read reviews before getting on depo!!.",Skylynns
32,Depo-Provera,Birth Control,10.0,Taken for 1 to 2 years,"May 13, 2021",3,"I personally love depo I've been on it for 2 years and I can’t remember the last time I had my period. I sometimes get light spotting when it’s time for my next dose but that’s only sometimes. I also get really emotional/moody when it’s time for my next dose. I didn’t experience bad weight gain or any other bad side effects, I really don’t want to get off of it. Does anyone know if it’s healthy to stay on past 2 years? My doctor said to take the one a day multivitamins if I stay on longer.",TAaliyah
33,Depo-Provera,Birth Control,6.0,,"May 9, 2021",2,"I wanted to share my notes I’ve taken since I’ve been on Debo Provera. I get the injection every 3 months and this is my experience.Got my first depo (birth control) injection 10/23/202012/10/2020 I have been bleeding everyday, I’ve been through so many tampons 12/26/2020 still bleeding everyday. Got my second injection 1/16/2021Still bleeding the following day... 3/13/2021 stopped bleeding for 2-4 days and then today started bleeding again.. 4/10/2021 stopped bleeding for about a week and a half now I’m spotting everyday 5/8/2021 bleeding today again been on and off since last note For me this injection has been a nightmare.",Ash
34,Depo-Provera,Birth Control,1.0,,"April 29, 2021",6,"In the past I haven’t been the best in remembering to take birth control pills so I figured this would be more convenient. I was aware of side effects like spotting and gaining weight but I suffer from really bad cramps and this was supposed to diminish that. For the first few weeks I was fine, I had one period and it was very light. But, a month later is when things really started to kick in. I’ve always suffered from anxiety and have had my episodes of depression here and there but this was unreal. I would have the worse mood swings; going from being intensely paranoid and borderline panic attack to suddenly feeling next to nothing. I felt so empty and numb and started questioning if I really even loved my boyfriend or if my life was even worth it...I just didn’t feel like me at all.",Jasmine
35,Depo-Provera,Birth Control,7.0,Taken for 5 to 10 years,"April 28, 2021",0,"I took depo injections every 3 months for about 8 years. I remember spotting and irregular bleeding after the first 6 months after taking it. Then my body calmed down and I didn't have any bleeding.I decided to come off depo after 8 years as me and my partner were considering starting a family.What a horrid experience! Initially nothing happened for about 6 months after stopping. Then I had constant, heavy bleeding, soaking super tampons in an hour or so on some days. The bleeding may have stopped for a day or two then start straight back up again, this carried on from about March to July. I also had horrendous cramps with the bleeding. I gave up being off contraception because I just couldn't cope with the side effects of coming off it. So now I take the pill instead. I wish there was more information out  there about these withdrawal symptoms and what to expect.",54321
