,drug,condition,rating,duration,review_date,upvotes,review,username
0,Lyrica,Diabetic Peripheral Neuropathy,1.0,Taken for 10 years or more,"October 6, 2021",1,"I’m T2 diabetic since 1995 using insulin. I have had diabetic neuropathy since 2011. Initially I started with gabaline and changed to Lyrica in 2014, max dosage. I still have some pain with some symptoms which were very cold feet, tiredness, difficult sleeping, anxiety, nervous, very angry, loss concentration, not patient. Since 2019 I’m getting additional symptoms which are dizziness whenever I get up and walk even to kitchen for water, I see cloudy, not even when I go out for a walk, very low blood pressure with high heart rate, I faint 3 or 4 times a month, nausea, weak arm muscles, muscle aches, twitching and jerking constantly, frozen shoulder on both, eyes burning, sweat more, increase ear wax, always tired, unbalanced walking, loose foot, loose arm, shaking hands and legs, pain in between chest when I walk, and severe pain at the back of my neck. All test results are OKAY",Izzy
1,Lyrica,Diabetic Peripheral Neuropathy,1.0,,"July 14, 2021",4,"Nightmare med. Doesn’t work on pain. So many horrid side effects: suicidal, vivid nightmares each time you sleep, makes you very sleepy, sleep nearly 24/7, makes you feel awful, doesn’t help at all with pain, fast & huge weight gain, hair fell out in clumps, makes you angry & changes your personality negatively.",Anonymous
2,Lyrica,Diabetic Peripheral Neuropathy,8.0,Taken for 1 to 6 months,"October 25, 2020",8,"I took Lyrica along with endone for a few months with slipped disc and impacted nerve , without it I was in agony.  Endone in its own didn’t do much but with Lyrica I coped with the pain and could also attend physiotherapy until I was better.  I was extremely thankful for it.",Anonymous
3,Lyrica,Diabetic Peripheral Neuropathy,1.0,Taken for 1 to 6 months,"October 19, 2020",14,"I had taken Lyrica for about a month and then caught the flu - not Covid-19- my neurologist prescribed an antibiotic.  One morning @2 days later, I took a second dose of Lyrica a few hours after the first because my leg was hurting and had a bad reaction.  I blacked out, but was mumbling, seemingly had a seizure, was responsive, but didn’t remember anything. My husband took me to the ER. I woke up at 7:00 pm.  I thought I was making sense talking, but my husband said I wasn’t. There for 2 weeks.  Occupational therapist tested me daily - took that long for me to totally make sense, walk better, etc.  I still had trouble thinking of some words for about 2 months.  Once in a while I still have trouble with words now after 6 months.  I advise not using Lyrica if there is anything else you can take.",Pdlbc
4,Lyrica,Diabetic Peripheral Neuropathy,1.0,Taken for 1 to 6 months,"November 5, 2019",70,"I have neuropathic pain ( burning, pins and needles, numbness ) in the pads of my feet, non diabetic. My internist prescribed Lyrica. Tried it for about a month - no help. Went to a Neurologist who prescribed Tegretol 400 mg. Extended Release. Within a week my pain went from a 10 to a 2. Been taking one a day for over ten years with no side effects. Originally this med was developed for seizures but patients with neuropathy as well as seizures told their Docs that it helped with the neuropathy and thus  it is now used for this condition. Highly recommend it. Initially you may feel some sluggishness but within a very short time that goes away.",Mec
5,Lyrica,Diabetic Peripheral Neuropathy,7.0,Taken for 2 to 5 years,"September 16, 2019",32,"My diabetes was in good control for two years before I started experiencing severe symptoms of peripheral neuropathy in my lower legs and feet. Lyrica has been a miracle drug for relief of the stabbing pain in my legs. However, it doesn't help much for the horrible burning in my feet. Also, I occasionally feel like I'm still walking on marbles. The nerve studies have concluded I'm getting it in my hands also. I've been fortunate that my side effects have been minimal. If it helped more with burning, I would rate it s 10.",Shirlv
6,Lyrica,Diabetic Peripheral Neuropathy,1.0,Taken for 2 to 5 years,"December 19, 2018",20,I've used Lyrica for over 2 years now. If anything my pain got worse.  I just stopped taking it last month. Was taking 150 mg 3 times daily.  Have no idea where to go next. Waiting to see my Dr for something new.,sgt
7,Lyrica,Diabetic Peripheral Neuropathy,5.0,,"September 27, 2018",27,I take Lyrica three times a day but it doesn’t seem like it’s for me. I've got  severe diabetic neuropathy and I don’t feel my feet and I want to feel my feet again so what do I do,Trisha
8,Lyrica,Diabetic Peripheral Neuropathy,1.0,Taken for 1 to 2 years,"September 17, 2018",16,Doesn’t help at all. I’ve been taking it for over a year along with gabapentin. Various dosages. Makes me groggy and unable to actually think sometimes. I’d stop taking them but don’t know what else to do. There really aren’t many options. All big pharma hype!! Advertising all over doctors offices,Kkav
9,Lyrica,Diabetic Peripheral Neuropathy,,Taken for 1 to 6 months,"July 29, 2018",9,"What I've read so far in confusing. One said Lyrica can cause peripheral neuropathy, another said Lyrica was prescribed for it! I have diabetic peripheral neuropathy. I'm no longer a diabetic. I'm taking 100 mg of Lyrica twice a day, not sure it's really helping me.  Some days and night are so bad, I sleep sitting up on my couch. Don't like the dry mouth, dizziness, weight gain. I'm watching what I eat, some days certain foods bother me, other days same food doesn't bother me, very frustrating!! I don 't want to gain any more weight, afraid my diabetes will come back. I have had one treatment of botox, it helped so the pain is not as severe. DR. gave me very little medicine to start off with. My next appointment will be after 90 days,  and I will ask for more of the medicine, hoping to get off Lyrica after this next treatment!",Jim
10,Lyrica,Diabetic Peripheral Neuropathy,10.0,Taken for less than 1 month,"June 14, 2018",14,"I just started Lyrica on Monday.  I had no pain on Monday and Tuesday nights so I was able to sleep better.  Since I sit in a desk chair most of the day at home, my feet are on the ground most of the day and I don't have any pain or very little, but when I go to bed at night and raise my legs/feet, the pain would become quite bothersome, but now at least the last 2 nights have been much better.",wvrnsson
11,Lyrica,Diabetic Peripheral Neuropathy,8.0,Taken for less than 1 month,"April 29, 2018",15,"I'm newly diabetic, (was diagnosed Jan. 2018, but who knows how long I've had it), and was experiencing pain in my feet. My doctor, who already has me on 100 mcg/h patch Fentanyl, 4mg Dilaudid every 4 hrs, and 10mg diazepam 4xday for chronic pain from a MVA 34 years ago where my whole upper torso was crushed, and many other medications for high blood pressure, high cholesterol, insomnia and other ailments. Since I've been on Lyrica for almost a month now, I'm finding that it's not only helping my foot pain, but also my back pain which the narcotic medications only helped some. I'm glad I was put on it as it has increased my mobility!",Saskatoonian
12,Lyrica,Diabetic Peripheral Neuropathy,9.0,Taken for 1 to 6 months,"March 24, 2018",33,"I guess I'm one of the lucky ones or with the expected cases. My nerve pain is so mild now that I can almost forget about. Lyrica changed my life for the better! Within the first week I was able to walk up my steps without pain, without needed to stop and wait because of pain. I'm sleeping well now and doing my favorite thing to walk through Thrift stores and Peddler Malls with my Daughter. I hope anyone else starting Lyrica will have the success that I had.",DEB
13,Lyrica,Diabetic Peripheral Neuropathy,8.0,Taken for 6 months to 1 year,"March 18, 2018",6,"Controls it most of the time, but fingers get cold.",Ang
14,Lyrica,Diabetic Peripheral Neuropathy,,,"March 16, 2018",14,"My boyfriend started this med and shortly after beginning this medication my boyfriend changed drastically. He became angry, belligerent, irrational, accusatory and more hurtful than I ever imagined. He picked arguments with me every single day for a month and a half before he finally broke up with me citing that it was I, who was awful to him. He got to the point of having to pull off the highway so he could cry. He is not the man he once was, but does not see that he has an issue...has anyone else had any of this?",Cat
15,Lyrica,Diabetic Peripheral Neuropathy,9.0,,"March 5, 2018",15,I have had diabetic neuropathy severe leg pain for 15 years. One year ago I started with Lyrica and it only helps fully if I take it with my Tramadol that I was previously on. Taking those two together gives me about 95% pain relief. Before starting Lyrica and tramadol I had been on gabapentin which after 3 years stopped working for me at all. As far as lyrica side effects I had immediate weight gain and increase in appetite and swollen feet legs hands face and fingers but I guess that's the price I had to pay because without the pain relief I finally received I would have soon killed myself.,Kimmyj
16,Lyrica,Diabetic Peripheral Neuropathy,9.0,Taken for 6 months to 1 year,"February 18, 2018",15,"I take 100 mg three times daily (TID) for diabetic neuropathy. I find while it lowers the pain, pins and needles, and burning sensation a good deal, it doesn’t eliminate them. I’ll take any improvement though. I previously took opiates which had about the same pain control but I developed tolerance, dependence, all the baggage that comes with opiates.I also tried gabapentin, which worked at high doses, but seemed to work sometimes but not others. It also took 2 hours or so to take effect. Lyrica is nearly instantaneous and reliable. It does make me high or drunk after taking it, sort of like marijuana mixed with benzos, but milder. It does mess with my short term memory and makes me clumsy. It also blurs my vision a bit. I’m still mostly functional though.  Overall it’s an ok tradeoff; moderate side effects for good pain control.",GoodMojo
17,Lyrica,Diabetic Peripheral Neuropathy,7.0,Taken for 6 months to 1 year,"February 16, 2018",14,"I’m 52 with a good deal of diabetic neuropathy, mainly stabbing pain, occasionally burning or feeling frozen, like frostbite. I tried Gabapentin first, which was moderately effective. My doctor suggested Lyrica, which was only slightly better than Gabapentin. However, the Lyrica was effective enough @ 100 mg TID. Lyrica has a calming effect, and provides me a mild mood boost. It’s nowhere near as powerful as opiates though for pain control though.  I also accidentally discovered it all but eliminated opiate withdrawal. I was still restless, brain dead, and exhausted for a week, but almost all the other awful symptoms I had been through before in pain med withdrawal never materialized. Unwelcome side effects for me have been feeling drunk with blurred vision for a couple of hours after taking it. I’ve also stopped and restarted it, without major withdrawals.  I know some people have significant withdrawals from Lyrica, but I’ve not experienced that.",Anonymous
18,Lyrica,Diabetic Peripheral Neuropathy,2.0,,"October 9, 2017",18,"This one of the worst medication ever. It does not help, I end up in tears I am hurting so bad. I drop things, don't even notice, can't open things like I used too. The pain is unbearable, I just think this is a rubbish medication.",Chancy1985
19,Lyrica,Diabetic Peripheral Neuropathy,,Taken for 2 to 5 years,"July 18, 2017",12,I have had Diabetic Peripheral neuropathy for many years now. I started with Gabapentin which worked at first but only to a smalldegree so we switched to Lyrica 75mg. It was asgood as the Gabepentin  but I hoped for more so we upped it to 100mg. A trial at 150mg did not work at all soI dropped it in 2 days and went back to 100mg. Nowit will work but only for one half of a day and I refuse to take more until after dinner. At bedtime I take an OTCproduct from Hyland for restless legs and another for leg cramps (one & one) with my prescribed 500mgMagnesium and it helps me make it thru the night.Please do not deplete my drug store for the Hylandsproducts. I told one friend and the entire stock was gone in 2 days.,Sally Smooth
20,Lyrica,Diabetic Peripheral Neuropathy,5.0,Taken for 6 months to 1 year,"February 7, 2017",24,"This medicine helped my neuropathic pain, but gave me neck and shoulder pain I couldn't talk without straining to find the words I walked around like I was drunk. I'm off and back to me again",Maj735
21,Lyrica,Diabetic Peripheral Neuropathy,5.0,Taken for 6 months to 1 year,"September 20, 2016",26,"Going to have to decrease dosage (50mg 2x daily) or quit Lyrica due to loss of memory & confusion & jerking. Once could top out any IQ tests but my husband says I can't even find my ""behind"" anymore. Taking it for neuropathy & came home from complete knee surgery with foot drop in leg operated on. Now the other foot has dropped half way so I am all but an invalid. No more going outside for me to enjoy our horses on our farm. The dry mouth I got with Lyrica also frightens me as afraid I will lose my teeth as others have. Lyrica also causes severe sleepiness. I guess it MIGHT have stopped the shooting pains in my feet at night?",Poniwoman
22,Lyrica,Diabetic Peripheral Neuropathy,1.0,Taken for less than 1 month,"August 29, 2016",34,"Day 1, Neuropathy specialist at Cornell hospital NY , came home with Lyrica.  by end  of the day I could see some changes on my pain. Day 2, Pain was gone but I was very sleepy not able to concentrate. Day 3, slept all day could not keep my balance and my dreams was almost real. Day 4, very sleepy and unresponsive, it was so bad that I could not feel my low blood sugar until all my body was shaking and I needed help to take sugar. Day 5, STOP taking the dame thing. Day 6, Pick up the phone, called my doctor and used every word I have learned in English on him and those scientist, who came up with this IDEA. Instead of spending their time and knowledge to fin cure for diabetes, they just look for accommodating, Just to make MONEY.",Cia Pak
23,Lyrica,Diabetic Peripheral Neuropathy,1.0,,"June 28, 2016",66,"The nerve pain became so unbearable that it forced me to take lyrica despite the bad reviews and long list of negative side effects. I was told by many that it worked a lot better that neurontin with less drastic negative effects. Well, it has eased my pain some, but the side effects have taken my life from me. I'm dizzy at times, my head is always foggy and not clear thinking, I have depression, anger outbursts I've never had before, daily nausea, and am so tired that I can sleep all day and night long and can barely function. Unfortunately the alternative medications have even worse negative side effects, so what are we supposed to do in order to have some normalcy?",Anonymous
24,Lyrica,Diabetic Peripheral Neuropathy,2.0,Taken for 1 to 6 months,"April 24, 2016",27,Lyrica worked (for 2 weeks) when I first began taking 75mg then it stopped helping at all ...now @ 100mg 3 times a day it still is ineffective..,TETPOL
25,Lyrica,Diabetic Peripheral Neuropathy,3.0,,"April 17, 2016",28,"The needle standing pain was bad, but then I developed this feeling like I dipped my lower legs and feet in frying oil. It all is getting worse. It has really been tough especially at night trying to sleep.",Appaz
26,Lyrica,Diabetic Peripheral Neuropathy,4.0,,"April 3, 2016",23,"Eased diabetic nerve pain somewhat but caused ""jerking motion"" so severe that I could not feed myself.  This was with only one month's use.  Discontinued use and jerking getting much better.",Early
27,Lyrica,Diabetic Peripheral Neuropathy,,,"February 28, 2016",23,Lyrica helps with the pain and it works for me I been using it for 5 years but I don't pay  any thing for it. my insurance pays it all for me,dawsons
28,Lyrica,Diabetic Peripheral Neuropathy,9.0,,"January 11, 2016",56,"I was taking Lyrica for several years.  I stopped taking it because of the price.  My prescription medications are covered by Medicare & other insurance, but I do not believe in indiscriminately spending Medicare money.  So, again, only because of the cost, I stopped. My feet went wild, burning pain, could not even have the bed covers on them at night.  I got my Rx for Lyrica renewed and when it came I first took 2 caps in order to see if it would get started again.  It did!  I'm going to be doing a bit of research on the internet for a lower cost alternative.  Gabapentin looks good at the moment, maybe on my next doc appt. I'll try it.I gave it only a 9 because of the cost, but for effectiveness I'd give it as high a number as allowed.",agss241
29,Lyrica,Diabetic Peripheral Neuropathy,10.0,,"October 27, 2015",41,"Been taking this for about 5 years and has helped lessen pain a lot, only side effects are some swelling of the legs and feet.  Only issue is my body seems to get use to it and have to increase dosage every 6 mths - year.  Started out on 75 mg and now up to 300 mg at night and 100 mg during the day.  Have tried just about every other drug with no results, this was the only drug that offered relief.",LindyF
30,Lyrica,Diabetic Peripheral Neuropathy,3.0,Taken for 1 to 6 months,"August 23, 2015",25,"Edema in ankles and feet, cellulitis in shin and calf, 6 days in hospital, memory loss, dizziness, letharga",Anonymous
31,Lyrica,Diabetic Peripheral Neuropathy,10.0,,"August 7, 2015",44,"I have been taking Lyrica for the last three years and I don't know how I would live without it. In 2012, I was involved in a serious accident, sustaining an incomplete spinal cord injury, as well as severe injuries to my lower limbs. The pain is not as bad as it was in the beginning, but I am in constant pain and, according to my pain management and spinal and lower limb reconstruction consultants, this will probably always be the case. Initially I thought if I found the right combination of medications I could stop it and so I tried all of the other drugs prescribed for neuropathy, as well as some more experimental ones. Without Lyric I spent a lot of time crying and ended up in hospital a few times because the pain was so bad.",sarahbia
32,Lyrica,Diabetic Peripheral Neuropathy,6.0,,"August 1, 2015",30,"I just started .75 mg. Lyrica two nights ago.  Helped me sleep and not annoyed by RLS or diabetic nerve annoyance (not pain).  Also, have had issues with back pain and it seems to be helping after such a short time.",pattijacks1113
33,Lyrica,Diabetic Peripheral Neuropathy,8.0,,"July 12, 2015",22,"have had good results in controlling foot pain,i have type 2 diabetics,and prescribed 50 mg 1 per day.i have had weight gain in 50 lb  range.eat very little,age 89 yrs     little exercise .works for me",geno.s
34,Lyrica,Diabetic Peripheral Neuropathy,7.0,Taken for 2 to 5 years,"October 17, 2014",60,"I've been taking Lyrica for about 4 years now and because of the cost, I end up in the ""donut hole"" lately and the cost is almost $200 and that's with my insurance! While it works pretty well I have been forced to cut down to 2, 150mg pills a day to save up enough for at least one month. I'm a senior and $200 the last 3 months of the year is a budget breaker!",fishermom
35,Lyrica,Diabetic Peripheral Neuropathy,6.0,Taken for 1 to 6 months,"June 19, 2014",52,"I did not feel it was helping all that well with the pain.[ lower, middle back and rib]   I went from 25 mg to 75, 150 then 225mg.  I found I was tired and lethargic. I had a dry mouth and throat constantly, and my vision was hard to focus, jumpy.I had stopped and restarted after 4 months, still the same. Breathing is harder, so I've noticed this time.     I have stopped for good!",B.A.H.
36,Lyrica,Diabetic Peripheral Neuropathy,8.0,,"June 12, 2014",81,"Lyrica is about as effective as opiates without the baggage that comes with the latter.  Lyrica has it's own side effects for me while working up to 450 mg/day including a floaty spaced out sensation, INSANE appetite, and constipation - these side effects largely disappeared at the 2-week point. Pain relief was fairly quick, at about the third or fourth day.",AnnonnA
37,Lyrica,Diabetic Peripheral Neuropathy,7.0,,"April 30, 2014",39,It makes my eyes twitch,Bub2222
38,Lyrica,Diabetic Peripheral Neuropathy,10.0,Taken for less than 1 month,"August 31, 2013",109,Started taking Lyrica yesterday for severe diabetic neuropathy in both feet and lower legs. I am currently on Suboxone for a 15 year addiction to opiates and was concerned that Lyrica wouldn't work because my body is so screwed up from all the years of opiate use and most medications do not work well for me. Thirty minutes after the first dose I noticed a significant improvement in the neuropathic pain. My bedtime dose was another 75 milligram capsule and I slept better than I have slept in months! This medicine has been a God send for me so far. Hoping that it continues to work well for me! Thanks Pfizer!,neuropain!
39,Lyrica,Diabetic Peripheral Neuropathy,2.0,Taken for less than 1 month,"April 13, 2013",72,I started Lyrica 30 days ago and take 150mg per day.  I have not received any relief in my neuropathy.  I have a constant headache and my vision is fuzzy.  I am hoping the Lyrica will solve these problems in 60 days or I will have to stop the medicines.,justbg
40,Lyrica,Diabetic Peripheral Neuropathy,10.0,Taken for 1 to 6 months,"January 23, 2013",117,I have type 1 diabetes for 25 yrs. Neuropathy diagnosis for 16 yrs. Was on gabapentin for 16 yrs and it quit working for me. 2 months ago my doctor put me on Lyrica and what a difference my pain in feet and legs is all but gone! Thank you Pfizer for Lyrica it has made such a difference in my quality of life!,chris 74
41,Lyrica,Diabetic Peripheral Neuropathy,10.0,Taken for 1 to 2 years,"September 19, 2012",97,This works within 30 mins. After the first pill my legs stopped burning and tingling one of the only medicines I ever found that worked so fast.,Don K.
42,Lyrica,Diabetic Peripheral Neuropathy,1.0,,"September 8, 2012",45,"Extremely drowsy, no difference in pain",Anonymous
43,Lyrica,Diabetic Peripheral Neuropathy,1.0,Taken for less than 1 month,"August 25, 2012",88,"My husband suffers from neuropathy and his Dr put him on Lyrica 75mg twice a day. The side effects were horrible, he had to stop taking it immediately. He was dizzy, had headaches, off balance, couldn't judge distance, and it looked to him like the walls and floors were moving.",Anonymous
44,Lyrica,Diabetic Peripheral Neuropathy,,,"February 22, 2012",62,"Ive been prescribed pregabalin for 3 yrs and over the last year I've noticed that I am progressivly forgetting things which are important i.e Bills or appointments. Anything really, it just depends. They are good for what they are prescribed for but on the other hand, is it just me?",pre chat
45,Lyrica,Diabetic Peripheral Neuropathy,9.0,,"February 19, 2012",74,I recently started taking Lyrica for two herniated discs. The doctor said I have massive nerve damage that will result in surgery but suggested taking this medication temporarily until surgery because my pain was unbearable! At first I was a little off balance but within a week I wasn't constantly in pain....within a month my pain was almost gone and I refuse to do surgery now! Thanks Lyrica for making this happen!,Anonymous
46,Lyrica,Diabetic Peripheral Neuropathy,9.0,,"January 14, 2012",58,"I have been on this medication for 4 years now.  There has been a 20 pound weight gain, so far.  My GP is always after me about the weight gain however I would rather be fat and happy then suffering from the pain it used to cause. I also take methadone as a pain killer.  The sad part to the Lyrica is the price.",Canuck Sue
47,Lyrica,Diabetic Peripheral Neuropathy,5.0,,"February 16, 2011",37,"Worked good for first 3 days.  Then got severe side effects, breathing problems, vomiting, shaking.",Irv1
48,Lyrica,Diabetic Peripheral Neuropathy,5.0,,"November 11, 2010",68,"I was already overweight and went on Lyrica because of the tingling in my hands and feet being intolerable. Three weeks later, its like I woke up one morning and none of my clothes fit. I got on the scale and from the time my doctor gave me this pill to current and have gained over 25 lbs. It's a shame I have to decide between being obese or able to sleep and be pain free.",lyricafatty
49,Lyrica,Diabetic Peripheral Neuropathy,9.0,,"September 13, 2010",80,"I have been using Lyrica for about 2 months now. I originally quit it because I gained 7 pounds in a week.  Stopped taking it.  Could not stand the pain in my feet, outer thighs and now along my belt line.  I noticed that the weight gain seemed to be from an increased appetite. I have been able to keep the weight off by being very mindful of my hunger, or mindless eating. I am 5'10"" 185lbs. Without Lyrica I don't really get hungry.  Mind is bigger than the belly when I order food.  With Lyrica I find I could eat a horse, and a cow and maybe a squirl as an after dinner snack ..LOL.  It makes me lose what ever normal appetite suppresent that I may have.  It does wonders for my nerve pain that started 6 months ago and seems to get worse without Lyrica.",Anonymous
50,Lyrica,Diabetic Peripheral Neuropathy,2.0,,"August 28, 2010",38,Lyrica made me a zombie. I could just sit and flip channels on the TV or stare off into space. If it helped the neuropathy I did not notice. Stopped taking it after one week and the Doctor put me back on Neurontin. Neurontin does not help so much with the pain in my feet and legs but at least I can function.,Anonymous
