,drug,condition,rating,duration,review_date,upvotes,review,username
51,Lyrica,Diabetic Peripheral Neuropathy,9.0,,"April 3, 2010",49,Started using LYRICA about 6 months ago.  It seems to have minimized the toe/foot pain I have when I go to bed.  This was keeping me awake with pain and restless legs.  Now I can get to sleep easier.  Did notice some weight gain... but am working on it.  No other side effects noted at this time.  Sure has helped me at night!,brunot
52,Lyrica,Diabetic Peripheral Neuropathy,10.0,,"February 15, 2010",65,"I love this medication!!! With out lyrica i would not be able to walk.Nerve damage from diabetes has taken its toll on my nerves in my feet and legs.My new insurance company is denying my coverage for lyrica.But my drs are trying to keep   me on lyrica because i have been i it for so long.Shame on insurance companies who r just trying to save a buck!!! Not fair",shy shy
53,Lyrica,Diabetic Peripheral Neuropathy,1.0,,"December 22, 2009",43,"I am glad that Lyrica has helped many, just did nothing for my nerve pain and tons of side effects.",bhutch1294
54,Lyrica,Diabetic Peripheral Neuropathy,10.0,,"September 26, 2009",57,"Not only do I have diabetic neuropathy, I also have nerve damage on both sides from total loss of L5S1 disc.  I could not live without Lyrica.  Just don't miss a dose, it's not pleasant. Lyrica doesn't stop it all, but I know how much it does stop and won't ever be without it",roos
55,Lyrica,Diabetic Peripheral Neuropathy,3.0,,"August 19, 2009",51,"I suffered with nerve damage at back of my neck. Lyrica caused me severe memory loss, confusion and depression. It stopped my nerve problem but my good memory has not returned. I also suffer headaches, which I never had before.",marle
56,Lyrica,Diabetic Peripheral Neuropathy,10.0,,"August 18, 2009",73,"I started using Lyrica six months after it was put on the market and I think it is a miracle drug for those of us who could not sleep or relax in any way due to severe neuropathy.  The only side effect I experienced was sleepiness which disappeared after about a week.  This is a wonderful, wonderful thing for diabetics with nerve pain.  Thank you to the makers!",DBT2009
57,Lyrica,Diabetic Peripheral Neuropathy,6.0,,"July 30, 2009",20,It makes my hands shake.,Anonymous
58,Lyrica,Diabetic Peripheral Neuropathy,8.0,,"July 8, 2009",49,I have nerve pain from diabetes. I was waking up several times a night with severe pain. Lyrica has allowed me to sleep through the night without interruption. So far no side effects to report.,Anonymous
59,Lyrica,Diabetic Peripheral Neuropathy,,,"June 9, 2009",70,"I was put on 50mg of Lyrica at age 62.  Within a week there was noticeable improvement in the amount of burning and tingling in my feet and legs. Within a month the burning and tingling disappeared. At 3 months I had gained 15 pounds at a rate of 5 pounds per month. Most importantly I began to notice I did not care if I lived or died. I stopped taking the drug. I have also experience this with antidepressants. For 6 months after stopping Lyrica I remained relatively free of pain. By 8 months the burning and tingling have returned at their full intensity. I rate the drug a 5, great for pain with serious side effects.",Anonymous
60,Lyrica,Diabetic Peripheral Neuropathy,9.0,,"May 12, 2009",28,Lyrica has its pros and cons like any other medicine in the market. Lyrica has helped me in many ways including neuropathic pain and depression together with other antidepressants. The only side effect that bothers me a little is the fact that I feel tired most of the time but I can still function with a lot of calmness.On the other hand I have tried every single medicine for insomnia during the last 12 years with not so great results until I found this medicine. Now I sleep like a baby at 150mg twice a day.,hemaro
61,Lyrica,Diabetic Peripheral Neuropathy,8.0,,"February 9, 2009",44,"I take a 75 mg dose, and it really makes a difference, I still have an underlying tenderness in the toes and the pads of my feet, but at least I can walk. I am looking for an alternative for it as the cost to me is excessive.",Robert Webb
62,Lyrica,Diabetic Peripheral Neuropathy,8.0,,"January 30, 2009",37,"I am on dialysis and now have neuropathy in my feet. I have tried many things and find Lyrica works but I have to take a low dose, only 75mg a day.  I have found that this low dose of Lyrica works well with 10mg of Vicodin.  My feet are tolerable and I can function without kicking my feet every millisecond and always thinking of the pain in my feet.  This combination works very well and I recommend it to all diabetic/dialysis neuropathic pain patients.",Anonymous
63,Lyrica,Diabetic Peripheral Neuropathy,8.0,,"September 11, 2008",59,"I was prescribed 400mg/day of lyrica for severe peripheral neuropathy of my feet.  Prior to Lyrica I was taking 60mg/day of methadone with significant relief but with plenty of room for improvement.  With the addition of Lyrica to my Methadone regimen, my relief now stands at approx. 80% analgesia which is a God send considering the severity of my pain.  As a welcome side benefit, significant anxiety, hot flushes and insomnia were relieved as well.  For me, Lyrica has been something of a miracle drug.",Anonymous
64,Lyrica,Diabetic Peripheral Neuropathy,10.0,,"July 15, 2008",55,"Lyrica stops the pain in the ball of my feet. It's wonderful to be able to walk without the pain. I am diabetic and take insulin. I too have had a weight gain of 35 lbs over the past 6 months. I seem to suffer from a bit more memory loss than before and I fatigue easily. I have caught myself dozing off in front of the computer at work, so I force myself to get up and walk around a bit. All in all a small price to pay for the relief of the pain in my feet.",texaswanderer
65,Lyrica,Diabetic Peripheral Neuropathy,10.0,,"February 28, 2008",120,"I love the drug but I am experiencing EXCESSIVE Weight Gain. I began the medication in November 2007.  To date, I have gained 30 lbs.  Some of my now FAT clothes have gotten too tight.:(  Has anyone else experienced this problem??",trisho
66,Lyrica,Diabetic Peripheral Neuropathy,10.0,,"February 25, 2008",114,"I was have burning pain to my feet, with sharp shooting pains from my toes.  Lyrica has completly stopped both kinds of pain.  It has also helped with the shart shooting pains in my fingers - arthritis related.",Anonymous
