,drug,condition,rating,duration,review_date,upvotes,review,username
0,Prozac,Obsessive Compulsive Disorder,10.0,Taken for 6 months to 1 year,"March 9, 2022",10,"I was very nervous to try Prozac because of my horrible hypochondria and fear of trying new medicines. I was constantly struggling with OCD intrusive thoughts and compulsions, as well as TERRIBLE anxiety. I felt as though my OCD and being in a constant state of worry were taking over my life. I’m 29 years old, work full time & decided that this way no way to live. I caved and started 10mg daily. Week 1 I was exhausted and in a fog. Week 2 was brutal, I had peak anxiety and OCD. I almost felt manic. I had a panic attack, was nauseous, & couldn’t eat. Week 3 I started feeling better, I noticed my intrusive thoughts weren’t constantly haunting me. Week 4 I woke up one day and felt like a new person. I no longer have intrusive thoughts or OCD routines, irritability is nearly gone, and I’m not in a constant state of worry. I feel 100x better, Prozac has changed my life. I’m posting this for people who are nervous to try. Try fighting through the side effects, it’s SO worth it.",OCD and Anxiety
1,Prozac,Obsessive Compulsive Disorder,10.0,Taken for 1 to 2 years,"February 28, 2022",1,"It has helped so much. My OCD used to be horrible and awful to manage. Ever since I'’ve been on prozac, it’s been so much more manageable. The only side effects I’ve had is a dry mouth, dizziness, and a low sex drive. I’m on 30mg",ilua
2,Prozac,Obsessive Compulsive Disorder,9.0,Taken for less than 1 month,"January 25, 2022",9,"I recently started on Prozac for Major Depressive Disorder, Generalized Anxiety Disorder, OCD, Insomnia after cycling through a number of medications for several disorders. I tried trazodone at first for anxiety and insomnia, then added quetiapine when the trazodone didn’t work. Then I started using Imovane which made me feel awful. My psychiatrist started me on 20mg Prozac to improve anxious and obsessive thoughts and depression. It has significantly improved those and I no longer feel the physical effects of anxiety or depression. It has also significantly improved sleep as I do not stress about not being able to sleep. Finally, it did cause a few side effects like headache and nausea for the first few days but it is now gone.",searching
3,Prozac,Obsessive Compulsive Disorder,6.0,Taken for 1 to 2 years,"January 20, 2022",2,I took it for 18 months for severe OCD it made a difference but not enough to keep taking it.  The tablet would mess up my stomach the whole day I couldn't take more than one 40 mg.,Jose
4,Prozac,Obsessive Compulsive Disorder,2.0,Taken for 10 years or more,"December 17, 2021",1,"Forgot to add to my other review. The generic equivalent of Prozac did absolutely nothing for me, either for my ocd or my depression. I needed the brand name for it to work. So if you’re not having an effect, ask your doctor to write brand name only . You better have great insurance though, because it’s thousands of dollars.",George
5,Prozac,Obsessive Compulsive Disorder,2.0,Taken for 10 years or more,"December 17, 2021",0,"Warning! Just be careful. I’ve used Prozac off and on for maybe 30 years. Be aware of sexual side effects of this drug. Total inability to reach orgasm during sex. And no, it wasn’t caused by anything else. I was checked out. Sometimes the inability to climax persists even after you’ve off the drug. I’m not the only one to experience this; there’s plenty of information on post SSRI sexual dysfunction. Oh, and the percentages  of sexual problems listed in the package insert are skewed on the low side.",George
6,Prozac,Obsessive Compulsive Disorder,10.0,Taken for 6 months to 1 year,"November 18, 2021",45,"I have OCD, anxiety and occasional depression.  My OCD is hyperawareness related.  I had an extremely rough time this summer.  Getting on these meds was rough but benzos helped me on bad days.  I just have to say, this medication saved my life.  I hope that this brings hope to whoever is reading this right now.  You can get better.  My anxiety is gone, depression is gone. OCD is background noise now.  I was terrified I would never get better. I was suicidial.  I am a mom of 2 kids.  I was deathly scared of my own mind.  Don't give up.  Give this med a shot! (I take 40 mg).",Abby
7,Prozac,Obsessive Compulsive Disorder,2.0,Taken for less than 1 month,"November 4, 2021",0,2 weeks in and now I have suicidal thoughts and my clitoris is completely numb. Everyone will have a different experience but unfortunately mine hasn’t been great.,Lily
8,Prozac,Obsessive Compulsive Disorder,10.0,Taken for less than 1 month,"October 28, 2021",15,"30y/o F with moderate anxiety and very mild OCD regarding relationship, and PMDD.I just wanted to share a positive review, after reading so many negative ones listed below. I started on 10mg, and at 7 days, I doubled to 20mg. Other than maybe feeling SLIGHTLY ""dazey"" the first few days, I have had no other side effects. It has changed my life in just 3 weeks. Things are more vivid. Life is lighter. It almost feels like I'm constantly microdosing on mushrooms (if you know what that feels like)It got rid of the constant angst, the obsessive thoughts, the severe PMS symptoms. My sex drive didn't go away, if anything, it's even better because I actually like my boyfriend now, instead of the PMDD telling me I need to get out. It's a game changer, and it started working day 3-4 for me, with VERY minimal bad side effects. So thankful.",Positive Review
9,Prozac,Obsessive Compulsive Disorder,4.0,Taken for less than 1 month,"October 17, 2021",1,"It was ok, but I didn't really like the feeling. I took 20mg for a week and then I quit. I felt like I couldn't think as deep, which I guess could be good for those with OCD, but I just felt off and would rather feel normal instead of on a medication. It felt like someone filled my head with oatmeal and I had to think around the oatmeal. I slept less and the sleep itself felt artificial. I did have a few interesting moments on it, but overall I wouldn't recommend it and I don't see how people can take this drug for long periods of time. My face even looked different. It was just a strange experience overall. I'm glad to be off it.",jessie
10,Prozac,Obsessive Compulsive Disorder,10.0,Taken for less than 1 month,"August 19, 2021",15,"I started taking Prozac three weeks ago. I have depression, anxiety, PTSD and severe OCD with the intrusive thoughts.  Before Prozac I have battled with depression and anxiety for years but the OCD has just hit hard within the past year and a half. To the point of loosing my family and friends over it because I was constantly questioning and accusing and it was just awful. My family doctor wasn't giving me the correct medicine. I have tried wellbutrin, lexapro, effexor etc. and none of them were helping me, I just felt like I was getting worse. I started seeing a Psychiatrist and she diagnosed me with severe OCD and put me on Prozac. The first week I couldn't really tell anything, the second week I felt alive again, like a weight had been lifted off of me, thoughts were still there but I was able to dismiss them a lot easier. Week three I am feeling a little down and depressed this week but I am not giving up. The way I felt with week 2 I hope to start feeling more often and even better.",Girlygirl
11,Prozac,Obsessive Compulsive Disorder,9.0,Taken for less than 1 month,"August 6, 2021",10,Fluoxetine : the 24th day I feel a little change I'm on day 25 I think it will take some more time for full effect so I m good . First 23 days are very tough because I always wake up with anxiety attack and suicidal thoughts but on the 24th day it gone and feel better. Don’t quit it seriously working. This is the best decision I have made I my life. Fact : it takes time and make worse before better and take time to fully effective. Love for those share their experiences these reviews helped so much. I'm so thankful to all,Ahaan
12,Prozac,Obsessive Compulsive Disorder,8.0,Taken for 6 months to 1 year,"August 3, 2021",7,"I can’t recommend fluoxetine enough. I had been suffering for weeks with debilitating OCD/anxiety and depression, Having been SSRI free for over 4 months but it came back with vengaence. In essence, fluoxetine works! For those nervous about the side affects - the first time I took it the anxiety/OCD was seriously INTENSE and took 8 days to work. At points it felt like I was losing the plot. If it got that bad again this time I was planning on taking Xanax while it kicks in. However, I’m 4 days in now and the anxiety/OCD has been pretty bad but I was able to ride it out. It’s now Day 5 evening and I can feel it is starting to work again. Depression has gone, head feels clearer with no more anxiety alongside the intrusive thoughts. It may take longer for you so don’t give up before 1 month.",Dave
13,Prozac,Obsessive Compulsive Disorder,,Taken for less than 1 month,"July 9, 2021",6,"To those waiting for Prozac or other to kick in - if you’re miserable ask your doctor to give you .5 Klonopin in the morning as an interim, it’s immediately effective and short term use is ok.",Hope
14,Prozac,Obsessive Compulsive Disorder,8.0,,"June 8, 2021",3,If you are having sexual issues with your SSRI get your doctor to prescribe some cyproheptadine.  It temporarily blocks the effects of SSRI medications.,mihulka3
15,Prozac,Obsessive Compulsive Disorder,1.0,Taken for 1 to 6 months,"May 10, 2021",33,"My husband suffers badly with severe OCD. He has had OCD since I’ve known him, almost 35 years, but in the last 6 months the symptoms have ramped up and he is tortured by thoughts of contamination. He recently found a psychiatrist who put him on Prozac. He is at the 8 week mark and has yet to see any benefit and in fact seems to have gotten worse. Everything we read says it needs to be taken for 8-12 weeks to begin to see improvement, but is it common for the obsessions and anxiety to worsen initially? He is discouraged and desperate for some relief. Is this anyone else’s experience?",HAZ
16,Prozac,Obsessive Compulsive Disorder,10.0,Taken for 1 to 6 months,"February 14, 2021",31,"I was dealing with chronic and miserable anxiety for months and was losing hope that I'd ever feel at peace again. Did 10mg Prozac for a couple days then increased to 20 mg for about a month. Didn't notice any differences, so increased to 40 mg for a little over three months. I noticed quite the change with that increase after a month or so, and was finding myself less anxious throughout the day and feeling a little less guilty all the time. Just increased to 60mg a couple days ago and am feeling quite optimistic. While I still have my bad days, I really think this has saved me and I am so glad I gave it a try. I was apprehensive at first because of all the horror stories I've heard, and being anxious about trying a more intense medication but I am so so happy to have begun this journey and finding that there is hope. I dealt with minor insomnia after the first month for about a week, and for a about a week after the first dose increase.",peace
17,Prozac,Obsessive Compulsive Disorder,2.0,,"January 20, 2021",11,"I tried this medication for a week and had a horrible experience. I didn't sleep for two days and completely lost my appetite. I did not eat anything and lost three pounds. I was already skinny to begin with. So, if you want to be malnourished and sleep-deprived and feel like a crack addict,  this is the medication for you. It does help with anxiety, however.",College
18,Prozac,Obsessive Compulsive Disorder,9.0,,"January 10, 2021",76,"I’ve been on 20mg of fluoxetine for five weeks so far. I was terrified to start because I had a horrible experience with lexapro. My experience with fluoxetine has been a cake walk so far compared to lexapro. The first week or two were a little rough. I had difficulty sleeping, dry mouth, forgetfulness, and extreme exhaustion. Now at week five my intrusive thoughts have decreased. When I do have them, I can let them go. I don’t ruminate like I was doing prior. I’m also not having panic attacks when trying to do every day tasks like going to the store or driving. This medication is slow working, so it takes time to feel improvement. A lot of information says 4-6 weeks but many people in support groups that I’m in say it took closer to 12 weeks to feel full benefit and if this is the case, I’m excited to see how I’ll feel in a few more weeks because I’m already feeling so much better! The medication has saved my life.",Pitbulls and pillows
19,Prozac,Obsessive Compulsive Disorder,2.0,Taken for 6 months to 1 year,"November 25, 2020",15,"I’ve been on prozac for like 9 months, I’m actually at 80 mg, the maximum dose and I’ve felt little to none relieve of my OCD. I know that for some people it has worked, but for me it is not the case, I’m going to start taking luvox tomorrow and I hope I get better, with prozac my hands shake all the time, I gained weight and I’m really sad for the overcome result",piglet
20,Prozac,Obsessive Compulsive Disorder,10.0,,"September 21, 2020",168,"I cannot even put into words how much Prozac saved me. I was struggling badly with severe OCD and it was taking over my life. I couldn’t function like a normal person anymore and it was a very dark time for me. My doctor put me on Prozac and the first month I didn’t really notice a change. After the first month went by, everything got better for me. I noticed myself not worrying about OCD anymore and actually felt genuinely happy inside. It’s been 8 months on Prozac and I can honestly say I love my life now, I’m truly happy & OCD isn’t something I’m controlled by anymore. Although it never goes away completely, it is now 100 percent manageable. :)",Slimlys
21,Prozac,Obsessive Compulsive Disorder,9.0,Taken for 2 to 5 years,"September 12, 2020",39,"Prozac got me out of a very dark place when I was first diagnosed with severe OCD, would not be alive without it. It stopped working for me after about 3 years of taking it but it was a great start to getting help with obsessions and compulsions.",Jess
22,Prozac,Obsessive Compulsive Disorder,10.0,Taken for 6 months to 1 year,"September 11, 2020",32,"In college my counsellor wanted to primarily treat my depression and anxiety with Celexa, then Lexapro. Each of these medications drastically worsened my symptoms and I began experiencing suicidal thoughts (side effects of both). Naturally, I was too terrified to every try medication again. However, when I was accurately diagnosed with O.C.D., my O.C.D. specialist recommended Lexapro and it has changed my life (in combination of Cognitive/Behavioral Therapy). I experienced a mental and physical breath through and am thriving like never before. I literally thought feeling like this would never be possible. I have SO much mental energy now that it's not being used up for my obsessions and compulsions. I am forever grateful for this one tool. But I firmly believe it's just one tool, not the ""cure all"". Without the intense 1 year of therapy leading up to medication, and learning how to better communicate, I don't believe I'd be thriving like I am.",Jenny
23,Prozac,Obsessive Compulsive Disorder,10.0,,"August 17, 2020",40,"I have depression and OCD.  Prozac 40-60 mg combined with 5 mg abilify has really helped soooo much.  I feel my severe OCD is a loooot more manageable, and my depression is not deep and unliveable, I feel so much better.  I needed the addition of abilify to really help with the depression, but I noticed after 7 or 8 weeks my OCD was better with 40 mg of Prozac.",Anonymous
24,Prozac,Obsessive Compulsive Disorder,,Taken for less than 1 month,"June 26, 2020",21,I'm starting Prozac today and I'm currently on Zoloft but I've been weaning off of it.  I tried about everything except Prozac so we'll see how it goes. Zoloft did help my OCD by didn't cure it.,RayRay
25,Prozac,Obsessive Compulsive Disorder,10.0,Taken for 1 to 2 years,"June 25, 2020",111,"I’m 40 and for last 15 years have tried and stopped taking  many many different SSRI’s and anti-psychotics Meds. Mostly stopped mental drugs cause of side effects, made depression / anxiety worse, and some other issues. But dang! Was on Prozac for last year and this vintage SSRI from the early 1990s has worked better and much much more tolerable  than any other drug I have tried.",Jerry
26,Prozac,Obsessive Compulsive Disorder,10.0,,"May 13, 2020",84,This medication Prozac has helped me so much and has truly saved my life. My OCD and panic attacks were taking over my life to the point where I felt I could barely function. When this medicine began working for me I felt that I finally am the person I want to be if my OCD and anxiety did not stand in my way. This medication was absolutely amazing for my OCD and anxiety/panic attacks. I am on 50mg.,Anonymous
27,Prozac,Obsessive Compulsive Disorder,10.0,Taken for 5 to 10 years,"May 2, 2020",70,"Fluoxetine helped to get me out of a bad place with regards to my OCD. I'm so thankful to it. Compared to other medications that I've taken in the past, it has very few side effects, especially in terms of weight gain etc. Alongside therapy, it's changed my life. Without even realising it, my compulsions and ruminating lessened dramatically. It's worth going through the first three weeks of transition, to experience the final effects.",Janey12
28,Prozac,Obsessive Compulsive Disorder,9.0,Taken for 1 to 2 years,"February 8, 2020",31,"My son takes prozac. Thing I like about it, it works for OCD. He still has it, but compared to how it was -  the compulsions and tic like compulsions were almost unbearable. Then there was the hoarding! Since taking Prozac most of that has subsiding. He still hoards but it’s not near as extreme. He still has compulsions but it’s less and more manageable. My issue is, when we have periods and his OCD is ramping up, we have to increase and it seems like we have a honeymoon period and need to increase again. Also, for my husband, this medication was horrible. It did not work on him at all. He had better success with lexapro, but we were not trying to treat OCD with him. I think if you’re trying to treat OCD, this is a great option.",Steph
29,Prozac,Obsessive Compulsive Disorder,10.0,Taken for 1 to 6 months,"January 8, 2020",43,"After trying countless medications including zoloft, lexapro, lovox, to name a few. I finally found the medicine that healed me. Before taking this medicine, I would do the most bizarre rituals including always selecting the right side of everything, touching objects repetitively, stepping on lines and more. The OCD was mentally draining. I will admit I have done exposure therapy alongside taking this medication, which has helped me tremendously. Have faith, this medicine is a lifesaver. Also if you suffer from OCD join a group on social media. There are more suffers than you think.Also make sure you take this medicine with food.",Tilda
30,Prozac,Obsessive Compulsive Disorder,2.0,Taken for 1 to 6 months,"November 3, 2019",8,It did nothing for me. Generic meds don't work,Vicky
31,Prozac,Obsessive Compulsive Disorder,10.0,Taken for 1 to 6 months,"October 27, 2019",43,Helped me so much with both my depression and OCD. I still get anxiety but my life doesn't revolve around compulsions anymore. First 10-14 days were hard but so worth it. If you are struggling with depression and OCD its really worth giving prozac a try!,Depressed gal
32,Prozac,Obsessive Compulsive Disorder,10.0,,"October 22, 2019",36,I benefited a lot from the medicine and combined with Cognitive behavioral therapy (CBT) it cured my OCD it takes around 2 year to completely cured and to have my thoughts under control and I continued used 20 mg of the medication to control anxiety.  I am again successful in life  I recommend with good CBT programme.,Semsem
33,Prozac,Obsessive Compulsive Disorder,,Taken for 1 to 6 months,"August 1, 2019",16,I take it in the morning with my other meds. Less OCD.,Don89
34,Prozac,Obsessive Compulsive Disorder,10.0,Taken for 1 to 6 months,"July 23, 2019",56,"After trying many forms of therapy for my OCD and anxiety I was beginning to feel as though nothing would work long-term. I started this medication 3 months ago and the dose has gradually gone up since then. The only side effects I’ve experienced is that I’m a little more fidgety than usual, and when I first started it I was a lot more anxious. However, after a few weeks of being on it I started to feel so much better. Now I’m on 20mg and it is definitely the best thing I’ve ever done. With a combination of cognitive behavioural therapy and Prozac I can’t believe how good I feel. I am less anxious, my mood is better, I can control my OCD more. It really does take a few weeks to kick in, but it really does work.",peaches
35,Prozac,Obsessive Compulsive Disorder,10.0,,"June 18, 2019",199,I would like to speak about prozac. When I first started it  I felt like giving up . I was on 20mg and I couldn't eat or sleep and my anxiety got so much worse. My thoughts went on overdrive and new OCD thoughts came.However I am now on it three months at 40mg dose and my brain is so much clearer. I can rationalise the thoughts. OCD is no fun but don't suffer . I went on here when I first started and I read a positive thread and it kept me going. Please don't lose hope .,ki 2
36,Prozac,Obsessive Compulsive Disorder,1.0,Taken for less than 1 month,"June 12, 2019",19,Took Prozac two days. I felt like my soul and conscience were being stripped away. Very hard drug.  Dangerous.,Boris
37,Prozac,Obsessive Compulsive Disorder,1.0,Taken for less than 1 month,"June 5, 2019",13,"Awful. Couldn't sit still for a minute onProzac, couldn't sleep, got kicked out of the cinema for moving too much. Had to get off it after three days, it was too much.",Yellow
38,Prozac,Obsessive Compulsive Disorder,10.0,Taken for 1 to 2 years,"May 24, 2019",177,"I keep meaning to share my review of this drug. I know there are many people reading these reviews just starting Prozac, and extremely anxious. Because at one point I was one of them. How long does it take for Prozac to work you may ask? Well the first few weeks are rough, then at 6 weeks it was like a switch went off and I felt so much better. Panic attacks gone, my OCD is under control (also with help of ERP therapy with psychologist) it has completely changed my life. I almost quit taking it the first few weeks because the side effects were so terrible, but with support from my family and online support groups I kept taking it. I’m here telling anyone struggling PLEASE give this medication at  least 5-6 weeks before you quit taking it. Please hang in there. Prozac has literally saved my life.",Silly goose
39,Prozac,Obsessive Compulsive Disorder,7.0,Taken for 6 months to 1 year,"May 16, 2019",16,"Prozac has been pretty good for the depression, my anxiety has been worse though. I get shaky when I get anxious and my knees feel wobbly. I don't feel some of the side effects such as heart palpitations or chest pressure just anxious. Zoloft caused heart issues but I felt like doing some things like going to the gym. With Prozac--no heart issues but I feel more on the lower end with less energy. Started 20 mg 5 months ago then 30mg for a month now 40 mg recently. I hope the anxiety gets better.",A289
40,Prozac,Obsessive Compulsive Disorder,10.0,Taken for 1 to 6 months,"April 30, 2019",67,Prozac has changed my life. I feel like I’m living life and enjoying it to the fullest for the first time in a very long time. I use to feel so empty and hopeless. I can truly say I’m the happiest I’ve ever been.,Cheryl
41,Prozac,Obsessive Compulsive Disorder,10.0,,"February 26, 2019",7,I started having really strong suicidal thoughts. I saw a psychatrist and he diagonised me with OCD and said there's no depression inside me I doubt it. He started me on Prozac and Risperdal. I struggled for 1 year long. I decided to change the doctor. He said not to leave Prozac and add one other medicine called effexor. I finally found out that only the brand Prodep Olimelt and Lamez ( Brand name of Prozac Zyprexa and Lamictal in Nepal) work best with each other. No other brands can be used.I am now currently on 150mg Efexor XR( Australian Brand) Prodep 20mg 2  capsules( Nepalese Brand) Olimelt 5 mg ( Nepalese Brand) and Lamez 100mg ( Nepalese Brand) and I am living a life. So if you are suffering from any mental just go to Nepal and ask a psych to take Prodep 20 mg capsule Olimelt 5 mg tablet and Lamez 100 mg Tablet( Remember lamez 50 mg tablet doesn't work well with this combo so just 100mg Tablet) doesn't matter whatever dose you are on. Good luck !!,Reesub
42,Prozac,Obsessive Compulsive Disorder,,Taken for 1 to 6 months,"February 23, 2019",8,"I took this medication for 2 months for body dysmorphic disorder and my breasts grew three cup sizes. I can’t exercise or fit into my old clothes, and I have back and neck pain.  It has exacerbated my BDD. I am so afraid I am going to get breast cancer now. It is extremely disturbing, and I am terrified. I have been off it for over a year and they have not gone down. This was not listed in the literature and there was no indication of permanent side effects. If this starts happening to you while taking this medication, please be aware that you could be stuck with it for life. I wish I knew or I would have stopped it immediately.",Sallyforth
43,Prozac,Obsessive Compulsive Disorder,3.0,Taken for 2 to 5 years,"February 9, 2019",10,"Relieves anxiety slightly, not enough to render you a functional human being and definitely not worth the side effects.",dordeduh
