,drug,condition,rating,duration,review_date,upvotes,review,username
72,Prozac,Obsessive Compulsive Disorder,9.0,Taken for 1 to 2 years,"March 21, 2016",74,"I had been having anxiety and other symptoms such as weight loss.  I was diagnosed with OCD and started on 10mg prozac. I battled with side effects for the first month of increased anxiety, nauseousness and sleeping problems.  At about the 5 week mark the negative side effects went away and I started to feel some relief from the anxiety caused by the OCD.  I was increased to 20mg which seems to be enough for me.I have now been on it for over a year.  I feel so much better.  Like a weight is lifted off of my shoulders and I no longer worry and obsess.  I have gained some weight but the anxiety had made me lose weight so I think I am able to eat now because I feel better.  I don't sweat the small stuff in life anymore!!",OCDin PA
73,Prozac,Obsessive Compulsive Disorder,9.0,,"February 15, 2016",52,"Had to switch to this after sertraline didn't work when I tried to go back on it. OCD blew up as soon as I stopped my previous SSRI and I ended up sick. Always consult your doctor and if you have severe OCD, it's an SSRI for life... Fluoxetine had the usual side effects: suicidal, anxious, worsening of depression and tiredness. Unfortunately you just have to work through this with these meds. After a few weeks I started to see some slow progress and my obsessions decreased. I was still severely depressed and I augmented this with risperidone. That too made me a bit crazy for a few days but after a couple of weeks I was able to return to work after 3 months off. These meds take time. 18 months on I'm just on fluoxetine 60mg and feel great!",Gregocd
74,Prozac,Obsessive Compulsive Disorder,7.0,Taken for less than 1 month,"November 28, 2015",40,"First week was hell, more anxiety and panic attacks. Had to leave work early one day for the anxiety, also left a family event early. But now... Starting second week and starting to feel like myself again! As long as things continue this way will be happy on this drug! Without the first weeks' side effects would give it a 10.",Anonymous
75,Prozac,Obsessive Compulsive Disorder,10.0,,"November 5, 2015",172,"I had all of these horrible thoughts racing through my mind for 5 weeks before I started Prozac. I kept thinking about dying, my family dying. I feared time and death and could not stop the racing thoughts no matter what. I thought I would never get better, but then a week after starting Prozac, I no longer had any racing thoughts! It has brought me back into the moment. No more intrusive thoughts :)",Julian1227
76,Prozac,Obsessive Compulsive Disorder,4.0,,"October 2, 2015",14,"I have been on prozac now for a while as I suffer from ocd and ptsd also. I feel as if it has made me crazier, if thats possible. Some days I can't stop twitching, feel full of energy and experience nausea. Other days my bones hurt, I feel not fully awake and just odd. Keeping in mind that daily, I have a high levels of caffeine and smoke marijuana. and not daily, but weekly I drink quite a bit of alcohol. I have noticed alcohol and prozac really don't mix. but nevertheless, I am still taking 20mg daily (which i do not think is enough) but then some days I want to stop taking it altogether? I do not although prozac doses shouldn't be skipped but evidently the only words I can use to describe this drug is odd and weird and idk???! uuGh",buffalo soldier
77,Prozac,Obsessive Compulsive Disorder,10.0,Taken for 2 to 5 years,"September 17, 2015",50,"I wasn't sure if this drug was helping with OCD.  When asked I would reply, ""it seems to make it easier to deal with it"".  Then my Doc decided to lower my dose in order to take me off it.  When I got to 60mg I lost it.  The obsessive thoughts were out of control.  Compulsions increased as well.  I am back on 100mg and feeling and thinking much better.  The med helps a lot, but doesn't fix me completely.  I challenge my compulsions every day so I can reinforce that I do not need them.",dariley38
78,Prozac,Obsessive Compulsive Disorder,9.0,,"August 23, 2015",17,"Hi ive been on prozac 60mg for 10years the drug is miraculous it got me out of a hole, but as i suffer from ocd i decided to self medicate with drink and drugs also that led me me to a 12 step fellowship! Now 7half years without a drink or drug im self medicating on prozac which is not v good! It got to last friday i had taken probly 4 tablets in 2 weeks and just crashed! Im now back on 60mg a day but having bouts of anxiety again and thinking its not real, im hoping this is just the side affects of the prozac again getting in system, im tired headache and anxiety thinking",Taximan42
79,Prozac,Obsessive Compulsive Disorder,7.0,,"April 25, 2015",28, Recommend using Lovan 20mg the generic brand of Prozac. Break in half to start at 10mg a day. Your looking for small signs of success. Keep a daily journal of your time taking it so you can look back TRUST ME this helps when spotting reaction patterns and finding right exact dosage amount. For some LESS Prozac is more benefit. Mania / sweating / twitching muscles was part of my first 2 months but settled down. Alcohol leaves toxins in your blood for 2 days that stop the medication working fully. Sex drive gone by 80%.** I have still had to apply daily mental awareness techniques and being aware of my thoughts to get great results. Not been a cure all but is brilliant,Hugo. Depressive episodes. Ocd. Tourettes. Anxiety
80,Prozac,Obsessive Compulsive Disorder,9.0,,"March 24, 2015",51,Prozac really saved my life 6 years ago when I was suffering from major Obsessive Compulsive Disorder and Insomnia related to it. Tried to stop it few times but always had to come back. No sexual side effects even at 40mg/day. Unofortunately it seemed that the medicine had pooped-out on me after 5 years and I currently started taking Paxil.,Jeff235235
81,Prozac,Obsessive Compulsive Disorder,9.0,Taken for 1 to 6 months,"January 22, 2015",145,I am so happy that I finally received a diagnosis and treatment! Ever since I was about 19 years old (29 now) I have dealt with depression that came in waves. My anxiety and obsessive tendencies didn't begin until I was 22 and had the military. I always thought that the high stress situation just fed into my depression and caused anxiety and obsession. I finally decided to seek help and I was shocked to find out that I suffer from obsessive compulsive disorder which causes depression and anxiety. I started on Prozac and within the first 6 weeks I felt a rush of relief. I no longer obsessed over the smallest things. I feel so much happier and my friends and family notice the difference big time!,piegirl
82,Prozac,Obsessive Compulsive Disorder,8.0,,"January 21, 2015",24,"I have been off Prozac for about 4 weeks now...after starting 2 years ago for a terrible depression/sadness/menopause. Wanted to take a Holiday to see what would happen. When on Prozac side effects like decrease sexual drive and slight weight gain, otherwise it put my menopause symptoms in control Decrease my hot flashes, helped my sadness, and gave relief for some mild OCD that I have had for years. Now when I am off the medicine I notice and increase in my OCD behaviors. Not concentrating as well at work. Sexual appetite is still not that great despite a wonderful patient husband (could still just be the menopause). Hot flashes have not really returned and I do not feel overwhelmingly sad. I will start Prozac tomorrow and see if it help with OCD.",Nord
83,Prozac,Obsessive Compulsive Disorder,9.0,,"October 22, 2014",81,Saved my life.,Raya1128
84,Prozac,Obsessive Compulsive Disorder,10.0,,"September 15, 2014",199,"I have been taking fluoxetine for about five months now. It has been a God send for me!  I am notoriously moody, possibly from BPD, and I do have Obsessive Compulsive Disorder where I have repetitive thoughts and the only way I can describe Prozac is that it feels like a vice grip on your brain that made you think about things over and over, releases completely.I feel so in control and wherever I put my focus, it stays without drifting back.I love this medication so much I will never leave it. The only complaint I have is that it does take forever to work. Forget about the 6 to 8 week rule, it will take a few months. And when it works, you will feel so amazing. For me, 60 mgs is ideal.",Southern Summer
85,Prozac,Obsessive Compulsive Disorder,10.0,,"June 14, 2014",144,I have Obessive compulsive disorder which causes a lot of anxiety and depression. Prozac has improved my quality of life I'm now a calm happy person with a great family of my own after being on Prozac a year. It really helps me focus on the real problems in my life and reaching a resolution instead of just feeling overwhelmed. It also greatly increases my energy and focus! It does not make me a zombie to emotion but it does prevent me from obsessing and lingering on how things make me feel. I still feel sad anger etc but in normal amounts like everyone else. Aside from very detailed dreams I've had no negative side effects. ,RayS45672
86,Prozac,Obsessive Compulsive Disorder,8.0,Taken for 2 to 5 years,"November 13, 2013",38,"I had my first major depressive episode in the late 80's when my first child was a toddler.  I was put on 20 mg of Prozac and felt like I got my life back.  However, it seemed to quit working and the next 20 years I went through almost every SSRI there is as well as a couple of common anti-anxiety drugs and none of them seemed to work very well.  About 4 years ago I went back on Prozac and this time I was taking 60 mg for ocd.  It has worked quite well but I think my body is getting used to it again.  My doctor wants me to consider changing to Lovox.  I had thought I had already tried that in the past but I have to do something because I feel like I am slipping into the abyss again.",DPenn
87,Prozac,Obsessive Compulsive Disorder,,,"October 11, 2013",128,"I have been taking 60mg of Prozac a day for the last 2 yrs. I was diagnosed with severe obsessive compulsive disorder (OCD)when I was 14. Have lived with OCD and anxiety ever since. I'm now 32 and for the last two years since taking Prozac I feel normal again. I have experienced no side effects but did quickly realize that alcohol does not mix. But, I'd rather give up alcohol than go back to a mental institution.",fishcake dai
88,Prozac,Obsessive Compulsive Disorder,10.0,Taken for 10 years or more,"August 15, 2013",106,"In 1990 (age 45) I had a nervous breakdown. I did a lot of strange things and ended up in a mental ward. Because of medication I was taking I developed a problem with simple walking. While at the hospital, I decided to re-teach myself to walk normally. I practiced all the time. I got it right by the time I left but I found it was now impossible to stop walking back and forth, I was pacing all the time. This went on at least a year. Then my doctor thought that PROZAC would possibly help me. After starting Prozac, 2 weeks into it, I sat down and no longer needed to pace.....aaaahhhhh...Peace at last. I continue to take it for depression, no side effects noticed.",venus8i8
89,Prozac,Obsessive Compulsive Disorder,9.0,Taken for less than 1 month,"August 9, 2012",125,"It was very disappointing when Zoloft and Ability didn't work for me, but Prozac began working within 4 to 5 days of taking. This medicine is working good for my OCD.",Anonymous
90,Prozac,Obsessive Compulsive Disorder,10.0,Taken for 1 to 6 months,"June 6, 2012",170,"Prozac has changed my life. I've suffered from Obsessive Compulsive Disorder, Anxiety, and Depression since I was in my pre-teens. I've tried Celexa and Paxil, but couldn't sleep at all while using them. I asked my physician to prescribe Prozac on the advice of a friend and I've had amazing results.  I started at 10 mg a day and increased to 20 mg a day after a month. I noticed that I was drowsy and unmotivated during the day when I took the medicine in the morning, so I switched to a bedtime dose and I haven't noticed any side effects since then. Prozac makes me calmer and much more in control of my fears. Others who didn't know I had gone on medication have noticed a positive change as well.  I've been on Prozac for 4 months.",Thank you Prozac
91,Prozac,Obsessive Compulsive Disorder,9.0,Taken for 2 to 5 years,"May 6, 2012",40,I love Prozac. It really helped with keeping me relaxed and in a decent mood and severely lessened my need to feed the OCD. For some reason my doctor recommended that I should try Zoloft instead. For the first two weeks on Zoloft I had diarrhea and now after six months on it I am starting to have moderate to severe pain in my legs. My leg muscles always feel as if they need a good stretch.,quetzacotl
92,Prozac,Obsessive Compulsive Disorder,8.0,,"March 9, 2012",82,"I took Prozac for 15 years and it worked great for obsessive compulsive disorder!  About 3 years ago I started noticing ""mania"" where I couldn't sleep or sit still to even eat.  After seeing several different doctors who treated it with medication for ADHD or Bi-polar it was determined that it was a side effect to Prozac so I stopped taking Prozac and all the mania stopped. Google shows two side effects to Prozac are 1) can't sit still and 2) can't sleep at night.  I wanted to share this unusual experience to help any others who may be experiencing mania and can't figure out why.  If you too are on Prozac then it may be a side effect but check with your doctor. ",Anonymous
93,Prozac,Obsessive Compulsive Disorder,10.0,,"February 2, 2012",185,"I've only been taking Prozac for a very short while but once it started to kick in, it was like waking up from a three year-long OCD/major depressive nightmare.  I feel like myself for the first time in forever.  I've tried other antidepressants and anti-anxiety medicines and nothing else has worked for me.  I'm already having less obsessive thoughts and compulsions, and the crippling sense of dread, anxiety and panic that accompanies my OCD is lifting. I just started it recently so I'm trying not to get my hopes up, but the preliminary results have been amazing.  I'm so grateful to feel like a human being again.",Anonymous
94,Prozac,Obsessive Compulsive Disorder,10.0,,"December 4, 2011",110,"I took Prozac for 6 years continually.  Started at 20mg/day and went up to 100mg/day at times.  My new doctor took me off of Prozac 2 years ago and put me on another medication.  I have gained 90 pounds in 2 years.  I am pulling out my hair again, intrusive thoughts.  I had no side effects from Prozac, no loss of sexual drive.  I LOVED (and still love) Prozac.  As a matter of fact I am going to the doctor tomorrow to see about getting back on Prozac!",Anonymous
95,Prozac,Obsessive Compulsive Disorder,5.0,,"November 15, 2011",26,I took this medicine for OCD. It helped however I put on 30 pounds in 2 months and that's with not changing my diet or exercise. I've been off it for 3 months and the scale hasn't moved at all. ,Anonymous
96,Prozac,Obsessive Compulsive Disorder,9.0,,"October 28, 2011",79,"Taking 10mg for OCD and social phobia with very satisfactory results. Only side effects I've experienced are loss of appetite and mild forgetfulness. I have not experienced a loss of sexual desire, in fact my libido has increased somewhat.",Anonymous
97,Prozac,Obsessive Compulsive Disorder,,,"October 7, 2011",46,"I've taken Prozac for 15 years, started when my husband was critically ill. It was a life saver, it stopped me from crying all the time. He passed away in 1998 and continued taking it for depression..was taking 40mg a day and yes it takes all sexual desire away. I remarried 6 years ago. I weened myself off of it because of that.  I developed Compulsive Overeating...that's all I thought about.  I gained a lot of weight so I'm back on it.  I could care less about sex.  I don't like going to sleep the dreams are vivid, but it does help me with my appetite. I don't think about food all the time like I did.",madougl
98,Prozac,Obsessive Compulsive Disorder,7.0,,"March 22, 2011",41,I have been taking Prozac for almost 2 yrs for my OCD and depression. The medicine has done wonders for my disability but has done nothing good for my relationship with my boyfriend. Prozac has taken my sex drive completely away. We try everything to bring it back but nothing works. I had no choice but to take myself off the medicine.,Anonymous
99,Prozac,Obsessive Compulsive Disorder,9.0,,"February 3, 2011",59,"I have been on Prozac for almost a year. Although my dose has been upped a couple of times, I feel like I have my life back. I know what quality of life is now.",Anonymous
100,Prozac,Obsessive Compulsive Disorder,8.0,,"December 28, 2010",44,"I've been on Prozac for about 4-5 months. My doctor started me on the lowest dosage (10mg) and we had to increase it. Currently, I've been on 40mg/day for about 5 weeks or so. It seems to be helping me with my OCD somewhat. I've noticed that I haven't been quite as bad as I used to be, but I'm also seeing a counselor, which is helping as well. I've heard that for OCD, you may need to go as high as 60-80mg for people with OCD. We may change my dosage in the future.",Anonymous
101,Prozac,Obsessive Compulsive Disorder,10.0,,"November 10, 2008",79,"I have been on Prozac for about 3 months and I must admit that it is a wonderful drug. It helps me control anger and anxiety issues that I have. My only complaint is that I seem to get tremors, but I could live with that.",OCD
102,Prozac,Obsessive Compulsive Disorder,10.0,,"July 29, 2008",33,It was good.,Mad Mooks
103,Prozac,Obsessive Compulsive Disorder,10.0,,"April 7, 2008",165,"I love it! It helped my anxiety, depression and obsessive compulsive disorder without a lot of side effects or even changing who I am.",Anonymous
