,drug,condition,rating,duration,review_date,upvotes,review,username
36,Yaz 28,Menstrual Disorders,10.0,,"November 5, 2016",10,Yasmin (drospirenone / ethinyl estradiol):I've only been on Yasmin for a week and I can't say I've even had any really noticeable side effects as I'm already an emotional person in general I haven't seen much change. I hear you get nauseous if you take it on an empty stomach so I take it every night after dinner so I don't run into that problem. My skin hasn't really changed. I've never really had break outs I just get a few pimples here and there and that's what I'm having now but that's what I expected with this changing my hormones. I think a lot of it has to do with tricking your mind into having the side effects. I haven't noticed any changes except I'm way more thirsty from like it is a  diuretic so I've drank tons of water and actually lost 6 pounds. I love it so far :),Deswise
37,Yaz 28,Menstrual Disorders,4.0,,"October 11, 2016",3,"Yaz (drospirenone / ethinyl estradiol):its been almost a year using Yaz and ever since i started it changed my cycle completely, the color of my period change to a dark brown color, my flow even changed. Cramping did not stop but infact made it worse. so a month back i wanted to skip my period so i did not take the white pills, after having skipped them  started spotting, a week later i got my period which lasted for longerthan usual for approximately two weeks. i then consulted my doctor who gave me pills to stop the flow but it still persisted even today im still spotting. im confused and very worried as i dont know what to do. if i stop taking Yaz i know that the bleeding will continue so question is how do i make it stop.",CassAndy
38,Yaz 28,Menstrual Disorders,10.0,,"October 10, 2016",1,Yaz (drospirenone / ethinyl estradiol):I've been on Yaz for about 3 years now as my period was very irregular and sometimes even got it twice a month...Yaz has absolutely changed my life it's been controlling my menstruations it's perfectly on time according to my pills I've never had any weird side effects and it's also helped with the cramping a bit but not as much as the control it offers over your period.!Very happy!!,megan5700
39,Yaz 28,Menstrual Disorders,2.0,,"September 30, 2016",2,"Yaz (drospirenone / ethinyl estradiol):I've been on Yaz for five months. My periods are regular, great! However, regularity isn't worth the side effects. I experience crippling cramps, nausea and vomiting, horrible break out/cystic acne around my period (I've never been acne prone), and insane mood swings... :( I don't taking it and it only got worse AH! Talk to your doctor and don't do it on your own! Also, can I just say I think it's ridiculous the medical system labels menstruation effects as 'disorders' - last time I checked it's pretty natural. Is my uterus really that diseased, doc'?",unhappy123456789
40,Yaz 28,Menstrual Disorders,1.0,Taken for 2 to 5 years,"September 24, 2016",1,"Yaz (drospirenone / ethinyl estradiol):Unfortunately, I did not have a good experience with Yaz. I am 20 years old, and have been suffering from Endometriosis for about 7 years. Yaz was the first medication that was used to treat my condition (for 2 years), and it actually increased my pain. The goal of the medication was to stop getting my periods completely (skipping the white sugar pills) so that I would avoid the painful cramps, and to slow down the growth of the uterine lining growing outside of my uterus. #1: I kept getting my period every month regardless of skipping the sugar pills. #2: I was SO nauseous while taking these pills. #3: The pain was CRAZY. It either did not help the pain whatsoever or made it worse. My advice: NO",breadcrumb2211
41,Yaz 28,Menstrual Disorders,9.0,Taken for 2 to 5 years,"September 20, 2016",1,"Gianvi (drospirenone / ethinyl estradiol):Was started on this because of extremely heavy bleeding and also birth control. I have nothing negative to say. It's been 2 years and have been enjoying it. Took about 2 months for the bleeding to slow down, and now its literally spotting to non existence with little to no cramps.",KLani
42,Yaz 28,Menstrual Disorders,,,"September 7, 2016",1,"Yaz (drospirenone / ethinyl estradiol):This pill has made me extremely sick, the nausea it brings me is awful, and had made me lose 10 pounds in just a week from making me sick. It has made me vomit quite often. I used this to get rid of cramping and it brought me sickness instead.",Anonymous4223
43,Yaz 28,Menstrual Disorders,2.0,Taken for 1 to 6 months,"July 17, 2016",1,Yaz (drospirenone / ethinyl estradiol):I was taking this pill for pcos..i was fine for the 1st 24 days...after the 4 days of not taking it i then resumed and i started bleeding but the pain that has come with it is unbearable im now going onto my 5th day of intense pain..i too have taking myself off this pill and i hope the pain subsides soon.,Anonymous
44,Yaz 28,Menstrual Disorders,3.0,Taken for 1 to 6 months,"June 19, 2016",0,"Yaz (drospirenone / ethinyl estradiol):I was taking this pill for PCOS and heavy periods, and also birth control. While it helped my period become regular (which is very, very nice), and I guess lightened my period (but not by much), the side effects are just too much. I've never had such intense breast pain in my life (I even tested for pregnancy to be sure I wasn't missing something), acne that I never had even as a teenager has been plaguing me, and my mood swings are awful. I switch from happy to angry and depressed within minutes, which isn't like me at all. I'm moving off this pill thank the Lord.",NickyKM
45,Yaz 28,Menstrual Disorders,10.0,,"June 10, 2016",5,"Ocella (drospirenone / ethinyl estradiol):I must say Ocella has been nothing short of a miracle for me. In just 2 months my facial hair has deminished. I went from shaving,waxing, plucking EVERYDAY to not seeing any hairs on my face for 5 days now. My very heavy painful periods are already normal and I have lost 11 lbs. I have had no side effects. I hope this continues for the long term.",CarrieJ83
46,Yaz 28,Menstrual Disorders,1.0,,"June 8, 2016",3,Ocella (drospirenone / ethinyl estradiol):I am currently taking ocella and ever since I've been taking ocella my cramps have been worse and my mistral cycles are heavy and long,Vanessaofthecruz
47,Yaz 28,Menstrual Disorders,9.0,,"May 19, 2016",8,"Gianvi (drospirenone / ethinyl estradiol):The pill worked wonders for me, after being diagnosed with PCOS when I was 17. I was overweight, pimply, and struggled with chronic depression. I was originally prescribed Yaz but then began taking the generic, Gianvi, because of insurance reasons. I personally couldn't tell any difference between the two. This pill cleared up my acne, improved my depression, gave me light, short bleeds every month on the clock (as opposed to heavy periods every 4-6 months lasting 10 days to two weeks!) and it helped me lose a lot of weight over the course of a year. Unfortunately, I haven't been taking it the past couple years, and it's been rough. I greatly look forward to going back on it soon.",Sandy_beach
48,Yaz 28,Menstrual Disorders,1.0,,"May 12, 2016",0,"Gianvi (drospirenone / ethinyl estradiol):I started taking Gianvi when my pharmacy switched to it from the yaz knockoff I had been taking. My periods were out of control. Some would be two weeks, I had more periods days than non bleeding days over the course of two months which made me EXAUSTED. I gained about 30 pounds as well during the course of that time, despite walking an average 13,000 steps a day. And no. That was not muscle. I can no longer fit into most of my professional clothes, and have actually ripped and over stretched a number of items.",Brucethegirl
49,Yaz 28,Menstrual Disorders,3.0,,"May 5, 2016",4,"Yasmin (drospirenone / ethinyl estradiol):I began taking Yasmin when it first came out i.e. around 1999 or so for irregular periods. My PCP recommended birth control, and after researching them all I chose Yasmin as it touted the fact that the Progestin (drospirenone) contained a diuretic. After a few months I started having anxiety, insomnia, and eventually horrible depression. On the upside, because the drospirenone is an anti-androgenic progestin, my hair grew incredibly long and thick and stupid vanity kept me on it. On balance, I would not suggest this pill as a form of birth control for anyone. I eventually gained 15 lbs after a couple of years of use, and was an emotional wreck which impacted my career. My hormones never really returned to normal after stopping it either.",My Experience
50,Yaz 28,Menstrual Disorders,9.0,,"May 2, 2016",7,"Yaz (drospirenone / ethinyl estradiol):I have very, very heavy periods and PCOS (high testosterone, high androgens, etc).  I started out on Loestrin 1/20 and lost about 20 pounds in one month.  Yay!  After a while, it became less effective and my heavier periods were coming back after about a year.Come in Loryna (generic Yaz) and I'm back in heaven again.  It's been around a year, and it's less effective. :(  The heavy periods, dizziness, etc are coming back.  I'm not sure what else to try... I'm not sure why they work at first then increasingly become less effective.  Either way, I love the pill.  I'm single and the almost non-existent libido is a plus!  I can focus on important things than sex always on my mind.  I highly recommend it.  Yeah, it also causes dryness there.",B_Tanya
51,Yaz 28,Menstrual Disorders,1.0,Taken for 6 months to 1 year,"March 9, 2016",2,"Loryna (drospirenone / ethinyl estradiol):I would recommend this to anyone wanting to control hormones. I was very depressed, anxious, gained a lot of weight due to constant cravings. It's good for acne, my face was clear as it was with Yaz. I had to get my insurance to prior authorize this only to have bad side effects. Was on this for approx 8 months and gained 20 pounds from not wanting to leave the couch and bad depression/anxiety. I thought it was something else until I stopped taking it. I can't take generics, always a problem. I'm going back on Yaz, was never an issue for me, even lost weight.",Pl24
52,Yaz 28,Menstrual Disorders,1.0,Taken for 6 months to 1 year,"March 8, 2016",4,"Loryna (drospirenone / ethinyl estradiol):I'm 52 with heavy long lasting periods.  I was hoping for alot more results. I took it 7 mo given it a fair try. Unfortunately, it wasn't the answer.  I have bad cramps its heavy, blood clots still.  No sex drive, fatigue,  it made me crazy and I drove my husband away.  I do not recommend it.",Danika Rose Patrick
53,Yaz 28,Menstrual Disorders,,,"February 24, 2016",6,"Yasmin (drospirenone / ethinyl estradiol):Well one friend of mine took this pill for birth control and she almost died. For six months she walked around the house holding on to the walls, because she was so dizzy and weak.She almost never came out of it, until she tried an alternative method which released her from the terrible state she was in, due to this pill.Please stay away from this pill.Another friend of mine took Yasmin for irregular cycles before her wedding day, and her mood swung so much, she came to her wedding, depressed and extremely irratated.",Taliana
54,Yaz 28,Menstrual Disorders,9.0,Taken for 5 to 10 years,"January 6, 2016",1,"Loryna (drospirenone / ethinyl estradiol):Age 15 before pill, now 21. Pill was originally called Gianvi. Before starting, periods were painful and heavy. I was unable to wear tampons, and had to change pads almost every hour. I had moderate acne, the type that never ""turned white"". Large cyst-like zits on my forehead. Back was broken out.This pill completely cleared my skin, and made periods manageable. Instead of bleeding for an entire week, I would bleed for a few days, and not as heavily. I got my period at the same time every month. Unfortunately, I did loose 2 cup sizes.I began a relationship with my boyfriend shortly after starting the pill and have never gotten pregnant.Recently stopped the pill to try the patch, because I am forgetful. Big mistake.",Marisammm
55,Yaz 28,Menstrual Disorders,9.0,Taken for 2 to 5 years,"December 2, 2015",3,"Ocella (drospirenone / ethinyl estradiol):Overall no major issues with Ocella and I've been on it for over two years. I started taking it due to terrible heavy periods that caused nausea and migraines. My periods are much lighter now and my face rarely breaks out. I still get migraines and cramps, but not as bad as before. I've also avoided  pregnancy and I never had issues with mood swings.",Anonymous
56,Yaz 28,Menstrual Disorders,10.0,Taken for 5 to 10 years,"November 27, 2015",9,"Yaz (drospirenone / ethinyl estradiol):Before I started yaz, my periods were ridiculously heavy and the cramps that came with them were even more horrific. I've been on yaz for 8 years now, and I still love it! I have not had a cramp in 8 years and my period is REGULAR! My only downside is this: Several years ago studies started to show a slight increase in women getting gallbladder disease. I started yaz in December 2007 at the age of 21. By march (approx 3 mo. later), I had severe pain in my right side just under my breast. Turns out, I needed it (my gallbladder) removed. I am healthy and have never even been sick in my Life.  I'm convinced it was due to to the yaz, as nothing else in my life was different. Easy surgery/recovery though, and no problems since! Just watch out!",Positive and negative
57,Yaz 28,Menstrual Disorders,6.0,Taken for 2 to 5 years,"November 8, 2015",0,"Yaz (drospirenone / ethinyl estradiol):I've been taking Loryna (generic for Yaz) for about two years now. I'll preface this review by saying I'm turning 27 and I've been on some form of BC since age 20. I had surgery 12/2012 for ovarian cysts, and ever since have been struggling with weight gain, pelvic bloating, and cramping that gets worse with each passing month. When I first tried this medication, I had little to no effects. But after about 4-6 months, I gained about 30 pounds. After two years, I'm up to 40 extra pounds with no reason for it. I'm constantly bloated, hungry and moody. Not to mention my libido is nonexisstent and I never want to be touched by my fiance. I'm getting off this horrible medication and going on Sprintec this weekend.",magyar_boheme
58,Yaz 28,Menstrual Disorders,9.0,,"November 3, 2015",1,"Loryna (drospirenone / ethinyl estradiol):I love Loryna! I've always had extremely heavy periods, and the pain was so overbearing for years. I used to go a week to two weeks. I had them much more so than the average period... like I would go 10 days after I stopped bleeding and then start for another week or so again. I've tried several different pills and they've either made no difference or managed to mess me up more. Loryna is wonderful though! my doctor told me the first month may not show improvement, which was true.. but she said after the second month it should work and it did! my periods are so light, I honestly feel like I spot throughout the whole thing. AND they only last 6 days at most which is a huge improvement for me. I rarely cramp and when I do it's nothing.. :)",sav123097
59,Yaz 28,Menstrual Disorders,1.0,Taken for 1 to 6 months,"September 30, 2015",3,Yaz (drospirenone / ethinyl estradiol):Began yaz on the 20th of August because I was diagnosed with endometriosis and it caused me to have a 23 day period. 3 days after my period came again for 9 days and it was extremely painful worse than ever before and very heavy. I stopped using yaz at that point and now 6 days after here I am again with a next period heavy and painful. Wish I had never used this drug. Worst experience ever. Hoping to go back to a normal cycle soon because this is uncomfortable.,annoyeduserofyaz
60,Yaz 28,Menstrual Disorders,4.0,,"September 29, 2015",0,"Yasmin (drospirenone / ethinyl estradiol):I started taking this pill because of extremely heavy, painful and irregular periods. The first six months were great, I had very light bleeding, no cramps and my periods were very regular. Around my sixth month I got terrible acne, I only ever had a pimple here and there and I got cystic acne around my chin and cheeks. Now forward to the ninth month, I've been feeling very depressed, cry all the time and just feel like a mess. I also suffer from severe nausea. I'm ending this packet, and then I'm switching to a much lighter pill which will hopefully help me.",Anonymous71662672&292
61,Yaz 28,Menstrual Disorders,8.0,Taken for 1 to 6 months,"August 17, 2015",8,"Yaz (drospirenone / ethinyl estradiol):I have been on Yaz for about 4 months now. I started taking it to regulate my periods, as they were very heavy and irregular. Yaz helped 100% with that issue. Now I know when my period will arrive and it only lasts about 4 days. Yaz has also cleared up my acne. Before taking it I had fairly severe acne (for a 36 year old) and since taking Yaz I don't have severe breakouts, just one or two pimples here and there. If I had to list my negative experiences since taking Yaz it would be my irritability. Small things annoy me...like my husband chewing his cereal. It's not bad enough that I go into a rage or anything, but it can be annoying. Also, the outside edges of my breasts are sore. Feels like when I was nursing! So far, a positive experience",safford5
62,Yaz 28,Menstrual Disorders,2.0,,"July 25, 2015",2,"Yaz (drospirenone / ethinyl estradiol):I've been on Yaz for three months.  I started taking it because I told my doctor that I had really bad moodiness during PMS.  Ha, it's gotten worse!  I don't start my period till the last day of inactive pills.  My cramps feel like I'm 15 again (I'm 36) and my mood swings have worsened.  Barely any sex drive.  I'm going back to Ortho-Tricyclen (Trinessa).",CJ1321
63,Yaz 28,Menstrual Disorders,4.0,,"June 11, 2015",2,"Yaz (drospirenone / ethinyl estradiol):I started Yaz a few months ago and so far the results are unimpressive. Primarily I went on the pill the regulate my extremely heavy and long periods as a bonus I was using it as a contraceptive. Contraceptive wise it was a dream, but it did absolutely nothing for my periods, the pain was still there and instead of being 8 days they are now 10 or 11. I also got horrible mood swings, and I suffer from depression so I really didn't think I would get any 'lower' but on this pill I really have. My emotions are just all over the place.  If you are going to go on this pill I would definitely do proper research.  I have decided to stop taking it.",lpet76
64,Yaz 28,Menstrual Disorders,5.0,,"May 23, 2015",3,"Yasmin (drospirenone / ethinyl estradiol):My Obgyn recommended me to take Yasmin pills to regulate my hormones. This was after I had a surgery to remove polyps formed on my uterine lining. I have been on this for 1 year now and lately, I start to have cyst on my skin. I had one on my tummy, another on my thigh and now there is one more under my bum. This cyst is a small red bump on the skin which is painful.On one hand, I minimized the risk of uterine polyps recurring but on the other hand, I get skin cysts.",Anonymous
65,Yaz 28,Menstrual Disorders,8.0,Taken for 1 to 6 months,"May 22, 2015",15,"Yasmin (drospirenone / ethinyl estradiol):I have PCOS and my gynecologist recommended that I take Yaz or Ocella. I took Ocella about a week, but after feeling numbness in my arm I decided to look up reviews on Yasmin, Yaz, and Ocella. I was horrified. I stopped Ocella and my PCOS started to get worse so I searched for medications that were good to treat PCOS. Yasmin had awesome reviews from people with PCOS (not so much for those with out it). I read allot of reviews and found that most people can tell a difference btw Yasmin and Ocella. I don't have insurance, but to me the price is worth it! I've lost weight, have my period again which makes me feel normal, my breast have only slightly gotten larger but don't hurt, and my skin only breaks out when I'm on my period.",Anonymous
66,Yaz 28,Menstrual Disorders,10.0,Taken for 1 to 6 months,"April 12, 2015",7,"Yaz (drospirenone / ethinyl estradiol):My dermatologist recommended Yaz for my acne. However I also have horrible menstrual cycles and let me tell you, you cannot go wrong with Yaz. I hardly felt any pain. My acne was basically gone also. Now all I have is some dark spots here and there",starshanelle
67,Yaz 28,Menstrual Disorders,4.0,,"March 11, 2015",3,"Gianvi (drospirenone / ethinyl estradiol):I never got pregnant on this stuff so it works well for that. I started taking this for my debilitating cramps and heavy periods and it really didn't do much. Plus, I gained 15 lbs after starting this and had absolutely ZERO sex drive. I didn't even want my fiancé to touch me. I found myself being completely moody. It helped with acne except when I was about to start my period, I broke out like crazy. Now that I am off my sex drive is back to normal and my periods haven't really changed.",Jillian Barnes
68,Yaz 28,Menstrual Disorders,10.0,Taken for 5 to 10 years,"November 30, 2014",4,"Ocella (drospirenone / ethinyl estradiol):When I first started taking birth control I was only 13, I started it because I used to have two week long heavy & horrific periods every two weeks! I first started out on Yasmin, but later was switched to Ocella for insurance reasons. I'm now almost 19, have been on birth control for 5+ years, and I NEVER want to go back. It helps keep my skin clearer & softer (I only break out about a week before my period now) and my periods are much better now! I used to have issues with my period ending when I started a new pack, but eventually my body got used to it & now my periods are light with little/no cramps and only last around 3 days! I seriously could not be happier",FinallyHappy
69,Yaz 28,Menstrual Disorders,10.0,,"August 22, 2014",52,"Yasmin (drospirenone / ethinyl estradiol):This is the ONLY birth control pill that has ever worked well with my system. No weight gain, no hair loss, no mood swings, in fact, my periods used to be so irregular that's I'd have terrible PMS and now I'm only cranky pants for a day or so. It helped clear my skin, regulate my cycle, helped me maintain my weight, and I just love it.",Lenabenas21
70,Yaz 28,Menstrual Disorders,8.0,Taken for 2 to 5 years,"August 7, 2014",1,"Gianvi (drospirenone / ethinyl estradiol):I started this medicine mainly to regulate my period and help with cramps (it was initially very helpful with the cramps but got less effective over several years). It also helped clear up my skin. I had pretty positive results with Gianvi all around. Unfortunately I was switched to Vestura, which seems the same but it is really hard to swallow the pills. Their edges are sharper than Gianvi.",Emily V
71,Yaz 28,Menstrual Disorders,7.0,,"May 29, 2014",0,"Ocella (drospirenone / ethinyl estradiol):I have been on this for over a year. I was on Sydea previously for a year. This birth control works great. There are no cramps, it's a lighter flow, I'm more emotionally stable, it's shorter, and I only had one scare because I forgot to take it for two days in a row and my period came late. The only downside I've noticed is that I have almost NO sex drive now. But my insurance covers it all until I'm no longer considered a dependent/full time student.",GloriaAnne
72,Yaz 28,Menstrual Disorders,6.0,,"April 10, 2014",10,"Gianvi (drospirenone / ethinyl estradiol):I started taking birth control to treat painful periods, and this did get rid of the super painful cramps and I did not get pregnant while taking it, so it was effective. However while on this my anxiety became worse than it had ever been before and my sex drive completely vanished. I noticed my sex drive return about 1 month after I discontinued Gianvi.",Mehh
73,Yaz 28,Menstrual Disorders,8.0,Taken for 2 to 5 years,"January 4, 2014",10,"Yaz (drospirenone / ethinyl estradiol):I have been on Yaz for 2 and a half years and it's been the best form of contraceptive medication for me. I have tried other contraceptive pills and have had all kinds of bad side effects, but once I started Yaz I was fine. Originally I started using it as a form of contraception, I still do but it has also helped with my severe menstrual cramps and endometriosis. I can have my period every 3 months without a problem and I haven't experienced any side effects, pregnancy scares, bloating or acne on it so overall it's been great. ",coppola22
74,Yaz 28,Menstrual Disorders,7.0,Taken for 1 to 6 months,"August 14, 2013",3,"Ocella (drospirenone / ethinyl estradiol):I used to take Sprintec to regulate my period and help with cramps which worked for a while but after 2 years my periods were back to being miserable. The first week or two on Ocella were tough, I was very nauseous, had stomach cramps and headaches but it all went away after the second week. The first day of my period the first 2 months was incredible! I didn't even feel like I had a period, but by day 2 my awful cramps were back. I spoke to my Gyno and we've decided I can take Ocella continuously. Next week is the first placebo week that I'm skipping and I will only have 3-4 periods a year. Besides the first couple of weeks I haven't had any other side effects.",Mary Ann f
