,drug,condition,rating,duration,review_date,upvotes,review,username
0,Yaz 28,Menstrual Disorders,10.0,Taken for 1 to 2 years,"November 29, 2021",0,"I’ve had nothing but a great experience with this birth control. Not only is it an effective birth control but it has helped keep my endometriosis at bay. Another plus is I haven’t had a real period since starting it, I’ve had a few days of light spotting here and there but nothing major. Fabulous birth control!",JOs
1,Yaz 28,Menstrual Disorders,5.0,Taken for less than 1 month,"May 16, 2020",0,I have been on this pill for a few days now. I switched from Lo Loestrin Fe because it was making me break out. I went on accutane awhile go. So getting acne again was the worst thing ever for me because I thought my fight was over. I got off for a month then started this new drug. Everything is going good expect that I am very nauseous. I even woke up last night throwing up. I hope this goes away very fast because  don’t know if I can keep doing this.,syd
2,Yaz 28,Menstrual Disorders,9.0,Taken for 1 to 6 months,"November 29, 2019",1,"I started taking generic Yaz for anxiety (including social anxiety), acne, heavy bleeding, and depression. I'm in the middle of month three and here are the results- slight positive effect on acne, reduces bleeding but I'm still getting a seven day period (still better than it was!), and has helped A LOT with anxiety/depression. After taking Yaz for a few days my anxiety completely disappeared. I think my anxiety was caused by hormonal imbalance, and Yaz corrects this. There was a one week period where I didn't have Yaz and I slipped into a depression. Started back on the next pack and the depression disappeared.        Lower libido and pretty bad heartburn are the only side effects I have noticed. But I can live with this since my mental/emotional state is so much improved and so stable.        Overall, I would definitely recommend this birth control pill for treating anxiety.",Leyla
3,Yaz 28,Menstrual Disorders,1.0,Taken for less than 1 month,"July 2, 2018",3,"My periods have gotten longer over the last year. My doctor suggested mirena or the pill. I figured it would help balance my hormones and shorten my 7-8 day periods.I started taking Gianvi and not long after taking it, I felt severely depressed. I had nausea, vomiting, fatigue, was lightheaded, stomach pains, and heavy bleeding w/ blood clots. I bled through clothes and constantly had to use the bathroom. After 10 days of bleeding along the other miserable symptoms, I called my Gyn. She told me to go to the ER if I felt lightheaded. I decided to go and discovered I had small fibroids. Even though the ER doc told me to finish the pack, I decided not to (I was 15 days in). I did some research on Yaz and found a lot of women suffering with the same symptoms. It’s crazy that taking a pill for only 15 day can wreak such havoc on your body. I’m going on day 17 of bleeding and it’s finally getting lighter. Worst experience ever!",Sunny
4,Yaz 28,Menstrual Disorders,3.0,Taken for 6 months to 1 year,"April 11, 2018",0,"Taking Yaz  for endometriosis for 6 months, it caused difficulties breathing and sharp retrosternal pain. Difficulties sleeping as well as pain during defecation.",NerdyNix
5,Yaz 28,Menstrual Disorders,10.0,Taken for 6 months to 1 year,"March 9, 2018",3,"Gianvi (drospirenone / ethinyl estradiol):I have been on several pills over the past year and a half. Gianvi has been amazing for me! The first month, my period was light and my cramps were way less. I typically had 2 days of very heavy cramping and heavy bleeding for 3-5 days. After the first month, the periods kept getting lighter and lighter. I’m at month 6 now and haven’t had a period in 2 months! The first month I broke out a bit, but now my skin is completely clear! I love this pill and hope they never stop making it. If you’re just starting Gianvi, I suggest giving it a few months before throwing in the towel. I’m so glad I did.",MamaB
6,Yaz 28,Menstrual Disorders,7.0,Taken for 1 to 2 years,"February 23, 2018",5,"Loryna (drospirenone / ethinyl estradiol):I’ve been on this  since late 2016. The doctor told me I can skip placebo weeks for up to 3 months. So I did that and started spotting so I took it down to 2 months. Things were ok for a year but coming into 2018 I started spotting in between periods. Like non stop pink discharge. And I don’t know if I’ve always had them but I noticed tiny spider veins in my leg. I’m tan so you can barely see them but I notice them. I went to the doctor and told him my issues and he said to keep doing what I’m doing. So I said hell no, transferred all my records to an OBGYN office and hopefully getting an IUD on Monday. But I’ve heard horrible side effects on this pill. It has both estrogen and progesterone which can really cause issues but here’s what I experienced: weight loss, clearer skin, much higher sex drive. Literally the only issue is my spotting and the one spider vein. I’m so sorry for everyone who has apparently been through hell on this. I had great side effects",Berry
7,Yaz 28,Menstrual Disorders,7.0,,"January 21, 2018",2,"Loryna (drospirenone / ethinyl estradiol):The good: I started taking Loryna about 6 weeks ago. I have endometriosis. I have since had one menstrual cycle that was normal and virtually painless (yay!) Concerns: Anyone experienced dizziness or slight vertigo more easily after starting this pill? I have been on a few different BC pills for 20 years, but I don't quite remember this feeling. Looking down at something I'm reading or doing downward dog pose repeatedly or for longer durations makes me feel dizzy and nauseous. My breasts are tender and sore (that took 5 weeks to kick in!) and my face is breaking out all of a sudden. If you've taken this and had dizziness/nausea easily, please let me know what you did to help stop it! Or whether I should stop the pill?",MtnClimber
8,Yaz 28,Menstrual Disorders,10.0,,"January 14, 2018",8,"Loryna (drospirenone / ethinyl estradiol):I have been on this pill for over a year now. I have not had any negative side effects. No cramping or spotting or any weight gain. My bra size went from a 32B to a 32D, can't complain about that. I have endometriosis, and my periods without this pill were a painful nightmare. I was fainting due to the severity of my cramps, I was also vomiting due to the pain. I became anemic due to it too, but since going on this pill it is a breeze. I usually skip the inactive pills and just not have a period, but when I do it is about 3-4 days long with moderate cramping. Not as bad as before. I have no complaints or problems.",MayBrynn
9,Yaz 28,Menstrual Disorders,9.0,,"December 13, 2017",1,"Yasmin (drospirenone / ethinyl estradiol):I was prescribed Yasmin for my extremely painful periods and adult acne. I can honestly say that in terms of my period, Yasmin has been life changing. Before I was crippled and taking a combination of 50 pain relief tablets over a 5 day period, waking up in the night in pain and also struggling to work. Now I have basically no period pain at all and have to take zero pain relief medication...such a difference! My period was always pretty light but now it’s almost nothing! First month I had lots of break through bleeding but now nothing. In terms of my skin, I can definitely see a big improvement. It’s working much slower for his however (I’ve been on it 3 months). Otherwise no real side effects- my mood is good and no weight loss or gain.",Lily91
10,Yaz 28,Menstrual Disorders,,Taken for 1 to 6 months,"December 10, 2017",2,"Yaz (drospirenone / ethinyl estradiol):I am 23 year old lean PCOS girl (high dheas and lh/fish ratio off - no cysts). I started to take this pill in order to help my PCOS symptoms ( depression, anxiety, fatigue, hirsutism, hair loss, irregular cycles). I knew it would take around 3 months for my body to get used to this pill and I ended up taking it for 4. I really wanted this pill to work for me. However, the first 2-3 months were an extreme emotional roller coaster. My appetite increased dramatically and I gained a few pounds. I felt slightly better in the 3rd month, however my mood went downwards in the 4th month. I had extreme mood swings and would feel depressed, emotional like I had bad PMS two weeks out of the month. Pills can affect your thyroid! Be cautious!",PcosGirl23
11,Yaz 28,Menstrual Disorders,2.0,,"November 15, 2017",1,"Yasmin (drospirenone / ethinyl estradiol):Recommended to me by gynae to manage pain while on waiting list for excision surgery for my endometriosis. pros:Made skin & hair absolutely beautiful, cleared spots up & solved oily skin problem. Body hair  grew in much slower/ thinner! Only had a period every 3 months - nice break from pain (The period I had was hellish tho ): ) cons: Severely amplified pre-existing mental health problems. I don't want to scare anyone but yeah it was so bad I had to come off it. I wish I was able to stay on it longer. So if like me you already have mental health stuff going on I urge u to take that into consideration when trying this medication. I'm not saying don't take it, just make sure u have a support network in place to help you through. Be safe and look after yourselves",HanR
12,Yaz 28,Menstrual Disorders,,Taken for 1 to 2 years,"November 13, 2017",2,"Loryna (drospirenone / ethinyl estradiol):I LOVE  LORYNAThis is the only birth control where I feel great & it regulates my periods on time everytime. The flow is always super light!I will say that I gained a good amount of weight on this pill, but who doesn't gain wait on birth control in general??",MimiCita
13,Yaz 28,Menstrual Disorders,1.0,Taken for 1 to 6 months,"October 3, 2017",2,"Vestura (drospirenone / ethinyl estradiol):I got switched to this from yaz. The worst month of my life. Terrible mood swings, anxiety, not to mention I bled through the entire pack. I don't recommend this to anyone",Anonymous
14,Yaz 28,Menstrual Disorders,7.0,,"September 28, 2017",5,"Yasmin (drospirenone / ethinyl estradiol):I only gave this pill a 7 because it hasn't done WONDERS for me (I was hoping my skin would become flawless I guess) but I have lost about 4-5lbs since I started taking this pill. I just started my third pack 4days ago and the weight is still dropping. Not to say that will continue, I'm sure my hormones will level out in a month or two, but I am thankful I'm not gaining weight. I don't exercise anymore but I am semi-conscience about what I eat. I'm a firm believer that everybody's body is completely different and can and will react differently to different medications. I was put on this for PCOS bc my testosterone was high so it is supposed to help with that and I believe it has even as reluctant as I was to start taking BC again.",Sidcc
15,Yaz 28,Menstrual Disorders,,Taken for 1 to 6 months,"September 26, 2017",3,Loryna (drospirenone / ethinyl estradiol):I had such a horrible experience with this Birth control. The first week was fine. Week 2 to month 2 I bled the entire time and it wasn't break through bleeding it was full on period for two months. As soon as I stopped it within 4 days I completely stopped bleeding. I only give it two stars because it helped my light acne. This birth control is horrible for trying to regulate or stop periods.,CRivs85
16,Yaz 28,Menstrual Disorders,7.0,,"September 20, 2017",5,"Loryna (drospirenone / ethinyl estradiol):I switched from lo loestrin Fe, because it made me stop having periods and made me nervous that I was pregnant because I didn't get my period. I switched to loryna and my periods came back and weren't irregular anymore, fairly light and less cramps. I have barely any acne besides some occasional acne on my backside. I've been having mood swings, low and high periods that last a week or so. It started affecting my relationship in a negative way and I've had more anxiety attacks than I did without it. Didn't make me gain weight at all, although it did make my depression a bit worse. I recommend this birth control but advise to be careful and if you notice it taking a toll on your mental health then switch. I've haven't switched yet",Natralala
17,Yaz 28,Menstrual Disorders,,,"August 15, 2017",0,I started using daylette 2 weeks ago because I didn't have a normal cycle.So this really helps your periods to be lighter.Everything's great.Except for blood  and my libido is low.,Spica27
18,Yaz 28,Menstrual Disorders,,Taken for less than 1 month,"July 24, 2017",3,"Yasmin (drospirenone / ethinyl estradiol):I am suffering from irregular menstrual cycle, heavy flow, intolerable cramps and mood swings. I went to a doctor and she found that I had myoma in my uterus; it has been causing the heavy flow and pain. She put me on Yasmin saying that it will ease the pain, decrease my flow and make the cycle regular. The first pack made me so miserable because I couldn't stopped bleeding, I bled for 29 days straight with heavy flow, like it was the first day of my period. The doctor made me stop taking it because I was bleeding too much, she said that my body is reacting too much to the pill. Other than this, decreased appetite, better mood, bigger boobs. Couldn't see a difference in my acne.",Samdarko
19,Yaz 28,Menstrual Disorders,2.0,,"July 12, 2017",1,"Yaz (drospirenone / ethinyl estradiol):I was on Yaz for about 4 months. In the beginning, it was terrible.  I've never been so depressed, moody. I almost lost my fiancé because of it.  Even now, while I'm still on it, I cry often and feel depressed and insecure.  However, it didn't make me gain weight, which was my issue with other birth controls in the past. I just switched today to Reclepsin, so we'll see how it goes, but the SEVERITY of my depression on Yaz can't be stressed enough. It killed me! (And caused me to bleed out on my wedding, honeymoon, and for two weeks after... so much for sex, right?)",lovelylu12
20,Yaz 28,Menstrual Disorders,10.0,,"July 12, 2017",1,"Gianvi (drospirenone / ethinyl estradiol):I've been taking Gianvi for about three years, and have never experienced any negative side effects. I've noticed my periods have gradually become shorter and lighter, decreasing from about 4-5 constant days of heavy/moderate bleeding to 2-3 days of moderate bleeding and another day of light spotting. Additionally, prior to taking Gianvi, my periods were fairly painful for the first two days, but this medication seems to have helped dramatically with my cramping. Now I typically only experience one day of cramping, and sometimes it's so light that I don't need to take painkillers. Finally, I always know the exact day my period will begin. Gianvi has made my periods so much more manageable, and as an added bonus, my acne cleared up too!",Anonymous
21,Yaz 28,Menstrual Disorders,8.0,Taken for 1 to 2 years,"July 2, 2017",4,"Loryna (drospirenone / ethinyl estradiol):I've been taking BC pills for nearly 20 years to help regulate my cycles and ease the horrible cramping and mood swings. My insurance stopped covering the pill I was on previously, so I switched to Loryna. I liked the idea of only having 4 placebo pills compared with the 7 in my last brand. Pros of this pill? My sex drive was through the roof, and it felt like a love-potion for me and my guy ",Brown-Eyed Girl
22,Yaz 28,Menstrual Disorders,1.0,Taken for 1 to 6 months,"June 27, 2017",7,"Yasmin (drospirenone / ethinyl estradiol):I advise you all, to not take this pill. It is an absolute nightmare. If you wish is to cry all day long, get angry at everyone, have other people mad at you for being emotional, not be able to do anything with your life, and generally if you are wishing for misery, then this is the pill for you. But I would like to take revenge against the people who invented this pill. They knew if they up the estrogen dose on the pill their patients would need to be prescribed antidepressants which - CHA-CHING!! - is a plus for them as their eyeballs look like this ($) ($). This goes for Loestrin Fe too, which I am on now.",BaDumTss
23,Yaz 28,Menstrual Disorders,,Taken for less than 1 month,"June 13, 2017",2,Loryna (drospirenone / ethinyl estradiol):This medicine is by far the worst literally. Instead of help it makes me feel really tired a lot of nausea and vomiting,Anonymous
24,Yaz 28,Menstrual Disorders,1.0,,"June 1, 2017",3,"Loryna (drospirenone / ethinyl estradiol):This medicine is a nightmare. On it for 7 years after the second year my sex drive vanished and it became a chore. My cycle was normal.  My spouse and I  were fighting over the most ridiculous things. I was blaming him even when it was totally my fault. The moods affected my work, I lost a chance at a promotion, which I blamed my husband  for. Now he convinced me to go to marriage counselling and after a few weeks she started talking about medicine . I did not want to take any mood medicine. I was advised to see my gynecologist about stopping the Yaz / Loreyna . After two weeks of being off it I was feeling great  I was happy about things again. I was not having arguments . I even felt feelings I Had not in years. I feel normal again. Avoid this ",Meganb44
25,Yaz 28,Menstrual Disorders,1.0,Taken for 1 to 6 months,"April 12, 2017",4,"Loryna (drospirenone / ethinyl estradiol):DO NOT TAKE THIS MEDICINE. Seriously, just don't. It's poison. I have PCOS and was prescribed Yaz back in high school (I am 24 now, so 8+ years later). Yaz made me an emotional disaster, even having suicidal thoughts and fits of rage. I went on Lo-Estrin & had great results, before discontinuing after 5 years. Fast forward to now, and my new doctor prescribed me this. It was worse than Yaz. I would cry for hours at a time. I was so anxious and irritable. I was absolutely awful to my partner. I wouldn't recommend this to my worst enemy, 0/10",Sarah T.
26,Yaz 28,Menstrual Disorders,,Taken for 1 to 6 months,"February 18, 2017",3,"Gianvi (drospirenone / ethinyl estradiol):I took yaz when I was 18-20 with no issues at all. I'm now 27 and I was recently diagnosed with pcos, so I was prescribed yaz / gianvi to help with the side effects. I don't really have an irregular period, but more of the hormonal side effects. I took gianvi for one month with no weight gain, no nausea, but I had TERRIBLE migraines. It was truly debilitating. One was for at least 5 days. It got worse every time I took the pill, because I wasn't sure they were related until the 4th night of the migraine. I stopped taking it and the migraine stopped. Also, I had no sex drive for the entire month of taking this pill and really bad hot flashes and vag dryness. Pros: I had really clear skin & didn't get preg",Anonymous
27,Yaz 28,Menstrual Disorders,7.0,,"February 8, 2017",4,"Ocella (drospirenone / ethinyl estradiol):I'm a lesbian, so I don't take this to prevent pregnancy, but because my periods were lasting two weeks before.  Pros: my periods are regular and lighter, and my skin is completely clear.  Cons: I originally gained around 15 pounds (which I have since lost), and I have no sex drive whatsoever.  My breast size also increased from a D to a G, which I guess could be seen as a positive or negative.  I personally find it frustrating.  I am also very emotional, but I think that's just part of my personality and unrelated to the birth control.",laura7356
28,Yaz 28,Menstrual Disorders,4.0,Taken for 1 to 6 months,"February 6, 2017",3,"Gianvi (drospirenone / ethinyl estradiol):I am 25 years old. Not on birth control 2 years prior to taking this med. I just finished my 3rd month and everyday I have migraine, headaches and become dizzy for most of the day. I am switching.On the other hand I used to feel nauseous around my ovulation, this med fixed that. No weight gain. Acne diminished. But the migraines get in the way of school and work.",Gabriela Marie
29,Yaz 28,Menstrual Disorders,10.0,,"January 26, 2017",11,"Yasmin (drospirenone / ethinyl estradiol):Yasmin was the 1st birth control I ever tried.I used it for 3years, never had any issues. Before I had horrible acne and irregular menstrual. Yasmin cleared my skin beautifully!!  It also made my menstrual regular and I lost weight . I got off the pill for about 4 years then got back on the pill and was prescribed ortho-tri cyclen and that was awful. I'm now looking for something comparable to Yasmin that my insurance covers. Yasmin is like a miracle pill... pretty skin, got skinny and no babies",Jaybee9
30,Yaz 28,Menstrual Disorders,1.0,,"January 11, 2017",3,"Loryna (drospirenone / ethinyl estradiol):I highly dislike this BC! My doctor prescribed me Loryna because I have PCOS causing irregular periods. So I decided to try so that I can regulate my period & it has been hell! I have been really emotional, literally crying about everything. I get really crazy break downs to where I'll sit in my car & cry for almost an hour. I fight with my husband over the most stupid things. & I over think about everything. Because of being depressed I turned to marijuana to cope. It is not me to feel depressed or to feel as if I wanna hurt myself. & the first time I got my period my cramps were so painful to where I didn't want to move. I had a huge blood clot that came out which never happens. Ever since taking this pill my face has been covered in acne",mvbgx
31,Yaz 28,Menstrual Disorders,6.0,,"January 7, 2017",2,"Yasmin (drospirenone / ethinyl estradiol):I am 18 and the last year I have been developing ovarian cysts. Pretty painful periods were an everyday thing for me but a week ago it got worse with my period. I was on the 4th day and I was still bleeding a lot. My mother decided we should go to the gyno and I had an ovarian cysts again around 4cm!! Since a pill I had used once that helped shrink the cysts  discontinued I had to begin taking birth control pills. I started yasmin 4 days ago and my breasts feel stiff and today m y eyes are kinda swollen but in general nothing worse considering dangerous. Those pills do affect your hormones and body you can't expect amazing results without a drawback or two. I will be taking Yasmin for a month around, will update soon.",Anonymous
32,Yaz 28,Menstrual Disorders,4.0,,"December 13, 2016",0,"Vestura (drospirenone / ethinyl estradiol):I'm into my fourth month of Vestura (generic Yaz), and I'm a deeply worried. When I first began this BC, I experienced very few major side effects. A lot of people talk about the emotional mood swings of BC, but I'm a graduate student and I already suffer from undiagnosed depression, so my emotions on BC are the same as off. However, I did not expect the breakouts. It started last week, and now the right side of my face is covered in these tiny, raised itchy and sensitive bumps. I graduate next semester and I will have to go on job interviews. There's no way I can face an employer with this kind of rash on my face, in my industry, looks matter quite a bit. I think I may have to switch if this doesn't go away by the end of the current pack.",RogueOne
33,Yaz 28,Menstrual Disorders,2.0,,"December 8, 2016",1,"Ocella (drospirenone / ethinyl estradiol):I was on Ocella for about 10 years for PCOS.  Worked great.  Then I got off for about 2 years and was regular.  Had a miscarriage early 2016 and went back on it.  It has been horrible this time around.  Horrible cramps , heavy breakthrough bleeding that starts the second week and lasts until about 3 days b4 period starts.  I have been taking since Jan and it is now Dec and never improved.  Gyno switched me to sprintec.  Fingers crossed.",EG13
34,Yaz 28,Menstrual Disorders,1.0,,"November 27, 2016",7,"Loryna (drospirenone / ethinyl estradiol):This birth control made my life a living hell. First my emotions went out of control. I was always moody, terribly anxious, and started to become deppressed. Following this came the real reason why I am writing his review. I went on this birth control to help with my irregular and heavy periods. When the day came, I never experienced cramps so painful in my life. The only thing that I can compare it to is when I had to have an emergency appendectomy because it was about to explode. With this my period was the heaviest it has ever been and has been going on for 2 weeks now. This pill did much more harm than good for me and would never suggest it to someone.",Anonymous 12
35,Yaz 28,Menstrual Disorders,7.0,Taken for 2 to 5 years,"November 8, 2016",0,"Gianvi (drospirenone / ethinyl estradiol):I have been on Gianvi around three years. I had always had extremely painful periods with clotting that would last 7 days since puberty, and really did not know how abnormal what I was experiencing was. Suddenly, in my mid twenties, I started having two periods a month, then they would last almost two weeks at a time. I was either having horrible pms or bleeding 100% of the time. Originally, dr had me on Apri. After 6 weeks of nonstop bleeding, dr switched to Yaz, which switched to Gianvi a few months later. The bleeding stopped, and each period got lighter and less painful. However, it did take two years for my periods to actually fall on inactive pill days.",Anonymous
