,drug,condition,rating,duration,review_date,upvotes,review,username
40,Venlafaxine,Anxiety and Stress,9.0,Taken for 1 to 2 years,"December 27, 2019",68,"This drug venlafaxine turned my life around in the best way. However, it is important to consider the side effects. The side effects in the beginning were not great for me. I realized quickly that my stomach does not handle this med well, and I WILL throw up if I don’t go to bed right after taking it. However, as long as I take it right before bed it is not a problem. This med also made me feel quite drowsy for awhile at first and also gave me night twitches (body twitches when I was trying to sleep), which were annoying. After about 6 months of being on 75mg my body has completely adjusted to it and I no longer get those side effects (except I do still have to take it right before I go to bed). The withdrawals are also very uncomfortable, and if I miss a day, I am extremely dizzy. On the plus side, I feel extreme relief from my stress, anxious, and depressive symptoms, and I actually feel content with my life. I actually feel happy. Shout out to Effexor!",cass
41,Venlafaxine,Anxiety and Stress,,Taken for 6 months to 1 year,"December 9, 2019",14,venlafaxine worked good for anxiety and stress in the beginning at a dose of 75 mg then bumped up to 125 mg and that’s when I started getting constipated and gained 15 lbs in three months and sweat horribly at night and sweat more than normal at work. Getting off of it now. Did NOT work for me.,Amber
42,Venlafaxine,Anxiety and Stress,10.0,Taken for 2 to 5 years,"December 2, 2019",21,On venlafaxine I had a big struggle to begin with felt 'wired' and couldn't settle or sleep. However once I changed to modified release everything got much better. I would encourage anyone who struggles to begin with to persevere and change to slow release ,Lpe
43,Venlafaxine,Anxiety and Stress,7.0,Taken for 1 to 6 months,"December 1, 2019",24,"I was prescribed Venlafaxine 37.5mg for anxiety and mild depression and took it for almost 3 months.  I could tell an improvement in my mood and how I felt within the first week.  At this same time I began losing my hair.  Large amounts would come out when I would shower or brush it and this continued the entire time I took the med.  In 3 months I gained 10 pounds which could have been the result of feeling better, but my weight had never fluctuated that much in such a short time.  I had more energy while taking it and slept less, and had no other measurable side effects.  I actually did not want to stop taking it because of how much better I felt overall, but the hair loss finally drove me to stop.  Withdrawal effects aren’t great, but were not as bad as I had prepared myself for.",Daisy13
44,Venlafaxine,Anxiety and Stress,1.0,,"November 21, 2019",25,"I taken venlafaxine for just over a week for stress and anxiety, to start with I felt better, I had a more clear mind, however I was exhausted.After a few days I started feeling very sick & getting awful head aches.I realised as soon as I was taking this tablet within 20 minutes I was feeling sick, my head was pounding as well as blurred vision. This got worse, I decided to stop taking them, as I had only been on 75mg for a week.After two days I was off my feet, with flu like systems, brain zaps, numbness to my lips, wrists and finger tips, I couldn’t stop eating even though I felt sick. I am on the 3rd day of this come down and still no better, I am off work and unable to do much at all.I am now a lot worse off than I was before taking this drug as my anxiety has returned and I have found my depression has crept back too. I would not recommend Venlafaxine to anyone, it is a strong and scary drug to be on.",Gem
45,Venlafaxine,Anxiety and Stress,9.0,,"November 13, 2019",67,"This venlafaxine worked well for a long time, but about five years I became less active.  I thought it was the natural process of ageing, but after being on it for about 15 years, I subconsciously realised my brain had stopped producing as much dopamine, oxytocin, and probably endorphin as it used to.  I became reclusive, till someone shattered that, then my brain said it'd had enough.  It needed dopamine to get me out and about, it needed oxytocin for me to cope with people and being out and about, and it needed endorphin to overcome the aches of daily life.  All I had was what the drug supplied; the other processes had dried up.So I stopped the medication.  Had no choice.  Within 2 months, dopamine and oxytocin started coming back.  I now feel as young as I did when I started taking it over fifteen years ago.It worked great, but it's important not to keep taking it, as the brain will readjust neurotransmitters to compensate in the long run, and then you are a hollow person, supported only by the drug.",Rodenberry
46,Venlafaxine,Anxiety and Stress,10.0,Taken for 1 to 6 months,"November 3, 2019",52,"I'm 26 years old and have been taking Effexor SR for 2 months now. My first dose was 37.5mg and then bumped up to 75mg after 3 weeks. It saved me from my crippling anxiety and panic attacks that I've been having for 3+ years . I took this drug 6 pm but had to switch to 8 am because I could not sleep after taking it in the evening because it gives me energy. The only side effect I had was the first couple days of taking it I was so wired and full of energy felt like I was a superhero hahah and I could not sleep for 3 days and my pupils were huge. But after that I was 100 percent fine ! I also had severe migraines and they disappeared when I started taking this drug , also my period pain decreased significantly.",Yippie
47,Venlafaxine,Anxiety and Stress,1.0,Taken for 1 to 6 months,"September 16, 2019",31,"Ruined my life, made me a manic nut. Lost my family, who was confused why I changed and was acting like I was. After awhile I wasn't on it and wondered, what just happened to my life?",Someone
48,Venlafaxine,Anxiety and Stress,9.0,Taken for 5 to 10 years,"September 16, 2019",126,"Was on a downward spiral with anxiety and stress for years. Tried everything counselling, acupuncture, hypnotherapy. Nothing worked with my anxiety then 37.5mg  of venlafaxine for 6 years I haven't looked back.. Saved my life",Anonymous
49,Venlafaxine,Anxiety and Stress,8.0,Taken for 1 to 6 months,"August 26, 2019",38,"I am so excited about my initial experience with this drug.  For the first time in 13 years of treatment for anxiety (GAD & social) I have experienced a extended period of relief.  I took a SSRI for most of the past decade and it seemed somewhat helpful but never really gave me sustained relief.  I am now at 6 weeks on Venlafaxine (75 mg for 12 days, 150 mg for 30 days, now at 225mg), and I am feeling much calmer.  Most exciting, I still get panicked thoughts, but don’t seem to have the associated fear feelings.  I am so hopeful that this will last!  Side effects are very noticeable, but bearable.  Headache, some nausea, minor dizziness, a dry mouth and frustratingly slow urination.  I hope those will go away with time, but I’ve been on the 225mg for a week and they have been consistent.  If it means I can live without the constant struggle with fear, then worth it.",Rogdog1969
50,Venlafaxine,Anxiety and Stress,10.0,Taken for 2 to 5 years,"August 23, 2019",43,We call this my happy pillThe pill makes my wife happy when I take it.I am quick to anger or irritable if I don’t take this pill.No side affects that I know of.I have been taking this for at least 6 years.Started with 75 and now take two at a time..I take mine in the morning without food,JMS
51,Venlafaxine,Anxiety and Stress,1.0,Taken for less than 1 month,"August 18, 2019",35,"This drug venlafaxine was a nightmare for me. Problems started after the first dose. The expected dry mouth, but also severe nausea. After the second dose, the nausea was the most extreme I have ever experienced, and I began to vomit. Completely killed my appetite. Unable to sleep and spent the second night pacing, suffering anxiety attacks and taking gravol. Day three even worse--another night of no sleep and a day of throwing up. Day four added diarrhea to the mix.  Called Dr and said I would rather deal with the anxiety I had before starting. Just a horrible experience.",Ridgewood321
52,Venlafaxine,Anxiety and Stress,10.0,Taken for 2 to 5 years,"August 9, 2019",50,"I've been on venlafaxine for 2years at 225mg..amazing medicine. I don't mind withdrawal cause I'll never quit.  It's smoother than other SSRI has small half life so you can easily sleep at night.  Don't read  all these horror stories. The side effects for me  lasted a maximum 4 weeks, so take time off your schedule. Ay advice would be to take 75mg morning and keep one in your pocket to use as needed. Keep in mind that after the 150mg works as an SNRI ,so you will have a boost of energy.",Gr
53,Venlafaxine,Anxiety and Stress,10.0,Taken for 5 to 10 years,"August 1, 2019",91,It does makes you feel anxious and a bit sick but only for first few days. It's good to support yourself with some light med for stress. It goes away after few days you just need to make it through. After that you feel really good. I was on 750 dose for 5 years. Now I lowered it to 37.5mg but I am not planning to stop taking it. It improved my life and allowed to use my potential. I can see that negative comments here are mostly from people who just started taking it. As I said its temporary sickness. After 1-2 weeks maximum gets better.,Anonymous
54,Venlafaxine,Anxiety and Stress,,Taken for less than 1 month,"July 12, 2019",116,"Those side affects are all real and horrible but it goes AWAY!! Stick with it people! After 2 plus weeks on venlafaxine you continue to feel amazing! All that horrible anxiety, stress, all the peri menopausal symptoms woman have all go away! You can focus and be able to lead a normal life. That first week or so taking it yes I almost quiB, but continued on believing what my Dr. told me about it. they are right!. Best depression anxiety drug on the market.",anonymous
55,Venlafaxine,Anxiety and Stress,6.0,Taken for 1 to 6 months,"March 9, 2019",143,"I would like to share something positive about venlafaxine because when I was prescribed it initially I was so scared about the withdrawal symptoms I read about that I nearly decided not to even start taking it.  So I have now been talking 75mg daily for 6 weeks, I purposely take it at different times of the day just to test the waters and even missed an evening dose accidentally one time, well thankfully I have not noticed any side effected whatsoever, granted I am on a low dose and not been taking it very long but still I thought something may have happened..well it didn’t so please feel encouraged by this review that all these horror stories may not necessarily be true for your own experience and remain open minded.",Jay
56,Venlafaxine,Anxiety and Stress,,,"February 12, 2019",31,"I can't rate this medicine just yet because it's only day 4 but after the first few days of nausea headaches and a foggy feeling, I smiled and had good thoughts today. I know it's way to soon and I'm only on 37.5mg so far but I have a good outlook in this medicine now. I see my therapist on Monday and I'm hopeful for the first time in a long time after battling this for 11 years. They started me on buspirone 15mg and it did absolutely nothing. I started lashing out and hated every moment of it so after 2 months I tried 20mg celexa and again nothing but I was hyper the first few days then went to lashing out again at everything. I couldn't drive to work without freaking out the entire 15 minutes.  I was suppose to try pristiq but my insurance wouldn't cover 400.00 and said they would cover Effexor /venlafaxine . I'll update in a month again but give it a try.",Byrdie
57,Venlafaxine,Anxiety and Stress,,Taken for less than 1 month,"February 11, 2019",23,Started Effexor XR last night. Took my dose as directed with food around 8:30pm. I woke up around 3am extremely nauseous and was up sick until 5am. But other than that everything has been fine. I noticed I felt a little calmer today but who knows if that is because of the medication yet. Will update later.,ML
58,Venlafaxine,Anxiety and Stress,,Taken for 2 to 5 years,"December 15, 2018",37,"Weird drug. I think it helped at first and really eased a lot of the really dim days initially. I continued to take it over the course of several years and in hindsight, I don't think it was quite right for me. I became a bit out-of-character, high-strung and weird. Maybe slightly bipolar but possibly a reaction to very difficult times and lots of change. Some of my worst periods of mental illness were on this stuff; my doctor had me on 300mg+ at one point, things were very flat, dysphoric and my adrenals were certainly working. I was a bit suicidal and a little detached at points. I eventually ditched it, experienced some lack-of-energy brain-zappy withdrawal for a while. I spent a few months drug free then found meds I suite a lot better. If you're still feeling depressed/despaired and it seems like your perception of the world has become cold/weird and you're agitated, I strongly advise you to speak to your doctor and try something new.",biscuits
59,Venlafaxine,Anxiety and Stress,,Taken for 1 to 6 months,"September 16, 2018",14,"I was diagnosed with ADHD and my doctor prescribed me Effexor. It actually helped me a lot with the anxiety and depression I had to deal with, but I still don't feel that much well for concentrating.",Grande1996
60,Venlafaxine,Anxiety and Stress,9.0,Taken for less than 1 month,"September 16, 2018",50,"Only been on it a week and yes the side affects are pretty bad, like the drowsiness and the severe sweating. That’s nothing compared to the depression I felt before hand! I’ve been on other medication and nothing has worked like this. I feel like myself again. I’m enjoying life and enjoying my family!!",Jen
61,Venlafaxine,Anxiety and Stress,9.0,Taken for 1 to 6 months,"May 13, 2018",150,"Venlafaxine  has allowed me to live an almost 'normal' life. 8 weeks ago I was honestly on the verge of suicide. It has now enabled me to be a mum to my kids and be 'present' with them rather than in my spiralling hell. It has helped me with major anxiety, depression, OCD and PTSD. I can now think more clearly in the day and have the energy to go to the gym... several months ago I could barely walk upstairs. It has therefore also helped me become motivated to be healthier and I've lost 12lbs in 8 weeks.I hated the first few days as felt very sick and drowsy but I persevered. I had a few night sweats in the beginning and dilated pupils but began to notice an improvement about a week into it.This is the only antidepressant that has ever worked for me... citalopram had no effect.If this is recommended to you I would definitely consider it. It has changed my life and my family's life because my kids have their mama back xx",beaches
62,Venlafaxine,Anxiety and Stress,1.0,Taken for less than 1 month,"April 18, 2018",13,"I am a male who just turned 20 years old and is about 140 lbs. I took Effexor for the first time ever because it was suppose to help my anxiety and panic disorder. I had the lowest dosage of 37.5mg .Within the first hour or 2 it had me feeling dizzy, weak, feeling light headed, extremely dry mouth and it made me throw up. This medicine is the worst medicine I’ve ever took",J
63,Venlafaxine,Anxiety and Stress,7.0,Taken for 2 to 5 years,"March 5, 2018",10,Worked great for 2 years then had to up them to 225mg and 75mg at night and additional propranolol 80mg,Jackie
64,Venlafaxine,Anxiety and Stress,1.0,,"November 29, 2017",14,"Absolutely horrible drug!!! Made me feel really ill and when I started this drug I was 8 stone and 2 months later I’m 6 and a half stone!! Absolutely horrific, had bad dreams, felt aches all over, if you don’t want to lose weight I highly suggest you don’t take this medication!! ",Cece_94c
65,Venlafaxine,Anxiety and Stress,6.0,,"November 18, 2017",14,"I was prescribe this medicine to help me because I was gaining to much weight with the bupropion XL, this didn’t do any good at all for me. I had the anxiety 3-4 times a week, you know, that feeling of something is going to happen and you feel like you have your heart in your throat. I did like that I felt strong emotionally, not depress at all, I wish I didn’t feel that anxiety at all. Hope it works for everyone else.",Lennys
66,Venlafaxine,Anxiety and Stress,,,"November 10, 2017",12,"I took one and felt like my head was in a microwave oven; I felt zapping all around my cranium. Then when night time came around, I couldn't stop yawning. Effexor will hijack your brain, from the start. I stopped after one dose, and now my doc wants me to try Lexapro - after research, I found it seems to have fewer side effects on users - we'll see. I also started seeing a therapist once a week which I highly recommend.",Jake G.
67,Venlafaxine,Anxiety and Stress,10.0,Taken for 1 to 6 months,"November 9, 2017",111,I was at the end of my rope...I tried everything to control my anxiety...other medications  (zyban)...nutrition choices...self medicating  (alcohol-which only made it worse). Venlafaxine is a God's send for me...it has given me my quality of life back. No more waking up scared to face the day...no more fear of driving or feeling of fainting in a social situation. I can't praise this medication enough.,So much better
68,Venlafaxine,Anxiety and Stress,5.0,,"September 28, 2017",13,"I rate this a 5 because this worked for me 3 years ago. I originally started taking it for fibromyalgia and it essentially took away my pain in a week or two. I stayed in it for about a year and a half and noticed how less anxious I felt. I tapered off over 6 months which has its side effects,  but nothing like others have reported. I write this review though in case someone has had a similar experience. I went back on about a month ago, this time solely due to anxiety. I took two pills and started have burning on my tongue and lips. I will also mention that I took Xanax these two days as well so I can't be certain it was the venaflaxine. I then started having 24/7 panic, lost 12 lbs in 2 weeks and blood pressure went really high.",Kad0512
69,Venlafaxine,Anxiety and Stress,9.0,,"July 25, 2017",111,"I have been taking venlafaxine for almost a year now and my life has changed for the better in so many ways. I have BPD and the mood swings, constant anxiety, depression, anger, stressing over the smallest things and overthinking everything always got in the way of living a normal life, I also struggled with an eating disorder due to comfort eating and weight gain with other anti depressants. I have lost weight and don't binge anymore, have much more energy, sleep well, less stressed and my moods are much calmer and less irrational. I didn't score it a ten as the first few weeks of side effects were pretty rough - constant dry mouth, excessive sweating, nausea, dilated pupils but didn't last long! Everyones experience is different",Janemaryjane
70,Venlafaxine,Anxiety and Stress,,,"June 14, 2017",41,"I have been on venlaflaxine now for two years, in that time I have stupidly made attempts on my life, after trying citalopram and other antidepressants, I have to say venoflaxine has given me control over my anxiety instead of it controlling me, the only way I can describe it is the drug has opened a door, it's taken all this time to appreciate it because it's frightening to step outside your comfort zone, there is no magic pill, you have to try yourself but I've found venoflaxine has given me those opportunities to better myself that I just didn't have before, it's a very good tool but isn't a quick fix xx",Custardjr
71,Venlafaxine,Anxiety and Stress,,,"May 12, 2017",82,"I'm on 300mg a day 150mg at night and 150mg in the morning. I have to say it's helped me LOTS 5 years being on it .I have come a long long way from where I was I suffer from anxiety and depression, I've taken many other meds till I found this one .It seems to b working for me for last 5 years (KNOCK on wood, lol)Wish you all the best and remember if it doesn't work for you then talk to your doc to find something that does. Best of luck to all n god bless",Miss mandy
72,Venlafaxine,Anxiety and Stress,4.0,,"May 6, 2017",22,"Started Venlafazine 37.5mg - 150mg over a 6 weeks period for Anxiety and PMDD but had to stop. Previous to this I was on Mirtazapine 15mg to help with sleep and appetite but it did nothing for my 'feelings'. VENLAFAXINE- PROs-  Slightly more confident, didn't blush, more energy, less body pain.CONs- INSOMNIA, no appetite at all started losing weight, muted feelings, had no empathy anymore, like a I don't give a shit attitude, NO LIBIDO and couldn't orgasm! I decided to quit this garbage and return to the mild Mirtazapine for good. Some of the weeks I was on venlafazxine I actually also took the Mirt (the combo known as Californian rocket fuel) so I could get some sleep although doctors did not allow me to do this! Effects after stopping Venlafaxine -3days",Cali2
73,Venlafaxine,Anxiety and Stress,2.0,,"April 27, 2017",20,This medication is very scary to take. I was only on 37.5mg for one day and my pupils dilated and one eye was bigger then the other. It felt like I had taken some illegal drug. I felt dopey and after stopping it from one day I still felt high days later. Told my doctor and was prescribed escitalopram and took only 5mg same thing happened with my pupils again and made my out of reality feelings worse. I honestly think medication is only good if you actually have a full on disorder that is bad.. but taking this to get a relief from anxiety it just masks it. It made me feel numb to my emotions.. I don't want to be masked and not feel happy or sad..,Anonymous23448
74,Venlafaxine,Anxiety and Stress,9.0,,"April 24, 2017",26,"Male, 32y. I was suffering from stomach complex pains, terrible headaches, and depression. 16 months ago I was prescribed for Venlafaxin up to 225mg/day and Trimipramin for sleeping. It was very complicated with ups and downs but I finally got to a normal life. Since then I have gained ~10kgs but I think it's not bad for me since I was underweight before. My doctor suggested me to decrease it gradually and cut it off. I was on 75mg until yesterday and today I didn't take it. In the afternoon I was very irritated and anxious but it could be the short term withdrawal. I will update you if I could stay off medication. I wish you all strength and happiness",Merso44
75,Venlafaxine,Anxiety and Stress,8.0,Taken for 5 to 10 years,"April 20, 2017",17,"I was prescribed this drug due to very stressful and lack of help at work, the company l worked for refused to help me in a very busy office always manned by two staff and made to run the office by myself. I worked on till l cracked and had to seek help, l was placed on a very high dose in the first instance and laid off work through ill health.I am now on this medication for life as l cannot get off this drug through the side effects of a 'buzz like static electricity at the back of my head' this gets so bad that l feel like passing out at times. This is why l will be on this for life.If l had known this at the outset l would not have taken it, but nothing explained so, through ignorance and placing my trust in the doctor, l suffer.",jeff69
76,Venlafaxine,Anxiety and Stress,8.0,,"April 19, 2017",34,I started at a low dosage of about 30mg (little more) and that first week I felt high 24/7. I noticed immediately that my anxiety would not surface. It was like it was trapped. After that week I went up to 75mg. Slept a lot the first month. Always tired going straight to sleep after work and sleeping all not. Never woke up tired though. It's been 2 months and I think it's safe to say that I am stress and anxiety free. The only thing I hate about it is the dry mouth all the time.,Jaybee85
77,Venlafaxine,Anxiety and Stress,2.0,,"April 17, 2017",13,"My experience with this was so horrible, made me feel worse, was always tired and so irritated, not to mention the headaches it gave me! I was always so hungry after taking the tablets, I was constantly eating and still didn't feel like I was full. Made me feel really achey and weak, I would not recommend this anti depressant to anybody!!!",CeCe_93a
78,Venlafaxine,Anxiety and Stress,5.0,Taken for less than 1 month,"April 12, 2017",16,"I started this medication 2 weeks ago to help with anxiety, cognitive issues, and hypochondria. I'm currently on 75 mg. The first day I began to feel calmer but within the next few days more anxiety symptoms switch to depression. I went from having OCD thoughts and medical worries to wanting to sleep any chance I can get. There's also a complete loss of libido. I've also started having constipation problems.",Anonymous
79,Venlafaxine,Anxiety and Stress,5.0,,"March 23, 2017",10,Worst experience took it at night and now woke up nauseous and can't sleep going back to my medication that worked for me for years.,Future mrs. Heim
80,Venlafaxine,Anxiety and Stress,2.0,Taken for less than 1 month,"March 20, 2017",18,"I have only been on it a couple of days, but the side effects are terrible.  I am prone to insomnia, and this exacerbates it terribly.  Even with 10mg of Ambien at bedtime, I am only getting 3.5 hours of sleep.   I am also having muscle shakes, mostly at night.  I'm having daytime muscle twitching that causes me to be very uncoordinated and drop things.  Last night while I was trying to sleep I saw strange geometric patterns, and when I would get close to actually falling asleep I would see a bright flash of light and hear a booming noise which would wake me back up again.  Considering all of that I am able to function pretty well in the day time.  Also: constipation...",37.5mg SID
