,drug,condition,rating,duration,review_date,upvotes,review,username
0,Venlafaxine,Anxiety and Stress,6.0,Taken for 6 months to 1 year,"March 3, 2022",3,"Please remember that everyone is different and their bodies respond differently. Don't always take negative reviews as gospel as you never know how the drug will work out for you unless you try it. I started off using Prozac ( Fluoxetine) but didn't get on with the drug. I then tried Zoloft (Sertraline) but I didn't get on with this either as it increased my anxiety.I then tried a different class of medication, Venlafaxine (Efexor). I started off on the low side with 37.5mg instant release tabs. I had a small positive response so my doctor upped my dosage to the 75mg slow related tabs. I felt after a few weeks but this was short lived so my dosage was then upped to 150mg and then upped again to 225mg where I stayed for about 6 months. I was in a stable place, not bad but not fantastic, more stable. Then  it stopped working. Back down to 150mg and added 15mg Mirtazapine at night. On second day and I've had no crazy withdrawals like some people experience, just a bit tired.",Luis
1,Venlafaxine,Anxiety and Stress,9.0,Taken for 1 to 6 months,"February 13, 2022",1,"When I tried this medicine 10 years ago it was a miracle drug for me. Literally alive because of it. I got GAD and more on. I'd tried many many SSRI's before but none of them worked at all, not before this one who works on two receptors. Always been sceptic for trying antidepressant, but this gave my life back. It was not easy to get off though. Recently I started this same medication again because I'm back in quite a depressive state of mind, the feeling of being high is an unpleasant high for me, like an really unpleasant ecstasy drug like feeling, but it wears off after a week or so. Bad stomach and shaky hands comes with and seems to stay. Been on 75mg for awhile and will go up to 150mg soon. Hopefully it will drag me up from the black hole once again. Won't recommend this drug generally to everyone because some people get worse of it also. Like all ssri/ssrni it works individually, you just have to find the right one for you.",Venlafaxine
2,Venlafaxine,Anxiety and Stress,10.0,Taken for 10 years or more,"February 8, 2022",2,I find it helps me greatly with anxiety. However I feel very sick and nauseous if I forget to take my tablet. I take 75mg twice a day and have done for years,Susan Straker
3,Venlafaxine,Anxiety and Stress,10.0,Taken for less than 1 month,"January 12, 2022",3,"Have suffered horrendous anxiety for years.  Tried every type of medication to no avail I  currently take propranolol to help heart rate and shakes but had bad few years where even this wasn't helping.Was put on mirtazapine (highest dose) for a year, this only helped my appetite so I then became house bound with agoraphobia.I was at wits end until I was given 75mg twice daily of venlafaxine.Now at first the side affects were nasty, very nasty.  I'd feel extremely nauseous, yawn every minute followed by gagging sensations and completely loose my appetite. Also when I went to bed I'd shake, sweat and feel very agitated.This lasted for about 2 weeks and then all of a sudden they disappear and I feel amazing.  Nerves haves gone and I honestly feel like a new man.  I don't even have brain fog anymore.  It's like somebody went into my body and took control.  Best drug everHighly recommended for anxiety and depression",Mike87
4,Venlafaxine,Anxiety and Stress,9.0,Taken for 6 months to 1 year,"January 8, 2022",3,"I can confidently say this medicine truly works wonders!! I am a 31 year old female and struggled with depression and anxiety since I was a child. I was put on a number of different anti depressants before that I found the side effects to be extremely uncomfortable and either didn’t stick with the medicine or felt numb. After being put on venlafaxine 6 months post-partum I can honestly say I feel so good. My anxiety has completely diminished. The strongest benefit though is the ability to think clearly, manage stress and still sleep wonders. I take two 37.5mg every morning with breakfast and find it is the perfect dose and time of day. The first 10 days adjusting to the medicine I felt a little bit brain zappy and minor headaches / fatigue but that quickly subsided and now 3 months in I feel awesome. I do suggest taking this everyday or you will feel groggy or foggy if you miss a dose. I too was weary of some of the 1 star reviews but I can honestly say I give this medicine 5 stars!!!",Ken
5,Venlafaxine,Anxiety and Stress,10.0,Taken for 1 to 2 years,"December 8, 2021",15,"I had been through every depression med there is and finally, finally one worked for me,v enlafaxine.  It is not an immediate miracle pill, it takes weeks to work into your system, so give it a chance because it could change your life, it did mine. Also,I didnt have all those negative side effects everyone is talking about, guess it just depends on your body. But trust me stick with this one, you'll be better soon!!! Hope this helps someone keep on keeping  on there is a light at the end of the tunnel",Lauren
6,Venlafaxine,Anxiety and Stress,2.0,Taken for 2 to 5 years,"November 20, 2021",1,"I’ve been on venlafaxine for a few years and let me tell you it’s been a roller coaster, the brain tingling when you forget to take it, also lost a lot of weight cause it makes me never wanna eat. It does improve my mood a bit not much maybe I just need a different medicine not so sure it doesn’t really help me that much.",Zero
7,Venlafaxine,Anxiety and Stress,2.0,Taken for 1 to 6 months,"November 10, 2021",0,I spent a time cycling through various SSRIs/SNRIs.Venlafaxine was one of the worst for me. At 75mg it was barely noticeable. Not helpful.At 150mg it started having an anti-depressant effect. But I was very apathetic. Still anxious and having problems. I started waking up at night and sweating/feeling really sick. The sickness went away when I took my next dose. I switched to a different drug.,SSRIs Not 4 Me
8,Venlafaxine,Anxiety and Stress,9.0,Taken for 2 to 5 years,"October 22, 2021",1,"Was on a tricyclic antidepressant for many decades . It was good , especially for sleep BUT, it eventually stopped working ! Changed over gradually to venlafaxine and it’s been amazing ! 37.5mg twice a day !  Got the usual nausea , only at first , and I still  get vivid dreams ( but NOT nightmares) . I used to be absolutely terrified and anxious  of flying and that fear has totally gone! ….Side effects ? I do have constipation and grind my teeth a bit , however it’s such a small price to pay ! It’s been a lifesaver ! I’m a much more relaxed and a more positive person . Friends and family have noticed .",Leslie
9,Venlafaxine,Anxiety and Stress,4.0,Taken for 2 to 5 years,"October 11, 2021",0,"Hi I find venlafaxine ok until things around you get really bad like having to go to 4 funerals with in your family in 6 months  plus covid & every thing else in my life, now I need something stronger..",Postman pat & j
10,Venlafaxine,Anxiety and Stress,1.0,,"September 15, 2021",1,"6 days on them feel worse than ever, I feel like I'm on the top of a cliff dangling at the edge.  I feel like everything is getting on top of me, breaking down past few days to tears - these tablets are not helping me.",Anonymous
11,Venlafaxine,Anxiety and Stress,8.0,Taken for 1 to 6 months,"August 12, 2021",2,"I have taken Zoloft along with Buspar for over 5 years now. I began have horrible night sweats about 2 years ago. Then about 3 months ago, I could tell my nerves were getting out of control. My doctor recommended Venlafaxine 37.5 mg. The first couple of weeks, I had extreme nausea. Now, I have no night sweats or nausea. I function so much better. I am reading books a little bit better now, and I have a little more energy. I no longer plop on my sofa after work until bedtime. I have begun to tell that the dosage wears off, about 2-3 hours before my scheduled time to take it. My doctor has upped my dosage. Hopefully, with the correct dosage, I will be able to read longer and have more energy. So far, I really like it.",Ms KP
12,Venlafaxine,Anxiety and Stress,10.0,Taken for 1 to 6 months,"July 31, 2021",3,"it has greatly improved my mood based on my anxiety. However, well, it works for me it gives me constipation.",faye
13,Venlafaxine,Anxiety and Stress,10.0,Taken for 1 to 6 months,"July 23, 2021",77,"I have been on venlafaxine for 10 weeks after a cancer diagnosis. I was about to give up on it when I got to eight weeks & asked the doctor if I could try something else but he told me to stick with it. I'm so glad I did! I had to go up to 300mg so that's quite high for anxiety but now I'm feeling so much better. The worst part was the side effects but that's soon forgotten when you start to feel yourself again. So anyone just starting, don't give up. I have operations, chemo still to face but feel so much stronger than I did.",Cornish lass
14,Venlafaxine,Anxiety and Stress,1.0,,"July 5, 2021",2,"Horrible medicine, the side effects are unbearable, constantly burping, yawning, feeling like vomit, can't eat or drink anything, just terrible for me. I have taken many different meds before & I can honestly say this the worst. Currently seeing doctor to lower dosage and try a different medicine.",DoubleA
15,Venlafaxine,Anxiety and Stress,1.0,Taken for less than 1 month,"July 4, 2021",7,"Help, I've been taking venlafaxine 75mg slow release for 8 days today I was on citalopram 40mg for 15 years, someone please tell me I'm not going mad! The last few days I wake up with like an internal shake feeling right through me like a bad panic attack and I feel really weird can't really describe, it's like I'm having an out of body experience I can see and feel everything but  it feels like I'm looking down on myself - weird I know and so light headed very panicky and feeling so scared and fearful and generally unwell off this med, will this pass? Should I stop? Please help x",Clairegavin
16,Venlafaxine,Anxiety and Stress,1.0,Taken for less than 1 month,"June 23, 2021",26,"Lasted 4 days on this, far worse than any depression, anxiety or stress. Extremely confused, no attention span, couldn't concentrate, lost all motivation and even with the tiredness and life sucked out of me I never slept once during the 4 days. Time practically disappeared and felt like a robot. Decided to stop yesterday and feel far worse than I did taking it. Headaches and even more anxious than before and sweating a lot, feel like I'm going crazy during this withdrawal and it was only 37.5mg. Research into the medication before starting this because the withdrawal is even worse than the side effects on the medication.",teal1995
17,Venlafaxine,Anxiety and Stress,1.0,,"June 17, 2021",8,"don't take this I got confusion, really scared, sweating, chills, headaches it was the worst ever.  It  lasted all day and had night sweats feeling sick dizzy and feeling sick it should be banned",annebev
18,Venlafaxine,Anxiety and Stress,3.0,Taken for 1 to 2 years,"May 9, 2021",12,"I started it for anxiety attacks that were really bad from everything going on.  I decided to not do any research into it and just go in. It did help my anxiety,  but as I continued to take it my depression kept increasing. It went to crippling depression and suicidal thoughts almost continually. I know they say it usually only happens at first.  I was almost at a year with it getting worse.  I would much rather have run of the mill anxiety and regular depression over that thank you.",Benjo
19,Venlafaxine,Anxiety and Stress,,,"May 6, 2021",8,"This medication made me feel awful from the first dose. I took the two prescribed tablets and about an hour and a half or so later I began to feel sick. I was retching, my head was pounding and I had extreme dizziness and tremors followed by an irregular heartbeat. It’s been horrendous. This happened last night and I’m still feeling worse for wear today. My legs feel like jelly. During the night I experienced the chills and then had hot flushes.  My pupils were completely dilated.  Even this morning my eyes were bulging.  I’m not prepared to continue with this drug as the experience",star*1
20,Venlafaxine,Anxiety and Stress,10.0,Taken for 1 to 2 years,"March 23, 2021",106,"I have suffered from anxiety all my life in varying degrees and have tried lots of different medication to control the unpleasant feelings.From just feeling nauseous, butterflies in the stomach or mild to severe full blown panic attacks. Venlafaxine for me, is a game changer. It helped me within a week or so. I started on a very low dose for 2 weeks then 75mg which I have now been on for over 12 months.My panic attacks have gone and I can now face the day without the constant feeling of overwhelming worry and despair. I would definitely recommend them. Very few side effects.",Dawniow
21,Venlafaxine,Anxiety and Stress,10.0,,"January 27, 2021",61,"I’ve suffered depression for the last 11 years after a nasty breakup with the father of my two children. I was quite happily going on with life over the last 10 years, yes it had its ups and downs but eventually my sons father, we split up and bang! I was so depressed I wanted my life to end. Every time before I was due my period I contemplated suicide and in between it would pop up every other day. I just couldn’t cope anymore so went to my doctor and told her everything. That’s when I started my journey on venlaxfine. I started at 37.5mg and increased it higher the following two weeks,it would work then it didn’t and my anxiety came back so bad so I then upped it each time I had a bad episode of anxiety and suicidal thoughts.  I’m on the highest dose now and can honestly say I’ve never felt better.  I can’t even remember the last time I thought about suicide and my relationship is going well with my sons dad again.  It really has changed my life, push through the side effects.",Sass
22,Venlafaxine,Anxiety and Stress,1.0,Taken for less than 1 month,"January 7, 2021",11,I have never taken medication like this before but after that first night I'll never try again. I suffered every side effect. All of them! I'm so glad its winter so I could go outside and cool off. Possibly the worst night of my life. It almost gave me a panic attack. I hallucinated. I have diarrhea and was throwing up. I'm still jittery today but no more hot flashes... for now. I called my Dr at 5am freaking out. I'm so embarrassed. He gave me 150mg venlafaxine to take once a day with food. I took it at 9pm in case I did have side effects I could sleep through them. Bad decision. I'll probably never take depression medicine again.,Stef
23,Venlafaxine,Anxiety and Stress,8.0,,"January 6, 2021",116,"Venlafaxine changed my life, after only taking it for 2 months. The side effects were horrible at first I had headaches and would shake or tremble when anxious and I got extremely itchy. When you suffer from depression, GAD, PTSD and OCD its a small price to pay because I started to see a change in my mood and my anxiety. For the first time in my life my anxiety was almost gone I could go out in public and engage in conversation for the first time in my life. I started on 75mg and I am still on it 6 months after. Lexapro made me a slow zombie and did nothing for my anxiety it only helps for depression. A lot of reviews have negative feedback but if you are in a bad place push through the side effects because its worth it they do go away. This is the only anti depressant that doesn't make me a zombie during the day I feel more awake. Stay strong.",Luckyluke
24,Venlafaxine,Anxiety and Stress,1.0,Taken for less than 1 month,"December 31, 2020",6,This depression medicine venlafaxine is horrible the headaches and nausea OMG I’m not taking it any more I would rather deal with depression,Dale52
25,Venlafaxine,Anxiety and Stress,,Taken for 6 months to 1 year,"November 30, 2020",8,"This medicine venlafaxine is complete garbage don't ever get on it it makes you balloon up. There are a lot of bad reviews about weight gain on this medicine it's terrible. It made my anxiety and everything worse, it made it better for a while and then it made it worse. It made me balloon up which caused me to be severely depressed cuz I gained 50 pounds eating a clean diet that I ate before that I was a hundred and twenty pounds now I'm 178.  My other Dr put me on contrave because I was obese after taking this",Barbie.
26,Venlafaxine,Anxiety and Stress,10.0,,"October 23, 2020",208,"13 year ago was started on the usual citalopram, mirtazapine etc. My son is very ill and immunocompromised, lots of hospital visits. I was the lowest I’ve ever been, no interest in anything and even contemplated walking away from my life (I was very ill mentally) until I started to take venlafaxine. Started January and it’s now October, I’m a new woman, can deal with things, I don’t overreact or make my mood effect the household. It’s greatly improved my anxiety too, still have same fears but can rationalise things better and more healthy.Bit worried about coming off in future but trying to just live in the now. Also lost 5 stone very easily without trying. In my humble  opinion this drug transformed my life, no longer idolise death as the easier option as I can can actually deal with my emotions now. Feel mentally healthier and enjoy life again instead of just existing",Smiffy
27,Venlafaxine,Anxiety and Stress,4.0,Taken for 1 to 6 months,"September 26, 2020",14,"This was very effective for me when in regards to treating major depressive disorder. I have MDD, PTSD, GAD, and OCD. However, when the dosage increased to 75mg ER daily I started experiencing more negatives. I had very strange and vivid dreams, tremors, and began to always be in fight or flight. Overstimulated and sensitive. Unpleasant orgasms. My appetite decreased and I became more anxious overall.",Xbele Om
28,Venlafaxine,Anxiety and Stress,3.0,Taken for 1 to 2 years,"September 8, 2020",23,"DO NOT TAKE THIS DRUG venlafaxine! I went on this medicine due to a temporary life event that caused a great deal of stress. Started at 75mg and eventually moved  up to 150mg. I was not warned about any side effects or withdrawal. I had been in the med for almost a year & forgot to take it one day. By lunch I was vomiting and felt horrible. It took about a day or two for me to start to feel better. I NEVER skipped again and was terrified of trying to come off of this medicine. Only stayed on it longer because I was afraid of the withdrawal. I finally worked with my doctor to try to come off of it. He was great and did what he could to make it tolerable. I still had to pull apart the capsules and take out a few of the balls each day. I felt awful: brain zaps, nausea, confusion, dizziness, memory issues, and headaches. If I had known how incredibly life altering this drug is,I never would’ve started it. I have been 100% off of this drug for about 2 weeks now and I still don’t feel close to normal.",Mar6330
29,Venlafaxine,Anxiety and Stress,6.0,Taken for 5 to 10 years,"August 24, 2020",20,"Been on Venlafaxine for 7 yrs. After a long battle with severe anxiety and stress that lead to long bouts of depression I was finally prescribed venlafaxine modified release. Eventually settled on 150mg which slowly but surely started to work alongside my body and I felt better. Missing 2 days or more was a nightmare and resulted in nausea, insomnia, jitters, and the horrible brain lag (only way I can describe it?). I'm now in a much better place in my life and my dr and I are decreasing my dose slowly. Long term side effects I've had are a complete loss of any sleeping pattern combined with horrible night restlessness (feeling like all your skin is ever so slightly itchy), and now that my dose is being decreased I'm noticing I'm having uncontrollable anger outbursts along with increased night tremors. If this drug works for you, the pros are greatly outweighed by the side effects. But those side effects can be debilitating sometimes. Take with extreme caution",Rapture
30,Venlafaxine,Anxiety and Stress,1.0,Taken for 6 months to 1 year,"June 16, 2020",18,"I take venlafaxine for my anxiety and panic, they do nothing to help, I have many meds to help with anxiety and panic but nothing works",Andrew66
31,Venlafaxine,Anxiety and Stress,1.0,Taken for 6 months to 1 year,"June 2, 2020",22,Effexor has given me depression and suicidal thoughts. I tapered down over for 2 months and I’m still experiencing severe withdrawal symptoms after 4 weeks of stopping. It’s horrendous.,Llll
32,Venlafaxine,Anxiety and Stress,1.0,Taken for 5 to 10 years,"May 2, 2020",142,I've been taking venlafaxine (Effexor XR) for over 7 years and I'm giving it a rave review!  It's the best medication I've ever used for my anxiety disorders and I've tried almost all the SSRI's.As added bonuses it also relieved my depression and the only side effect I had was a mild headache for the first few days after I started it.I can't say how happy I am with this medication!  It's turned my life around.,WildcatVet
33,Venlafaxine,Anxiety and Stress,5.0,Taken for 6 months to 1 year,"April 26, 2020",20,Venlafaxine pretty much eliminated my anxiety and depression for a few months then stopped working. Was good while it lasted.,gs
34,Venlafaxine,Anxiety and Stress,3.0,Taken for 6 months to 1 year,"March 26, 2020",14,"I was put on this drug because it really helped my sister with her depression and anxiety, but it didn’t help me at all. It didn’t do anything to worsen my symptoms of anxiety, but it also didn’t help either. However, I’m currently being weaned off of it and it’s the absolute worst nausea I’ve ever had. I’m taking my pill every other day; therefore, I get nauseous every other day. I don’t doubt that this medication helps certain people, but for me, these withdrawals are just straight up painful.",Jen
35,Venlafaxine,Anxiety and Stress,10.0,Taken for 2 to 5 years,"February 19, 2020",25,I forgot to take Venlafaxine 225mg for 5 days ( not out of neglect but because of severe bone socket pain after the removal of my teeth.  What followed was horrendous to say the least.  I was urinating uncontrollably and had diarrhea that I couldn’t hold onto. I was so physically sick. As I was consumed with getting the pain in my mouth eased I totally forgot my important meds.  Please don't ever do this.  I lost all my confidence that had built up over many months.,Cybil
36,Venlafaxine,Anxiety and Stress,1.0,Taken for 1 to 6 months,"February 6, 2020",35,"Given venlafaxine at lowest dose of 37.5mg for 5 weeks. Very manic feeling followed by very sleepy. After 5 weeks decided to come off them VERY, VERY difficult, brain zaps, mania, anxiety through the roof and couldn't settle down. If you are taking this drug beware missing a dose is very very bad on ur body. Now a week off it and am taking diazepam to remain calm during bad moments. Would NOT RECOMMEND.",Drombo Howes
37,Venlafaxine,Anxiety and Stress,9.0,Taken for 10 years or more,"January 17, 2020",79,"I have been on effexor (venlafaxine) for around 10 years and I could not have survived without it. It helped me to feel ""normal"" and allowed me to go out of the house without getting panic attacks. I did sweat profusely for some time and once I did not take it for 3 days that was really bad. I had shakes, shivers, light headedness and nausea... I would say this medication saved me from years of mental nightmare.",PandaBrian
38,Venlafaxine,Anxiety and Stress,1.0,Taken for 2 to 5 years,"January 15, 2020",16,"I was diagnosed with depression and was prescribed venlafaxine and found that I had so many side effects, bad headaches, nausea, suicidal, self harming and the list goes on, it made my depression worse. I wouldn’t recommend this drug to anyone.",Anonymous
39,Venlafaxine,Anxiety and Stress,5.0,,"January 10, 2020",48,"Used Ireven(venlafalxine)Started 75mg.A small bit woozy ,increased heart rate, sweats and hyperactive. This eased after a couple of days. I increased from 75mg to 150mg. Same effect on increase, but quickly subsided. Life was easier, emotions more manageable and generally a bit happier, although I did experience really really vivid dreams and fatigue. After Christmas I decided it was good time to come off them. This is where it got bad. First off,I should have consulted a doctor and weaned off, but being me,I  didn't. Cold turkey is not a good idea, trust me on this one. It was absolutely awful. Vision, motor control ,nausea, cramps, pains all over shaking and tremors, awful migraine, no pupils, I couldn't co ordinate my mind and body to work in sync.Admittedly I should have followed a doctor's instruction, and am writing review to advise other to do exactly that. Overall it worked well for its purpose, just be mindful when coming to the end, do it slowly.",Home
