,drug,condition,rating,duration,review_date,upvotes,review,username
41,Vivitrol,Alcohol Dependence,6.0,Taken for less than 1 month,"May 17, 2018",24,I received the Vivitrol shot  3 days ago for alcohol dependency. So far it has helped with the craving to want to drink. The side effects that I have is I’m constantly tired and have no motivation. I just feel blank and withdrawn from the world. I hear this lasts for only 4 days or so I truly hope that’s true. Hopefully my body adjust to this medication (injection) so I can get up out of bed and enjoy life again. I’m just so not used to being down I’m normally full of energy and have motivation to do things. Fingers crossed.,Lynelle
42,Vivitrol,Alcohol Dependence,10.0,Taken for 1 to 6 months,"February 20, 2018",42,"I've been an alcoholic for the past 35 years I'm 52 pretty sad I tried every single way to stop, a year here, 6 months there. I thought I can just have one drink but it never ever worked. I tried every which way I could but it always round up to the same thing, drunk staggering in hospital or mental institute. I finally made the choice to get Vivitrol and it was the best thing I could have ever done I only had one shot so far and the craving is which I couldn't get rid of is gone. It's gone one shot I can't wait to get my second shot it's a miracle. Thank you Vivitrol and for anybody thinking about it seriously go for it it's worth your life I didn't get any side effects whatsoever God bless us all",AnnaMoe1
43,Vivitrol,Alcohol Dependence,,Taken for less than 1 month,"February 15, 2018",16,Just started and noticed sleepiness and lethargy-I am also taking 5mg of valium 2x day to wean off of Ativan. I think that in conjunction with other meds the shot is causing the effects-I take HBP medication which itself causes drowsiness so I'm hopeful that I will be able to adjust all of my meds to accommodate staying off the alcohol-Has anyone had side effects the first time/first few days similar to this? extreme sleepiness/lethargy?,FarRockjohnny
44,Vivitrol,Alcohol Dependence,,,"December 30, 2017",16,So far on my first shot I notice a reduction in craving or thinking about alcohol. I hear after the second and third injection that the cravings go completely away. We shall see. But after the injection there is no sense in trying to get away with a drink as either you will feel deathly ill or feel nothing at all. Including no buzz or good feelings from the drink. No side effects for me. I’m happy I took the shot.,Elayna2020
45,Vivitrol,Alcohol Dependence,9.0,,"August 12, 2017",38,"Received my 2nd injection this week. So far, so good! No cravings and no discernible side effects from the shot. This has become a very tool in my sobriety toolbox, which includes AA, outpatient counseling and antidepressants. And, of course, my higher power, who I call the God. This shot is definitely worth a shot. ☺️",Milo9116
46,Vivitrol,Alcohol Dependence,10.0,,"March 24, 2017",147,"I started going to a clinic to get extra help on top of AA. My alcohol use had gotten to a very, very dangerous level. I would flirt with sobriety through AA, getting almost to 30 days, then a bad craving would hit and I couldn't resist. Then I found out about vivitrol. After my first shot it cut my cravings down ten fold. Now 4 shots in I rarely have a craving and when I do it's manageable. This has allowed me to concentrate on my recovery without also battling cravings. I'm 95 days sober today and so grateful.",Mendee86
47,Vivitrol,Alcohol Dependence,10.0,Taken for 1 to 6 months,"March 2, 2017",91,I have been on the vivitrol since November 2016 I have remained sober for 5 months. The urge to drink went away and it felt good knowing that even if I drank on the shot I wouldn't feel the warm fuzzy feeling that I was so addicted to. So recently I did drink and I feel so terrible shakes.. Sick to my stomachs. Alcohol withdrawal is terrible and it really sucks. Now I know why I love feeling sober. Vivitrol had not only kept me sober it truly saved my life because I know that I have control of my life. I would recommend this to Anyone who has a problem with alcohol. It truly takes the cravings away. And helps you find yourself.,Annngggell
48,Vivitrol,Alcohol Dependence,,,"January 8, 2017",31,"I am a member of a support group for a person in their mid-20's recovering from alchohol addiction.  The person has been taking monthly Vivitrol injections for about 6 months.  The injections have helped the cravings, but not 100%. When the person did consume alcohol (vodka) it produced severe flu like symptoms that were similar to alchohol withdrawal. Has anyone else suffered these types of symptoms drinking alchohol while on vivitrol injections?",SupportingGroupMember Question
49,Vivitrol,Alcohol Dependence,8.0,,"November 25, 2016",25,"I think my experience with the clinic may be coloring my opinion of Vivitrol. As far as I know, it DOES work to curb cravings--I haven't had any to speak of in the 6 months I've been getting the injections. OTOH, I've noticed that my depression gets significantly worse for a few days after each injection, then it eases up to my normal low (someday I hope to feel actual happiness again). My problem is with the clinic and the hour+ wait times. I'm clean. I'm in therapy. I go to AA meetings daily. I have a strong support system in place. But I'm thinking of discontinuing because I don't have 2.5 hours to spare every time I have an appointment (commute to clinic, time at clinic, commute to work).",Anonymous
50,Vivitrol,Alcohol Dependence,9.0,,"April 4, 2016",70,My experiance with this medication is not that bad. I have all of the side effects that has been listed I've had 4 doses and have not had a drink in 4 months .,Mr. AC
51,Vivitrol,Alcohol Dependence,10.0,Taken for less than 1 month,"December 17, 2015",75,After abusing alcohol for many years I received the shot last week and cravings are minimal and pass quickly. Having relapsed early in sobriety before I feel that going to meetings and the shot will help prevent another.,Naladog
52,Vivitrol,Alcohol Dependence,10.0,,"November 27, 2015",204,"After battling the bottle for 30 years I am so Grateful that I found this. I tried everything from AA to SMART Recovery and to be honest while each program has it's good points they did not take away that urge to drink. This did. Instantly. Vivitrol has really been a blessing because it not only blocks the urge to use but it goes the extra step of blocking the high if you do drink  I was just a Garden variety alcoholic. I drank around the clock. I would even drink in the shower. The funny thing is I never bought into the disease model even while I was sober for years at a stretch. I would eventually pick up a drink because the urge, that voice, the Beast was always there. Not anymore! Vivitrol stopped the brain imbalance that MADE me drink.",GRATEFUL...
53,Vivitrol,Alcohol Dependence,1.0,Taken for 1 to 6 months,"August 3, 2015",31,"I am losing a lot of hair meaning it is coming off in clumps so I rated it low. It has worked on cravings and I like the ""safety net"" of taking the injection as it prevents me from making an impulsive bad decision. I wish I could continue taking these injections",Snucks
54,Vivitrol,Alcohol Dependence,8.0,Taken for less than 1 month,"March 31, 2015",199,"After partying almost 30 years in a successful, trouble free life, I began taking antabuse pills a few years ago without a recovery program.  I was told about vivitrol and it interested me in quitting my prescription hydrocodone, benzo, and drinking. My 1st shot was 10 days ago and it does make your mind content. I can tell the drug is wrapped around my receptors. If I where to attempt to take a drink....it feels like I already had one. Not taking pills is no big deal either. I still take a sleep aid at night and Aleve  or Ibuprofen for anything else. I. Am now experiencing eating and sleeping like I've seen normal people do all my life.  A spiritual feeling should come along with that for those of you who are willing to make a change.",Hollister resident
55,Vivitrol,Alcohol Dependence,9.0,,"March 2, 2015",83,"I took the Vivitrol for the recommended year, and have not had cravings and remain alcohol free (since 1-31-14).  In some ways, I think it also helped me quit smoking.  However after 13 shots I feel stiffer than I ever have, and I was wondering if anyone else shared this experience.  Some days my shoulders are almost immoveable.  I didn't feel this way before the medicine, and I was wondering if there was a correlation.  It is actually painful to get out of bed some days.",jbirmi58
56,Vivitrol,Alcohol Dependence,9.0,Taken for 1 to 6 months,"February 23, 2015",86,Got my second shot today. It literally took away the urge to dr ink.  So far so good.,dtowngal
57,Vivitrol,Alcohol Dependence,10.0,Taken for 1 to 6 months,"January 8, 2015",151,"I took my 1st Vivitrol shot around 9/10/14, 2nd -3rd-4th-and the fifth shot 01/04/15. By injection 30 days apart. I can honestly tell you that I have not had any cravings for alcohol since the very 1st day of shot. I can personally tell you that I have not had any side effects. Some people may have but I have not. I now speak at my rehab center (Clarity)  where I was at.  I'm a firm believer in Vivitrol. Saved my life. I will take it for a year.",jackrice1947
58,Vivitrol,Alcohol Dependence,9.0,,"November 9, 2011",193,I just received my second Vivitrol shot.  I am so glad that I did.  It has helped curve my cravings and have had no side effects.  I've been a heavy drinker for 16 years and have struggled with relapsing for a few years.  I know this isn't a cure and this is a daily disease that should never be put on the back burner but not having the cravings where the only thing I can think about is that next drink helps a ton.  To anyone that is thinking about trying Vivitrol I would say stop thinking about it and do it.,kyle5050
59,Vivitrol,Alcohol Dependence,10.0,,"August 7, 2011",160,"I am looking forward to my second injection. The obsession of taking a drink has been diminished significantly. I am motivated and happy. I attend 12 step meetings and do everything suggested from the fellowship however, this medication has taken me to the next level in my sobriety.  It is merely a band aid to my disease and support is still extremely important. I recommend this medication to any chronic alcoholic who has a problem staying sober.",Twaud
60,Vivitrol,Alcohol Dependence,9.0,,"November 13, 2008",148,I am an alcoholic in recovery and have been sober for over 10 years.  I used this drug when it was fairly new and I was in rehab.  Seemed to work along with all the other tools given to me at that time.  No side effects that I can recall.,Anonymous
61,Vivitrol,Alcohol Dependence,,,"May 10, 2008",168,"I am a chronic alcohol relapser and found the injection helpful. Not only mentally, is it a deterrent. It definitely curbs the  ""feeling"" found in a drink because I did test it.  The second shot only makes it more potent and you get better with time. Combined with meetings everyday, and the shot I have a better chance at an alcohol free life.",Pamelas555
