,drug,condition,rating,duration,review_date,upvotes,review,username
0,Botox,Urinary Frequency,1.0,Taken for 6 months to 1 year,"January 14, 2022",1,"Getting Botox for OAB was the worst decision I ever made.  My life is exponentially worse right now. Prior to the procedures, I had frequent urination and had to go 4-5 times a night on average.  I tried the Botox the first time and I think I had one night where I only woke up twice.  The worst effect was the retention; the inability to go, knowing I had a full bladder.  They said ""you have to do it again for it to really work"" so I did.  I now get up 8-9 times at night, can't empty bladder and have the worst pain all night long.  I would give anything to go back in time and not have this done.",Anonymous
1,Botox,Urinary Frequency,,Taken for 10 years or more,"January 10, 2022",0,"I have had regular Botox treatment many times over the past 13 years for bladder frequency and urgency, however the last time, which was 4 weeks ago has been terrible. I was unable to void properly, and after 3 weeks or pushing and coughing and hurting myself and prolapsing my urethra, I ended up in emergency with a bladder the size of a football. I have had a Foley catheter in for 4 days, and am now waiting to be taught to self-catheterise. M new urologist has said I will be self cath routinely forever.",Australia Qld
2,Botox,Urinary Frequency,1.0,Taken for 1 to 6 months,"October 25, 2021",1,"Never again! I've had botox injections 3 months ago for my overactive bladder. ptns and medication didn't work. Before botox I had to pee every hour, after botox even more, my bladder feels painful and full all the timeThe injections were a bit painful and I got antibiotics before but after 2 weeks I had a UTI. Can't empty my bladder without pushing really hard so I have to cath myself 3 times a day. Still my bladder feels full all the time, so sick of this",Elke
3,Botox,Urinary Frequency,,,"August 9, 2021",0,I'm having botox in my bladder on the 11th August. Any tips for me as I'm excited but scared. Is it painfull? I've opted for local  anaesthetic,Reorete
4,Botox,Urinary Frequency,10.0,Taken for 1 to 6 months,"May 26, 2021",7,"I am probably one of the happiest people in the world!  My extremely over active bladder led to severe depression, becoming 100 lbs overweight, never going anywhere.  If it weren’t for worrying about what would become if my dogs - well, suicide seemed a fairly good option.  After trying different medications, my urologist (my hero, he should wear a cape) suggested trying the bladder Botox injections.  Only two days after the procedure I got to put on real panties !  I’ve become more active in spite of my COPD, have begun Intermittent Fasting & am losing weight steadily.  I’m thrilled with the result, to say the least!",Happydolly
5,Botox,Urinary Frequency,2.0,,"May 9, 2021",4,"I wish share with you an effective treatment for chronic nocturia. I am a patient and have tried every other form of treatment. I would literally get up nearly every hour of the night with an urge to urinate even the tiniest amount. It was a nightmare. My urologists tried every form of treatment on me with no success. Here is the very effective course of treatment I have found only after 3 years of constant trial and error.  At bed time I take the following: 1.Trazadone 50 or 100 mg,2.Gabapentin 300mg, 3.Melatonin 5mg      I tried Botox injections to the bladder. I had it done 3 times. The first dose of 100 ml really seemed to help in that it allowed me to sleep for an amazing 2 hours at a time without having to get up to pee. However, once the first dose wore off the two subsequent dosed did nothing even though we doubled the dose to 200 ml!",gaeliccouple
6,Botox,Urinary Frequency,1.0,,"May 6, 2021",11,"I had Botox 8 months ago all I was told was how good it would be to help my over active bladder, 2 days after the  procedure I couldn’t pee at all for 3 months I wore a bag on my leg then I ended up real sick and got sepsis and almost lost my life.  I was on 3 different antibiotics while in the hospital. Then after 7 days in the hospital  then still had to come home on 2 weeks  more of levaquin which is dangerous in itself. I still had to come home and self cath which I am still doing in an 8 month time frame and have had 3 more kidney infections since coming home from the hospital now my kidneys have scarring on them and I still can not use the bathroom on my own or empty my bladder!!! Everyone has their own experience and mine hasn’t been good!!! I would read all reviews and do ur research before having this procedure done!!!",D
7,Botox,Urinary Frequency,1.0,,"January 25, 2021",21,"I used to pee about hourly and about 5-6 times a night. Botox suggested. Had botox and ended on toilet every 5-10 minutes. Warned to expect frequency. Hours later crippled in pain from continual peeing then had blood in urine.Had ultrasound of bladder to measure residual urine which showed 60ml residual after peeing. My bladder holds 50-70ml.Needed catheter to give me some rest. Went home with indwelling catheter. No antibiotics before or after botox. 2 weeks later now 2-3 bags of blood each day in bag. No visibility in bag due to blood and stringy clots 4 days in a row. Told nothing to worry about at local hospital, antibiotics injected and got tablets for bladder infection. Wishing I was never pushed to try botox by Urologist. Returning to remove catheter for 1 day in a few days, to see  if successful & teach self cathing. This means toileting 15min - 1/2 hour and 1-2 hours at night with self cathing.Would not recommend botox for bladder issues requiring bladder surgery.",Happymum
8,Botox,Urinary Frequency,6.0,,"August 22, 2020",18,"I have had Botox surgery 2 times in a year for urinary issues, but do not find the results to be that great. I have a lot of UTI's and have to use a catheter all the time. It has helped some so probably will continue with Botox in future.I do not think the drug works as well as it should ordoes not work as advertised.",skylight
9,Botox,Urinary Frequency,1.0,Taken for 1 to 6 months,"June 3, 2020",17,"I'm a relatively healthy 29 year old male and botox did nothing to help my over active bladder and urge incontinence, I had 100 units of botox injected, about 6 weeks ago and the only thing it has done for me is that it is more difficult to empty my bladder, I really have to push it out. So I feel like if I do have another treatment with more units, it seems like I wouldn't be able to pass anything and will have to use a catheter like others have explained which I'm not ok with. Back to physio training and seeing how that goes, bit of a waste of money the botox was but worth a try",Dental
10,Botox,Urinary Frequency,10.0,Taken for 1 to 6 months,"February 29, 2020",15,I have to update after reading many reviews  everyone’s different   It is very uncomfortable while being injected but since it works that’s all that matters   Yes I have to self cath not easy for women but as I told my doc in check up  it’s so worth it  I never want to go back to the need to find the closest bathroom everywhere I go   Or get up 4 times a night to urinate   Bottom line it gave me my life back.   So in my opinion it’s worth the discomfort and the cathing,Turkeylady3
11,Botox,Urinary Frequency,,,"February 26, 2020",21,"It is my experience as a health care professional that I would never advise botox for the bladder. The bladder is a muscle, therefore you use a stimulant not a product that stops muscle activity. Most patients never been asked to measure their urine when the urinate. Frequency doesn't mean quantity. I treat patients with acupuncture and it works.",GG
12,Botox,Urinary Frequency,1.0,Taken for less than 1 month,"February 11, 2020",30,I had the procedure today at the hospital and the doctor that was doing my procedure said it would be just a little pinch. Well she lied it hurt and burned like I don't know what. Never felt anything like it. I told her many times  to stop she continue to torture me.  who ever said this procedure and isn't painful is extremely lucky or under anesthesia. This procedure is very painful. I will not complete any follow up treatments,Sabrinachitoen
13,Botox,Urinary Frequency,10.0,Taken for less than 1 month,"January 23, 2020",22,"I read all these reviews and total freaked myself out, honestly I barely had any pain it was just a bit uncomfortable. This is my first time getting it and so far so good, I do recommend",C
14,Botox,Urinary Frequency,1.0,,"January 13, 2020",21,"Worst experience i have ever had, its has been bad since day one,  1st of all the procedure hurt, then I could not pee at all.  I went to the doctor and was informed this was a side effect and now I should be able to pee on my own, well I still could not, the spasms almost drove me crazy, she prescribed my some med and they stopped.  I am still unable to urinate of my own, just a few drops come out and I know my bladder is full.  I hope this stops soon, I hope I don't have to self cather until this wears off... never again....",Leelee
15,Botox,Urinary Frequency,10.0,Taken for 1 to 6 months,"December 20, 2019",54,"Had this 20th November 2019 to help my problem of  needing to pee every hour 24/7  and I now go about 4 time a day and sleep all night which has not happened in 4 years I was so tired but after this is a life changer, tiny little sting when put  Botox in. I will recommend it 100 percent",Jayne
16,Botox,Urinary Frequency,1.0,Taken for less than 1 month,"December 16, 2019",14,"Had Botox 2 weeks ago, it was not painful. But a week later started having problems urinating. Then 3 days ago, bladder would not empty at all, ended up in hospital with an in dwelling catheter. My urethra is that painful. It’s early days, but I doubt if I will any more Botox, take me back to leakage!",Goldengirl
17,Botox,Urinary Frequency,1.0,Taken for less than 1 month,"December 11, 2019",12,This procedure has been a nightmare for our family!  My sister and I drove her 90 year old husband for this.  I live with them and we so regret it!!!  Maybe more problems because of his age?  He came home in horrible pain and threw up for 2 days.  He was going a lot more and so sick and in so much pain after 5 days -we took him to the emergency room.  They put in a catheter until he could go to his Dr Monday about 50 miles.  They took the Cath out and he can't go at all now!.  Then we heard from my other brother in law tell us about  having it done also a few months ago.  Very painful and he will never do it again.  The Drs didn't seem truthful about what might happen and the horrible pain.  We hope his bladder will start working again.  Drs should have to share percents of problems from this! My 2 family members wish they never had it done.  Is it worth the odds of it helping or the potential life changing side effects!??,Sad regretful family member
18,Botox,Urinary Frequency,1.0,Taken for less than 1 month,"November 29, 2019",21,I am 70 years old and have severe OAB since I was 35. Medications were of little help. In March 2019 I had botox injections of 200 units. It was not unpleasant but of no use. Three weeks ago I got 300 units and it was a much worse experience. I have to pee every 10-30 minutes and urine just flows out between bathroom visits. I am extremely discouraged and disappointed. I give up.,Michelle
19,Botox,Urinary Frequency,5.0,,"November 27, 2019",41,Hi  Guysi am a 34 year old female and had botox in my bladder in July this year for urine frequency that I had been suffering with for years. Procedure went fine but a week in I was in so much pain. I had to self catheterize 4 times a day and have had 5 different antibiotics for infections. I am also in a lot of pain around the urethra area constantly. I would much rather go back to the way I was than to go through it again. Hoping it starts to wear off soon. The pain is driving me crazy and not getting much sleep. Is anyone else experiencing this pain. Its been over 4 months now since I had the botox  procedure.,Loulou
20,Botox,Urinary Frequency,1.0,Taken for less than 1 month,"November 16, 2019",18,"I had Botox 2 & 1/2 weeks ago, for urinary frequency, then I became completely obstructed, and now have to self cath 4 times a day, if not more. What a nightmare. Urgency was better!",Ironman
21,Botox,Urinary Frequency,1.0,Taken for less than 1 month,"November 4, 2019",32,I got botox October 1st  2019 for urinary problems and they said it takes anywhere from 2 weeks to 4 weeks to 6 weeks to work. The procedure is very painful. And takes about 1 hour. The aftermath this has caused I would never wish on anyone. I'm peeing every 15 min to 5 mins the procedure weaken the bladder and made me worse.  Don't have it done.,Christy
22,Botox,Urinary Frequency,,Taken for 1 to 6 months,"November 2, 2019",13,"I had first Botox treatment for urinary problems seven weeks ago and, for me, it is a winner.  As background, I am a 78 year old male in otherwise good condition.  With Botox I was able to stop taking both Myrbtriq and Tovias.  Not sure how long Botox will last but so far am pleased with results.  Good luck to all!",TJ
23,Botox,Urinary Frequency,1.0,Taken for 6 months to 1 year,"October 5, 2019",9,"Early 20s with neurogenic bladder from a spinal injury. I was so desperate for something to work, I was really excited to have this done. I tried it four times, it didn’t work at all. I had 100 units, 200 twice, then 300. Nothing. Disappointing would be a understatement. I would have taken catheterizing over the constant urge to pee in a heartbeat. I read a study somewhere that said it was much more effective for older people, in their 40s and up, than younger people. I wish allergan would look further into this to figure out why. It’s worth trying, but don’t get your hopes up like I did, unless you enjoy disappointment.",Usernaem
24,Botox,Urinary Frequency,10.0,Taken for 1 to 6 months,"September 30, 2019",10,The injections work great  have to cath due to high residual but I believe that’s a problem I have anyway.    Problem is the effects of Botox only last me a couple  months   Medicare only pays for every 6 months,Turkeylady3
25,Botox,Urinary Frequency,1.0,,"September 20, 2019",11,"I'm a 26 year old male who had a neurological illness when I was 18 which even though making (near enough) a full recovery was left with an extremely weak bladder. Having tried numerous prescription medication over the years I was talked into botox by my consultant as last resort, without really detailing the possible side effects. Since having the procedure 5 weeks ago I have seen no improvement in the urge/frequency to go and I have had 3 bladder infections lasting a week at a time, experiencing this whilst working in an office 9-5 and having a busy social life is really not ideal. I strongly urge you to ask questions of your consultant and conduct your own research prior to having this procedure done, especially given the length of time it takes to wear off",Rfc26
26,Botox,Urinary Frequency,10.0,,"September 8, 2019",29,"I am so very lucky. I have had Botox into my bladder 5 times. Approximately every 6-9 months. I have it under general anaesthetic and recover well. This procedure works so well for me that when I feel it is starting to wear off, I contact my consultant. It has transformed my life. Previously when  I had urge incontinence, I was reluctant to join in any social activities. With the Botox injections, I actually feel normal. My rescue bag has place of honour in my bedroom cupboard than my handbag: As I said,I am so lucky that Botox works for me!",Pam reader
27,Botox,Urinary Frequency,10.0,Taken for 6 months to 1 year,"September 4, 2019",10,Nov 18 ...What can I say ??? My life was not good want to pee every 2mins or so it felt like that...I'm going for my second lot Sept it's made a massive improvement on my life. Yes its painful  when they do it but for me the pain only lasted a bit then I'm good. Yes  I had to self cath for few weeks but like I say it's worth it (for me ),Dondon
28,Botox,Urinary Frequency,10.0,,"August 29, 2019",13,"I have urinary retention with spastic bladder. I have self cath'ed for the last three years. I travel and it’s hard to keep supplies with me and I was having accidents regularly even with the self cath. I tried all the meds and nothing helped in the slightest. I received the Botox along with a suprapubic cath a week earlier. Best decisions I have made related to this issue. I have no spasms, leaks or accidents. I don’t have to carry supplies and my life is back. Truly it is back. I hope and pray itcontinues forever.",JohnnyG
29,Botox,Urinary Frequency,1.0,Taken for 5 to 10 years,"August 20, 2019",12,"Six weeks on from having Botox for my bladder and the only positive thing is that at least I know I tried it. Negative is it was a total waste of time and money. I wonder if I had any botox at all. I had general anaesthetic and a little brief discomfort afterwards. Specialist said maybe botox was over-active. Didn't spend more to go back. I'm hoping it will either get better or wear off anyway. Also, I've never noticed a strong urine odour before this and believe I've had mild 2 UTI's. Pleased I haven't had problems like others here. Will not have it again.",Ann
30,Botox,Urinary Frequency,,Taken for 1 to 6 months,"August 17, 2019",18,"My mom had the Botox injection done two months ago, the worst decision she’d ever made. She’s was in a lot of  pain when she had it done and still experience pain here and there till this day along with other side effect. People should read up on common and rare side effect from this procedure, weigh out pros and cons. Please think carefully before you decide to go for it. It’s awful to see my mom going through this whole ordeal and unable to help her.",HL
31,Botox,Urinary Frequency,1.0,Taken for 1 to 6 months,"August 15, 2019",21,"Had botox done in March 19 under local anaesthetic.  Told this was the all singing and dancing cure, total rubbish.   Not only was it extremely painful (according to clinicians only going to feel a slight scratch), it didn't work.  I was worse off than when I started after this useless treatment.  I would never have this treatment again and it is extremely painful under local.",KM
32,Botox,Urinary Frequency,1.0,,"August 3, 2019",13,"I had bladder BOTOX done on 2 Aug 2019 after suffering for years with urge incontinence, I had local anasthetic, a tiny bit of numbing cream,   and they assured me it wasn't too painful, how wrong could they have been, I felt everything they did, I screamed and cried in pain, it was like jabbing a red hot needle into raw flesh, she said nobody else had been that bad, there had to be one didn't there! After all that, it hasn't worked for me, I'm just the same as before  (insert swear word here!) I don't know if it will improve in a few days or not, anyway all I'm saying is if you do decide to have it done, have a general anaesthetic, you could have an extra sensitive bladder like me!!",Cathy
33,Botox,Urinary Frequency,10.0,Taken for 2 to 5 years,"July 3, 2019",21,"Hi i have an over active bladder, tried lots of tablets that worked for awhile then it wore off. I've required botox approx. once a year for four years. On two occasions I've had flu like type symptoms a couple of weeks after that have lasted for two weeks. But it's well worth it. I've always chosen to go for general anaesthetic as I was too scared to go for local. Today, my Dad went for bladder botox under local. And Dad said it was so painful they had to stop. I keep getting asked to go for local. I think this is to save money. I could be wrong. (Scotland)",Fi
34,Botox,Urinary Frequency,,Taken for 1 to 2 years,"June 21, 2019",16,I had this done by a urologist over a year ago and  that's the worst thing I could have ever done because it backfired on me. I have multiple sclerosis and I was told by the doctor because I tinkled a little bit when I coughed or sneezed that this would be a great thing for me so I wanted to do that because I didn't like the sneezing and cough problem. 2 days later after having injection I was in the ER with severe pain like I had  the worst bladder  infection a person would not want and then they gave me a suppository and that helped but that didn't last long and when I went back to the doctor who did this Botox all he could say was I'm sorry It didn't work for you and it ruined my bladder that now I have to wear briefs and this is really out of control so I would not recommend anyone because it didn't work for me and for the ones that did work for I say great for you...,Fancygal
35,Botox,Urinary Frequency,10.0,Taken for less than 1 month,"June 12, 2019",24,"I have MS and unfortunately for months I was suffering with overactive bladder issues and urine leakage. Urologist told me about procedure. I had this done under anesthesia.Its nearly day 4 and so far I feel amazing,I remember the day after waking up with not a full bladder at all. I don’t have to cath myself. but I do have to strain a bit to make it come out.But no pain or discomfort at all.",Sue
36,Botox,Urinary Frequency,10.0,Taken for less than 1 month,"June 5, 2019",33,"I had Botox for my overactive bladder and I must stay it is a miracle.  100%. Effective. Zero side effects.  After almost 20 years of worsening incontinence, one treatment restored me to normal control, like when I was a teenager. The procedure is a little painful, but totally worth it. I’m 71 years old .   Medicare covered it. I tried acupuncture in the ankle prior to this as a treatment, it was 100% ineffective.",Santa Fe Gal
37,Botox,Urinary Frequency,1.0,,"May 22, 2019",29,"I had Botox for overactive bladder December 13, 2018. Within  a week I couldn’t urinate at all and had to start self cath.  6 months later I’m still having to cath and have had 6 bladder infections that are becoming resistant to most antibiotics. I’ve even had to have a PICC line for IV antibiotics. This has changed my life and not in a good way. I see no end in site for the self caths and scared this could be continue forever.",Mia
38,Botox,Urinary Frequency,1.0,,"May 3, 2019",30,"I shared my experience earlier. I had botox on November, 2018 and 6 months later, I am still having to self-cath. I go to the bathroom more now than I did before, it has been horrible. I didn't think I would have to live on the toilet but I am. The botox has really affected my life and job negatively.  I have exhausted all other options and am wandering if I am going to have to live like this for the rest of my life. This has been such a horrible experience.",Cat
39,Botox,Urinary Frequency,10.0,Taken for 6 months to 1 year,"April 13, 2019",28,"Had my second set of Botox today  for overactive bladder problems, the first one lasted 8 months, could have gone longer but going on a trip in June and wanted to make sure I did not have to pack a suitcase full of pads.  Best decision I ever made. After five years of wetting all the time, not getting any sleep and quality of life awful, this has been a miracle.  Yes it is a little painful during the injections, but well worth the pain.",SB
40,Botox,Urinary Frequency,10.0,,"March 19, 2019",19,"Best thing I’ve ever done, I had urge incontinence and was rushing to the loo all the time. Had 200 mgs of Botox. It was very uncomfortable having the injections but didn’t take long. Had a bad month where I thought  ""I’m not having this done again"", but then it settled in. I sleep through the night. I have to self cath about 4 times a day. I can now go 5 hours without wanting to go. I’ve booked three holidays and regularly go out walking and travelling on public transport. Definitely a life changer.",Sally
41,Botox,Urinary Frequency,1.0,,"March 14, 2019",22,"I had Botox last Nov 2018 for my bladder and I hate it - it has changed my life. I go through more pads now and had to change to the bigger ones. I can't go anywhere for any length of time. I walk around the block have to come in and change a pad. Other then my surgery it was the worse thing I did. BUT I had to try I was desperate to get my life back.But I realize now that the life I had was okay, and now its gone.Good Luck",Tapper
42,Botox,Urinary Frequency,1.0,Taken for 1 to 6 months,"March 8, 2019",27,I had a Botox injection in my bladder in December and I had trouble peeing.  My bladder was in a lot of pain before I had this done too.  The severe pain did stop but still had some pain still with my bladder.  By February I was having severe pain again and infections again.  So that Botox injection doesn't really work.  It causes problems.  It is not good that you can't pee and that is what it does.  I much rather run to the bathroom several times then not be able to pee at all.  And my pain issue with my bladder is back so soon.  So I wouldn't recommend it to anyone.,help
43,Botox,Urinary Frequency,3.0,,"February 20, 2019",24,"I had Botox for the second time 23rd Jan and a week later I had to go to A&E as I couldn’t wee, they tied to put a catheter in but I was screaming crying as it was so painful, they eventually got it in and I had retained 518mls, I don’t use catheters now but the  sensation I get when I need to go is painful and I’m finding I have to squeeze the last drop out, I also get a shivering/shuddering sensation as I start to wee. The first time I had Botox was brilliant no problems at all that’s why I agreed for a second treatment, I’m never having it done again all I think about is my bladder, I’d rather wet my self than go through that again, can’t wait for it to wear off",Lulu
