,drug,condition,rating,duration,review_date,upvotes,review,username
44,Botox,Urinary Frequency,10.0,Taken for 1 to 2 years,"February 19, 2019",21,"So far the best decision for me. Had the injections Jan. 19, 2018 and is still working I make an appointment every month just in case but so far so good! I am so sorry for other peoples nightmare results as I must be one of the lucky ones!",ladiedi329
45,Botox,Urinary Frequency,1.0,Taken for 1 to 6 months,"January 21, 2019",49,"I would never do this again.  Since my injection one month ago I have had three trips to the ER, two foleys catheter put in, bleeding when I tried to self catheter and a physician who seems indifferent to my problem.  My life has become an obsession about being able to pee.  My QoL has been negatively affected.  I should have found this site before I let myself get talked into procedure.  What a mistake.",Q
46,Botox,Urinary Frequency,1.0,,"January 16, 2019",34,"I had the Botox in October 2018 for an overactive bladder. I  got told I could go into retention for a few days. This was the worst decision of my life. 3 days after the procedure  I couldn’t pee I was in agony so I got taken to A&E I was admitted and was in for 13 days.  I had an infection and was in retention fully, had a fullness feeling and was in chronic pain.  I got discharged with catheters and  I was so sore using the catheters I couldn’t use them. So ended up back to A&E admitted again another 5 days with a indwelling catheter in this time.  Then came home 3 days later the catheter got blocked the pain was that bad I couldn’t walk, sit, stand  or anything. I was sick so back again to A&E admitted again it’s now middle of January I’m no better.  I’m still using catheters. I've got the fullness feeling and can’t get on with my life.  I don’t get any feeling of needing a wee. All I can say is please look into it properly before deciding to have this. It is not worth it at all !!!!",Donna
47,Botox,Urinary Frequency,4.0,Taken for 1 to 6 months,"January 14, 2019",22,3 months ago I had my first injections. It made it so I go even more often in my pants. I read where someone did it a second time and they got better. I go in tomorrow for my second try. Mine is worse now than before I started treatment. I damaged something from my radiation. I was great until my 40 treatments of radiation. I hate wetting myself and feeling so dirty. I even decided to retire at 61 because sometimes I'd wet myself in front of customers. I pray this time it works. It's very depressing so now I am on depression meds.  Wish me luck,jimbo
48,Botox,Urinary Frequency,10.0,Taken for 6 months to 1 year,"January 12, 2019",31,"We were going on a 90 day trip, and I was used to doing PTNS  (Percutaneous Tibial Nerve Stimuation) every month.  I decided to try the botox so I would not have a problem on my trip.  Actually if I had read some of the horror stories on this blog, then I probably would have opted out.  I am glad that I had it done.  The procedure was painful.  Then the twinges afterwards were like mild labor contractions for about 12 hours.  Tylenol helped a lot.  I told my husband that I would never have it done again.  After the initial twinges and a few days it worked, and it has been amazing for 6 1/2 months, and it is still working.  I feel free from rushing to the bathroom.  I am now just wondering when it will wear off.  I will definitely be doing it again and just taking Tylenol that first day.  Just know that it hurts, then it cramps for a while, but to me it is so worth it.  I am hoping I can go without another treatment for 8 or 9 months.",snookie
49,Botox,Urinary Frequency,1.0,Taken for 1 to 6 months,"January 7, 2019",29,Had procedure in August 2018 and have suffered with constant infections ever since. Wish I could turn the clock back as I would not have had this done- BIG mistake.  I don’t think the risks are explained enough and they most certainly should be as a lot of people suffer negative effects from this treatment.  Think very carefully and ask LOTS of questions before making a decision.,Bennybenson
50,Botox,Urinary Frequency,2.0,Taken for 1 to 6 months,"January 2, 2019",28,"I had this done in December 2018  due to an over active bladder. I regret having this done.  Now I can't fully empty my bladder which brings on cramps. I rather deal with the over active bladder..  At least I felt relief when I passed urine. Now constant cramps, fullness and discomfort..",Bladder 1
51,Botox,Urinary Frequency,,,"December 28, 2018",31,"I had Botox a year and a half ago for OAB and it has never worn off. I’m in constant agony. I have to self catheterise nearly every hour or two, sometimes more. There’s times I’m cathetering every 20mins if I’ve had a drink. What ever goes into my bladder  has to come out right away or I am in agony. It’s ruined my life wish I had never got it done!!",Alana
52,Botox,Urinary Frequency,1.0,Taken for less than 1 month,"December 23, 2018",27,"I had the botox on 11/30 and on 12/10 I had to go to the doctor because my bladder felt so full and I could not urinate enough. They gave me catheters to cath myself which was hard for me to do, I always got at least 500 mL. I got 650 mL back, called the doctor and was told to go to the ER and get a foley catheter. I went back to the doctor on 12/19, had the foley removed. The next  morning, I had to cath myself again, I could only urinate a little. I went back to the doctor, after urinating they had a 650 mL urine return and they put another foley catheter in. I am in so much pain today I could just cry. I have had 2 UTI's since the procedure and am just miserable.",Cat
53,Botox,Urinary Frequency,7.0,Taken for less than 1 month,"December 22, 2018",29,So I’ve been taking medicine for overactive bladder for a long time and I’ve had some undesirable side effects from those medications. I’m only 27 and when my doctor told me about the Botox injection into the bladder I was skeptical but I told myself I would give it a try and at least then I would know so when I went into the doctor to get the procedure done it was pretty uncomfortable but here I am three days later and I can feel Definite relief for me. I wasn’t having any problems with leaking or peeing on myself it was just the urgency I was having to get up during the night up to 10 or even more. Anyways like I said I’m on day three and I definitely feel a lot of relief from the sense of urgency and my doctor said that it could take up to two weeks for the full effects to work so I am super hopeful that it will get even better than it already has overall I’m really glad I got this treatment I hope this helps,Shayster
54,Botox,Urinary Frequency,1.0,,"December 14, 2018",15,Had mine done 4 weeks ago my incontinence is worse. Goning through more pads per day. I'm glad I tried it  had to find out if it would help.  Now I realize that after my prostate surgery I have to realize a new normal and live with it. The one good thing about Botox is it wears off after a few months so I should get back to where is was before the treatment. Hang in there it does suck but it could be worse.,tapper
55,Botox,Urinary Frequency,1.0,Taken for 1 to 6 months,"November 10, 2018",22,"I deeply regret being talked into getting a botox injection by my specialist. I have an extremely small bladder capacity (about 100ml at best) and extremely high bladder pressure of 100 per 50 ml....This meant I was going to the toilet to pee every 20-30 minutes or so. It was frustrating, but somewhat manageable by wearing uridomes and leg bags. I was talked into undertaking a botox injection by my specialist and it has completely backfired for me. I am now urinary retentive and cannot pee at all. I have a constant sensation of having a full bladder and am needing to self catheter every 1-2 hours, day and night. Apparently I may be like this for several months until the effects of the botox start to wear off. It is now costing me a small fortune buying catheters, lube, hand sanitiser etc....I am going through about 70-90 catheters per week, so it adds up very quickly.",Cooper
56,Botox,Urinary Frequency,10.0,Taken for less than 1 month,"October 21, 2018",18,"I am so pleased! I had horrible pain and leakage, so much so that I would wet myself several times a day. I suffered for years! Diapers with pads couldn’t hold all the leakage. I had Botox last week, and from day 1 have had no leakage. I do have a little urgency, but I expect this to get better, and it’s not constant. I did check my residual urine amount via catheter to make sure I was not retaining. I found this very simple to do, and quite reassuring.  It was a little scary to have the Botox simply due to fear of the unknown, but everything is great and I’m so excited to have my life back!",Astromom
57,Botox,Urinary Frequency,10.0,Taken for less than 1 month,"September 21, 2018",25,"Had it done today. Worked for me right away. For once I feel normal again. That being said, I was given a percocet and valium one hour before procedure. Still felt half the needle sticks in bladder. Scale 1 to 10 , it was a 5.. but it was quick..Results almost immediate. I feel like my old self! I'm a 58 year old woman that had to double up on pads just to walk my dogs..Can't wait to walk them now.",Vicky
58,Botox,Urinary Frequency,1.0,,"September 14, 2018",32,This procedure has destroyed my life. My condition has gone from bad to bed ridden.  I cannot wait for this to wear off. Do not get this done without reading about the risks.,Frustrated
59,Botox,Urinary Frequency,1.0,Taken for 1 to 6 months,"August 29, 2018",27,"I had an overactive bladder before the botox treating. I had to urinate very often especially after drinking coffee or alcohol. Five weeks after the injection my condition has worsened. I urinate more often, in smaller amounts and the urge comes on very rapidly. I do not recommend this treatment.",Yves
60,Botox,Urinary Frequency,2.0,,"August 28, 2018",18,"I'm 20 years old, I was diagnosed with an overactive bladder a year ago. I have tried many pills and none of them have worked. I used to always walk every single day when I was bored or had nothing to do. I was outgoing but my background was really unhealthy, I was always depressed ever since I been like this I have had bad anxiety and depression. I always got sad when my family would travel somewhere out of town especially my partner to. I always wished I went to. I had Botox done on July 24 and it hasn't changed a bit. I haven't tried any thing else but I always wondered if anyone has been in my boat and felt like going all the time but embrasses to go every time you have the urge.?",Tee
61,Botox,Urinary Frequency,10.0,Taken for 2 to 5 years,"August 27, 2018",17,"After reading all the reviews, it is just like everything else.  It is good for some people and others not.  I have been on Botox for 3 years getting the procedure twice a year.   I have an excellent urologist and have had no problems at all.  It is not perfect but makes my life manageable.  I do use pads on outings as a precaution.  Ladies restrooms are usually full and sometimes hard to find and I don't want to take a chance.  At home, I don't need a pad.  I am sorry for all that have this problem starting at a young age.  I am in my late 70's and so glad for this procedure.  I am off to a cruise this Fall.",Lizzie
62,Botox,Urinary Frequency,1.0,,"August 26, 2018",32,"Worse decision ever. Prior to receiving Botox , I used to go to the restroom 5-6 times during the day and night. Now I go approximately 8 times during the day and 11 at night. I have not been able to sleep at all. Most of the time is just the urge to go but not able to empty my bladder. My life has become a living hell!!!!....Please, Please do not have this procedure.",Insane
63,Botox,Urinary Frequency,1.0,Taken for less than 1 month,"August 12, 2018",34,"I had a botox injection  into my bladder on June 21st and last year for four days I was fine and it felt funny not having pee running down my legs  then a couple days later I broke out really bad with rash all over my body and very sick and into the emergency room at two different hospitals.  I had a hard time breathing, sick to stomach and I could no longer urinate and had to use catheters for two weeks and I had to be put on 1 and a half worth of steroids pills and injections.  I almost died from not having anyone explain to me more about the dangers.  I am not still feeling like I was before the Botox. I had one injection that almost killed me. You will not submit because you don't want other patients to know the truth about what happened to me.  But I will make sure that the media will know and inform the public as to what Botox can and will do to some women like me.",Momma Cass
64,Botox,Urinary Frequency,7.0,Taken for 1 to 6 months,"August 6, 2018",11,"Got botox on my bladder 4 weeks ago after years of overactive bladder. Since then I've had 4 UTI's and now have to use a catheter as I was retaining urine, that's the downside. On the positive I've had no embarrassing accidents and certainly don't run to the loo like I used to. Nurse says it's early days so time will tell would I get it again???  Undecided on that one at the moment x",Kaz
65,Botox,Urinary Frequency,,Taken for less than 1 month,"August 2, 2018",17,"I'm 24 years old. Felt like my life was falling out of control. I would have to wear leakage pads every where I went. I literally got so depressed I stopped going out because I would have to leave the restaurant or leave a party to go home. I have been on several overactive bladder medications and this last one Myrbetriq has helped me but I was still having spasms. I went to a physical pelvic floor therapist and she did wonders on me. Unfortunately, my spasms came back and I felt bloated all the time! My urologist recommended Botox and we gave it a try. Let me tell you even though I felt some of the needles in my bladder. Was the best decision I ever made! I don't have to pee as often now, I can enjoy a public outing without the worries. I feel so much better!",RodeoQueen
66,Botox,Urinary Frequency,10.0,Taken for 1 to 2 years,"July 25, 2018",12,"My daughter at 21 suddenly developed an overactive bladder. She is in a wheelchair so it was a very difficult  and trying situation.We tried anticholinergic medication but it was unreliable and dried her out so she was always thirsty & it was a vicious cycle drink, pee, drink per 24/7.A friend told us how she had Botox for same condition so we gave it a go.100% effective easily by day 3 and just changed our lives - we now have 100 units every 7-8 mths .My daughter has her life back.",Relax
67,Botox,Urinary Frequency,1.0,Taken for 1 to 6 months,"July 17, 2018",26,"I had botox injection on June 12, 2018. The doctor never told me about urinary retention possibilities before hand or I would never have agreed to this procedure. I have had urinary retention since June 12 and still  have to self catherize 6 weeks later with no let up in sight. I am constantly sick like I have the flu. I have terrible urge to urinate constantly. This is  living hell for me between trips to the ER and doctor's office. I have lost over 20 pounds in 6 weeks. DO NOT HAVE THIS PROCEDURE DONE. I DO NOT RECOMMEND IT.",Toni
68,Botox,Urinary Frequency,9.0,Taken for 5 to 10 years,"March 6, 2018",17,"I have been getting Botox injections for 6 years now. I react differently almost every time. Sometimes it lasts a year or so, and other times only 6 months. I've had to use catheters for up to 4 months after, other times not at all. I always end up with infections though but that is normal for me anyways. All I do know is that no matter what, it's always worth it!!! I will ALWAYS pick any single side effect that happens to me over peeing uncontrollably all over myself! These injections have changed my life and I an truly grateful ",Anonymous
69,Botox,Urinary Frequency,5.0,Taken for 1 to 6 months,"March 1, 2018",11,Many more trips ro bathroom with very little output.  Gained 6 pound this week.Lots of urges with little or no pee.???,Papa
70,Botox,Urinary Frequency,8.0,Taken for 1 to 2 years,"February 20, 2018",12,"Best treatment I've had. I thought my active life was over. After several years of misery, missing out, avoiding people and feeling unclean, I have got my life back.",Lady Vics
71,Botox,Urinary Frequency,1.0,Taken for 1 to 6 months,"January 30, 2018",17,"Three hours in hospital for injection, $2,650.00,doctor bill  $249.00.  Results: I used to get up 4 1/4 times a night, now it's 5 or 6, one night 9.The urge to pee is so strong that it leaks before I reach a urinal and I can't hold it back.  Usually the urge to pee is so strong, I hurry to the toilet and nothing comes except pain in my penis.  Many times when I do pee it burns.  I just can't wait for the Botox to wear out..",Anonymous
72,Botox,Urinary Frequency,10.0,Taken for 1 to 6 months,"November 18, 2017",13,I have IC of the bladder and it helped a bunch!!,Susie Bouhaouli
73,Botox,Urinary Frequency,10.0,Taken for 1 to 6 months,"November 11, 2017",20,"I was very unsure about going ahead with this treatment, but nothing else had worked and have had OAB all my life. From the start of all the OAB treatments that failed and inconclusive results to my first 150ml injection was around 18 months. End of line treatment was Botox or acupuncture, so I opted for Botox. Well, it was definitely worth the wait and the procedure was very straightforward. Fully prepared with my chosen catheters ready to be used, I was pleasantly surprised to find I hardly used them. No UTIs, just a life changing feeling of no urgency. I've read some horror stories on here, maybe I'm lucky. Not getting up in the night anymore, no urgency, catheter free, it's the only treatment that's worked for me!",Jms71
74,Botox,Urinary Frequency,1.0,Taken for 6 months to 1 year,"October 17, 2017",34,"I had 200mg ( a large dose) of Botox injected into my Bladder in August 2017. I got an infection within days of having the procedure. I went straight into retention. It has now been about 12 weeks since the procedure. I am still having to use catheter and I am never free from infection. I have spent nearly three weeks in hospital due to complications with UTI resulting in Kidney damage.I am on a very rare Antibiotic that my own GP and local chemist had not heard off. I truly hope that this Antibiotic does the trick as I don't think that I am going to be able to cope with the outcome of the Botox injections for much longer. I wasn't given an Antibiotic after the procedure, the outcome may have been different if I had.",Littlev
75,Botox,Urinary Frequency,10.0,Taken for 5 to 10 years,"October 16, 2017",29,"I've had botox injections 5 times and would definitely recommend it. They say it lasts for 6/8 months but mine have lasted the longest being 2 years. I'm very pleased with the outcome of it, it has made a massive improvement in my life.",Nannies girl
76,Botox,Urinary Frequency,1.0,,"October 8, 2017",28,I had Botox for an OAB. Before I had a terrible urge to go but I could not fully empty BUT I COULD GO ! The date is Oct in April it would have been three years since I had this done. At the beginning I was reluctant but my urologist recommended this. I was told I was going to have to be totally reliant of self catheterisation  which I was ok. She did however say there are instances where the Botox would get rid of the urge but you would still be able to pee. A week after having Botox I have been 100% reliant on catheters. Without them I have urinary retention I cannot go at all.  I feel totally let down by the medical profession and the company that makes this drug as they have washed their hands of me and the only suggestion is to have MORE Botox !,Gray79
77,Botox,Urinary Frequency,1.0,,"September 25, 2017",33,"I've had bladder problems since the age of 13, got worse around 15 but could still go out even though I was using the toilet every couple of hours then at 18 I stopped leaving the house as it got so bad. I'm now 23. I had Botox in June and I can't wait for it to wear off. So ill all the time, feels as if I constantly need the toilet more that ever, pains in my bladder and sides, had to use a cath but can pee a little tiny bit. Was at the doctors on Thursday and he said I've got an bad infection that I've had for a while as there's blood in it. This Friday I go back to the hospital that I had Botox done for a check. I'm at my wits end, have no clue what to do anymore and I feel like I'm never going to get better",Lou2345
78,Botox,Urinary Frequency,,,"September 2, 2017",23,"I have had overactive bladder for many years and have found Botox to be a life changer. It has made a big difference to my quality of life, although I am still wearing protection at night. The only down side is having to wait so long for repeated treatment when the effects wear off as symptoms seem to come back with a vengeance. For me it lasts for about 4 months. Yeah I have to self catheterise but I don't think that is much of a problem. Can't wait for my next dose as I have frequent accident without it.",Col69
79,Botox,Urinary Frequency,10.0,,"August 31, 2017",31,"Let's just say LIFE CHANGING!! Good bye pads - hello active lifestyle!  I've had this procedure twice and am excited to be going for the third time tomorrow!  I have a great doctor who has been with me every step of the way since I asked him about it in 2015.  It sounds like I'm one of the lucky ones - besides pain/cramping during urination that first day (which Ibuprofen helps!), and a couple of UTIs shortly after each procedure, I've suffered no ill-effects, but have experienced a dramatic improvement in all issues I've had with painful urges, frequency, and leakage.  Mine lasted a full year each time before I noticed any degradation, and it was almost 18 months before I was 100% back to the old symptoms.",lrz
80,Botox,Urinary Frequency,3.0,,"July 26, 2017",33,"@Colbak - I too had the sling surgery. It took care of the laughing, coughing, etc. accidents. I had difficulty emptying my bladder. I couldn't sit to urinate, I had to squat like a linebacker. I had to go pee every 30 minutes. And when I had to go, I went from no urge to running and barely getting my pants down. My urologist said that I could a. Have the injection. b. Have bladder snipped to ""undo"" the surgery. Or c. Go to a dr. in Pittsburgh (close to me) and have a pacemaker type device put in. I got the injection a little over a week ago. The first day I was really crampy. Now, I can't fully empty and its getting worse everyday. I thought it was a UTI ,but now I have to self cath. I also go (trickle) every 15 min. Grrr! Hope this helps!",GeckoLane
81,Botox,Urinary Frequency,1.0,,"July 7, 2017",47,This is my last post as I am finally able to empty my bladder after having to self-cath every 4-5 hours for 6 months! I will never do Botox again for OAB.,RB2020
82,Botox,Urinary Frequency,1.0,,"June 19, 2017",39,"I had 200 units of BOTOX injected into my bladder 4/52. Worse decision ever! I struggled to pee on the first night and requested an indwelling catheter to be able to rest. On discharge I could void a little, but not too well. By the following week the retention was so uncomfy I went to the GP who sent me for a scan. I was retaining 380ml. Drained bladder and showed me how to self cath. I wasn't very successful. Had a day with Gyny and nurses following week and they ended up putting in an indwelling cath. Been weeks now. Had it out for 2 hours and retained 680ml I couldn't void. Awful awful feeling of being so •full•  Huge regrets I took this route, 4.5 years post a TVT for stress + urge incontinence that didn't help.",SuzyR
83,Botox,Urinary Frequency,1.0,,"May 28, 2017",48,"An update from my post on March 7- I still cannot empty my bladder and have to self-cath. The Botox treatment was December 21, so now it has been five months! I am beyond frustrated! I have no idea when and if my bladder will ever be normal again.",RB2020
84,Botox,Urinary Frequency,10.0,,"May 20, 2017",45,First had Botox injections March of 2016.  Doctor stated it would last six to nine months.   Lasted 13 months and no side effects.  Last week had my second injection as an outpatient.  Took about five days to have me back to normal.  Best choice I made for my OAB.  No problems at this time and hoping it last at least nine months.,BK
85,Botox,Urinary Frequency,2.0,Taken for less than 1 month,"May 17, 2017",30,So I just had the botox done yesterday.  I was really hoping for possible reaction but with in a few hours I couldn't urinate called the Dr on Call and pissed (pun!) me off for he never called me . I had to go to my own hospital for 3 hours which was way to far. The hospital drained my bladder all though not much in it and had me begging him please there is still more iron in there he said nothing I'm sorry. I went to there bathroom  5 more times. I have one of the worst cases and next is getting the box implanted.,Rpoole
86,Botox,Urinary Frequency,5.0,,"May 11, 2017",35,"I just had my third botox treatment.  The first was great.  It was painful but worth it.  I did not retain urine or have an infection. What a relief. The second one was 7 months later and I had good results.  This third one was nine months later and after 6 weeks I have not had any positive results.I have an appt with my urologist to see what we can do, but it is very disappointing to go through this with no results. I thought I could control this urge incontinency for life.",Haiku24
