,drug,condition,rating,duration,review_date,upvotes,review,username
55,Olanzapine,Depression,1.0,,"February 7, 2020",15,"I have had depression and anxiety for many years. I believe my psychiatrist falsely diagnosed me as having mild psychosis because of my description of my traumatic history in an unusual religious culture. I talked about demons but was not experiencing voices, images or delusions. It was just part of the culture. Olanzapine ruined my physical health - high blood pressure, severe weight gain and continual tiredness. As it sedated me I stopped talking about my issues. This made others think my mental health improved but inside I was suffering the same experience of trauma. I was threatened with detention if I stopped taking the medication until I resisted with legal action. The whole experience caused issues with my finances, my career and my health and I have struggled to recover. Maybe this medication would help with genuine psychotic issues short term but off-label usage caused me harm. I would recommend reading the works of Joanna Moncrieff before taking or prescribing this drug.",Lasered
56,Olanzapine,Depression,1.0,Taken for 2 to 5 years,"December 18, 2019",80,"Zyprexa (olanzapine):This drug is awful,  I should've stopped from day 1, now I'm in the 4th year and just started tapering because I'm one of the good boys that always listen to his parents and doctors.Please don't be a fool, don't take this drug it will make you lose years of your precious life.  Better be drug free as you know the only winner of your supposed condition is the big pharma that only wants your money every month.",serj
57,Olanzapine,Depression,1.0,Taken for 1 to 6 months,"December 14, 2019",15,"Well, I have an obsessive personality and refractory depression mixed with anxiety. Was put on olanzapine 2.5mg. The first 2 weeks were amazing. I felt euphoric and energized and slept much better. Then everything went haywire. I don't really know what was happening but life just seemed just too hard. So weaned my dose down 1 month at 2.5mg -> 2 weeks at 1.25mg -> Stopped 14 October -> 2 amazing days without it -> About 1 month of horrible withdrawal. Currently with lots of brain fog that never really had before but not suicidal anymore.",AliceVai
58,Olanzapine,Depression,9.0,Taken for less than 1 month,"December 9, 2019",11,Added 2.5mg to Viibryd. I was only going to take it when I need to but after only 3 days trial my depression has lifted so well that I want to keep going on it daily. I weigh myself every day and if I see some changes I'll only use it occasionally.,Clem
59,Olanzapine,Depression,3.0,Taken for 1 to 6 months,"November 29, 2019",14,Olanzapine on its own was not particularly effective for depression. I didn't enjoy anything and this didn't change that. It also made me lazy/unmotivated/tired. At the 20mg dose it caused sexual side effects . I think it is more effective for acute mania than acute depression.,John
60,Olanzapine,Depression,,Taken for 6 months to 1 year,"November 15, 2019",10,"Developed tolerance on olanzapine after 9 months, like all psychiatric drugs and the withdrawal symptoms were terrible. Glad I came off this stuff.",Hate psychiatric drugs
61,Olanzapine,Depression,6.0,Taken for 1 to 2 years,"October 29, 2019",78,"Zyprexa (olanzapine):Hi all,I've been on Zyprexa for about a year and a half at 15mg. I was put on Zyprexa to help with severe treatment resistant depression. I also take 150mg of Effexor and 300mg of Welbutrin. In the past year my depression has slowly gotten worse and I suspect it's the Zyprexa. About 3 months ago I decided to taper myself off Zyprexa. I went from 15mg to 7.5mg for 3 months. I experience moderate sleeping issues (I sleep between 4-8 hours and wake up about 10 times during the night), nausea and a dramatic increase in depression. My highs are lower and my downs are longer and more severe. My two questions are this: 1) Has anyone experienced increased depression as a result of taking Zyprexa 2) Has anyone experienced an increase in depression as a result of Zyprexa withdrawal.",Josh
62,Olanzapine,Depression,1.0,Taken for 6 months to 1 year,"October 26, 2019",20,"I was injected with this drug because I had a psychotic episode. It took care of psychosis but it developed tolerance for negative symptoms and depression so I got depressed while on the drug (because your brain stops producing serotonin while on it). Quitting it was very difficult but I managed and now am in remission only with vitamins and nutrients. They can  treat mental disorders! You can read more about this in William Walsh'es book ""Nutrient power: heal your biochemistry and heal your brain"".",Radastas
63,Olanzapine,Depression,,Taken for 6 months to 1 year,"October 14, 2019",28,"I was prescribed with 10 mg of this rubbish. Now after 1 year I feel totally like garbage. Was prescribed for shizophrenia and now I wonder did it damaged my brain. I lack of motivation, I've gained weight, I feel tired and unmotivated to do just regular activities like to brush my teeth. I'm off of it. Don't take it, it is just a bunch of rubbish.",Anonymous
64,Olanzapine,Depression,10.0,,"September 13, 2019",42,"I have been on many different anti depressants for depression and for insomnia/PTSD. So I started on Prozac 20mg a day. I had relatively no side effects! I started sleeping a bit better and wasn't so unhappy.  But I still wasn't feeling myself. So, I read up on add-on type products and found olanzapine as a great combo with Prozac.  I got that prescribed but sat on it for a while because I also read all the horrible side effects and got scared. But after a month still not feeling myself, I decided to try a very small dose.(I read you could split the pill safely),that way it would be easier to get off of it. So, I cut a 5mg into eight pieces... so .625 mg - a couple hours before bed. I slept better than I had in years! I've been taking it for about 2 weeks. I again, lucky, have had zero side effects. I feel AMAZINGLY happy!! I am going to stay on the super low dose. I hope this helps someone, maybe you can ask your MD about taking a smaller dose to get the good effects and not the bad ones.",Tookie
65,Olanzapine,Depression,,,"September 11, 2019",23,"I just wish to cry and let out my emotions but I can not. I sit there trying, but can't. Want to get off olazapine. Been feeling overwhelmed and anxious. Feel really terrible.",Timkerbell
66,Olanzapine,Depression,9.0,Taken for 2 to 5 years,"September 3, 2019",9,This is the second time I have been prescribed this and for the same symptoms of anxiety and not being able to eat. Both times I stopped taking it I felt better almost immediately and appetite returned to normal,Tad
67,Olanzapine,Depression,1.0,Taken for 2 to 5 years,"August 15, 2019",122,"Zyprexa (olanzapine):Zyprexa made me dull and gain weight, then found its impossible to stop taking. Even with a very, very slow taper, I have terrible withdrawal symptoms that I never ever experienced before olanzapine. I only took 1.25mg, and after 3 years of tapering  I'm down to about 0.7mg. Now I have heart arrhythmia, akathisia, insomnia, I feel dazed and out of it, erectile issues, and don't feel pleasure or get excited about anything. Olanzapine has ruined my life. If I could do one thing differently in my life it would be to never ever start taking this horrific drug.",Trapped1
68,Olanzapine,Depression,,Taken for 1 to 6 months,"July 19, 2019",55,Zyprexa (olanzapine):I hate this drug so much. It made me feel so tired at work and I couldn't focus. Almost got fired from my job thanks zyprexa.,Anonymous
69,Olanzapine,Depression,1.0,Taken for 5 to 10 years,"June 24, 2019",92,"I have been a teacher for the 28 years. I was diagnosed with depression. I was prescribed with olanzapine. Once on olanzapine My life was totally changed. I could not act like a good teacher. I could not work properly. I was sleeping  18 hours a day. I put on weight. I was hungry all the time. My depression did not go away, it became worse. I couldn't speak , couldn't think properly. Please don't take this medicine.",Josh
70,Olanzapine,Depression,1.0,Taken for less than 1 month,"June 13, 2019",87,"Zyprexa (olanzapine):Stay away! I took 15 mg  Zyprexiafor 2 weeks and I  feel so tired, my vision is blurry , weak hand-eye coordination, and its difficult to speak or understand anything. Why is this drug still being prescribed???",Vani
71,Olanzapine,Depression,1.0,Taken for less than 1 month,"May 16, 2019",39,Olanzapine made me feel terrible- I was prescribed it for a depressive episode and quickly found (within a few days) that I felt worse- I was in a constant state of feeling despair/panic/anxious as a result of it.  I then went back to a different doctor who immediately withdrew this drug (luckily it had only been a few days) I was then prescribed Escitalopram which I used for a couple months.  Olanzapine is an extremely strong drug that was wholly inappropriate to my treatment,Nat
72,Olanzapine,Depression,10.0,Taken for less than 1 month,"May 15, 2019",58,"As far back as I can remember, I have always had anxiety and depression. But the last 2 years had been a complete  awful. My doctor ‘experimented’ with more than 25 medicines including SSRIs, SNRIs, benzodiazepines,   antipsychotics, TCAs, lamotrigine, lithium etc without any result. I was bedridden and had lost all hope. Enter olanzapine and life took a complete U turn within 2 days , it has worked so well for my depression, I have never felt like this since childhood. Just wanted to thank the inventors of this magical drug.",Depression Slayer
73,Olanzapine,Depression,2.0,,"April 26, 2019",25,I have been taking HALF of a 2.5mg dose for a few months. It makes me so exhausted I can barely think straight. It does help with anxiety but only so much in that it puts me into a complete state of exhaustion. I feel mentally and physically depleted. The level of drowsiness/impairment concerns me at what is probably considered a sub-therapeutic dose.,zuser
74,Olanzapine,Depression,2.0,,"April 19, 2019",92,"Zyprexa (olanzapine):put on this drug for anxiety, loss of weight, not sleeping, all connected with something that happened to me. On it for a month at 10 mg and had pounding blood pressure in ears, sudden headaches, ankles swelled up 2x their size, gained 25 lbs. in a month, huge appetite, foggy thinking, flat personality and dizzy. After I got off, I felt much better. Off  it now for 2.5 months and I can't lose any weight, and in fact am still gaining, so can't get it out of my system. How can i get it out of my system? I don't want to become diabetic or get heart disease, but this drug can do that and I'M NOT EVEN ON IT! Doctors are putting people on it that should NOT be given this drug, it should be a last resort if at all. This drug can cause permanent changes chemically, in metabolism and dopamine receptors in brain-is there no antidote?",maddie
75,Olanzapine,Depression,1.0,Taken for 1 to 6 months,"March 27, 2019",76,"Zyprexa (olanzapine):Zyprexa made me feel very tired and irritable. I almost cussed my boyfriend over a small convenience,  My  eyesight kept blurring up, always hungry, and then I started getting this uncomfortable drowsy feeling that lasted the whole day. STAY AWAY from this garbage.",Anonymous
76,Olanzapine,Depression,10.0,Taken for 1 to 6 months,"February 21, 2019",20,Zyprexa (olanzapine):I’m taking this with pregabalin Slowly helping anxiety and depression. Anyone take zyprexa on it’s own?,Mimismum
77,Olanzapine,Depression,,Taken for 1 to 6 months,"December 24, 2018",44,Seems to be making my depression worse. Anyone else have a similar reaction?,Bradkling
78,Olanzapine,Depression,,,"November 16, 2018",33,Guys this drug made me manic as anything.  I was on this for 3 months. DON'T touch it if your sensitive. I started getting really dark thoughts which I've never had before. DON'T do IT,Jonas
79,Olanzapine,Depression,1.0,Taken for 1 to 6 months,"October 31, 2018",47,"Zyprexa (olanzapine):A doctor said I had bipolar and put me on Zyprexa and Lexapro. It was a nightmare, I told my doctor it made my depression worse and that I developed restless leg syndrome while on it. The doctor completely ignored me. After months of this horrible nightmare, I switched doctor's and was told I am NOT bipolar, but suffer from depression. I was tapered off Zyprexa and now I feel 100% better. Thankful",Me
80,Olanzapine,Depression,10.0,Taken for 1 to 6 months,"October 14, 2018",76,I have been on it for a month now. Its been great. I don't have the weight gain problem or the sexual problems. I basically laid on the sofa with the blinds pulled shut for 3-4 years depressed. I take it at night and zoloft in the morning. I don't feel at all like a zombie in fact I feel great. I'm off the sofa doing things I love again. I sleep regularly and have a positive out look on life once again. This drug has changed my life for the better. I hope this helps someone.,Brian
81,Olanzapine,Depression,8.0,Taken for 1 to 6 months,"September 30, 2018",45,"Zyprexa (olanzapine):I have ever been a fan of antidepressants as I feel they are a bandaid for underlying problems. I starting to think differently. My doctor put me on 2.5 mg along with 0.5 Xanax. After years of feeling depressed and hopeless I now have more energy, sleep well at night waking up feeling great. I have also have gained weight which I needed to do. I give Zyprexa a 10 stars",Lilone
82,Olanzapine,Depression,9.0,Taken for 6 months to 1 year,"September 16, 2018",28,Zyprexa (olanzapine):I've been taking zyprexa for 1 year.   I had obsessive thoughts it has helped me very much.,jizzhue
83,Olanzapine,Depression,1.0,,"September 8, 2018",29,"Worst medicine. It ruined my life from all aspects. I suffered from lack of sleep, shivering hands, strong appetite. This medicine makes a person feel unconscious. It's very appalling , and it should be banned!",Lana.179
84,Olanzapine,Depression,1.0,Taken for less than 1 month,"August 24, 2018",16,Ruins bladder of the  patient,Sec
85,Olanzapine,Depression,1.0,Taken for 1 to 6 months,"August 1, 2018",21,No effect other than gaining 35 kilo. For me olanzapine made my condition worse not better.Please be very careful if you take olanzapine,Jensen
86,Olanzapine,Depression,9.0,Taken for 6 months to 1 year,"June 8, 2018",29,Zyprexa (olanzapine):It is very good drug .It  helped me very much with obsessions and depression. I recommend it to you,09dibbie
87,Olanzapine,Depression,5.0,Taken for 1 to 6 months,"April 7, 2018",12,"I was on olanzepine and fluoxetine for depression, and it helped with my depression but the olanzepine was far too sedating and made me feel emotionally numb and indifferent.  I was also on Vyvanse for ADD at the time and it essentially eliminated the effect of the Vyvanse. It also increased my appetite significantly, and I ended up putting on 10lbs in a month and a half, so I stopped taking it and had no issues with any withdrawal symptoms.  Overall it helped with my depression somewhat, but it didn’t give me any benefit apart from being not depressed and emotionally numb.",Sjfvry146
88,Olanzapine,Depression,4.0,Taken for 6 months to 1 year,"February 14, 2018",23,"I have been on this drug for the last several months on 5 mg/day.  For most of my life, I have been underweight or at a healthy-weight level (work out on a regular basis). However, with this drug, I am overweight even though I am on a caloric-restricted diet.This drug initially caused a noticeable increase in suicidal thoughts and ideation as well. Eventually, it wore off for the most part. However, I no longer feel anxious but I also kinda feel ""empty"" inside -- I don't feel fully human, almost like a robot. I am trying to get off this medication because I felt that while it did improve my depression/anxiety - it robbed me of my motivation, personality, and a fully functional brain. My cognition has taken a noticeable decline since on this medication -- I feel like I stepped back into the 7th/8th grade, mentally. Also, short-term memory has significantly declined.",jamaas9
89,Olanzapine,Depression,5.0,,"February 10, 2018",15,"Olanzapine isn't as bad as it is depicted by many people here, which I guess is mostly because I've been on it only for 3 weeks and on a fairly low dose of 5 mg. The positive effects I've found are that it suppresses unnecessary and stressful circling thoughts and makes you focus on reality. On the other hand it has subtle side effects such as sleepiness and fatigue (when first taking it), weight gain (which is I guess sorta good in my case since I'm underweight) and some slight extrapyramidal symptoms and spasms. It can also make you feel emotionless like your head is empty and you keep zoning out in the middle of things. All in all I suppose this drug would be useful for some other conditions, but this one isn't for me; I think I've been misdiagnosed.",OlanUser
90,Olanzapine,Depression,,Taken for 1 to 6 months,"February 7, 2018",18,The mixture of fluoxetine 60mg and 5mg of olanzapine got rid of my depression in a week! I gather that this combo is very effective and thank God it worked for me.And I haven't gained any weight after two months on it.I'm very lucky in this respect because a lot of people do.,Eben007
91,Olanzapine,Depression,9.0,Taken for 6 months to 1 year,"February 2, 2018",16,"Taking 2.5mg Olanzapine in combination with 150mg Pristiq for moderate/severe major depressive disorder and anxiety.The combination works well for me, relieving severe depression (suicidal thoughts, delusional, panicky thinking, etc) and completely eliminates anxiety/panic attacks.  The only downside I've noticed is an increase in weight, even though my calorific intake of food has not increased and I'm just as active as before.",Blookie
92,Olanzapine,Depression,6.0,Taken for less than 1 month,"January 5, 2018",25,Zyprexa (olanzapine):My husband started zyprexa a few days ago and all he can do is sleep. Is this normal and how long will the sleepiness last,Russfamily7
93,Olanzapine,Depression,,Taken for 1 to 6 months,"December 12, 2017",26,Zyprexa (olanzapine):I took this medication many years ago and gained 50 lbs in the first month of taking it. It is horrible nasty stuff and didn't do anything for my moods. I went off it  after that first month.,south pole
94,Olanzapine,Depression,,Taken for less than 1 month,"December 3, 2017",18,"After years of trial and error with antidepressants and anxiolytics, I finally asked to try an antipsychotic. I take 10mg of olanzapine with 75mg effexor each day. The combination is quite effective compared with antidepressant mono-therapy. I wish I'd been on this combination long ago. Helps particularly with suicidal thoughts and getting a new perspective on depressive thought processes. It also starts working faster than antidepressants, which was important in my case.",Roger322
95,Olanzapine,Depression,,Taken for 10 years or more,"November 30, 2017",9,I have been taking olanzapine 5mg for 11 years after been admitted to a psychiatric hospital for severe depression  and had electric shock treatment Have had severe side effects of this medication,Anonymous
96,Olanzapine,Depression,1.0,Taken for 5 to 10 years,"September 15, 2017",83,Zyprexa (olanzapine):Zyprexa withdrawal is the worst thing that has ever happened to me in my 55 year old life. I took 2.5 mg for 6 years. Sure it helped me sleep for a few months and that is why I did not know what was causing the terrible grief and over all health problems I was experiencing. I was fainting without warning because of this drug. It ruined my life and I have not touched zyprexa in almost 2 years! It is a drug so terrible it should not be prescribed to anybody. The makers of this drug should be totally ashamed of themselves. They really should be punished for what they have done and continue doing to peoples lives with this drug. No joke.,Ed McLendon
97,Olanzapine,Depression,1.0,Taken for less than 1 month,"July 23, 2017",42,Zyprexa (olanzapine):I was only on Zyprexa for 10 days but it made me so tired I couldn't even function. All I wanted to do was sleep all day. And it made my depression worse. I was so depressed by that 10th day that I almost quit my job because I just felt like I couldn't handle any stress at all. So glad I stopped taking this drug.,cmac527
98,Olanzapine,Depression,8.0,,"July 10, 2017",34,Zyprexa (olanzapine):Works wonderfully for anxiety and works fast. Does help together with Prozac for depression.,Biancapixi
99,Olanzapine,Depression,7.0,,"May 30, 2017",25,I started on this as I was psychotic and had severe depression. I was seeing things. This med was great after it was upped to 15 mg but  now after 2 months not working so great. Luckily I'm not seeing things but no energy and weight has ballooned. I can't stop eating. So don't know what to do. Gained 70 pounds in a couple months,Twasabug
100,Olanzapine,Depression,4.0,,"April 12, 2017",17,The side effect have taken over,Lucious
101,Olanzapine,Depression,9.0,,"April 4, 2017",19,Its good for preventing psychosis. The only side effects I am having is I sleep a lot and can't control poop for long and end up pooping in my pants sometimes. Btw I am taking this medication for one year.,Gaurav Rai
102,Olanzapine,Depression,3.0,,"February 6, 2017",22,"I was given olanzapine 2.5mg six days ago.  I already take 40mg prozac. I think I've tried every med going for anxiety and depression and I haven't responded well to any of them.  I  started taken meds about 9yrs ago...after 6 days I've done a lot of crying and feeling strange, a lot of negative things but I am willing to persevere as two positive things have happened.  I can eat dinner where as before I could barely eat a thing and I seem to be feeling motivation just in a small way but thats a massive improvement on sleeping all day as I couldn't face getting up and another day. I'm hoping this med will give me my life back, although anxiety feels worse and irritible and a bit snappy....",curly72
103,Olanzapine,Depression,7.0,,"December 23, 2016",39,"Zyprexa (olanzapine):Definitely relieved morning anxiety attacks. I'm also taking Effexor and Klonopin. I take the Zyprexa at night because it does make me sleepy. I wasn't eating anything at all before starting this drug, so I'm not worried yet about the weight gain; I'm not overdoing it with the food. I don't plan to be on this for long; my doctor told me it's not really a maintenance medication. But if it gets me through the Holidays and my horrible anxiety about work, I'm fine with that.",Maxiemar
104,Olanzapine,Depression,6.0,,"November 20, 2016",18,"I've been on this drug for a manic episode.  I was given 15 mg. which did wipe out the mania.  Now I'm on the other side, the depressed side.  I asked for prozac but the doctors insisted that a low dose of olanzapine would stabilize the depression.  My depression is reactive:  i sold my house and moved to another state to be closer to my job.  I have hardly any friends here as I'm starting over.  It remains to be seen if this low dose at 2.5 mg. will help with the depression.",Larasue
105,Olanzapine,Depression,1.0,Taken for 5 to 10 years,"November 5, 2016",32,Zyprexa (olanzapine):In 2010 I take Zyprexa 20mg for 2 months. Now I manage to eat one meal a day cause I got diarrhea up to 5 times per day. I'm surprise to be alive.I hate so much what Zyprexa did to me cause it's so awful.,piceli
106,Olanzapine,Depression,5.0,,"October 25, 2016",18,"Zyprexa (olanzapine):For a few days its take major energy at 2.5 mg, but later its make me ever tired and sleepy. I don't know what this drug work.",Unexist
107,Olanzapine,Depression,1.0,,"October 21, 2016",29,"On this drug which I've taken for a just a few weeks,  I have now developed a chipmunk memory. I can barely remember anything past 3 or 4 seconds, and I feel as though I almost can't think or hear my own voice in my head. Hopefully these effects will change when I'm off it, but as of right now, I don't feel quite normal yet.",Mola12
108,Olanzapine,Depression,2.0,Taken for 1 to 6 months,"October 2, 2016",43,"I had severe depression and was told by the psychiatrist that I also have psychosis. Was given 2.5mg of olanzapine. Maybe it helped with psychosis a bit but it made me even more depressed because I kept gaining weight, started to think slower, my vocabulary decreased and I found it difficult to express myself or make jokes. Started to have difficulties with doing my job and comprehending new information.Olanzapine really slows down your cognitive abilities and information processing! I found the benefits not worth the drawbacks and stopped taking it. Now I am taking Cytomel and it has been helping me much more - lost all the weight that I gained, have much more energy during the day, back to normal thinking abilities.",ayahuasca
109,Olanzapine,Depression,8.0,Taken for 5 to 10 years,"September 3, 2016",27,"I've been off and on this drug for years. It's extremely effective and fast acting, unlike the other psychotropics.  It's a powerful med and should only be used sparingly.  I'm not schizophrenic or have bipolar but I have some kind of delusional problem; I might have borderline personality disorder, and growing up they thought I might have asberger's, but I'm very social?  Mental illness has affected my life, (in a bad way), since I was 15. I've had multiple intentional drug overdoses and tried to hang myself, (not by trying to break my neck).  My last suicide attempt happened because I went off 20 mg's a night, cold turkey. That paired with my infatuation with this girl that doesn't ever think about me, caused me to hit rock bottom.",Matt hyer
