,drug,condition,rating,duration,review_date,upvotes,review,username
0,Olanzapine,Depression,10.0,,"April 1, 2022",0,This pill helped to get out from my laziness due to depression .I take it once daily before bed. Now I am very active in my life with no worries,Shahid Muneer
1,Olanzapine,Depression,9.0,,"February 26, 2022",1,"It is my second month on Olanzapine, but it saved my life. I take 5mg for depression, and I haven’t been better! (I also take 20mg escitalopram)",Ffff
2,Olanzapine,Depression,1.0,,"February 24, 2022",0,It messes with my  sexuality. It made me 50 pounds over weight. I can't really exercise because it gave me lower back issues,Annie Marie sul
3,Olanzapine,Depression,1.0,,"February 21, 2022",1,Zyprexa (olanzapine):I'm noticing zyprexa causes physical deformation in my lower back and knees. It also is causing hair loss. Thanks,Annemarie Sulli
4,Olanzapine,Depression,1.0,Taken for 5 to 10 years,"February 14, 2022",4,Zyprexa (olanzapine):I quit taking 2.5 mg Zyprexa cold turkey after taking it for six years! It was absolutely by far the worst experience in my 60-year-old life! This drug should not be on the market! It took me a full year to almost recuperate from having taken it. It works to sedate you but the price you will have to pay in the end is NOT worth it. I am guessing that most people stay on this poison because the withdrawals are absolutely horrific and take months to subside even just a little bit!,Egghead Ed
5,Olanzapine,Depression,1.0,Taken for 10 years or more,"February 7, 2022",1,Since using this drug I have had lower back issues.,Annemarie Sulli
6,Olanzapine,Depression,5.0,Taken for 1 to 2 years,"January 29, 2022",1,After a year taking olanzapine I developed an oculogyric crisis which I have to say was the most embarrassing and debilitating condition I’ve ever had. My eyes would flick upwards uncontrollably for hours at a time. I had to come off this Immediately as movement disorders are common with anti psychotics. I went down to 5mg every two days for 2 weeks then nothing and I’ve had no withdrawals whatsoever. I was so terrified after reading these reviews but I guess I was lucky that I’ve had absolutely nothing. Please don’t be scared to come off this.,Depression110
7,Olanzapine,Depression,10.0,Taken for less than 1 month,"January 4, 2022",3,"Zyprexa (olanzapine):After being prescribed zyprexa for depression I immediately went to Google for reviews, they were horrible!!! In all honesty it works for me yet I'm on a small dose of 5mg at bedtime. I can tell a huge difference in my mood. I can't speak for anyone else but I hope to continue taking zyprexa until hopefully I no longer need it.",Hazyholyquran
8,Olanzapine,Depression,10.0,Taken for 1 to 6 months,"December 24, 2021",2,"This drug has been amazing for me. I have used it in the past for postnatal depression and anxiety. My weight has stayed the same this time around while on it (my third time on it), although I can't lose the excess baby weight (only 4lbs to lose). I'm on 5mg at night and 2.5mg in the morning. My mood and anxiety is so much better and I wake up feeling refreshed every morning after a good night's sleep.",Anonymous
9,Olanzapine,Depression,1.0,Taken for 10 years or more,"November 27, 2021",4,Zyprexa (olanzapine):Can cause major weight gain.  I gained at least 50 pounds taking this drug. It makes you really over weight. If you are on it exercise every day and control your food intake. Probably find other ways. It is a big damper in the healing process.,Annemarie sulli
10,Olanzapine,Depression,7.0,Taken for less than 1 month,"November 6, 2021",2,"I'm on a small dose 10 mg cut in half, today I woke up and felt something missing... It was that anxious feeling. I actually felt like getting up. I've had a good day and I'm looking forward to many more",Skippy
11,Olanzapine,Depression,1.0,Taken for 1 to 6 months,"November 4, 2021",4,"Zyprexa (olanzapine):This drug is the worst thing ever created. For me, it CAUSED unbelievably severe depression, so bad that I’m  thinking of suicide. But, I was forced to take it repeatedly because of a lie told by a jealous women  who had me committed and force-fed this evil poison. Even getting off it now, every day is an enormous struggle and I worry I’ll never be the same again. Please stop making this dangerous drug. Nobody ever prescribe this, please.",Vzz
12,Olanzapine,Depression,2.0,Taken for 1 to 6 months,"October 25, 2021",3,"Zyprexa (olanzapine):Horrible, the withdrawal from even the lowest of dosages is a nightmare. Insomnia, weight gain, leg shakes, worsening anxiety, etc - it sucks.",CDD
13,Olanzapine,Depression,1.0,Taken for 5 to 10 years,"October 10, 2021",1,"I think that olanzapine causes major sinus issues.  I have to take sinus medication constantly, constantly sneezing.  I may be allergic to it and am being told I have to take it. I'm worried about other people being forced on it. thanks",Annie Marie sul
14,Olanzapine,Depression,9.0,Taken for 2 to 5 years,"October 6, 2021",2,"Zyprexa (olanzapine):I have dealt with severe depression with psychotic features since childhood.  I was initially put on Anafranil as my psychiatrist felt I had OCD characteristics as well.  The medication, while difficult to deal with,  was helpful.  After 25 years it simply stopped working and I went through a 5-year period of chaos.  I had 2 bouts of ECT which did nothing but seemingly compromised my memory, tried over 20 medications, and even gave Ketamine a shot.  Finally, Zyprexa was suggested.  The response was quick.  I could actually sleep during the night, my mood stabilized, and the psychotic features were diminished, appreciably.  It has been a life-saver.  I have gained substantial weight and am in the process of losing some of it but it is undeniably difficult.  I suppose you have to weigh the pro's and con's and, for me, the pro's are worth it.",story
15,Olanzapine,Depression,10.0,Taken for 5 to 10 years,"October 5, 2021",0,"I've been using this for years for general enxiety disorder, insomnia and depression. and it work great for all my symptoms especially helping with my withdrawal of Lyrica.Been on all medications of antidepressants.Using 15 mg currently.Bad history of any drugs I've been afraid from everything's unwanted fear unknowing the reasons.Be careful of using  serequel it can be dangerous.",Kaya
16,Olanzapine,Depression,1.0,Taken for 2 to 5 years,"September 24, 2021",1,"I had a brain injury before going on olanzapine.  Unfortunately, taking olanzapine made my brain injury worse.  I have a degree in engineering, and now I can't do simple things that I used to do.  I tried getting off the medication and it only made things worse.  Every night I have terrible nightmares, and every day I feel like I have no confidence anymore.  I also no longer feel any pleasure in any activity.  I wish I never took this drug.",severn123
17,Olanzapine,Depression,1.0,Taken for 1 to 2 years,"August 31, 2021",1,"Zyprexa (olanzapine):Do not take this medication unless you have a very specific need for it, namely, schizophrenia. I've struggled with severe depression, anxiety, and sleep issues for more than 8 years and was prescribed this because my psychiatrist had nothing left to try. While it did help my sleep and anxiety for about 4 months, it had diminishing returns to the point that it ended up making my sleep and anxiety worse, along with the depression. I'm 4 months off this drug and life is utter nightmare. I can't completely blame this drug for my current state as I've been constantly going downhill for years but this drug definitely overall made me feel worse. Beware if you have sleep issues because this might help for a little while but will likely stop at some point and your brain will no longer be able to get into deep sleep on it's own. I guess if you're suicidal, maybe then it's worth a go because what do you have to lose?",Brett
18,Olanzapine,Depression,1.0,,"August 31, 2021",0,"This drug ruined my life, impossible to come out at of it. I had severe insomnia, hardly any sleep for 4 weeks, the anxiety was out of this world, I’ve never felt so poorly in my life. Please read a lot before you take this poison, it should be only given to people who really need it, not for sleeping problem. I’m now seeing a psychiatrist to help me out of this mess. I used it for 7 years on 2.5 mg. Once your on it impossible to get off even if you tapered it slowly. The insomnia is horrific, it’s like the body forgot how to sleep by itself, awful. Please do not take",Ginny777
19,Olanzapine,Depression,8.0,Taken for 1 to 6 months,"August 8, 2021",1,Zyprexa (olanzapine):I gained weight on this medication. I could tell I would have trouble controlling my appetite while I was taking this medication. I've been on other anti-psychotics and this is the only one that causes fast weight gain for me. I'm currently on 15mg but will soon ask my doctor to switch to something that won't cause weight gain like Lamictal.,Luv2021
20,Olanzapine,Depression,1.0,,"August 6, 2021",7,"Zyprexa (olanzapine):I have never written a review but what I am experiencing is something I do not wish on anyone. Please listen to what I am saying before it is too late for you. The first thing I want to point out is that they say this drug is not addictive. I will tell you that is the biggest crock  I have ever heard. It is beyond addicting. You cannot just stop it. The nausea, vomiting, upset stomach, depression, mania, insomnia, desire to just die to get this over with, shaking, you feel cold and hot at the same time. The withdrawals are unbearable so naturally people keep taking it. The only solution I see to this is to find a rehab for this and have professionals help me through this. I should have never been placed on this drug to begin with. I needed to gain weight. But to give me one of the strongest antipsychotic for that is criminal. Sure I gained 40 pounds but I have no life. No desire to live. No focus. No motivation. Nothing. If you are not psychotic do not take this poison.",Now an addict
21,Olanzapine,Depression,1.0,Taken for 1 to 6 months,"August 5, 2021",5,"Olanzapine is an awful awful medication. I do not recommend. I have tried many and this one is one of the worst. I ridiculously was put on a high dose of 15mg even though my diagnosis was incorrect and I did not need this medication. It has damaged my life severely in many physical and emotional ways that I’m worrying about when I will recover from because I have been off the meds for 6 months now and I still have the effects it left me with. Caused hair thinning/loss, dry zero oil thin sensitive skin, extreme quick weight gain when on, then drastic weight loss when I went off, irregular periods, total loss of libido/sexual pleasure, dry mouth, loss of emotions/pleasure, loss of appetite and love of food. Resulting in the worst depression I’ve ever had. I am only 25 years old. It is unacceptable that this medication is being handed out to those that do not even need it and at such high doses. Also I was only on this for 2-3 months and that is how much damage it managed to cause.",Sky
22,Olanzapine,Depression,1.0,Taken for 1 to 6 months,"July 24, 2021",4,"Zyprexa (olanzapine):It isn't a joke when people say that this is weight gain in a pill. I was constantly hungry like I could eat a horse. Pretty sure I developed an eating disorder too. No positive effects, and the cherry on top - the withdrawal was an absolute disaster.",tyhmyydenylistys
23,Olanzapine,Depression,10.0,Taken for less than 1 month,"July 22, 2021",4,I started taking Olanzapine over the past couple weeks and it is a miracle drug! I feel completely back to normal and not feeling sick 24/7 with Major Depression. I am HUGE supporter of Zyprexa now. Ty to my Therapist for prescribing me this wonder drug.,StiffElephant93
24,Olanzapine,Depression,1.0,Taken for less than 1 month,"July 14, 2021",3,"I took olanzapine 5 mg for 20 days I had lots  of side effects: numb tongue, I talked and my tongue was slow, I had strange feeling in my arms and a  general  numbness.Intellectually I felt I was blocked",Andre
25,Olanzapine,Depression,8.0,Taken for less than 1 month,"July 9, 2021",2,"Zyprexa (olanzapine):I've only been on this medication for a week to treat my depression, insomnia, and desire for weight gain. It's done its job so far. Overthinking is at an all time low, my appetite is on 10, and I've gained weight, which has always been difficult for me. It does help me fall asleep rather fast and stay asleep. The only downside is that, I am ALWAYS overwhelmingly sleepy to where I can barely function.",MB
26,Olanzapine,Depression,1.0,Taken for less than 1 month,"July 8, 2021",5,Zyprexa (olanzapine):Zyprexa made me feel.worse. not good for anxiety.,Meds are not good
27,Olanzapine,Depression,1.0,Taken for 1 to 6 months,"July 6, 2021",1,This drug is purely awful. Please stop taking it ASAP,Bbh
28,Olanzapine,Depression,1.0,Taken for 1 to 6 months,"March 31, 2021",8,"This medication is horrible. It caused akathisia and insomnia when I tried to come off. Please, for the love of God, do not take this horrible medication. Read the reviews.",paix123
29,Olanzapine,Depression,1.0,Taken for less than 1 month,"March 23, 2021",30,"Zyprexa (olanzapine):So, one doctor recommended me to take this pill without no reason why. The effects of  this drug were:-insomnia-bruises on my neck-weight gain-desire for sugars-anger and low estimation of situationsGiving drugs for schizophrenia for just depressive People? Think about it twice.",Onzin47
30,Olanzapine,Depression,9.0,Taken for 2 to 5 years,"March 3, 2021",18,Have taken olanapine 2.5 mg with prozac 20 mg for years.  For last month have quit prozac and just been taking olanzapine.  From what I can tell the olanzapine has been what has made me happier and stabilized my mood and quit ruminating thought.  So far so good.  I have gained weight but not sure it's the drug.   I am just going to continue the olanzapine.  I like it.  And way cheaper than prozac...so far I am singing in my car and happy...,Mike
31,Olanzapine,Depression,1.0,,"February 26, 2021",15,I was prescribed 2.5 mg of this medication for sedation.  I took it roughly for a week and it caused my hunger to skyrocket.I stopped it and my otherwise mild depression has become unbearable.  I am crying and scared. Never felt this bad ever before. I was so better. Hope this ends someday and I am back to my previous self. I am not the only one with such an experience. Can anyone with similar experience please share how long the worsened depression last ?,Geoffrey
32,Olanzapine,Depression,,Taken for less than 1 month,"February 26, 2021",2,I was prescribed 2.5 mg of this medication for sedation.  I took it roughly for a week and it caused my hunger to skyrocket.I stopped it and my otherwise mild depression has become unbearable.  I am crying and scared. Never felt this bad ever before. I was so better. Hope this ends someday and I am back to my previous self. I am not the only one with such an experience. Can anyone with similar experience please share how long the worsened depression last ?,Geoffrey
33,Olanzapine,Depression,8.0,Taken for 1 to 6 months,"February 18, 2021",2,"Zyprexa (olanzapine):Was given this for agitation along with severe panic/borderline psychotic anxiety and paranoia in the psych hospital, I’ve gained some weight and am tired but I wouldn’t trade my mood stability for the world. I still struggle with severe depression on top of having chronic fatigue syndrome and do hope to be put back on a stimulant for that, but I am overall very pleased with where my head is at. If you struggle with severe mental illness unresponsive to the usual first-line treatments or severe panic, agitation, and insomnia, this may help a lot, even if short term or as an as-needed basis. Am also taking 100mg desipramine plus 10mg lexapro for major depression, and 50mg trazadone and vistaril as needed for anxiety. I am myself again partially thanks to this medicine.",Bee
34,Olanzapine,Depression,10.0,Taken for 1 to 6 months,"February 16, 2021",27,"Zyprexa (olanzapine):After reading the reviews, I was hesitant to start Zyprexa, but I was at rock bottom with my central nervous system. Let me tell you, 2.5mg has saved my life. I have CRPS and severe anxiety. It calms down the mind, calms the severe anxiety, and makes me sleep at night. I’ve had no side effects from this med. it really is a life saver. Don’t be afraid to start this medicine if you really need it.",audhep79
35,Olanzapine,Depression,1.0,Taken for less than 1 month,"January 30, 2021",4,Took it for only 9 days and slept great which I needed badly but now have awful dizziness from it and the room is spinning and withdrawals are horribleStay away!!!,Doc
36,Olanzapine,Depression,1.0,Taken for less than 1 month,"December 14, 2020",7,Took olanzapine for 7 days at 5mg and then 5 days at 2.5 mgs. Developed severe immune intolerance to it with aching pain in lymph nodes and swelling of my face.  Decided to just stop the drug yesterday. Hope I don’t suffer withdrawal after such a short time. Terrible drug.,Knackered
37,Olanzapine,Depression,10.0,Taken for 6 months to 1 year,"December 2, 2020",15,Zyprexa (olanzapine):Zyprexa work pretty well for me for a good year. It help with my OCD and anxiety and it made me feel the most happy and normal I ever felt. It help with intrusive thoughts and obsessive thinking. I hope it helps again when I start it back up.,Anonymous
38,Olanzapine,Depression,,Taken for less than 1 month,"November 12, 2020",9,"Olanzapine at first made me so sedated I couldn't function well but it was better then my racing thoughts anxiety / depression from it all. Olanzapine calmed my mind eventually. I've messed with the dose a couple times but I've been on it now for almost a month. No weight gain, I think my hair is thinning a bit but that could also be due to stress from being anxious 24/7 . I also take 20mg of Prozac as well which I'm in the beginning 3 weeks of taking it and my anxiety has soared hoping all of my anxious goes away or at least manageable so I can function normally and irrational thoughts and fears go away. I will be posting again after I've been on both medications for a month or so. Hopefully this helps other people! Also PS when my Olanzapine dose went down I had terrible shaking did anyone else on here have that ?",Anonymous
39,Olanzapine,Depression,6.0,Taken for 2 to 5 years,"November 8, 2020",9,"I have been on Olanzapine for about 3 years and now I’m  weaning off the medicine since April of 2020. At first I was feeling ok but when I was completely off the medicine, I experienced terrible withdrawal symptoms. I’m dealing with nausea, restlessness and terrible insomnia. Don’t get on this med!! Read about olanzapine before you start taking it.",Deewitt
40,Olanzapine,Depression,7.0,,"October 28, 2020",4,I'm on olanazapine for anxiety and depression. Anyone struggle to cope with the increased dose.Started on 5mg but can't get above 10mg,deos
41,Olanzapine,Depression,1.0,Taken for less than 1 month,"October 7, 2020",10,Olanzapine was prescribed for my Dad.  He has dementia and is depressed and agitated.  After just a few weeks he ended up in the hospital vomiting and unable to eat.  The drug had stopped his bowels from working.  He had to have a tube suck out the blockages.  It took over a week for things to even begin to get normal.  This is a horrible drug.,MEKP
42,Olanzapine,Depression,,,"September 27, 2020",24,"Had a very bad effect with olanzapine with had hair loss.  I don't know if anyone had this effect but for me it was really bad. I trying to stop on olanzapine now, waiting for the dr to prescribe  something else. I had weight gain too. I wish I can continue with it but unfortunately has to stop. Had anyone experience hair fall please advise.",Anonymous
43,Olanzapine,Depression,1.0,,"September 7, 2020",108,"This drug has absolutely ruined my life. Was on 2.5mg for approximately 1 year. During that year, I slept all day, felt like a robot, had zero motivation and was horribly depressed. I managed to get off. The first 2 months of withdrawal I had severe insomnia, severe anxiety, severe depression. Also have complete anhedonia. I have have lost the ability to feel joy or happiness. I'm chronically fatigued. I have suicidal thoughts on a daily basis. The worst part is the akathisia. I can't even put into words what akathisia feels like. I'm am in shock, every day, that these pharmaceuticals companies are giving these drugs out. It is so horrible and sad to see others like myself suffering in such a way. PLS! Do not allow yourself or loved ones to go anywhere near these drugs. They will ruin your life. I am now off olanzapine for 7 months with no end to the suffering in sight.",Merc
44,Olanzapine,Depression,1.0,Taken for 6 months to 1 year,"August 9, 2020",14,"I used 5mg of olanzapine every day for the past 8 months and when I read a little more about it, I decided it wasn't for me.  I have been tapering for about 6 weeks and I have now been off it for 12 days and my withdrawal symptoms are so bad I can't do daily things.  I look like even canceling my golf game...it is the pits and together with an enlarged Prostate, I get no sleep and feel sick all day.  I don't eat much as I don't feel like anything and all I can hope is that these withdrawal symptoms go away SOON.  I wish my Dr. would've told me about these issues BEFORE prescribing it to me.",Dunco
45,Olanzapine,Depression,8.0,Taken for 6 months to 1 year,"July 26, 2020",13,"Zyprexa (olanzapine):Zyprexa made me have hallucinations the first 4 nights I had taken it. (Cray, scary) Then they stopped. I gained a good amount of weight (but that didn't matter because I was extremely overweight) So this med basically saved my life. I don't feel 100% better off of it but I do recommend that it's a decent drug. I've tried SO MANY meds and there are some many more worse ones than this.",Nikkipixi
46,Olanzapine,Depression,8.0,,"May 9, 2020",27,Lexapro 10 mg and 2.5 olanzapine is good for MDD and generalised anxiety disorder.  It takes away fear and panic.  weight loss stabilizes with long term use and tiredness becomes less an issue.,rex
47,Olanzapine,Depression,8.0,Taken for 6 months to 1 year,"May 5, 2020",49,"Zyprexa (olanzapine):I've been on zyprexa for 9 months now, zyprexa has done wonders for me. No more spontaneous deep dark days ahead of me, my close family can really see a difference, I'm just worried about long term effects of this drug. I have bipolar 1 with psychosis.",Missy626
48,Olanzapine,Depression,1.0,Taken for 2 to 5 years,"April 25, 2020",50,"My Dr. (The expert) prescribed this for me when I was suffering with agitation and anxiety. I took it for 2 years and my new Dr took me off it. I put on 30kgs of weight, felt like I wanted to crawl out of my skin on a daily basis and was very irritable. But thats not the worst part. This medication permanently causes you to be DEPRESSED even after discontinuation! I've tried all types of SSRI's and SSNRI's and they simply don't work. I'm stuck in an incredibly bad depressive state, I can't laugh, I can't be happy. PLEASE, if your Dr. prescribes this to you, READ THE REVIEWS and do not take this horrible medication!",Sky25
49,Olanzapine,Depression,10.0,Taken for 1 to 6 months,"April 13, 2020",76,"Zyprexa (olanzapine):This medication Zyprexa is a miracle worker ! I was in a very deep depression,  suicide thoughts. I started feeling better after just a few weeks.I have been on it 6 weeks now and its keeps getting better. The Doctor is now increase it to 10mg, I feel more tired, but that will lessen as time goes by. I feel like me again !!!",Gigi
50,Olanzapine,Depression,,Taken for 2 to 5 years,"March 23, 2020",22,Zyprexa (olanzapine):I've found the Zyprexa very good for hearing voices and adjunct for depression.,MichaelMl
51,Olanzapine,Depression,1.0,Taken for 1 to 6 months,"March 13, 2020",220,"Zyprexa (olanzapine):I was put on 17.5mg of zyprexa in 2017. I took this for 6 months before I finally decided to listen to my body and stop listening to the so called experts. Zyprexa made me dull, depressed and robotic. I now lack empathy, emotion, concentration and I no longer get pleasure from things I used to enjoy. Zyprexa zaps the joy from your life basically. There is no upside. Please please avoid this drug. It will steal your personality and nobody will believe you except for the people who have also been victims of this drug.",Emero
52,Olanzapine,Depression,1.0,Taken for less than 1 month,"February 26, 2020",36,"Olanzapine is worst drug ever. Made my depression even more severe, made me feel numb and like a vegetable. And the withdrawal period is the worst even after taking it only for 4 days!!!! Glad it's over.",Worst drug ever
53,Olanzapine,Depression,1.0,Taken for 1 to 6 months,"February 20, 2020",38,"Hi am from Kenya  that is in East Africa..I was diagnosed with depression by my  doctor and put on deprex 10mg which is also a brand name for olanzapine. I took it for about 28 days, which went well, I got good sleep but after that it was a nightmare.  I was getting brain fog.  I tried to quit it but the withdrawals were crazy. I couldn't sleep at night, restlessness was another issue.So I self lowered to 5mg.  I am not having a normal sleep, walking up a couple of times at night. Last night I took 2.5mg...am really trying to get off this garbage by tapering coz the withdrawal is unbareable ...DON'T TAKE THIS DRUG IF U LOVE URSELF N UR LIFE",Game
54,Olanzapine,Depression,8.0,Taken for 1 to 6 months,"February 9, 2020",15,"olanzapine is one of the best sedatives I recommend trying it, good sleep even though I wake up a little bit scared, overall It's a safe drug unlike risperidone which was a curse for me",Mar4wan
