,drug,condition,rating,duration,review_date,upvotes,review,username
55,Zyprexa,Depression,2.0,Taken for 2 to 5 years,"May 25, 2013",146,"I started taking Zyprexa over two years ago for intrusive thoughts I was having as a result of Obsessive compulsive disorder/depression.  While the Zyprexa helped remove intrusive thinking, it added about thirty pounds onto my slender frame, made me severely tired, and took away my sex drive.  In addition to these adverse effects, I was unmotivated/uninterested in many activities that used to give me pleasure. I had a ""so what"" attitude about life in general.  All because of this medicine.  What really frightened me about taking this was my cholesterol went sky high, and my blood sugar was also very high, making me an at risk candidate for diabetes.  I am finally off of this. ",kestrel28
56,Zyprexa,Depression,6.0,Taken for less than 1 month,"March 6, 2013",68,Feeling heaps better about life and alot calmer only thing is I feel hungry all the time and have put on 4 kilos in one week!! Dont know what to do about that...,whereswally
57,Zyprexa,Depression,6.0,,"November 22, 2012",77,Really helps with mood swings and made me calmer. It also made me gain 50lbs in 6months. It's extremely hard to control your weight on this pill.,Nessa94
58,Zyprexa,Depression,6.0,,"October 15, 2012",80,"I take 5 mg of Zyprexa daily. I'm almost the entire day sleepy and have the feeling of doing nothing. I can not worry, because I have to sleep for about 15 hours daily.But I have tried everything out there, and this is the best at this moment.",hihityu
59,Zyprexa,Depression,7.0,,"February 13, 2012",89,"This medication is a great sedative, if that's what you're looking for. It's not euphoric, it just makes you sleepy.  But it caused me to gain over 40 pounds in less than 2 months.  I now get depressed just looking in the mirror.  My doctor says it just makes you hungry, not gain weight, but the amount of weight I gained in such a short time is unnatural!",Anonymous
60,Zyprexa,Depression,8.0,,"January 18, 2012",55,Worked well for depression. Didn't make me sleepy but always hungry.,Anonymous
61,Zyprexa,Depression,10.0,,"November 2, 2011",97,I have taken Zyprexa 2.5 with Zoloft for years and couldn't function without this combination. It was prescribed because the Zoloft just didn't take care of the insomnia and mood swings.  Zyprexa 2.5 has been a God-send.,jograndmama5
62,Zyprexa,Depression,1.0,,"October 29, 2011",57,"After taking the 2.5 dosage for 4 days I feel very irritable. I am experiencing crying spells, tiredness, extreme moodiness and just want to be alone. This medicine was prescribed for a mood disorder that I have been experiencing. I also take other anti-depressants. I don't think this is a good mix with other medicines or just not right for me.",Anonymous
63,Zyprexa,Depression,10.0,,"April 19, 2011",145,A two-year depression vanished in just 24 hours.,Anonymous
64,Zyprexa,Depression,8.0,,"February 1, 2011",87,Found this medication very effective in my withdrawals from both alcohol and weed. It stops my racing thoughts and keeps me calm. However it does somewhat make you zombie like and unable to feel emotions.,cheersrichard
65,Zyprexa,Depression,10.0,,"January 16, 2011",105,"I took Klonopin and Paxil for 15 years to treat my anxiety disorder.  I had to detox from the Klonopin this past spring.  I got off the Klonopin and switched my Paxil to Lexapro (sex side effect issue).  I am also a recovering alcoholic.  My doctor did not want me on Benzo's anymore (says it increased alcohol cravings).  I stayed on Lexapro only for 9 months, but my anxiety came back strong on just the Lexapro alone.  I almost resorted to taking Xanax before I switched doctors. My new doc gave Zyprexa a chance. I am on my 7th day and I haven't felt this ""normal"" in 5 years.  I take 5mgs at night and it has ended the ""chatter"" in my head, and removed my anxiety.  Great medicine so far.",Anonymous
66,Zyprexa,Depression,10.0,,"November 1, 2010",69,This medication works very well for me. I take it with Pristiq and it is a very good combination. Haven't felt this good for a year.,tdholste
67,Zyprexa,Depression,,,"October 28, 2010",63,"My doctor started me on 5mg of Zyprexa and the first 2 days I slept over 14 hours falling asleep within 20 mins of taking it.  By day three I couldn't sleep at all and went on for days making me feel out of control, confused, forgetful, pretty much out of it and unable to even have my daughter home with me.  I was also very bloated, feeling and looking.  On the start of the 7th pill/day I began swelling to the point of GOUT, had breathing problems, dry mouth, was oddly emotional/ crying a lot, and hurting badly due to the MASSIVE swelling and couldn't put on any of my pants. I quit taking the medicine but the next night it all got worse with the addition of tightening in my chest. I am now having skin irritations on my hands. This medicine is bad news.",Mom in trouble
68,Zyprexa,Depression,9.0,,"July 20, 2010",50,"Calms me down and helps me sleep that's for sure.Weight gain needs to be controlled with exercise program I guess.",HarryQ
69,Zyprexa,Depression,1.0,,"May 5, 2010",44,"I was constantly tired, spaced out and I couldn't eat enough. In 2 months I gained 20 pounds and slept an average of close to 14 hours a day.",Anonymous
70,Zyprexa,Depression,9.0,,"April 16, 2010",43,"Developed depression and significant anxiety this fall.  Doctor started me on Lexapro, but that wasn't controlling the anxiety, loss of appetite and insomnia.  Added Zyprexa and almost instantly felt much, much calmer, could eat and slept well.  Was very sleepy/tired for the first few days but acclimated within a week.  The problem I did have was with weight gain.  Thought my life had calmed down and I could do without the medicines, but have found that not to be the case.  Did not have any issues weaning off the Lexapro and Zyprexa. Just started Pristiq yesterday.  Hoping and praying for good things.",struggling mom
71,Zyprexa,Depression,4.0,,"December 9, 2009",39,Always tired and felt lazy. Also gained 20lbs.,Anonymous
72,Zyprexa,Depression,1.0,,"November 12, 2009",33,"Made me sweat in bed while asleep to the point it looked like I had a high fever. Took for depression, made me agitated.",dydibe
73,Zyprexa,Depression,7.0,,"October 8, 2009",36,Zyprexa was prescribed to augment Prozac for my depression. It helped me somewhat and I would have stayed on it but it made me extremely tired.,Anonymous
74,Zyprexa,Depression,9.0,,"September 9, 2009",45,"Excellent results, but without insurance it cost about 275.00 a bottle (too expensive).",channie
