,drug,condition,rating,duration,review_date,upvotes,review,username
0,Rivaroxaban,Deep Vein Thrombosis,4.0,Taken for 1 to 6 months,"March 28, 2022",0,"Xarelto (rivaroxaban):I was given this drug to treat a DVT in my calf. As far as I know it worked, but I have another 45 days to continue taking it. My concern is the side effects. It completely took away my desire to eat, if I force myself to eat I have to eat in tiny portions and I can't eat any thing with gluten. I get deathly Ill. Even From things I have ate all my life. I would not agree to taking this drug again. My Dr just ignores my concerns. I have lost over 20 pounds. Plus I can't sleep normally. It has been a terrible experience!",Not happy
1,Rivaroxaban,Deep Vein Thrombosis,1.0,Taken for less than 1 month,"March 24, 2022",0,"Xarelto (rivaroxaban):Developed a DVT and was put on Xarelto.  I developed a migraine headache that lasted 24/7 for the entire month I was on Xarelto.  I do not suffer from migraines, but this medication caused mine.  I went to 3 different doctors in 30 days before one finally prescribed a different blood thinner.  If taking this medication and you develop a migraine get off of Xarelto as fast as you can.",Splinter
2,Rivaroxaban,Deep Vein Thrombosis,,,"August 21, 2021",0,Xarelto (rivaroxaban):I’ve got a DVT but compared to a lot of the stories here mine doesn’t seem as extreme. It  is in my left calf muscle after knee surgery. Developed blood in urine that came and went and I am currently awaiting to be seen by a urologists.  First time suffering extreme anxiety and paranoia fatigued and stressed beating the end of my 3 week point have started developing problems with my sinuses and ears am worried but trying to think positive. Will see my GP first thing Monday. Good to read on some success stories :) will have to wait and see at the end if I would recommend this medicine. But the alternative not taking it isn’t very good either.,First time DVT
3,Rivaroxaban,Deep Vein Thrombosis,9.0,,"June 26, 2021",4,Xarelto (rivaroxaban):I suffered massive DVT on my left leg in 1998. I was on warfarin for few years. I developed looked like hives or rashes on both of my inner thighs. My doctor said that it looked like eczema. I  used all kinds of otc lotion to ease the itch and some pain but never went away.  When xarelto was introduced to the market My doctor said that I am a good candidate for it. Few months  after taking 20 mg. a day  itch on my upper arms started At the time it did not bother me because that was the least of my problems. In 2012 I noticed some red bumps on my lower leg and a bit itchy. It went away after few weeks. But my body itch continues. In the spring of 2020 the itch and red bumps intensified and appeared all over my body.  My doctor said it’s not from xarelto. The dermatologist could not recognize what these red spots on my body. I have to wear long sleeves even in the summertime to cover the red bumps and lesions that turned to dark brown spot all over my arms and body.,paopaoanddahlia1207
4,Rivaroxaban,Deep Vein Thrombosis,10.0,Taken for 1 to 6 months,"October 24, 2020",14,Xarelto (rivaroxaban):I experienced a proximal (whole leg) DVT 5 months ago with extreme swelling and tightness. 15 mg Xarelto daily was prescribed in ER for 1 month followed by 20 mg daily. I did a lot of walking when able and have only slight discolouration above the ankle along with tightness near the Achilles’ tendon now. The swelling has all gone. I experienced bouts of belching after 2 months but that has subsided now. Extreme fatigue upon little exertion has been a recent issue. 72 years old,Dennis123
5,Rivaroxaban,Deep Vein Thrombosis,8.0,,"August 7, 2020",2,"Xarelto (rivaroxaban):I was diagnosed with 100% DVT blockage in my left leg. The hospital gave me heparin for less than 24 hours. Then told me I had a choice to take Xeralto or Eliquis. I chose Xeralto. After taking the first pill it upset my stomach. The second pill upset my stomach. They sent me home with a prescription. Almost immediately, I started bleeding a lot. It continued. I’ve been taking Xeralto for a little over a week now. I’ve a surgery upcoming in about two weeks and need to go off Xeralto five days prior to the surgery which concerns me. I cannot get an appointment to see a hematologist until 4 days before the surgery. The last couple days the bleeding has stopped but the pain in my leg is much worse making it difficult to walk. I’m thankful for the Xeralto at this time. I started taking the pills with food and had no more problems with an upset stomach.",Jean
6,Rivaroxaban,Deep Vein Thrombosis,3.0,Taken for 2 to 5 years,"July 25, 2020",10,"Xarelto (rivaroxaban):Have been on Rivroxiban 20mg  for 4 years for deep vein thrombosis and have put on 3 stone since. The doctors gave me a health check and said I need to see a dietician I have never been 14 stone before always around 11 stone this I believe is a discrepancy that the doctors do not look into, I have about 30 20mg tablets left then it for Me- as from now on I will be taking 100mg of aspirin a day which is as good as Rivaroxaban but less risks as its good for thinning blood, and Edema ( swelling of the lower ankle and leg)",Vlad
7,Rivaroxaban,Deep Vein Thrombosis,6.0,Taken for 6 months to 1 year,"June 12, 2020",9,"Xarelto (rivaroxaban):Suffered from multiple clots in right leg that ended up traveling to my lungs. Had to have emergency surgery because a clot broke off and was blocking the left artery of my heart. After 8 days in the hospital I was put on Xarelto. Started out as 15 mg twice a day to 20mg once a day. Was originally supposed to be on it for 6 months but my insurance wasn’t approving my follow up CT scan and ultrasound. Ended up being on it for a year and 6 months. While taking Xarelto, I experienced numbness and tingling in the leg where the clots were, horrible anxiety, leg swelling, leg pain, heavy menstrual cycles, and bruising. I recently stopped the drug cold turkey, doctors orders. Anxiety has gotten worse as I’m afraid of experiencing another DVT/PE. Overall it did the job. No sign of clots in legs or lungs.",Khali
8,Rivaroxaban,Deep Vein Thrombosis,1.0,,"April 19, 2020",20,"Xarelto (rivaroxaban):This drug sent me insane. Recently had DVT in arm. 1st tablet caused burning nerves in face & spine rushed to A &E who were dumbfounded.Within 1 week i was pacing the house all night. Heart racing severely. Anxiety out of control (never suffered from anxiety). Week 2 lips and mouth burning. Anxiety and heart rate worse.Week 3. Pacing house 16 hours a day, paranoia, intense pressure in head, muscle spasms, unable to close eyes. Nerves on skin . Reduced dose didn't help improve situation. Eventually doctor switched me to Eliquis which I'm absolutely fine on. I believe this drug is ok for a lot of people, however if you have a reaction its severe. Lost over a stone in 3 weeks, hyperventilated daily, my behaviour and personality changed dramatically.Within 48 hours on Eliquis all symptoms ceased. I'll be reporting this drug as having done some research I've found it can cause anxiety, paranoia, muscle spasms which are not listed in the literature",Specialdiamond
9,Rivaroxaban,Deep Vein Thrombosis,7.0,Taken for less than 1 month,"April 4, 2020",2,"3 weeks following a 9 hour spinal surgery it was determined I had a DVT in my R calf, and a small PE in my L lung. My Primary Dr immediately started me on Xarelto (2 15 mg for 21 days, then 1 20mg daily that I am still taking.) After just 2 doses I began to feel the most sleepiness I have ever had. It is still continuing to this day, even when I do not feel sleepy, I wake up 2-3 hours later not even realizing I fell asleep! I am also on several anti-depressants, incl. Prozac and my depression & lack of ambition goes right along with my sleepiness. I am fedling a bit better since the surgery, yet I have no desire to do much of anything. I experience nausea, and a lack of appetite as well. Still have 8 weeks to continue taking this drug, and I pray I can bounce back to my energetic, busy old self. Despite the side effects, it is still 100x better than warfarin, so I suggest trying it first and seeing how you react.",ScoliosisSurgery22
10,Rivaroxaban,Deep Vein Thrombosis,9.0,Taken for 6 months to 1 year,"February 25, 2020",12,"Xarelto (rivaroxaban):Been on over 7 months. Now on 10mg by own will plus research concluding that xarelto 10mg is more effective than aspirin. These sites lack knowledge and unquestionable advice. First of all, drink mostly water if you want best combined results. Dont take 10mg unless that is what your doc told you or you have passed the end of your treatment prog based on your algorithm. We all have one. Reduce  consumption of colored drinks. Always wear stocking if swell problem. Exercise prevents new DVT on top of xarelto. ",Xarelto101
11,Rivaroxaban,Deep Vein Thrombosis,1.0,Taken for less than 1 month,"February 17, 2020",8,Xarelto (rivaroxaban):Had a blood clot in my arm after PICC line placement for chemo.  Dr put me on Xarelto 20 days ago and my liver enzymes have been tripled since starting the medicine!  I’m more worried about my liver than the blood clot now.  Anyone else have liver problems on Xarelto?,OdieJo
12,Rivaroxaban,Deep Vein Thrombosis,7.0,Taken for 1 to 6 months,"December 25, 2019",6,"Xarelto (rivaroxaban):After blood clots in my leg and lungs, I was given a prescription for Xarelto. With in a couple days, my erections increased substantially! I did loose some weight and my appetite diminished due to the pain in my knee and upper back. After taking Xarelto, I noticed that my penis had some length, about an inch, and my erections were noticeable more often. I am 62 and 1/2, about 180-185 pounds, taking Xarelto 20mg once a day, and currently have no blood clots. I will continue using Xarelto for the 6 month period then visit my Doctor for a follow up evaluation.",Flyboy
13,Rivaroxaban,Deep Vein Thrombosis,4.0,Taken for 1 to 6 months,"September 15, 2019",12,"Xarelto (rivaroxaban):I started Xarelto in April do to a unprovoked DVT in my upper left auxiliary. It was coincidental. I started 15mg x2 then 20mg x1.  After 2 months  on it I started noticing minimal blood in my stool and anal spams. Went to my GI doctor and now waiting for my colonoscopy to be done. I get headaches, muscle spasms, constipation, lightheaded. My concern right now is mainly the blood in the stool. Even though is minimal I’m scared that it could be something else. I’ve heard and read stories about Xarelto causing blood in stool. Anyone out there having blood in stool and spams in the anus do to this medicine? Please share. I’m off this pill next month since my clot went away.",Charlie
14,Rivaroxaban,Deep Vein Thrombosis,3.0,Taken for 1 to 6 months,"September 6, 2019",6,"Had DVT in left calf and pulmonary embolism in right lung. Was put on Apixoban but had severe nose bleed so changed to Rivaroxaban 20 m  daily.  I have headaches, find it hard to sleep, upset stomach, swollen ankles and numbness  in legs. As I also have irregular heart beat, have to stay on this drug.  I have gone from being really active and walking miles to now only walking short distances, as my back and legs hurt so much.  I feel as if I can feel everything through my shoes and  have a tight band across the front of my foot.  I have discussed everything with my doctor and the only thing he suggests is  a diuretic for the swollen ankles.  I would dearly love to be off this awful medication.",Wirralwinnie
15,Rivaroxaban,Deep Vein Thrombosis,3.0,Taken for 1 to 6 months,"July 7, 2019",20,"Xarelto (rivaroxaban):This drug did great for resolving a clot in a deep vein in my right leg. At the six month mark when I was cleared to come off it, no one ever told me, nor any of the safety literature indicated that what happened could happen. After one day of stopping Xarelto I was so instantly fatigued and sick I couldn’t function for days. It made my blood pressure spike and I had to see a doc about getting that under control. It finally took about 10 days for that medicine to let me go and trust me it was a miserable 10 days. A vascular surgeon and a cardiologist both told me they’ve never heard of this side effect. Kind of scary that this kind of stuff is not out there for patients to see early. Also, I consider it dangerous because where I live  there is no reversing agent available. If you decide to take Xarelto you would be better off going to Vegas and betting on a dice throw. Your chances are better. If I need another blood thinner I will go with the tried and tested Coumadin. It’s safer.",Machoo
16,Rivaroxaban,Deep Vein Thrombosis,2.0,Taken for 2 to 5 years,"May 23, 2019",2,"On Xarelto for 2.5 years. I have immunoglobulin infusions that put me at risk for clots. I believe this drug is the reason I feel severe vein pain in my left arm, behind me knee, and below my knee. I also believe that it causes swelling in the tissues around my brain stem.   I believe the Xarelto I take is causing this swelling, which is causing the decreased respirations which wake me up. I experience SEVERE agitation an anxiety when I try to put hours i nbetween my doses to wean myself off. I CAN NOT wean myself off. . I also believe it causes intracranial hypertension, idopathic if anything but have yet to see a neuro for a spinal tap to test the pressure in my head.",Mouse
17,Rivaroxaban,Deep Vein Thrombosis,2.0,,"May 2, 2019",56,"Xarelto (rivaroxaban):I started on Xarelto after having a bleed out with Warfarin through my kidneys. I was on this drug for almost 8 years. In the last two years, I kept telling my doctors the side affects this drug was giving my body. Nobody listened....Eventually, I received some helpful information on the neurological side of this drug. Everything it said was what I was experiencing. So I have now switched to Eliquis (which is recommended by cardiologists almost world-wide) and it has been heaven ever since. No  Xarelto induced crazy dreams, leg twitching, cramps, headaches, tremors, anxiety etc.Take control people over your own body.....",kate
18,Rivaroxaban,Deep Vein Thrombosis,9.0,Taken for 5 to 10 years,"April 25, 2019",1,Been on rivaroxaban for a DVT for about 7 years.  I can quite honestly say I’ve never experienced any side effects from this drug. Before I was on warfarin for three years with regular INR tests which were a pain.This drug has been a game changer for me.,Gazzasflute8
19,Rivaroxaban,Deep Vein Thrombosis,10.0,Taken for 1 to 6 months,"January 24, 2019",6,"Xarelto (rivaroxaban):I’m 47, female, and was diagnosed with DVT in my right calf, from oral contraceptives. The only side effect I had was heavier bleeding during my period (I already had heavy periods), where I couldn’t leave home. I had an ablation done and over a month has passed and no more bleeding (I hope no more periods ever). My AST was elevated (just 10 over the higher range) but it could also be from an intense work out 2 days before lab was drawn. ALT was normal . I have three more months to go on Xarelto and am glad I have very minor s/e compared to some reported here.",ACH
20,Rivaroxaban,Deep Vein Thrombosis,10.0,,"December 12, 2018",21,"Xarelto (rivaroxaban):Had extreme pain in my hip which I thought was from digging a drain line for my yard that was over 120' in length.  Sudden ""POP"" in my hip at work one day and almost passed out from the pain. An ER visit and sudden Emergency surgery to remove clots from my hip to my ankle in the left leg.  Another surgery to finish up the first surgery using a new surgical technic for ""REMOVING CLOTS"". Put on Xeralto 2 times a day for 30 days, then 1 time a day for 6 months.  During that time frame, my niece had a massive PE and died at 25!  Found out that Blood Clots are hereditary - my grandmother, father, sister, aunt, niece and myself all have had them.  Protein S deficiency is what it's called.  Will be on the meds for the rest of my life, I was 47 at the time.  Terrific Medicine for me anyways!  No side effects at all that I can tell.  Have to buy from Canada due to price in US is almost $1500.00 for 3 months - Canada meds are $138.00 for 84 pills.",lison
21,Rivaroxaban,Deep Vein Thrombosis,1.0,Taken for 1 to 6 months,"August 26, 2018",19,"Xarelto (rivaroxaban):I was put on 15mg of xarelto for a DVT. I experienced terrible fatigue and anxiety.  I was an active person,  but on xarelto I could no longer walk a block or do basic activities without feeling exhausted. I also started to experience numbness and tingling in my toes and fingers.   My doctor switched me to eliquis and the fatigue was gone.  I finally feel like myself again.  Xarelto was a terrible drug for me",Lo
22,Rivaroxaban,Deep Vein Thrombosis,,Taken for 1 to 6 months,"May 8, 2018",11,"Xarelto (rivaroxaban):I was 55 when I was diagnosed with DVT that caused extreme pain and swelling. Doppler testing confirmed blockage from mid-thigh to the base of my calf for both primary and secondary veins of my left leg. I was prescribed Xarelto and was placed on the drug for six months. At the end of the six months the condition improved sufficiently to allow complete blood flow. I was then placed on high aspirin use for the next 12 months. I was not aware of any noticeable side effects. The condition existed for me due to being athletic, a consultant with over 20 years of frequent air travel, and was a pre-mature birth. These are all known conditions that can lead to DVT.",Anonymous
23,Rivaroxaban,Deep Vein Thrombosis,1.0,Taken for less than 1 month,"April 29, 2018",8,"Xarelto (rivaroxaban):Diagnosed with blood clot in left leg.  Put on Xarelto, after 3 doses had severe headache and neck pain. Dr. took me off and will try something else.  Treatment worse than the problem.",Lynn
24,Rivaroxaban,Deep Vein Thrombosis,,Taken for 1 to 6 months,"February 16, 2018",5,"Xarelto (rivaroxaban):RESPONDING TO ""cludden i50""   I've been taking Xarelto for 4 weeks and have blood in my urine intermittently.CAT -Scan shows no cancer in urinary tract but stonesstuck in ureter are the cause and hoping removing them will stop bleeding. Suggest you do these tests.",ken3
25,Rivaroxaban,Deep Vein Thrombosis,1.0,,"December 11, 2017",13,"Xarelto (rivaroxaban):In 2008, a kindergarten kiddo knocked me down and I broke my femur. I ended up with a DVT and bilateral PEs. Took Warfarin but my INR was all over the place, so Doctor put me on Lovenox until all was clear. Fast forward to this past October 13, 2017. Woke up with swollen and hurting ankle. I feared a superficial clot. NEVER dreamt I had a DVT... Much less 3 huge clots from behind my knee stretching all the way to my ankle. Dr. started me on Elaquis and, of course, I was allergic to it. I was switched to Xarelto. 3 days later, I started having HORRIBLE headaches that began about one hour after taking the med and last ALL day long! I'm up and down all night, either insomnia or leg cramps. I am waiting to hear from dr on a plan. HATE this med!",Kindergarten Teacher
26,Rivaroxaban,Deep Vein Thrombosis,,Taken for 1 to 6 months,"September 29, 2017",16,"Xarelto (rivaroxaban):On my fifth week. Everything was fine. I cannot remember if I doubled my 20mg dosage yesterday, but this morning up to noon time I was urinating blood. I have gone twice more since noon time with no blood. Has anyone else experienced this with xarelto before?",cluddeni50
27,Rivaroxaban,Deep Vein Thrombosis,7.0,,"August 26, 2017",12,Xarelto (rivaroxaban):Xarelto seems to work for thinning the blood and allowing clot reabsorption but it causes bleeds particularly heavy periods. This major side effect which obviously affects women but not men does not seem to be addressed by Xarelto and therefore it is under researched. Heavy periods are associated with anemia which in turn can cause heart and other organ problems as well as cause fatigue and weak immune system apart from the obvious life style inconvenience to women sufferers.,Anonymous
28,Rivaroxaban,Deep Vein Thrombosis,4.0,,"July 10, 2017",18,"Xarelto (rivaroxaban):I was taking Xarelto for DVTs in my right leg. For the most part the drug went as expected. Until I got a nose bleed. When it started it was like any other. Then the bleeding started like a cut vein. And it would not stop. I was rushed to emergency at a local hospital, where they shoved 2 devices that were to help it stop. They did not work and the ER doc on hand had to put larger ones in. I was told at the time there wasn't any drugs that would slow the bleeding down. It was time and compression that worked. It scared the hell out of me. As of now I will not go back on it due to these effects. And also due to my work. If I got a bleed in the place I work, it'd be disastrous.",RJ347
29,Rivaroxaban,Deep Vein Thrombosis,1.0,Taken for 1 to 6 months,"July 1, 2017",11,"Xarelto (rivaroxaban):Hospitalized for 5 days with DVT in both arms.  During my stay I was given lovenox and warfarin.  Upon discharge, I visited my regular MD and was put on Xeralto.  Thirty days later I was admitted to hospital again, but with DVT'S up and down both arms. I would not recommend anyone to take this medication.  I had a horrible experience, not to mention scary experience while being on this medication.",cabbagemoma
30,Rivaroxaban,Deep Vein Thrombosis,1.0,Taken for 1 to 6 months,"June 26, 2017",24,"Xarelto (rivaroxaban):DO NOT ALLOW DR TO PUT YOU ON THIS MEDICATION IF YOU:ARE AUTOIMMUNE (Positive ANA, Rheumatoid Arthritis, Systemic Lupus, Sjögren's Syndrome)OR TAKE: EFFEXOR OR ANY OTHER SNRII AM EXPERIENCING LIVER INJURY DUE TO THE COMBINATION OF THESE CONDITIONS/DRUGS",lisae1963
31,Rivaroxaban,Deep Vein Thrombosis,2.0,,"June 11, 2017",12,"Xarelto (rivaroxaban):Xarelto  caused weight gain , tingling, numbness and pain in arms as well as hands approximately 2 months after I began taking it. I'm not sure if this is permanent or not, stopped taking a week ago and still having these side effects. This was not a positive experience unsure until I see my Dr. if their is permanent damage.",Numb still
32,Rivaroxaban,Deep Vein Thrombosis,6.0,,"April 28, 2017",22,"Xarelto (rivaroxaban):I am 20 years old and I just started the rivaroxiban 2 weeks, after they found a clot in my arm ! I'm on 20mg twice a day for 3 weeks and then 15mg for 3 months. I find I am really tired all the time and I do get a good bit of sleep at night too ! I never usually got headaches before but now I find around a hour after taking the pill I get a headache ! Just wondering is this due to the pill or am I just overthinking it !",Hannahprend1
33,Rivaroxaban,Deep Vein Thrombosis,7.0,Taken for 1 to 6 months,"April 18, 2017",15,"Xarelto (rivaroxaban):I had a DVT in my right lower calf muscle. I was on a training schedule and was very intense workouts, I did lots of flying for work and as well taking some supplements my blood became thicker and ended with my calf swelling up. I've been in xarelto for the last four months first two months were all good now in the the last two months the side effects of it have really out of it started getting sore ribs and on my sternum feels like my body has spasms.  Sometimes I can't bare the pain I'm also on tramadol to calm my spasms I don't like tramadol because I don't feel in control I get fatigued faster and tired easily does anybody else get these side effects from xarelto",Kolossus
34,Rivaroxaban,Deep Vein Thrombosis,10.0,Taken for 6 months to 1 year,"March 6, 2017",14,"Xarelto (rivaroxaban):I developed  a DVT in my thigh after hurting my back and being unable to get around for a few weeks, ended up in the hospital for 5 days on total bed rest. Shortly after a large DVT was found in my right thigh.  I was put on Xarelto for one year.  I have been on it now for 6 months and my leg and foot stays swollen, but does not hurt.  My hair fell out for the first two months and then stopped, I have had no other side effects.  I feel good with the exception of getting tired more easily.",Nutmeglady
35,Rivaroxaban,Deep Vein Thrombosis,1.0,,"February 26, 2017",3,I have been on this medication for 5 weeks now and since starting it my body has been so itchy and I don't know if I should stop it.,Olive oil
36,Rivaroxaban,Deep Vein Thrombosis,8.0,Taken for 1 to 6 months,"November 29, 2016",0,"Not many people take this drug for my condition (Antiphospholidid Syndrome) in the UK, so I'm what you might call an 'experiment', but I begged and pleaded to go on it as I'd had enough of taking warfarin, my INR was never steady and I was having blood tests taken every week sometimes. It does have some not so good side effects. When I first started taking it, I felt dizzy and faint within a couple of hours, so my haematologist suggested I take it just before bed instead of in the morning which solved the problem. It makes me more tired than before I was on it and I don't have as much energy. I've always been a stressful person and have noticed I seem to get more anxiety now. The good outweighs the bad though, I've had no more mini-strokes, so it's doing its job!",Anonymous
37,Rivaroxaban,Deep Vein Thrombosis,6.0,Taken for 1 to 6 months,"September 19, 2016",9,"Xarelto (rivaroxaban):Very nauseous, hope hair does not fall out",ywbeach
38,Rivaroxaban,Deep Vein Thrombosis,,,"September 13, 2016",8,Xarelto (rivaroxaban):It has side effects. I cant treat it.,Temame
