,drug,condition,rating,duration,review_date,upvotes,review,username
84,Empagliflozin,Diabetes Type 2,2.0,Taken for 6 months to 1 year,"October 1, 2019",62,"Jardiance (empagliflozin):Jardiance did reduce average sugar levels and A1C.  It also caused many sleepless nights due to dry mouth, dehydration, chest congestion, and constant trips to the bathroom.  It caused increased bladder leaking, tired leg syndrome to the point my joints hurt so bad walking was painful. I did not want to exercise.  I was too tired.  I stopped Jardiance 3 weeks ago.  I feel great.  Sugars spiked but I am working on it with diet and exercise.  I sleep all night now and wake up refreshed and ready to meet my day.",SDR
85,Empagliflozin,Diabetes Type 2,1.0,,"September 30, 2019",99,"Jardiance (empagliflozin):I was on Jardiance before and had a lot of trouble with itching swelling down there, but didn’t tie it to the medication. I tried yeast medication, a mild soap, anti fungal soap, a soap specially formulated for women. Did stop it for several weeks and rash cleared....still didn’t associate it this medicine. Been back on Jardiance maybe 4-6 days and I’m a mess! Swollen front and back. Inflamed, red itching!!! Will not take this ever again. Signed MISERABLE",Pamcakes
86,Empagliflozin,Diabetes Type 2,1.0,Taken for less than 1 month,"September 29, 2019",65,Jardiance (empagliflozin):This medicine Jardiance gave me a yeast infection SO BAD I could barely walk!!! I would NEVER recommend it to anyone! I was on it for less than two weeks!! I was drinking plenty of water and one day I only drank 3 bottles of water instead of six and the very next day I had the YI! It makes you urinate a gallon every time you go. Woke up with sore kidneys from having to urinate so bad every morning. If I could give it a zero I would!!! I hope if you take it it does better for you than me! Good luck!,Upset
87,Empagliflozin,Diabetes Type 2,7.0,Taken for less than 1 month,"September 23, 2019",40,"Jardiance (empagliflozin):I have not done a week yet! I have all the common effects, drinking loads, up at night, falling sugar levels, lost a bit of weight, all good so far, lets all hope I can avoid that unwelcome itch.I am male, over 50, and been Type 2 for longer than 20 years, weighing just over 100kilos (220lbs)I am British and as such have free medication currently.",IAMX
88,Empagliflozin,Diabetes Type 2,1.0,Taken for less than 1 month,"September 19, 2019",36,"Jardiance (empagliflozin):Took this on Monday 16/09/19 within 40minutes had an itchy rash then was covered in hives and my skin went hot and red, my lips started to tingle and my throat felt weird a few minutes later my face started swelling and it became hard to breathe my partner had to call an ambulance as by then I could not talk,I was given adrenaline ,steroids ,other stuff I can’t pronounce and a bag of saline I was terrified this was the first time taking this medication",Wigwam
89,Empagliflozin,Diabetes Type 2,7.0,,"September 19, 2019",24,Jardiance (empagliflozin):This medicine did decrease my blood sugar but what it also did was make me continually thirsty. For the amount of decreased sugar for me it was not worth continuing. I did not lose weight with this medicine either. I gained weight and my diet is very good for type 2. I did not get yeast infections or kidney infections. My skin was severely dry as was my hair. I stopped this med and am just on metformin .,Tam’s
90,Empagliflozin,Diabetes Type 2,8.0,Taken for 1 to 6 months,"September 12, 2019",33,Jardiance (empagliflozin):I am type 2 diabetic I was put on Jardiance one week ago and in that time I have lost 3.5 kgs. The down sides are constant visits to the toilet during the night and day but if the weight continues to come off I will persevere with this drug. My GP put me on this,red dragon
91,Empagliflozin,Diabetes Type 2,1.0,,"September 7, 2019",59,"Jardiance (empagliflozin):Avoid if you've ever had UTIs or rashes down below - or proceed with caution. After 1 week on Jardiance, my groin was RED RAW. I immediately stopped the tablets.  GP diagnosed ""a severe case of eczema"" and prescribed 5 x small tubes of a thick cortizone cream (Novasone), which took about a fortnight to relieve the redness.Some months later, my A1C shot up so my GP prescribed it again, in addition to the Metformin I take. Reluctantly, I took the Jardiance but had to stop after only a week - red raw again, despite wiping myself after each potty trip with non-allergenic 99.7% pure water baby wipes, in an attempt to eradicate all traces of pee from my skin. It really makes me wonder what this drug has done to my kidneys and bladder.I envy patients who've had no adverse skin reactions but I'm afraid Jardiance is now on list ""medicines to never take again"" list. And it didn't help bring my sugar down much either; I find avoiding night-time snacking works far better!",Blondie
92,Empagliflozin,Diabetes Type 2,8.0,Taken for 1 to 6 months,"September 1, 2019",25,"Jardiance (empagliflozin):Has worked great so far for my type 2 diabetes; however, I have started taking Ketoconazole for a fungal infection that has begun to spread throughout my mid-section...splotches of darkening skin.",rayrons
93,Empagliflozin,Diabetes Type 2,10.0,Taken for less than 1 month,"August 30, 2019",34,"Jardiance (empagliflozin):I recently started using Jardiance and I love-love-love it!  My blood sugar readings have been amazing.  I'm on 10mg, but I think if my doctor increased it to 25mg, I might be able to stop using Novolog fast-acting mealtime insulin--which would be nice.  I'm keeping a log of my readings and will ask the doctor during my next visit about maybe increasing the Jardiance and either stopping or cutting back on the fast-acting mealtime insulin.",Leslie Anne
94,Empagliflozin,Diabetes Type 2,8.0,,"August 23, 2019",64,"Jardiance (empagliflozin):I have been on Jardiance for close to 2 months.  Initially I was on Metformin and Glimepiride (4) 2x's day.  This medicine has really worked wonders for me.  I have only been a diabetic for a 1.5 years.  My doctor reduced the Glimepiride to once a day and took me completely off of the diuretic.  I have experience side affects like everyone else.  I had a yeast infection but taking the prescribed meds cleared it up.  Jardiance causes me to urinate quite often, normally around 10 times a day. I'm up tinkling in the middle of the night; but it's well.   The pro's outweigh the con's.   I'm not the type of person that's easily persuaded by what people say or do.  People, never allow other's opinion to be a defining factor for your health. I plan to continue using Jardiance  because I see the positive result.",Victory
95,Empagliflozin,Diabetes Type 2,5.0,,"August 23, 2019",18,"Jardiance (empagliflozin):I started taking Jardiance on  Tuesday and today is Friday and I'm starting to get a yeast infection but I have more energy and feel good everyday.  I hope I can get my yeast infection under control  as the doctor is calling me something for my yeast infection, I hope it works but I constantly don't want to keep an yeast infection",Libralisa
96,Empagliflozin,Diabetes Type 2,9.0,Taken for 1 to 6 months,"August 20, 2019",30,"Jardiance (empagliflozin):I have been taking Jardiance for over 3 months now.  I am also taking Metformin 2 times a day, 1000 mg.  At my last doctor's visit, my A1C had gone below 7.  I had not heard that Jardiance can cause weight loss.  It was a surprising discovery.  I saw some friends the other day and their jaws dropped.  They could see the weight loss.  It is encouraging.  Being in my early 60's,  I had pretty much given up on losing weight.  My price with insurance, is only $15, (Affordable Healthcare)  not the over $500 a month retail price.   I hope the price stays low for me and I hope the weight loss continues.  It was gradual so I hope to keep it off.",gatyamgal
97,Empagliflozin,Diabetes Type 2,1.0,Taken for less than 1 month,"August 18, 2019",30,"Jardiance (empagliflozin):Only spent 10 days  on it and I had a yeast infection, easy to deal with. Then, by day 12 day upper respiratory issues. Called my primary care and she wanted me to keep taking it. I stopped taking it. Next day I went to urgent care because I could not breath without wheezing and a chest x-ray said I had pneumonia. Great way to end the summer. No way would I ever go back on the pill.",BeastieBarb
98,Empagliflozin,Diabetes Type 2,9.0,Taken for 1 to 6 months,"August 10, 2019",37,Jardiance (empagliflozin):Been taking this for 5 weeks 10mg. Took 4 weeks to get used to it. I was really tired the first 3 weeks. My mmol was 13 but now it is 6.9mmol. I have lost 3 pounds also. Thirst has subsided. Urinating less. Seems to suit me really well. Feeling positive about life again.  Also my blood pressure is now normal. Diabetes nurse pleased with progress. I started taking it at night to stop tiredness. Brilliant pill. FREE ON NHS here in the UK,Steven
99,Empagliflozin,Diabetes Type 2,9.0,,"August 10, 2019",48,"Jardiance (empagliflozin):I started taking Jardiance 3 months ago. I now feel much healthier than before. I originally weighed 231lb when I was diagnosed and the doctor started me on metformin 2 times a day. Got down to 203lb when she introduced jardiance. I now weigh 194.8. Now my arms and legs feel less heavy. I am more flexible. I did get a yeast infection when I got lazy about the water. Monostat 3 took care of that in 2 days. I had a lot of yeast infections growing up.  Overall I am happy she started me on this medication. Diabetes has taught me that my health is my responsibility. My doctor does her part, the medication its and the rest is up to me to know my body and maintain it.",Kelann
100,Empagliflozin,Diabetes Type 2,3.0,Taken for 1 to 6 months,"August 9, 2019",31,"Jardiance (empagliflozin):Been on Jardiance for 5 weeks and up to my 2nd yeast infection and now have a UTI.  Also makes me get leg cramps at night.  Told my doctor, nope, I would rather take my chances with the diabetes than to live with the side effects of this medicine.  Not to mention, the price was insane and my insurance only covers 50% of this over-priced medication.",Beth
101,Empagliflozin,Diabetes Type 2,7.0,Taken for 1 to 6 months,"August 4, 2019",25,Jardiance (empagliflozin):I am in my50’s I Lost 5 pounds I take 10 mg Jardiance  I take Metformin  as well  I prefer this to Tradjenta As Tradjenta gave me a constant runny nose that was gross Yes I have to get up maybe three times a night to go the bathroom  I am thirsty but not as thirsty as I am when my sugar is high  I take it at night so I am not as dizzy during the day  So far so good,Ctlace
102,Empagliflozin,Diabetes Type 2,3.0,Taken for less than 1 month,"July 31, 2019",21,"Jardiance (empagliflozin):Hi,I started taking this medication Jardiance due to diabetes type 2 after blood sugar with insulin 18units, Metformin and Apo-Glickazide did not help bring it under control, although I was being very careful, always hungry.Within 1 week I have a yeast infection down there, am so swollen I can barely wipe after urinating. Also drinking lots of water, up frequently at night to urinate. Will try unscented wipes and Vitamine C. If it doesn’t help, I’m stopping this medication. We don’t need additional health problems.",Blueeyes
103,Empagliflozin,Diabetes Type 2,10.0,Taken for 1 to 2 years,"July 30, 2019",72,"Jardiance (empagliflozin):Endocrinologist took me off of insulin and I started taking Jardiance along with my Metformin.  The results have been life changing for me.  A1C dropped down to 6.7 and went from 237 to 172.  Other than frequent urination, I have not suffered any bad side effects.",JB
104,Empagliflozin,Diabetes Type 2,1.0,Taken for less than 1 month,"July 28, 2019",47,"Jardiance (empagliflozin):If I had run an errand that day in April,  my son would be dead. I found him in a diabetic coma and seizure.  Sweating drenched his bed. Called 911 who didn't come for 25 minutes  they sent cops instead.  His blood sugar was below 20 and dropping.  In 5 to 10 minutes he would of been dead.  We later realized it was the new drug  Jardiance that  pharmacy gave him. He would get dizzy and had even more lows after this. Called to report it to company.  Didn't get far. So I reported it to FDA.  Needs to be taken off market. Someone will die. It could of been my son. I expect to see a commercial for legal  on this drug soon. As I was harmed also.",George
105,Empagliflozin,Diabetes Type 2,3.0,Taken for 6 months to 1 year,"July 24, 2019",21,Jardiance (empagliflozin):Had a yeast infection for seven months and Dr didn't care. Women's Health visits were no help. Dr there said until I get off Jardiance I wouldn't get rid of yeast infection. I went to Drs office with husband with me and insisted on Metformin.,Wheezy
106,Empagliflozin,Diabetes Type 2,3.0,,"July 21, 2019",55,"Jardiance (empagliflozin):I am a nurse and let my diabetes go. My A1C was 10.2.  I was on trajenta  and glipizide. I started on Jardiance 2 months ago. My life has been a nightmare. No sleep due to urinating every hour. Daytime too. My lady parts are about to fall on the floor. Multiple yeast and urinary infections. Never had either problem before.  I have to pour water over myself after urinating (hourly) to stop the burning. I drink a lot of fluids because I am always thirsty. Benefits, 4 point drop in A1C and 20 pound weight loss. But I don’t think I can handle another month of these side effects. I’m going back on Metformin until I get to see my MD. As a kidney nurse, I’m also afraid of it’s toll on my kidneys and ketoacidosis.",Crey
107,Empagliflozin,Diabetes Type 2,9.0,Taken for less than 1 month,"July 18, 2019",24,"Jardiance (empagliflozin):I left a message when I was prescribed this medication (2019-07-10) so now is the update. After about a week of using this I have not felt any side-effects but I did say that I have other conditions which are making me feel some things that people say they suffer with...so I am glad to say this has not made me feel worse. So far so good and I have also lost a couple of pounds. Could be the meds or the stomach issue I have ongoing - yet to be diagnosed!I would recommend trying it and if you do suffer, just stop and try the injection form, which supposedly does not give the same side effects.",ElsieJay
108,Empagliflozin,Diabetes Type 2,10.0,Taken for 1 to 6 months,"July 17, 2019",33,"Jardiance (empagliflozin):Started taking 10 mg Jardiance on April 9th , 2019.  With exercise and Jardiance, I have lost 26 lbs in 99 days. 224.4 lbs down to 198.4lbs.I pee more during the day but I drink a lot of water. Sometimes, I feel slightly lightheaded if I arise too quickly. A1C went from 7.9 % to 7.1 %.  Fasting blood sugars went from ~225 down to ~175 . Have been walking about 15 miles per week at gym. Lower carbs diet.",RobbyL
109,Empagliflozin,Diabetes Type 2,2.0,Taken for 1 to 6 months,"July 16, 2019",28,"Jardiance (empagliflozin):I actually have Metabolic Syndrome X, The yeast infection is not worth it!  I hadn't had one in over 25yrs & now it's a constant nuisance.  Plus, the risk of getting a necrotic perineum is a deal-breaker.  I'm going the holistic route.  Not for me!",Yucky
110,Empagliflozin,Diabetes Type 2,9.0,Taken for 1 to 6 months,"July 12, 2019",37,"Jardiance (empagliflozin):I was using insulin, but had become somewhat better in controlling my A1C so switched over to Jardiance in combination with Metformin.  I did have the vaginal issues off and on, but found if I increased my water intake to flush my system better I did not have this problem. I have lost 15 lbs in four months since starting Jardiance. Overall I am very happy with this drug and my experience.",jaxreg
111,Empagliflozin,Diabetes Type 2,1.0,Taken for 1 to 6 months,"July 7, 2019",41,"Jardiance (empagliflozin):This is the worst medicine that I have ever taken.  I had a yeast infection that was misdiagnosed as vaginal dryness.  The yeast infection got to be so bad that I was bleeding, unable to walk and sit (pain was excruciating!) and my vaginal area is still raw...Still.  This is July 6th and I have had this yeast infection since early April....NOT GOING AWAY.  I have only been off of the medication for two weeks.  It is starting to get better, but it was so bad that it has taken time! THROW IT AWAY.  It is not a good drug at all!",Barney
112,Empagliflozin,Diabetes Type 2,6.0,Taken for less than 1 month,"July 6, 2019",21,"Jardiance (empagliflozin):I have been taking this medication for one week and it makes me extremely thirsty and I feel the need to urinate mostly all the time.  I feel light headed and giddy when I stand, become really tired mid afternoon (I take 10mg around 8.00am) and occasionally feel sick. I have lost my appetite slightly but can not see or feel any weight loss yet, which is what I hope for.  It has helped my sugar levels and as yet, I have had no signs of UTI's or intimate itching. Weirdly though, my lower arm itches like crazy.  I've also had a few headaches, perhaps because I need to drink even more water.  I will keep taking Jardiance as its early days, but the constant thirst and urinating is a pain!",Annie
113,Empagliflozin,Diabetes Type 2,,,"July 5, 2019",19,"Jardiance (empagliflozin):I have been prescribed this medication today to run along side Metformin and have read a lot of reviews, listened to the nurse's advice and so I am hoping it will do what it says it will do. Unless you are strict with yourself and exercise regularly then most of us with this condition will need some help and now I do need further meds. I am 50 and menopausal so a lot of the symptoms described, I do feel anyway!! . The aching, 'women's problems', constant itching all over, light-headed etc. So I am not sure I would be able to tell if the meds are doing this or just normal for me at the moment. But given the fact that I do struggle to maintain a healthy weight (12st currently, 5'5) I am hoping I will feel have some weight loss and then one thing can combat another over time. Obviously, if you feel the extreme side effects then best to change to the injection type maybe... In England so meds cost covered, phew!I will update as I go. Good luck to all.",ElsieJay
114,Empagliflozin,Diabetes Type 2,10.0,Taken for 6 months to 1 year,"June 28, 2019",37,Jardiance (empagliflozin):I have had great luck with Jardiance it has kept my blood  sugar in check and I have had no side effects.,chestnut
115,Empagliflozin,Diabetes Type 2,9.0,Taken for 1 to 6 months,"June 27, 2019",42,"Jardiance (empagliflozin):I’ve been a type 2 diabetic for many years. I’m on a cocktail of diabetic medication. Started with Janumet, added Tresiba insulin and my sugars were still being difficult. I kept raising my insulin levels. When I added Jardiance into my regime of medication, wow, there was no lag in sugar management. Straight across the board normal sugar levels. Not even 1 side effect. I haven’t felt this good for many years. I’ve now been on it for 4 months and still am having great success with my sugar levels. I haven’t lost weight though, but my cravings for sugar has subsided completely.",Candy
116,Empagliflozin,Diabetes Type 2,5.0,Taken for 1 to 6 months,"June 20, 2019",18,"Jardiance (empagliflozin):I have been taking Jardiance for last 6 months. I lost 9 kg within 6 months. It did not control my sugar as I expected. But I have pain and irritation in the places where you all have mentioned. However, I did not find it serious.Can anyone suggest better medicine than this? My GP says that this will better protect your heart",UMR
117,Empagliflozin,Diabetes Type 2,2.0,Taken for 1 to 6 months,"June 18, 2019",16,Jardiance (empagliflozin):Jardiance gave me the most painful nocturnal leg (calf) cramps. I had to discontinue use of Jardinance. I have $100 worth of Jardinance that I can't use.,Izzy
118,Empagliflozin,Diabetes Type 2,6.0,Taken for less than 1 month,"June 17, 2019",20,Jardiance (empagliflozin):I started taking Jardiance 2 weeks ago to supplement metformin and januvia in addition to insulins. I have a very stubborn case of type 2 .  Although my numbers have levelled out I am tired of violently vomiting every night and having an upset stomach all day.  I've lost 8 pounds because I can't stomach anything without barfing.  Otherwise it's ok..,MaureenB
119,Empagliflozin,Diabetes Type 2,5.0,Taken for 1 to 2 years,"June 15, 2019",30,"Jardiance (empagliflozin):I have taken Jardiance for about 18 months now. My doctor thought with my family cardiac history it was a good addition to my diabetic regimen. I had fairly good results at first. HgA1C came down. fasting Blood Glucose came down. Didn't see any weight loss. At first urination increased to an almost problematic level with extreme urgency and frequency. That levelled out after about 2 months. However, I have had almost constant yeast infection, UTI and extreme genital irritation. I tried moist wipes after urination and that helped mildly.  I've had maybe 7-8 yeast infections in my life, I'm 53. Until Jardiance. I have the skin in private areas splitting and bleeding. Meeting with my doctor this week and am requesting another drug...I can't take the constant irritation to my lady bits and surrounding area.",Anonymous
120,Empagliflozin,Diabetes Type 2,1.0,Taken for 1 to 6 months,"June 13, 2019",37,"Jardiance (empagliflozin):Dangerous drug. It should be taken off the market. Took it for 4 months.  Extreme thirst, constant having the urge to urinate.  It did lower my blood sugar.  After 4 months I swelled up like a balloon. WARNING.... DO NOT TAKE THIS DRUG.  Especially if you have any kind of cardiac conditions.  I am surprised no one has died from this drug!!!",TH
121,Empagliflozin,Diabetes Type 2,5.0,Taken for less than 1 month,"June 11, 2019",16,"Jardiance (empagliflozin):Took Jardiance it from May 20, 2019 together with Crestor and Metformin.  From 121 kg to 112 kg today (June 11, 2019).  Too quick weight loss but my daily 30 min walk and less rice and no soda and anxiety (life things) might have contributed to the quickness of the weight loss.  Went to the Doctor today as this is the first time I have experienced this tiredness.  Blood and urine tests were done, better numbers overall (HDL, LDL, triglycerides and A1C down to 7.5 from 8.2).  Asked if I could stop taking it and they agreed as they mentioned I am basically peeing all the sugar I am consuming and as a consequence felt tired all the time.  It is good for losing weight to probably make cardiovascular numbers better but I don't think I can continue taking it long term.  Will consult again on July 27, 2019.",Castiron
122,Empagliflozin,Diabetes Type 2,9.0,Taken for 1 to 2 years,"June 8, 2019",39,Jardiance (empagliflozin):Take Jardiance with loads of vitamin C. Started taking Jardiance about a year ago.  I read about yeast infections as a side effect so take 2000 mg of Vitamin C every night and am fine to stop the yeast infections. I ran out once and got a yeast infection the next day but it disappeared with treatment and hasn’t been back. It’s not a panacea and my A1C hovers between 6.6 and 7.4 but it’s encouraging me to eat and exercise better so overall has been a game changer.,Skykpk
123,Empagliflozin,Diabetes Type 2,9.0,Taken for 1 to 6 months,"June 8, 2019",35,Jardiance (empagliflozin):Have been on Jardiance since January 2019. Have lost about 11lbs. A1c was 9.1 and is now 7.1. Urinating increased at first but has levelled off a bit. I am constantly thirsty but nothing I can't handle. Love this medication. I take 1/2 of a 25mg pill daily.,Charlie
124,Empagliflozin,Diabetes Type 2,3.0,Taken for 6 months to 1 year,"June 7, 2019",13,Jardiance (empagliflozin):I was told today to stop taking Jardiance. I have had two UTI's in recent months. I have gone twice for a urine test because of the constant pain and uncomfortableness in the lower region. At first I thought this would be my wonder drug but now I wonder if I have done damage.  I was grateful for the Jardiance program that paid for my drug.,Jtsags
125,Empagliflozin,Diabetes Type 2,,Taken for 1 to 6 months,"June 4, 2019",30,"Jardiance (empagliflozin):On Jardiance. I started having weird symptoms right off the bat. Dizziness, unquenchable thirst, extreme tiredness and fatigue, vaginal itch from hell, weird bowel movements, for a few days could not pee.  I did nothing but sleep. I could not stand up long enough to fix a piece of toast. I am not hungry. But I do eat. One day I was getting ready to go see the kidney doctor and came out of the bedroom, with no obstruction, did not pass out, did not slip or trip, fell face first into an end table. Went to ER. Thanks God no damage. Blood sugar was 400.  Never in 10 years have I experienced this. They gave me insulin and liquid for I was severely dehydrated. Sent me home. Primary put me on 15 units of insulin. My sugar is down in the day and goes back up at night. Very erratic. I can’t get hold of my doctor to get help so I have researched Jardiance.  I agree with many of you! I quit last night. Thanks to all of you for reassuring me that I am not going out of my mind.  My poor husband.",Barb
