,drug,condition,rating,duration,review_date,upvotes,review,username
124,Yaz 28,Premenstrual Dysphoric Disorder,1.0,,"July 19, 2018",0,"Started on Nikki for PMDD.Found out all birth control can theoretically help PMDD. Thought it was only Yaz becuase it's the only one that did a study on it, but after looking they're just the only company that decided to test for that. Doctor and pharmacist said ALL hormonal birth controls help with PMDD.Happy because no periods when skipped placebo pills. Didn't get pregnant. Did therapy and that helped lots. Could sleep again, was less irritable, less moody, and able to handle stress. Insurance stopped paying for therapy so I stopped. Two weeks later and I went almost completely back to how I was before therapy. Sad that the pill isn't helping me more. Back to being unable to sleep, moody, easily stressed out.I started spotting when I got switched to Loryna. Since my moods aren't being helped with this drug and my sex drive is now zero, I'm just going to get off of it. Not worth the potential blood clots and side effects. Tried it for a year. Bummer.",Amanda
125,Yaz 28,Premenstrual Dysphoric Disorder,7.0,Taken for 1 to 6 months,"July 16, 2018",1,Vestura (drospirenone / ethinyl estradiol):Prescribed for cramps and to help with acne. Definitely helped with acne but not so much with cramps. Now I have medium cramps every period instead of every few periods but at least I no longer have the really intense ones I had before. My period is more regular which is great but comes more frequently than before. My period is also shorter by a few days which is pretty nice. My doctor said that it could take a few months to see changes with cramping. My pharmacy just switched me over to a different drug a few days ago with same active ingredients.,Tomber
126,Yaz 28,Premenstrual Dysphoric Disorder,1.0,Taken for 1 to 6 months,"May 11, 2018",0,"Gianvi (drospirenone / ethinyl estradiol):I was on Yasmin and loved it. I lost weight, my skin cleared, my cramps and bloating gone. I had severe PMDD and it helped BUT I was bleeding constantly. I felt so good I stuck it out for 8 months hoping to adjust which I didn't, so my doctor switched me to yaz and I ended up with the generic Giavni. It's AWFUL! My mood swings are back, I'm depressed and have no energy. I gained 4lbs and cramped 3 weeks out of the month. My back hurts. And I'm still constantly bleeding. I made it through two packs but I can't take anymore. So I'm switching again.",P
127,Yaz 28,Premenstrual Dysphoric Disorder,9.0,Taken for 1 to 2 years,"May 9, 2018",5,"Gianvi (drospirenone / ethinyl estradiol):I started Gianvi March of last year and requested this brand specifically, because a friend had told me how well it worked for them, and it is the generic for Yasmin, which is often used to treat PMDD. I was seriously suffering mentally and emotionally every month before starting Gianvi. Granted I have battled depression/bipolar disorder for quite some time, but everything was so much darker right before my period. I was extremely irritable to the point where everything set me off and I'd get violent, I was crying uncontrollably, completely hopeless, suicidal, etc. In addition to this, I also suffered from pretty bad acne (I'd get large, painful, cystic-like pimples every month that would then often take months to go away). While I still do get acne (I've had it since my early teen years), I no longer get the kind of acne I had been, and it is much more manageable. I'm so glad I gave Gianvi a shot.",Kim
128,Yaz 28,Premenstrual Dysphoric Disorder,6.0,,"April 28, 2018",9,"Yaz (drospirenone / ethinyl estradiol):I started taking Yaz about 6 months ago. I suffer from very severe and painful PMDD & periods (I bloat for like 10 days before my period), have had a fibroid removed, ovarian cyst ruptures etc etc (just bad luck overall with my reproductive system). Docs have put me on a lot of pills in the past. I have to say Yaz is the only pill that has ever helped with my physical symptoms. But, it has also had the most crippling effect on my mental health. I've experienced sadness, anxiety, hopelessness and worthlessness like never before. I cry at the drop of a hat (not normal for me), I can't focus (and I'm in grad school), if my boyfriend doesn't text me back for a couple hours I'm basically on my death bed. It's crazy. I really thought I was going super crazy but I'm pretty sure it's this pill. I'm going to see a doc about it to see what they have to say. It sucks what we have to go through - choosing between pain and discomfort or damaged emotional health!",C
129,Yaz 28,Premenstrual Dysphoric Disorder,1.0,Taken for less than 1 month,"April 20, 2018",1,"Nikki (drospirenone / ethinyl estradiol):Was prescribed Yaz, insurance gave Nikki. Always try to be educated with what I'm taking. Reviews were a little intimidating and despite more negative than positive decided to try for myself. By the second day started breaking out with cystic acne and extremely emotional. Crying, agitated to the depressive thoughts by day 7. (Didn't have acne prior.) Talked to prescribing doctor and stopped after day 8.  Despite reading possible side effects nothing could prepare me for how quick and hard they hit. Not a good fit for me personally. Feel like Nikki should give a better warning how extreme things can be beforehand.",Sarah
130,Yaz 28,Premenstrual Dysphoric Disorder,6.0,Taken for 1 to 6 months,"April 17, 2018",3,"Yasmin (drospirenone / ethinyl estradiol):I suffered PMT in my youth & after years of being free at the age of 42 the condition  came back with even more severity. I was prescribe Yasmin by my gynea & the first month was fantastic. I am now in my second month & my symptoms are worse than ever. I have constant headaches, severe bloating, cramps, break through bleeding & chronic fatigue. I am hoping the third month will regulate my cycle & settle the symptoms.",Clara
131,Yaz 28,Premenstrual Dysphoric Disorder,7.0,Taken for 1 to 6 months,"April 13, 2018",1,"Nikki (drospirenone / ethinyl estradiol):I'd been taking Gianvi for 4 years and I loved it. But I was forced to switch to Nikki last year since all of the pharmacies where I live stopped carrying Gianvi & I'm not happy. It does fine at regulating my cycle but does not help with my cramps (I have endometriosis though, so take that into consideration.) It also does a pretty good job keeping my pmdd under control but I'm also taking an antidepressant, so that works against my depressive mood swings as well. It's not great with preventing acne, I've been getting a lot of hormonal cystic acne. However, my big complaint is that I have been getting frequent intense headaches & menstrual migraines since I started Nikki. I can live with cramps, mood swings and acne, but these headaches put me out of commission & it's interrupting my life. However, because of my pmdd I have to be in this specific pill and I can't afford name brand. My advice is to avoid this pill if you can, especially if you're switching from another bc.",CJ
132,Yaz 28,Premenstrual Dysphoric Disorder,9.0,Taken for 1 to 6 months,"March 29, 2018",13,"Yaz (drospirenone / ethinyl estradiol):I took YAZ in college and never had any issues with anxiety, depression, and anger.  Well now I realize why.....I was on YAZ.  Now in my thirties, I have struggled with PMDD for over five years.  Finally decided to go back to YAZ to relieve my symptoms and its effective.  My first month was easy, I felt a difference immediately.  Now on my second month, I have some bleeding and noticed my hormones are up and down towards the end of the pack.  Looking forward to my third month, hopefully the light bleeding with stop.",Sharon
133,Yaz 28,Premenstrual Dysphoric Disorder,,Taken for less than 1 month,"March 23, 2018",2,Gianvi (drospirenone / ethinyl estradiol):I start my pills tonight! I was on lexapro for 2 years to treat PMDD which was terrible for me and my loved ones.  Lost sex drive completely and gained 42 lbs so doctor is treating me with this drug in order to stop my cycle and relieve me of PMDD without lexapro Stay tuned!,Coleman
134,Yaz 28,Premenstrual Dysphoric Disorder,1.0,Taken for 6 months to 1 year,"March 5, 2018",1,Gianvi (drospirenone / ethinyl estradiol):Stay away from this pill!!  I have always had a happy upbeat personality but this pill killed that.  I started to notice half way through my  4th month that I would start to cry over stupid small things and my anxiety was so debilitating . I am not using this pill ever!,Hate crying !
135,Yaz 28,Premenstrual Dysphoric Disorder,8.0,Taken for 1 to 6 months,"February 28, 2018",0,"I started Bella 21 the end of Jan 2018. First 2 weeks I had a little nausea, slight anxiety, and little on and off headaches. Ginger tea and Advil helped though. At the end of my first pack I got my period on day 3 of my placebo pills. Still had slight bloating and moodiness, barely any cramps. Flow was lighter then the past. Starting second pack. Fingers crossed on this one.",Bella21
136,Yaz 28,Premenstrual Dysphoric Disorder,1.0,Taken for 1 to 6 months,"February 22, 2018",3,"Loryna (drospirenone / ethinyl estradiol):After two months my daughter is having a severe adverse reaction. She has had CT, MRI and now being treated by a cardiologist for long term monitoring due to her risk of blood clotting and heart/stroke related symptoms. This is a very dangerous drug - and for what?  Acne and PMDD?  Please research before taking. Stop immediately with ANY adverse side effects.",Mom who cares
137,Yaz 28,Premenstrual Dysphoric Disorder,9.0,,"November 4, 2017",3,"Gianvi (drospirenone / ethinyl estradiol):I've tried what feels like every birth control for the last 15 years, and always come back to gianvi. I have severe PMDD. Gianvi is the only birth control that controls my cramps, my excessive anxiety, and also keeps those hormonal cysts on my chin at bay. I took it straight for 8 years, came off it because of those scary ads on tv about blood clots, and tried lo-lo. My hair was falling out in massive clumps within two months so I stopped bc entirely. Well, after 6 months I realized my life was revolving around my cycle because of the pmdd anxiety. So, back on gianvi. Within weeks, I felt back to my normal self. 8 because it does worsen my cellulite on thighs that almost completely goes away when I stop taking it. But the cellulite is WORTH IT.",raccoonmath
138,Yaz 28,Premenstrual Dysphoric Disorder,1.0,Taken for less than 1 month,"September 13, 2017",8,"Loryna (drospirenone / ethinyl estradiol):I recently started taking birth control for my PMDD and this is my second pack (Gianvi with my 1st, Loryna for the 2nd).  I'm also diagnosed with GAD (Generalized Anxiety Disorder) with Panic Disorder and depressive symptoms. When I was taking Gianvi, I had no anxiety, mood swings, a short period that lasted 4 days (it used to be 7-9), and my relationship around people, especially my boyfriend, is stable. It's only been my third week of using Loryna, and my anxiety and depression is back, I break out easily, I've been feeling this terrible ache in my lower abdomen, and I've been constantly arguing with my boyfriend. I'm definitely calling my doctor to change prescriptions!!!",Irritated and Achy
139,Yaz 28,Premenstrual Dysphoric Disorder,,,"August 6, 2017",4,"Vestura (drospirenone / ethinyl estradiol):So, I read reviews for this med before starting exactly 1 week ago. I took Yaz years ago and LOVED it! I'm taking this primarily to help with my mood/ hormonal imbalance (self-diagnosis) bc I believe Yaz helped with that before. I saw reviews for this medicine which made me skeptical and I generally don't leave product reviews online, but I wanted to weigh in bc these reviews help. I'm almost 35 years old- have only been taking for a week and I have noticed a breakout on my face! I can't really tell if the meds is helping with my moods or not yet. Sometimes I think it does, but it could be the placebo effect. My plan is to try this for a 3-month cycle to see how my body reacts. After this, I'll either continue with this or go back to Depo-Provera.Meanwhile, I've also heard that the Plexus probiotic VitalBlome is getting good reviews for really helping with moods. I'm ordering that next week.",djohnson22
140,Yaz 28,Premenstrual Dysphoric Disorder,1.0,Taken for less than 1 month,"July 16, 2017",9,"Loryna (drospirenone / ethinyl estradiol):I tried to take beyaz again which was the only birthcontrol I liked ever. My insurance refuses to cover it, so I figured a yaz generic would be similiar enough. I FIRMLY BELIEVE WHATS IN THIS GENERIC IS NOT AT ALL THE SAME AS THE ORIGINAL. How could the same exact medicine affect me so negatively. I took this for two weeks and felt like I was physically having a panic attack all the time. I got this to help me during my hardest time of period. (right before I get it) and spent these past two weeks losing my mind. I do not even believe the positive reviews on this site are legitimate. I was tired, hungry, nauseous and  unable to do my daily tasks. No sex drive. I tried taking it at night to combat these negative things. No escape. Don't take it",life ruiner
141,Yaz 28,Premenstrual Dysphoric Disorder,,Taken for 1 to 6 months,"May 27, 2017",1,"Yaz (drospirenone / ethinyl estradiol):Acne is worse, migraines are worse, gained weight.  Helped with pmdd.  I switched back to aubra last week and my acne completely cleared in 5 days and I feel less bloated.  I'm sticking with Aubra!",Yogini_b
142,Yaz 28,Premenstrual Dysphoric Disorder,10.0,Taken for 2 to 5 years,"March 31, 2017",51,"Yaz (drospirenone / ethinyl estradiol):I used ortho-tri-cyclen-lo from 16-18yo.  My periods were easy without any side effects.  By mid 18yo I was experiencing painful and heavy periods, with strong emotional swings.  My emotions became unpredictable, extremely reactive, and at times I experienced deep depression and strong suicidal thoughts - completely contrary to my personality and traits.  My parents requested I leave university, until that night we read about YAZ studies. YAZ was the ONLY birth control with proven study results showing YAZ helps to control PMDD, which described exactly what I was experiencing.  YAZ was immediately successful. 3.5 years later I am still on YAZ and graduating with a Neuroscience degree. P.S. Generic yaz experience was unsuccessful. 03/31/17",Life changing results
143,Yaz 28,Premenstrual Dysphoric Disorder,9.0,,"March 30, 2017",30,"Yaz (drospirenone / ethinyl estradiol):I started having PMDD when I was 24, I would be depressed and suicidal for 3 weeks every month, and I knew those feelings were not real so I try to fight it by exercising/yoga/massage/oils. After 3 years I finally decided to try birth control. I've read bad reviews about Yaz but it's what doctors recommend for PMDD. I decided to give it a shot. The first week I felt nauseous with migraines. But on the first month my suicidal idealisations are gone and I felt like I'm just having normal PMS. I'm starting my 3rd pack, and really happy with the results.",GraceA
144,Yaz 28,Premenstrual Dysphoric Disorder,,,"January 14, 2017",96,"Yaz (drospirenone / ethinyl estradiol):Hi I'm 43 year my PMDD become worse the older I get.  I use to be a bit moody 2 days before my cycle, now I'm a raving lunatic 1 week before and 2 days into the cycle.  Only to start again before  I enter the ovulation phase.  I feel happy go lucky maybe 1 week per month the rest of the time I can't stand being me.  I'm starting YAZ today wish me luck.  I'll report back in a few weeks.",:)
145,Yaz 28,Premenstrual Dysphoric Disorder,7.0,Taken for 1 to 6 months,"January 1, 2017",20,"Yasmin (drospirenone / ethinyl estradiol):I've been on Yasmin for about a month and a half now. I didn't experience any side effects for the first two weeks of taking it, and then gradually I started feeling more moody, irritable and depressed. My sex drive also went away around the time it would normally be in overdrive. I haven't gotten any acne from this pill, nor weight gain. I did notice that I wasn't nearly as crazy just before my period like normal, so it has helped with actual PMDD so far. I'm now halfway through my second month on it, and it actually seems better so far. My sex drive has improved and I haven't been moody or depressed. Still no acne or weight gain. I think this pill just takes time to adjust to your body  for some people.",Yasmin User
146,Yaz 28,Premenstrual Dysphoric Disorder,1.0,,"December 28, 2016",22,"Yaz (drospirenone / ethinyl estradiol):I was prescribed this pill to treat PMS however, taking this medication was the worst experience of my life. It alleviated anxiety but it made me severely depressed and paranoid. I am a fairly active person and I would go running every day. As soon as I began to take the pill I lost motivation to do the things I enjoyed and it got to the point where I did not even want to leave the house. I also almost lost my job over it. I tried to quit three times in one week and luckily my employer would not let me end my career and encouraged me to stay. Taking this medication also damaged my relationships with my friends and my partner and almost costed me my relationship. Please do not take this medication. ",Bianca1987
147,Yaz 28,Premenstrual Dysphoric Disorder,1.0,,"September 5, 2016",7,"Loryna (drospirenone / ethinyl estradiol):I started Loryna for PMDD.Started on a Sunday. By Tuesday I had 3 enormous, painful zits. By Thursday I was in severe abdominal cramping pain. Similar to period/early labor pains. By Saturday they landed me in the ER.Every lab test and ultrasound/xray was normal so the only diagnoses that made sense was the pill. I'm currently on day 9 of my period which would normally only last 5-6 days. Needless to say, it's in the trash now.",BWayneLin23
148,Yaz 28,Premenstrual Dysphoric Disorder,10.0,Taken for less than 1 month,"August 10, 2016",37,"Yaz (drospirenone / ethinyl estradiol):I'm just simply amazed and I hope this continues to work. I've only taken 2 doses of yaz and I went from constantly struggling with physical and emotional symptoms of pmdd and overall hormonal imbalancement to feeling much more at peace with myself. I feel lite and my body feels calm. I had anxiety, anger, I was hyper sensitive and so negative- I felt it physically. I would physically shake from anger. I could feel my uterus contract and cramp up when I got hurt and was angry. My pmdd had started early just 3 days ago when my breasts just felt so heavy with cysts that were so painful - it hurt to just get out of bed. I could sleep all day. I was cranky and could not stand being touched by my BF. Constipation and lots of gas as well.",EvaGurl
149,Yaz 28,Premenstrual Dysphoric Disorder,10.0,Taken for 2 to 5 years,"July 28, 2016",67,"Yaz (drospirenone / ethinyl estradiol):I was diagnosed with PMDD 3 years ago by my gynecologist & was prescribed YAZ. Let me just say that it changed my hormones to a more controllable manner. I love YAZ & I cannot live without it (honestly) without YAZ I have severe depression during ovulation & cannot get out of bed. PMDD was interfering with my day to day life & relationships. After 3 months of taking YAZ I felt 100% better, I know that every medication has side effects but I didn't get any on YAZ. I came off YAZ after my wedding to try fall a baby & fell pregnant within 8 weeks. I have now given birth & straight back on it as I wouldn't be able to go through PMDD with a new born baby.",Adriana33
150,Yaz 28,Premenstrual Dysphoric Disorder,10.0,,"July 20, 2016",38,"Yaz (drospirenone / ethinyl estradiol):I've been on Yaz for 7 months now, and I am extremely happy with it. I was always a ravenous, aching, emotional mess before my period. It was hard for me to function, and when I was in uni since I could skip classes and lie in bed and cry. I couldn't do that when I started working though. Yaz now makes me a functional human being every day of the month, and even gave me clear skin and an increase in appetite as add-on rewards!The adjustment period was shitty for me because I breakthrough bled my way through my first three months on Yaz, had really bad mood swings that came without notice, and then had a two-week long period. After that period, though, my body has accepted Yaz as its own, and my life is stellar!",Hafiraz
151,Yaz 28,Premenstrual Dysphoric Disorder,1.0,,"May 21, 2016",1,"Used this to help combat PMDD. Instead of having PMDD for two weeks out of the month, which for me results in a sense of complete hopelessness, I had four weeks of rage and crying fits. It was pretty relentless for the four weeks I used it until I stopped. Now I feel much better.",Rueball
152,Yaz 28,Premenstrual Dysphoric Disorder,7.0,Taken for 1 to 6 months,"April 7, 2016",25,"Yaz (drospirenone / ethinyl estradiol):I just start Yaz almost 4 weeks ago. I am 42 years old, I have my tubes tied so I don't need this for birth control but I started having perimenapause issues and I needed something to fix my hormones asap. I actually asked for Yaz. The first three days I was extremely tired but I was also extremely chill. After day 2 things started looking better and each day after that it gets better and better. This has helped the moods quite a bit, right now the only con is that my sex drive is lower but I am going to give my body some more time to adjust to the hormones before I make any changes. I plan on taking this pill back to back to eliminate my periods. I'll check back in another month.",slewis1973
153,Yaz 28,Premenstrual Dysphoric Disorder,10.0,Taken for 1 to 2 years,"March 3, 2016",31,Yasmin (drospirenone / ethinyl estradiol):I was having pretty heavy pms and very irregular mensturation cycle. Now I'm almost on my first year with Yasmin and never ever pms anymore. I feel even happier as my period gets closer. All thanks to yasmin. It took a little time for my body to get adjusted. Almost for first 2 months it made it worse than ever. But I knew that was gonna happen so I was patient. And it ended up extremely well. I recommend it for anyone having severe pms and emotional problems related to period. It's also really good to know exactly when to have your period.,ElifZ
154,Yaz 28,Premenstrual Dysphoric Disorder,9.0,,"January 2, 2016",25,"Yaz (drospirenone / ethinyl estradiol):I started this pill because I was having crazy mood swings and just not feeling like myself at least 3 weeks out of the month. My doctor prescribed me this hoping it would also treat my acne along with PMDD. Well, the first month was pretty rough as far as my acne was concerned but it wasn't as bad as I've read in other reviews. I had a few painful cystic pimples within 2 weeks of taking Yaz. I felt really embarrassed because my old pill (loestrin) gave me clear skin and I wasn't used to acne anymore. Well now I'm about to start my 4 inactive pills and about 3 days ago my skin just cleared up like MAGIC. I read that it takes about 3 months to level out your hormones. But I finally feel like myself again! No more crazy crying fits!!",Jasssss
155,Yaz 28,Premenstrual Dysphoric Disorder,1.0,,"November 21, 2015",19,"Yaz (drospirenone / ethinyl estradiol):After having some issues with what could be classified as PMDD, I went on a search for ways to help alleviate the mood swings I got every month around the time of Aunt Flows visit. After googling around, Yaz was the number one remedy that I found, so I went to Planned Parenthood, got a prescription, and tried it out for a month. Let's just say my PMDD went away... but I was in crying fits and had really bad anxiety for about 80% of the month. Nothing new has come up for me that would cause those issues, and it is very abnormal for me to cry that much and have uncontrollable anxiety. In short, this drug made me a crazier and depressed. It sucked! I've been off of it for two days and I'm finally feeling better. Nope! Not for me.",pinke138
156,Yaz 28,Premenstrual Dysphoric Disorder,10.0,,"November 11, 2015",48,"Yaz (drospirenone / ethinyl estradiol):I am 21, and have been taking the pill since the age of 16. Two years ago I began to take Yaz, after severe mood swings, depression, and overwhelming sadness and anger due to PMDD.  Yaz has been a lifesaver for me! I don't have cramps, my period lasts 3 days at most and is very light (not even enough to warrant use of a tampon), and my skin is perfectly clear, with the exception of 2 pimples a month around menstruation. But the absolute best part is my mood! I became ME again, a happy, easy-going person, who doesn't pick fights with her boyfriend over burnt spaghetti noodles ;)",BosRae
157,Yaz 28,Premenstrual Dysphoric Disorder,1.0,Taken for less than 1 month,"October 26, 2015",5,"Yasmin (drospirenone / ethinyl estradiol):I have started taken yasmin after reading reviews about how good it is for acne and PMS , and I had very frequent periods that I needed to regulate ,   but soon after taking the 1st tablet I had severe nausea that lasted all day , 3 days down the line I became very low in mood , I was very tearful , the slightest things would irritate me , I had never felt like this in ages, I was  taking accutane at the same time , so I attributed the low mood to accutane. Since I couldn't tolerate the severe nausea , I stopped taking yasmin and strangely my mood suddenly changed , I was no longer depressed or tearful and I was still on accutane. I think people react differently to medications , but I am sure yasmin wasn't the right OCP for me.",tenatona
