,drug,condition,rating,duration,review_date,upvotes,review,username
0,Yaz 28,Premenstrual Dysphoric Disorder,1.0,Taken for less than 1 month,"April 2, 2022",0,"Yaz (drospirenone / ethinyl estradiol):Instead of helping stop my period, it caused me to bleed heavily for 8 days, a few days after my period and made me feel very depressed and suicidal. Horrifying experience!",Xxgbh
1,Yaz 28,Premenstrual Dysphoric Disorder,1.0,Taken for less than 1 month,"March 19, 2022",0,"Loryna (drospirenone / ethinyl estradiol):I'm on day 5 of Loryna and I am so suicidal I considered going to the hospital. I was trying it for PMDD, I did have success before on Lo Loestrin FE but I was having side effects of melasma and low libido so I wanted to try something else. This is awful. I've also had nightmares and nausea since starting it.",Math mom
2,Yaz 28,Premenstrual Dysphoric Disorder,4.0,Taken for 1 to 6 months,"March 9, 2022",1,"Nikki (drospirenone / ethinyl estradiol):This birth control at first decreased my appetite by a large comparison to previously used Junel 1/20. I tried this brand for the acne part, since I've seen dermatologists since I was 15 and nothing worked. Now almost 3 months into this brand, nothing has been done to clear my face, I sleep for entire days and am overcome with extreme tiredness. I get severe nausea and throw up at least 3 times a week, and I don't eat as much as I used to. I lost near 10 pounds in 2 months. A good thing was it stopped my painful period cramps and I haven't got a since period since taking the pill. A very slight increase in boob size, but still very tender breasts.",cristy
3,Yaz 28,Premenstrual Dysphoric Disorder,8.0,Taken for 6 months to 1 year,"February 27, 2022",0,"I’ve been on Yaz for 7 months now and started to take it for PMDD (trips to ER, suicidal thoughts etc). I have an underlying anxiety disorder but I can tell you Yaz has significantly improved my quality of life. Initially nervous about potential blood clots, the only initial side effects I noticed were headaches, heavy legs and bloating the first couple of weeks. 7 months later, I do not experience the extreme anxiety linked to my cycle anymore, and only get headaches while using the 4 sugar pills per month. The only long term side effects I noticed is water retention, slight increase in resting heart rate and fuller breast. I would highly recommend to give this medication a go if you are suffering from PMDD. It could change your life.",Girl88
4,Yaz 28,Premenstrual Dysphoric Disorder,8.0,Taken for 1 to 6 months,"February 9, 2022",1,"Yaz (drospirenone / ethinyl estradiol):I was honestly terrified reading the reviews before talking to my Dr about Yaz but we came to the conclusion that this is the best possible option for me. I mainly got on Yaz for my PMDD and acne and have seen a significant improvement for both. My acne is practically nonexistent on my face now and I have very minor PMS symptoms. I saw many reviews saying weight gain can occur but I lost 20 lbs so far. I do have extreme cravings but have gotten pretty good at suppressing them and eating only in moderation. My breasts have grown probably a whole cup size and are extremely tender however. Despite that, Yaz was a great option for me and helped me significantly when antidepressants couldn’t.",julrbel
5,Yaz 28,Premenstrual Dysphoric Disorder,8.0,Taken for less than 1 month,"February 8, 2022",0,"Yaz (drospirenone / ethinyl estradiol):I've only taken it for a month so far, but I do notice a positive effect. My PMDD made me near suicidal, crying a lot, etc. to the point where I would just isolate myself from others to hide it. I didn't notice any of those problems this first month on this pill. I didn't even bloat or have oily skin like I used to. The first few days were weird, just adjusting to a new med. I got headaches for a couple of days. I've had consistently weird dreams and issues sleeping while on Yaz. I've had more of an appetite, but that may just be from going to the gym more recently. I didn't notice any real weight gain. If weird dreams is the price to pay for this drug, its worth it. My mental health definitely in my control now. I hope this drug continues working.",macncheesequeen
6,Yaz 28,Premenstrual Dysphoric Disorder,9.0,Taken for 1 to 6 months,"February 6, 2022",1,"Yaz (drospirenone / ethinyl estradiol):I don’t ever write reviews but I need to help some girl who is potentially going through the same situation as I was 4 months ago…! I was very on and off about whether or not I wanted to try Yaz as I had heard good reviews but then very horrific ones about blood clots that scared me so bad. I went to the doctors twice in one week as I was having the worst panic attacks due to me thinking I would get a clot, however I tried again and the first 2 months I was quite short tempered and very tired and my skin also got worse, however I persisted and the only negatives now 4 months in is that I do tend to get tired more often and sensitive to sad things, along with a lower libido, butttt the pill has completely gotten rid of my PMS and I feel so much more level headed and calm. I also don’t get severe sugar cravings like I used to and have actually lost some weight, my skin is clear and periods are pretty much gone in 3 days! (Also no pregnancy;)",AMAZING!!!!
7,Yaz 28,Premenstrual Dysphoric Disorder,10.0,Taken for 1 to 6 months,"February 2, 2022",0,"Yaz (drospirenone / ethinyl estradiol):I was a little nervous to start Yaz because I had a bad experience with Alesse years ago (it made my mood a lot worse). I started Yaz due to irregular periods and significant PMS symptoms. I take it with no breaks (no placebo pills) as per my Gynecologist and it has made a significant positive impact on my life. I had noticed that my mood is generally a lot stable during pregnancy and this is very similar since I do not ovulate. I'm happier, feel more even keeled and it has even increased my libido. I haven't noticed any side effects and my weight has been stable (I'm on the 3rd pack currently).",tiger2022
8,Yaz 28,Premenstrual Dysphoric Disorder,1.0,Taken for 1 to 6 months,"January 27, 2022",0,"Yaz (drospirenone / ethinyl estradiol):I had my fallopian tubes fully removed after Mirena for 11 years and deciding I didn't want more kids. My period was non existent for the time on Mirena so I only had my teenage years of periods to compare and suddenly as a 32 year old I was experiencing similar emotional/mental troubles as I had when I was a kid. Irrational thoughts, depression, anxiety, mood swings, crying constantly for no reason, hopelessness. I'd come out of this period fog and feel fine and be confused about why everything felt so dire just days before. My Dr started me on Yaz 2 months ago and my H cup breasts have gotten so big that none of my bras fit anymore (as if I needed them to be bigger?!) I have acne that won't clear, I've been bleeding in between periods along with uterine & vaginal pain, my sex drive is dead, hasn't made a difference in my PMDD. I called my Dr this morning and told her everything that's going on and she agreed this clearly isn't the right option for me and is switching me to Prozac.",Anonymouse
9,Yaz 28,Premenstrual Dysphoric Disorder,9.0,Taken for 1 to 6 months,"January 11, 2022",2,"Yasmin (drospirenone / ethinyl estradiol):I started talking this pill 1.5 month ago for PMDD. I still have PMS to some degree but my mood is SO MUCH BETTER! I was really sceptic to take this at first because of all the negative experiences I read, but I gave it a try anyway.. I feel like I am myself again. I feel happier, am less anxious (which was severe), I can handle stressful situations better. My sex drive has gone up because I’m not always in pain or depressed anymore. I still need to take it longer to notice full effects, but the ones I’ve already noticed are life changing for me. I am so much more confident about myself. I don’t feel puffy anymore. No more swollen stomach. My acne is not gone (yet) but is a LOT better than it used to be. My wounds heal better. My skin looks more moisturised and clear. I have more energy,… the only downside is that I’m very tired in the morning. I will come back for update after 3 months of taking it",Fruitjuice
10,Yaz 28,Premenstrual Dysphoric Disorder,1.0,Taken for less than 1 month,"December 18, 2021",1,"Yaz (drospirenone / ethinyl estradiol):Never felt this way on a BC it was only my 4th day on the generic version of Yaz. I got a terrible headache and then couldn't sleep at all until 3am. I stopped taking the pill and the day after I still had a headache. My mood went down really bad and anxiety came back. I only had mild anxiety on Nuva Ring and heard Yaz helped with PMDD. My PMDD was way better without taking these pills. I am also taking Venlafaxine for my anxiety and maybe the combination of the drospirenone and my dose was too much. I started getting cystic acne that I never got before. My face was pretty clear with a tiny pimple or two. On this for only 4 days and I woke up with acne marks that hurt so bad. I scar easily so I couldn't continue this BC, I'm happy it worked for everyone else.",Nope
11,Yaz 28,Premenstrual Dysphoric Disorder,8.0,Taken for 2 to 5 years,"December 17, 2021",1,"Yasmin (drospirenone / ethinyl estradiol):I've been on Yasmin for around 2 years now and it has been such a lifesaver. Before this I had PMDD and would only have 1 good week in the month, the rest of the time I would be angry, irritable and sad to the point of having major depressive episodes that really affected my relationships with people. I've noticed cumulative improvements with this pill and now I'm much more stable and happy. I take mine back to back so I have a period once every 3 months and this works great for me!Things I've noticed:Good stuff:-No acne anymore-My boobs grew-Period cramps reduced (but mine were debilitating so they are still painful)-Shorter periodsBad stuff:-Vaginal dryness-Lowered sex drive-Increased susceptibility to yeast infections",mimi
12,Yaz 28,Premenstrual Dysphoric Disorder,10.0,Taken for 1 to 6 months,"December 9, 2021",0,"Loryna (drospirenone / ethinyl estradiol):Was given this in addition to Celexa to help with PMDD and general anxiety disorder. Was taking Jolessa for the past year and it made my anxiety/pmdd extremely worse. On the second month of Loryna and am absolutely in love with this pill. In combo with my anxiety meds it has taken away all bloat, my weight has started to decrease (gained 20 pounds on Jolessa) and my energy has returned. First period on Loryna was only 2 1/2 days with zero cramping. No acne. My anxiety and pmdd is still there but instead of 2 weeks of nightmare I had maybe 2 really bad days.",Anonymous
13,Yaz 28,Premenstrual Dysphoric Disorder,8.0,Taken for 6 months to 1 year,"December 9, 2021",0,"Yaz (drospirenone / ethinyl estradiol):I've taking Yaz for 7 months already.It saved my life as for the past 2-3 years I have had really bad mood swings. It started when I was 28. I've never had menstrual pain that intense as well.Yaz helped me a lot - no more mood swings, I don't cry anymore and I don't have any menstrual pain and breast pain. It also helped me to recover from depression I've experienced for the past 2 years (I started feeling better after therapy and thanks to tranquilizers, but Yaz helped me to adjust after I cancelled my meds).I don't need painkillers anymore during my period.I haven't gained weight and my skin is the same as it was before, but I have 2 side effects as well.First, I almost lost my libido. I don't have any sex drive.Second, the rare times when I do, I have problems with the lubrication.",Nat
14,Yaz 28,Premenstrual Dysphoric Disorder,10.0,Taken for 1 to 6 months,"November 29, 2021",0,"Nikki (drospirenone / ethinyl estradiol):Nikki has improved my life so dramatically.  I was on birth control from ages 14 until 27 when I started trying to get pregnant. After my son was born, I decided to stay off the pill and see how I felt. 1st year was ok, but then my periods became irregular and I started to have HORRIBLE mood swings. I would feel almost euphorically good for a week or so after my period ended and then live in 2 weeks of nightmare living. (irritability, depression, low energy)I started reading more about PMDD and decided to give this a try. The 1st 3 days I had really bad headaches. I have also experienced some nausea and also random increased anxiety which oddly always seems to happen after eating. Perhaps the anxiety is related to the nausea?Overall, my mood has been much more stable all month long. No highs, lows or angry outbursts. No weight gain- I think my stomach is actually feeling flatter. I plan to take this for 3 months continuously.",sea4321
15,Yaz 28,Premenstrual Dysphoric Disorder,8.0,Taken for less than 1 month,"November 12, 2021",1,"Yaz (drospirenone / ethinyl estradiol):Last month after one of the worst PMDD episodes (ER trips, over drinking breakdown, rage) I decided to just start the pill and give it a go, a month later and I'm cautiously optimistic and very confused. Started my period today and scratching my head as I've got barely any stomach cramps/ no back pain/ migraines in the week leading up to it so I'm rather confused. Felt rather sad the last few days, been watching sad commercials and crying and feeling somewhat guilty so I was expecting this to be the start of my horrific PMDD setting in, only to find - I started my period today lol. My boobs are fuller (no complaints there at all, yay!), rather perplexed, having suffered from PMDD since I was 13 it feels like a total new experience, this must be how normal people felt getting their period?! I was going to go for the coil but I wanted to go for a less invasive procedure first, wow. All I can say is wow and I hope this continues to work for me, I really recommend at least giving this a go!!",perplexedlol
16,Yaz 28,Premenstrual Dysphoric Disorder,10.0,Taken for less than 1 month,"November 10, 2021",0,"For many years I thought I had a weak immune system and was often sick. About a year ago, through journaling how I felt day by day of my cycle, I realised that there was a pattern and that I started feeling bad 10 days before my period, this gradually getting worse until the day before my periods. I self-diagnosed myself with PMDD, having all of the 11 symptoms inherent to it. Some medical advice includes eating healthy, doing sports, meditation… but I already did all of this. I figured out that mine must be quite strong and read about the combination pill. I had to tell my doctor about what PMDD was (which got all my girlfriends very angry). Luckily he was understanding and agreed that it was worth trying the pill. I’ve been taking it for a month now, and apart from a few discomforts (nausea the first week, spotting, sore breasts), I am so happy, relieved and grateful to say that my PMDD are completely gone now. I will finally be able to focus in my life.",Zoé
17,Yaz 28,Premenstrual Dysphoric Disorder,4.0,Taken for 1 to 6 months,"November 6, 2021",1,"Vestura (drospirenone / ethinyl estradiol):I am a 39-year old woman. I started taking Vestura five weeks ago to help with extreme mood swings during PMS. It's been 10 years since I last used birth control pills. I skipped the placebo pills and went into the next pack of active pills as advised by my doctor, but a week into the new pack I experienced medium-to-heavy breakthrough bleeding, cramps, nausea, and emotional distress, including crying spells and passive suicidal thoughts. I do have a history of anxiety and depression, but I'm concerned about continuing to take this pill if there's a possibility it's bringing on these intense emotions. I've decided to stop taking it rather than ""wait it out"" another few months.",Anonymous
18,Yaz 28,Premenstrual Dysphoric Disorder,10.0,Taken for 1 to 6 months,"October 13, 2021",2,"Yaz (drospirenone / ethinyl estradiol):I've had a v positive experience with Yaz (Eloine in the UK) which has completely cleared up my previously debilitating PMDD. All of my symptoms have gone: the fatigue, nausea, difficulty concentrating, depression, anxiety, foggy-headedness, bloating, water retention, cravings, muscle aches and insomnia. I've been taking it continuously for four months and, although for the first few weeks I noticed some of the side effects mentioned on the leaflet, such as tearfulness and breast swelling (also, I was hornier than usual!), these went and left me feeling really good. I don't notice a single side effect now, and I have more consistent energy and happiness. Also, no weight gain to speak of: I just had some fluctuations in water retention during the first month, and my shape has slightly changed (a little less fat on my stomach/more on my hips), but it's not extreme and I feel good. I definitely recommend trying Yaz for PMDD, and I hope your experience is as good as mine!",Great for PMDD
19,Yaz 28,Premenstrual Dysphoric Disorder,1.0,Taken for less than 1 month,"September 20, 2021",0,Yasmin (drospirenone / ethinyl estradiol):I’d taken Yasmin previously about 7 or so years ago for birth control and had no problems with it. I had started taking it again after having 2 children to help manage my PMDD and I felt nauseous all day and had very little energy or motivation to do anything I had to stop taking it after about a week because I just felt so awful all the time.,Shi
20,Yaz 28,Premenstrual Dysphoric Disorder,10.0,Taken for 1 to 6 months,"August 31, 2021",20,"Yaz (drospirenone / ethinyl estradiol):I have had severe PMDD for 3 years and I resisted hormonal birth control until I was having psychotic breaks every 2 weeks. It was destroying me and was extremely difficult and painful for my husband as well. I went on an antidepressant (Lexapro), which helped throughout the month, but was not powerful enough to prevent me from having crying spells and severe dips in mood around my period. I finally gave Yaz (a generic of it) a go. The first week was awful. It was like having a milder version of PMDD for 7 days. I had crying spells and low mood the entire week. Literally the day I was going to stop taking Yaz, I started feeling normal again, and have been feeling normal ever since. I feel emotionally strong and balanced again for the ENTIRE month, like I haven't in years. This little pill has given me my life back. Looking back at myself without Yaz makes me sad, but I have come out on the other side stronger and with more empathy. No one should have to go through the pain of PMDD.",lisssabel17
21,Yaz 28,Premenstrual Dysphoric Disorder,1.0,Taken for 1 to 6 months,"August 26, 2021",0,"Loryna (drospirenone / ethinyl estradiol):I was prescribed this for my SEVERE PMDD. Initially I had several days of break through bleeding, once that stopped my skin slowly starting becoming TERRIBLE. My once perfectly clear skin now has black heads all over my chin, my pores were starting to look bigger and just greasy, and now my chin has zits all over it, some under the skin. My forehead started breaking out too. I also developed restless leg syndrome, my stomach bloat is insane, and the closer I got to the placebo pills I felt constantly angry and ready to snap on everybody. It was starting to severely affect my moods and relationship. I also would feel very nauseated and just ill if I waited too long between meals, almost like when I was pregnant. I stopped after the first pack and its now in the garbage. Would not recommend to anybody. It was free under my insurance, literally the ONLY positive.",Melisa
22,Yaz 28,Premenstrual Dysphoric Disorder,8.0,Taken for 1 to 6 months,"August 26, 2021",1,I tried Yaz it made me feel less agitated and calm however I became disgusted at the thought of sex when I usually have a pretty high sex drive. I didn't even want my boyfriend looking at or touching me. One mild acne flair up in the first few days but that went away pretty fast. I had nausea when I started was pretty bad for approx. 3 days then gone. So overall the only negative side effect I had was a severe loss of libido. I discontinued for the mini pill and that was horrendous in comparison to yaz.,leximsluxx
23,Yaz 28,Premenstrual Dysphoric Disorder,6.0,,"August 23, 2021",0,Yaz (drospirenone / ethinyl estradiol):I just took my first one today never have taken birth control I'm 33 and I think I had a 4 second anxiety reaction I had to put cold water on my face and breath in and out now I'm ok maybe I need a lower dosage or I don't know if I was just scared,adela
24,Yaz 28,Premenstrual Dysphoric Disorder,3.0,Taken for 1 to 6 months,"August 16, 2021",0,"Loryna (drospirenone / ethinyl estradiol):I’ve been taking this for over a month and I feel miserable. I will say it has helped with my acne and it helped during that two week period before my cycle where my PMDD really kicked in, but now starting this second pack of pills I feel like a worthless monster. All I want to do is lay around, my house is a disaster. I don’t want to spend time with my family and my sex drive is a -10. I have generalized anxiety and depression which I take medication for and I’ve never felt lower in my life than when I started taking this. It helps the PMDD and acne but it is not worth losing all my joy.",Dev
25,Yaz 28,Premenstrual Dysphoric Disorder,8.0,,"August 12, 2021",0,"Loryna (drospirenone / ethinyl estradiol):I was prescribed this medication for severe PMDD and severe dysmenorrhea. I have only been on this medication for 2 weeks so far and I have not had any noticeable (I also take citalopram 10-20 mg QD) side effects either other than a bit more frequent urination. I have naturally clear skin, but  it seems to almost have a glow to it now though honestly. I did have about 4 days of mild spotting/bleeding initially, but no cramping really and that has stopped. I have mood swings, but I have those off of the birth control, so they haven't gotten any worse or better. I tried to stop the citalopram to see what Loryna would do on its own and I had HORRIBLE withdrawal side effects. I don't advise anybody to cold turkey stop that medication while also on a hormonal birth control or period. I rated Loryna an 8 because I don't know how I will feel 2 more months down the road. I have a history of truly bad mental health side effects from hormonal birth control. Will update then.",Melisa
26,Yaz 28,Premenstrual Dysphoric Disorder,3.0,Taken for less than 1 month,"July 28, 2021",1,"Yaz (drospirenone / ethinyl estradiol):After 4 days, I'm giving this a miss. Prescribed for PMDD and peri menopause symptoms. Terrible nausea and anxiety. I'm not looking to make things worse than they are. One day off it and feel better already. I'll just have to keep enduring these terrible periods until I am blessed with menopause.",Lou
27,Yaz 28,Premenstrual Dysphoric Disorder,1.0,Taken for less than 1 month,"July 3, 2021",1,Yasmin (drospirenone / ethinyl estradiol):Only been on it for a week and can already feel anxiety creeping up. Bad headaches and struggling to fall asleep every night. Has anyone suffered from insomnia from this pill ??? Read all the reviews and I am completely horrified I am stopping this pill ASAP. OH and it’s a rip off 80 bucks for Insomnia and anxiety?,Stef
28,Yaz 28,Premenstrual Dysphoric Disorder,1.0,,"June 17, 2021",8,"Yasmin (drospirenone / ethinyl estradiol):I started Yasmin as I read that it helped with severe PMS and didn’t cause weight gain. In short, thought I was dying when taking this. A list of the symptoms I was experiencing, which have gone since I stopped taking it:Extreme fatigue (big into my fitness and I couldn’t do a 10 minute walk at times)Extreme emotions (crying, depression) whilst feeling numb and disconnected.Joint pain, knees especiallyMuscle pain and shooting pains in arms and legs.DOMS would last 5 days instead of 1 day.Weight gain - over a stoneConstant nauseaNight sweatsAnxiety and chest pains, regular heart palpitations Declining kidney functionPainful, swollen feetBleeding under the skin Bad headachesSore eyes and blurred visionHair loss and brittle, broken nails Please reconsider taking this pill, I think it’s awful. now on the copper IUD and I’ll take the very painful periods any day over how I felt on Yasmin.",Victoriamcc
29,Yaz 28,Premenstrual Dysphoric Disorder,5.0,Taken for 1 to 6 months,"June 2, 2021",3,"Yaz (drospirenone / ethinyl estradiol):It’s been 2 to 3 years since I have PMDD. I had terrible anxiety, crying spells, I felt rejected and I had insomnia every month and never really realize it was PMDD, but about 6 months ago, I talked to my mom about it and she told me it was probably PMDD, because she had the same thing. Yaz was the solution for her. So, I tried it with hope it would work for me. Unfortunately, it didn’t help me. I believe it even made it worse, I had anxiety panics during the night which I rarely had before. Also, it really affected my libido and I never wanted to have sex with my bf. I was really feeling desperate and feeling that nothing would work for me until I tried antidepressant Citalopram. For me it was life changing, I take 10 mg every day and I have almost no more symptoms of PMDD, it has worked  really great for me. So, I would say, try Yaz first, because it worked for my mom and it worked for a lot of women and if it doesn’t work, try citalopram! It is really life changing for me:)",emmast
