,drug,condition,rating,duration,review_date,upvotes,review,username
0,Desvenlafaxine,Anxiety,,Taken for less than 1 month,"March 17, 2022",0,"I just want to get some hope. I have been dizzy for more than a year. All tests done, no apparent cause. Anxiety, depression, stress is the aiming explanation. Was prescribed this, I am afraid by the negative reviews, I do not want to start this, get hooked and still have this fatigue, dizziness and certain lack of motivation. On top of this sickness my girlfriend kicked me to the curb. I am really hopeless, I think I am physically sick without any way out. I think I am good guy, smart, etc... and I have this thought this drug may change the good I am. I quit fluoxetine 8 months ago. It helped but it made me irritable or at least I was irritable too often while on it. Please, some light to make the decision.",Rick
1,Desvenlafaxine,Anxiety,9.0,,"March 7, 2022",1,I was pretty hesitant to try this medicine because the reviews. But I’ve tried many other antidepressants/anxiety brands before. This one by far is the best one. I take 25mg daily.  My anxiety is little to none on a daily base. No racing thoughts. I can enjoy daily activities where before I was so irritable over everything all the time. I never wake up tired anymore and I can really tell a difference in my energy levels. I will say it made me lose 20 pounds I’m never hungry so that’s the only down fall to this medicine for me.,Anonymous
2,Desvenlafaxine,Anxiety,1.0,Taken for less than 1 month,"February 24, 2022",0,"This medication was prescribed to counteract the effect my emotional state was having on my blood pressure.It had the opposite effect, spiking my BP to such dangerous levels that I required urgent medical attention. I was taken off the drug immediately after 9 days use. Take note of the side effects and proceed with caution.",Gadey64
3,Desvenlafaxine,Anxiety,5.0,Taken for less than 1 month,"February 5, 2022",2,I have only taken desvenlafaxine for 5 nights and I’m finding to I’m so tired I have slept all morning I know it’s early days but can someone tell me does the tiredness go away. I’m finding it’s increased my anxiety but today I feel calmer.  I’ve read so many positive reviews thank you,Noami
4,Desvenlafaxine,Anxiety,9.0,Taken for 1 to 2 years,"October 31, 2021",2,I have been taking Pristiq for 1 year now and it is highly effective for my anxiety. First month I had insane insomnia (would sleep for maybe 2 hours a night) and also had zero appetite. Things went back to normal once my body adjusted. Only downside I feel now after a year is that I do not feel major emotion at all. The highs aren’t high and the lows aren’t low - I always feel neutral. Also have a hard time feeling emotion towards other people which can be problematic. It is also very expensive.,SF27
5,Desvenlafaxine,Anxiety,9.0,Taken for 1 to 6 months,"October 3, 2021",2,"I tried a lot of antidepressant like (zoloft,sertraline,prozac) for anxiety and the best is pristiq .No side effect for me. try desvenlafaxine",Pristiq
6,Desvenlafaxine,Anxiety,9.0,Taken for 1 to 2 years,"September 30, 2021",0,It has helped me a lot as all of the sudden I started to have extreme anxiety. Since I started taking it my anxiety is gone,Anonymous
7,Desvenlafaxine,Anxiety,2.0,Taken for 6 months to 1 year,"August 20, 2021",0,"Pristiq was prescribed and I gladly took it…only because I was unable to function any longer at that point. I had been on another antidepressant for years with no problems and stupidly thought that ridding myself of chemicals was the way to go. I stopped that antidepressant. But eventually anxiety issues manifested themselves …..so I thought Pristiq, recommended by my GP, would be a slam dunk solution. Right from the first pill I experienced a bitter taste and thought this will go away as my body adjusted. Fast forward to 6 months of living with a constant bitter taste all this time. As far as my anxiety issue the drug was mildly effective. I still was unable to sleep, had tingling sensations to left leg area , hot flashes etc. I was out of the country at this point and miles away from my GP. Everything tasted like I had eaten a bag full of kale. On my return home… my first job was get this drug out of me. After a month of stopping PRISTIQ the bitter taste is worse……",Anxious Lady
8,Desvenlafaxine,Anxiety,10.0,Taken for 1 to 6 months,"July 13, 2021",3,"It's an amazing drug indeed. I was suffering from heavy anxiety in the early days of quarantine in 2020 and my doctor told me to start taking desvenlafaxine 50mg with 20mg of Frisium. After 2 months I began taking only 100mg of desvenlafaxine and my life has been much better. Overall, my anxiety is non existent and I don't crazily worry about small things like before. The only negative point which I don't even care is that I sometimes feel a little slow in my thoughts. Not dumb but I take thoughts calmly.This weekend I forgot to buy my meds and I did not take it for 2 days. My life was a nightmare. Headache, dizziness, confused and vivid dreams, stress and anxiety. So, never forget to buy extra quantities whenever you can",Dio
9,Desvenlafaxine,Anxiety,10.0,,"June 27, 2021",7,"I am on day 3. Weaning off 20 mg Lexapro,  at 10 mg/day for 1 week my house is spotless! But with deaths of parents and sister in 10 years, I have been hit hard,  10 years ago. People need to understand,  no matter how strong a person you are, this nasty anxiety has no bias! I felt I was letting everyone down I loved, this alone causes you depression, hard to explain. I have an outgoing personality as I work with the public daily, in truth..that is what saved me to make it through another day. Most times I didn't want to go home after work. The house, mess...no one respecting my little requests,  eg. picking up shoes, putting their own back packs out of the hallway, I'd leave notes to - it just made me feel sad and alone.  I'm hopeful now I found relief! Wonder how family will respond? Besides always pushing my buttons for a reaction.",Mklos
10,Desvenlafaxine,Anxiety,8.0,Taken for 6 months to 1 year,"April 7, 2021",3,"Definitely helped with anxiety, was a noticeable change. I am a 21 year old male with GAD.",Me
11,Desvenlafaxine,Anxiety,3.0,Taken for 1 to 6 months,"February 6, 2021",3,Well I started taking pristiq three months ago and it was okay at first then out of no where I started having crying spells and I felt so out of it! All I had was bad days! It made me dissociate so bad with myself. I felt like I was watching my life just fly by all I felt was constant worry or sadness. I ended up seeing a psychiatrist and I have been diagnosed with bipolar disorder so I was taken the wrong medication so if you have bipolar disorder I would NOT recommend this medication at all.,Maddi
12,Desvenlafaxine,Anxiety,8.0,Taken for less than 1 month,"December 21, 2020",27,"I have severe Anxiety, PTSD, MDD and so have been taking Pristiq for seven days now. The first three days I was zonked and did not feel emotions, prior to this I was experiencing nightmares and anxiety attacks from childhood trauma along with vivid memories which would make me feel like I was reliving the event, so starting off zonked was not bad for me. For the past two mornings, no where near as dopey but I have woken and almost instantly have ""anxiety belly"" I can feel the stressful thoughts trying to seep through but they're not as loud as usual. Today is my seventh day, I woke up and today my anxiety belly is not as bad but still there. I really hope my physical anxiety will cease with the medication. Sick of not being able to live my life :(",Jam
13,Desvenlafaxine,Anxiety,5.0,Taken for 1 to 6 months,"December 13, 2020",3,"I have anxiety, negative thinking, and not engaging in social activity. And a continuous darkness -- I took Pristiq and it was terrible on the first day. Where it caused me severe nausea and the flash in my eyes and fogs in the brain, I felt better on the tenth day, and then the symptoms returned again -- After a month of the use of medicine, I can say that I changed at 40% to the best. But not exactly -- Now I've completed two months of having a 50 dose. I think it's enough time. And I want to try another medicine. My advice: You will be tired in the first weeks, but you have to resist and continue until you see the result.",Seito0o
14,Desvenlafaxine,Anxiety,10.0,,"November 22, 2020",24,Okay I suffer from PTSD childhood trauma. Fast forward I want my life back and decided to seek help. All the therapist are booked and backed up due to people struggling with mental illness since this quarantine and covid stuff. So my primary dr got me on this medication because I was losing it I felt it. Three weeks now I feel amazing. I will say this medication you shouldn't forget a day or two like I did because I felt so sick and run down. Nausea and body aches wow. I know its helping me because I'm more positive and don't feel so worthless anymore.,Nina
15,Desvenlafaxine,Anxiety,1.0,Taken for less than 1 month,"August 29, 2020",10,Started this drug desvenlafaxine 5 days ago when I had my 2nd ever panic attack and I haven’t been able to sleep since.  At first I thought it was my anxiety keeping me up but it was the side effects of this drug that has only made my anxiety worse . I warn those this seems to be a strong drug and don’t be tempted to get on it after your first anxiety attacks. I plan to get off of it but I am terrified that my body will react to the removal of this drug from my system. I'd rather have an anxiety attack than to feel like a zombie at 4am struggling to sleep. My doctor said I can wean off of it after a year but I have yet to read about someone successfully do so.,Amob23
16,Desvenlafaxine,Anxiety,8.0,Taken for 6 months to 1 year,"August 25, 2020",15,"I had been struggling with increasing anxiety and depression for about 2 years. Very stressful work, and losing the two people closest to me in the space of 6 months didn't help.I have been on Fluoxetine before, and it worked well. My psychiatrist recommended I try Exsira (this is desvenlafaxine generic where I live).It's been amazing. I'm dealing with my still-stressful job a lot better. I'm more confident, and just feel so much better in general.Social anxiety is still there, but I can deal with that in other ways.My libido has dropped, but I just need to make a bit more of an effort to keep things going. My BF totally understands.The downside is if I forget a single dose, I get brain zaps. Very uncomfortable and annoying. Overall I'm very happy with it.",Lily
17,Desvenlafaxine,Anxiety,8.0,Taken for 1 to 6 months,"August 23, 2020",12,"I missed 2 days of med I am on 150mg Pristiq, taken in morning.Somehow I forgot to take both Friday and Saturday. Today (Sunday) has been a complete nightmare, my withdrawal symptoms are dizzy, nauseous, can barely stand up, hot and cold sweats. I took today’s dose as soon as I woke at 8am. It’s now 6pm and I still feel so bad.How long will this last??? If I take another dose before bed tonight, could it make me feel myself sooner? I know not to double up when missed dose, but am hoping if I took a dose this morning, then next dose 12 or so hours later (so before bed this eve), I could speed up process of feeling normal again??I am desperate for some answers but don’t know where else to go",Purple42a
18,Desvenlafaxine,Anxiety,3.0,Taken for 1 to 6 months,"August 2, 2020",34,"After being on Venlor for a year and a half, the medication suddenly stopped working during my final year of high school, ensuing in a damn difficult year emotionally and mentally. This year May, I decided to try Exsira (generic of Pristiq - cannot get the generic in my country). The first 4 weeks were difficult with difficulty sleeping in the first week, heightened anxiety, and waking up so fatigued and drained throughout the day. Most of the side effects subsided except the fatigue which truly became debilitating - especially during quarantine. So I'm officially stopping this medication soon and trialling another. Reminder - Just because this medication didn't work out for me, does not mean it won't for you. I had such hope that it would work because Venlor did, but everyone is different. Don't let horrible reviews discourage you, everything is worth a try to be happy, so keep at it! Sending my best to all of you struggling, you got this <3Mara, 18",Mara
19,Desvenlafaxine,Anxiety,10.0,Taken for 5 to 10 years,"April 1, 2020",117,"I felt the need to provide my experience here after reading so many other comments. This drug  b has quite honestly saved my life. Anxiety, nervousness, control issues, and related anger issues would rule my behavior and was taking a major toll on my family. I've been this drug for many years now and it turned everything around for me completely. I'm able to live a somewhat normal and happy life specifically because of this medication. I know everyone's situation is different, but taking this medication was one of the best decisions of my life, and I have no problem continuing to take it for the rest of my life.",Bob
20,Desvenlafaxine,Anxiety,1.0,Taken for less than 1 month,"March 29, 2020",22,I have decided to come off this medication desvenlafaxine after 10 days of nightmarish living. I haven't had panic attacks in over 10 years and yet on this medication I have had 3 in the last 10 days. If anything this medication has made me realise that my symptoms are probably really mild and that I don't need medication. My partner came home one night and literally thought I was on drugs because of how wired I was from this medication.,Anxiouschick
21,Desvenlafaxine,Anxiety,8.0,Taken for 1 to 6 months,"February 20, 2020",32,"I have only been on this for 11 days, I’m really tired during the day ,and can take a three hour nap, my doctor said about three weeks and it would be a great change for me. I’m looking forward to the serotonin clicking in my brain!!! I get a bit shaky, and a bit dizzy, Little bit of brain fog. I figure after three weeks if this continues then I won’t be taking it. But honestly I’m looking forward to it working. So I’m doing this with a positive attitude!!!",Mousie
22,Desvenlafaxine,Anxiety,10.0,,"February 18, 2020",45,"This drug has been amazing for me. I have always been a little anxious but no issues. Then I had appendicitis that hospital failed to diagnose despite repeated visits for 8 days. This progressed to peritonitis and sepsis and I was in hospital for 5 weeks, after nearly dying.I went back to work ASAP and then realised I was on the brink of a breakdown. Constant crying and hospital flashbacks and unable to sleep. I went to a new GP desperate for help and he recommended Pristiq.I had the first four days of side effects - bad headache, feeling out of sorts, constipation - but after two weeks I felt better. The anxiety? Turned off like a tap. No more constant running of negative thoughts or traumatic flashbacks. It has been amazing.Only issue I have with it now is some days I feel utterly exhausted but it’s not every day, and the freedom from the anxiety is the best - I am a better partner and better colleague. I’ve never taken anti depressants before and I’m a convert now.",JM
23,Desvenlafaxine,Anxiety,10.0,,"February 8, 2020",96,"Pristiq (desvenlafaxine):I'm in love with prestiq.I had a breakdown where I was just over stressed and I couldn't stay awake. I slept for 3 days straight. My doctor put me on lexapro which made me feel annoyed. I went back and asked him for some Valium.  For 2 years I took Valium every couple of days but wanted to get off it as it's not good long term but I couldn't stay awake without it, and my anxiety was really peaking when I didn't have it. I was scared to try anti depressants again but my doctor said pristiq should work so I tried it and fell in love with it. I've been on it for 3 years and it has done wonders for me. I only take a  50mg dose which has really calmed my anxiety down and dulled my flight reflex. My doctor wanted me to start coming off it but I have no interest in doing so until my kids are big. I feel I cope so much better when I am on it. Im so grateful to that doctor for convincing me to try it. In the beginning I felt a bit out of it and high for about a week, the tight jaw and shaking that went away soon",Anonymous
24,Desvenlafaxine,Anxiety,9.0,Taken for 1 to 2 years,"February 6, 2020",31,"Great, life changing. I'm so glad I agreed to go on Desvenlafaxine, I feel like my old self again. It suppresses those feelings you have no control over regardless of how hard you try. Some side effects included initial constipation, jittery jaw, feeling a bit dizzy, but all subsided after a few weeks. Dry mouth still persists and if I forget to take it for a day I get the dizzy type feeling, but this goes when I get back on track with it. Side effects are well worth the positives. I have now halved the does to 25 mg (I cut a 50 mg myself as thats the lowest dose) and feel it still helps me. I am slowly working towards reducing the dose, I will see how I go through winter on 25 mg, but I will have no concerns to go back up to 50, and/or even stay on it forever if needed! It has improved my quality of life immensely.",Harold
25,Desvenlafaxine,Anxiety,1.0,Taken for 1 to 6 months,"January 8, 2020",8,"I took desvenlafaxine for a few weeks, for moderate-to-severe anxiety and mild-to-moderate depression.Side effects were horrible from the beginning, increasing my anxiety and making the dizziness and the brain fogs worse. It improved over time, but in the end I was still worse than before, so I stopped it and changed the medication.",Igor
26,Desvenlafaxine,Anxiety,9.0,Taken for 5 to 10 years,"January 5, 2020",39,"I used to have terrible panic attacks and have had anxiety since I was a kid. Pristiq took my anxiety away. A lot of people say it didn't help them or gave them terrible side effects but for me, it was a life-changer.",Naninzoo
27,Desvenlafaxine,Anxiety,9.0,Taken for 1 to 2 years,"October 2, 2019",13,"I’ve been on pristiq (50mg) for 18 months & it’s helped reduce my anxiety immensely. First week was tough feeling nauseous, tired, & dizzy, but that all went away. However, I’ve noticed that my weight loss plateaued & has hovered around the same weight since. This is besides a healthy diet & gym 3-4 times a week. I also have a minimal libido/sex drive &  issues with maintaining an erection or finishing. However, the improvement in my mental health meant I didn’t care while I was single, now that I’m dating it does get frustrating. I’ve also noticed jaw tension as I saw another reviewer write. I also have some detachment from emotions in general, but not so severe that I feel like a robot.Missing a day can also be hell; I usually take my tablet in the morning and if I forget I feel dizzy and cannot focus by 2pm.About to talk with my GP about coming off to see how I go without meds again.",32 y/o male
28,Desvenlafaxine,Anxiety,1.0,Taken for less than 1 month,"September 6, 2019",12,"I was prescribed this medication desvenlafaxine for anxiety and depression. Ever since I started taking it, I can’t sleep at night. Eyes wide open and my brain can’t shut down! Horrible! I will not be continuing...",MomOfTwo
29,Desvenlafaxine,Anxiety,9.0,Taken for 6 months to 1 year,"August 10, 2019",33,"I've been taking this medicine for about 7 months. In the beginning, I suffered through some extreme side effects (my body felt really heavy, couldn't leave the bed, lot's of nausea, etc) but after 10 days it started getting better (so if you can, try pushing through the side effects).I started taking desvenlafaxine for depression and anxiety and while it has KINDA helped with my depression I feel almost anxiety-free. Before the medication, I couldn't make a phone call without having an anxiety attack, and I had some serious tachycardia but now I don't feel any of it.One downside I felt from the medication was that I started feeling really drowsy and couldn't quite focus on my everyday tasks. I talked to my doctor tho and he recommended that I start taking bupropion alongside desvenlaxine so I hope that helps! Overall, I think this is a great med.",Nathalia
30,Desvenlafaxine,Anxiety,10.0,Taken for 5 to 10 years,"July 17, 2019",69,"I've been on Pristiq for anxiety for over half a decade and honestly I think it's great. Sure it's a bit of a crutch. But I've managed to achieve my university degree, meet, marry and bare children with the love of my life all while under the influence of Pristiq. I was actually prescribed Pristiq due to my anxiety and it has worked a treat. It's worth noting that I am on 200mg a day and every time I get my script filled the doc has to call up poisons control. But it's all good in the hood for me. Just have it with my coffee in the morning and try and get on with my life. I've achieved a lot while on Pristiq and I'm sure it has given me additional confidence and makes me more sexual, lasting and sensual. It's been win win win for me.",OilPainter1985
31,Desvenlafaxine,Anxiety,8.0,Taken for less than 1 month,"July 11, 2019",59,"Before I began this medication, I had terrible anxiety. I was barely functioning. I am currently on day 13 and I really started to notice a difference on day 10.  They say it takes months for symptoms of depression to improve but this works pretty quickly for anxiety.  The side effects I am experiencing are constipation and brain fog. Hopefully that lets up, but I am feeling much better without being constantly anxious. My anxiety has gone from a 10 down to a 2 on a 1-10 scale.",Jay
32,Desvenlafaxine,Anxiety,8.0,,"June 28, 2019",12,I've taken desvenlafaxine for about 18 months and in the beginning it worked great for me.  It helped me feel happy for the first time in years.   But I have severe anxiety issues that it no longer works for with out an increase.  I want to get off of medications now because ultimately I am the source of the solution for every issue I have.  ,Anonymous
33,Desvenlafaxine,Anxiety,7.0,Taken for 6 months to 1 year,"April 19, 2019",11,I’ve been on desvenlafaxine for 10 months. It worked great for my anxiety (which it was prescribed for). However I did gain almost 20 pounds 135 -155pds :(. Due to this I have stopped taking it.,Jbird
34,Desvenlafaxine,Anxiety,10.0,Taken for 1 to 2 years,"April 18, 2019",44,"I used to have severe anxiety to the point where I had to drop out of public school and began online school. I couldn't leave the house to even get the mail, all curtains had to be closed, and I started getting extremely depressed. After 2 years of therapy and countless medications with no positive effect, my doctor prescribed me Pristiq. A few months later, I was almost anxiety free and back to public school. That was a little over a year ago, and I'm now the happiest I have ever been. I have little to no anxiety or depression anymore. The only problem I've ever had with this medicine is the withdrawal when I forget to take a dose of it (extreme dizziness and brain fog) but that's avoidable.",Loving life
35,Desvenlafaxine,Anxiety,1.0,Taken for less than 1 month,"January 14, 2019",19,"Not good for me. After the first 2 days no real side affects. Day 4, couldn't settle. Walking around the house and garden feeling sick in the stomach. Day 5. Eight hours of on and off panic attacks. Night five, extreme anxiety all night. Day six did not take it and resumed to normal by the afternoon. Awful reaction. Never again!!",Wal
36,Desvenlafaxine,Anxiety,9.0,Taken for 1 to 6 months,"January 1, 2019",56,"I have suffered from moderately severe anxiety for most of my life. No depression. I took Paxil CR for about 3 years and it worked very well for about 2 years, then stopped working. Switched to Pristiq and feel much better. It took about 3 weeks to notice any change in my anxiety, but it definitely works. I've been on 50mg for a month now. Only side effects are dry mouth and some excessive tiredness, but that is so much better than being on edge all the time. Some reduced appetite, nausea and insomnia when first beginning this med but has since gone away. Only gave 9/10 because I'm only a month into this med and probably haven't reached the full benefit yet. Also take Xanax a few times a week (1mg), and while that works amazing for situational anxiety, it doesn't work for generalized all day everyday anxiety. Pristiq is working very well for me! Hope I don't jinx it.",June22
37,Desvenlafaxine,Anxiety,9.0,Taken for 1 to 2 years,"November 27, 2018",36,"I was to the point that I would look out the window to make sure no one was out side just so I could pop outside to get the mail, Just the idea of having to shop for food made me have chest pains and cry I could not do it anymore ... So I went back to the doctor and started this medication after 2 weeks I felt human again . I was myself for months but then I forgot to pick up my prescription and then it was a holiday and I thought it would be ok because it took so long to go into my system ... I was crying in the line at the pharmacy because my chest hurt and I could not breath my anxiety was back and bad . It was not ok do not miss a few days when you have bad anxiety it is still there waiting to overtake you :(  I am back on it and doing well .I now am on a ready fill program that will call me a few days before I run out so it never happens again .",I could not leave the house
