,drug,condition,rating,duration,review_date,upvotes,review,username
38,Effexor XR,Anxiety,10.0,Taken for less than 1 month,"December 27, 2019",42,"This medication Effexor was a life saver for me. I took prozac 20 Mg. It worked for a week or 2 and then I had to raise the dosage, until I got to 60 mg. My depression was treated but my anxiety was not. I kept having anxiety attacks every now and then. It depends on what form of anxiety u have. Prozac helped with not panicking in stressful situations but did not help with my fear thoughts. With norepinephrine things drastically changed. Though, when I raised from 37.5 to 75 mg my anxiety raised waaaay up. If u want to start at 75 mg make sure u take half and the other half at least after 4 hours until u build up tolerance. Hope it helps u too!!!",Lazapro
39,Effexor XR,Anxiety,9.0,Taken for 6 months to 1 year,"December 13, 2019",48,"Effexor has been a life saver for me! I tried Zoloft first because that’s what worked for a lot of my friends. Zoloft made me very sick so I was switched to Effexor XR and I feel amazing!!’ I had been living my life after having kids, but  sick to my stomach 24/7 and having majorly anxiety attacks. I’d have to leave work but no more. I still get anxious here and there but am able to cope with it now! Effexor isn’t for everyone but it worked and still works for me. The only thing I can say is a down side to it is I don’t always sleep as well as I did before starting it but life could be worse.",Laurenressel12
40,Effexor XR,Anxiety,6.0,Taken for 6 months to 1 year,"November 25, 2019",37,"I started taking Effexor 75mg for my anxiety at 22yrs old when lexapro and Prozac were no longer working for me. I immediately felt relief after I started taking it. I am very bad at taking it at the same time everyday/remembering to take it every single day and have experienced some of the most horrendous withdrawal symptoms. I start to notice it about 6-7 hours after a missed dose. I’ll start to feel off balance, headache, fatigue, flu-like feeling, vomiting, etc. This drug is amazing if you remember to take it but it is definitely something you need to be on long-term. Highly addictive & horrible withdrawal symptoms.",Andrea D.
41,Effexor XR,Anxiety,1.0,Taken for less than 1 month,"November 14, 2019",43,DO NOT TAKE THIS DRUG I have had very bad anxiety for about 2 years now and I have been given venlafaxine one time to see if it helps. It was the worse experience ever I took 1 capsule and experienced problems for 2 maybe more weeks. I had the worst anxiety ever the scariest dreams and my vision on life was completely different I felt sick for about 3 days my vision was blurred and I barely remember anything. It's been about 9 months since then and I still think about the horrific time I had,Jay T
42,Effexor XR,Anxiety,10.0,Taken for 10 years or more,"October 26, 2019",85,Been on the drug  effexre for 19 years. Not one relapse. A life saver for me,Peter
43,Effexor XR,Anxiety,5.0,Taken for 5 to 10 years,"October 20, 2019",21,"Effexor was a life saver for me Back in 2010. I had tried a couple of ADs for anxiety and depression with poor results. 150 mg Effexor and 300 mg Seroquel Prolong finally did the trick for me. I had 8 wonderful years and slowly reduced my dosage. Was on 50 mg Effexor for a year and 50-150 mg Seroquel. Finally quit Effexor in the spring of 2018. Started getting stressed a couple of months later - under a lot of pressure at work- so I decided to start Effexor again. This time all hell broke loose. I immediately had horrible side effects on 37,5 mg. Titrated to 225 mg but good effects of Effexor never kicked in. After 11 months with no positive effects I cross-tapered to Cymbalta. 5 months later no success. Feel much worse than before reinstating Effexor. Losing hope.",SLilly
44,Effexor XR,Anxiety,1.0,,"October 16, 2019",38,"This stuff is bad. On Effexor I could not think, could not eat, could not sleep, over stimulated and felt like I was having a 24 hour panic attack, and its highly addictive!  More big pharmaceutical pushing highly addictive garbage.",Rhonda
45,Effexor XR,Anxiety,1.0,Taken for less than 1 month,"October 14, 2019",26,"Doctor wanted to take me off Xanax and try Effexor.  It was the XR 37.5 dose.  I took one dose and that was the worst experience I ever had--just about landed in the emergency room.  Awful headache, severe dizziness and nausea, I tried walking to the bathroom and I didn't know where my feet were landing  and my heart was racing.  Thank goodness I only took one dose if this.  Obviously everyone cannot tolerate it.  Xanax it is for me (.5 mg once or twice daily).  Never ever had any side effects from that.",KAP
46,Effexor XR,Anxiety,4.0,Taken for 1 to 6 months,"October 3, 2019",14,"Female (45) taking Effexor for about 6 months. I used to be on Celexa but my anxiety was getting worse. I didn't have any problems getting used to Effexor like others have. After having been on it for 6 months, I'm back to having severe anxiety, so I'm being switched to something else. Weaning off hasn't given me the same problems other people have. I'm not working right now, though--if I was working I'd probably notice the withdrawal symptoms much more than I do. I've noticed sweating, feeling dehydrated, and an achy feeling all over.",JJ
47,Effexor XR,Anxiety,10.0,Taken for 1 to 2 years,"October 3, 2019",67,"Effexor has been great. I had been on 25-50 mg of zoloft for panic attacks and high anxiety and it had worked for a few years but then after I went off for 4 months and started getting them again, when I got back on it I got the worst morning panic with nausea, vomiting and IBS for three months. I didn't want to switch but it was getting so bad I'd have anxiety for most of the work day and was afraid I might have to miss work. It was a good thing my cubicle was right next to the bathroom during that time!  Finally I told my pcp I was ready to try something else and she prescribed this Effexor ER. She told me to stop the zoloft and start 37.5 MG of ER venlafexine. It was night and day. No more panic attacks and no more morning nausea and vomiting and anxiety and IBS. It's been over a year and I still like it. I took it in the morning at first but switched it gradually to night because I sleep better that way.",Believer
48,Effexor XR,Anxiety,1.0,,"September 25, 2019",38,"I was prescribed Effexor 37.5mg ER by my Dr to help with menopause symptoms (mood swings hot flashes etc) and I have mild generalized anxiety disorder she said it would help also. I took 1 pill at 10pm. By 11pm I had the worst anxiety I've ever experienced,  shaking, hot/cold flashes, nausea, diarrhea, muscle rigidity, complete loss of appetite. I tried to ride it out. By day 4 I still had the symptoms and ended up inpatient psychiatric.  It's been 9 days now since I took just the 1 pill and I'm still dealing with these side effects. My anxiety is higher than I've ever felt it. I feel like I'm in constant fight or flight state. I'm having multiple panic attacks a day. I still can't eat or drink much. I've lost 12 lbs in a week. The psychiatrist at the hospital said this drug at this dose can induce an ""anxiety episode"" in some people. How long this episode is gonna last, no idea but I hope it goes away soon.",Worstexperianceever
49,Effexor XR,Anxiety,8.0,Taken for less than 1 month,"September 22, 2019",21,On 150mg dose for social anxiety and depression. I take the 75mg tablets twice a day. It works better on my depression and somewhat effective for my social anxiety. Still too early to tell if it will work. Mild tiredness and trouble sleeping at night is only side effect that I notice with an occasional nausea if I don't eat small meals every 4-6 hours. The only time that I got scared was when I started Effexor and stopped the Prozac. I had a major panic attack for two days but after that it subsided. So I'm back on my Effexor. At least now I notice some improvements in my mood compared to taking Prozac which didn't work for me.,JB78
50,Effexor XR,Anxiety,1.0,Taken for less than 1 month,"September 9, 2019",36,"Took this before bed and woke up at 3:30am nauseous, bad diarrhea, sweating, and shaking. Had no appetite all day and was dehydrated. Tried napping and heart was pounding just laying there. The next day I had a migraine up until day 3 and felt awful. Will not take again. Should be called Sideffexor.",Maddie
51,Effexor XR,Anxiety,,Taken for less than 1 month,"August 15, 2019",14,"I started the Effexor the was  prescribed by my doctor for anxiety. By the second dosage, I felt nauseous. The nausea I could handle as it wasn’t severe, but what came next was not. From my elbow to my hands were weak and tingling. I experienced a severe brain fog, I couldn’t think properly, couldn’t respond. It was so severe, that my husband had to pick me up from work. I was dizzy and lightheaded and almost fell going down a stairwell. With time it did get better, but subsequently I had a migraine. Today (next day) my arms are still weak, my cognitive abilities are, better but there is still a delay. I was told by my doctor it would be in my system for an additional 48 hours.",Ashley
52,Effexor XR,Anxiety,1.0,Taken for 6 months to 1 year,"August 12, 2019",20,"I took it for a few weeks and couldn’t come off, possibly the first time in my life I’d experienced real panic. You need to be aware that you may well be on this drug for the rest of your life, it is so incredibly addictive. Withdrawal is the worst",Tbh
53,Effexor XR,Anxiety,8.0,Taken for 1 to 6 months,"July 29, 2019",97,"I have been on Effexor for just over a month and I can say that I'm rather surprised.I am a 25 year old male, who has been on antidepressants for almost 12 years (unfortunately I was diagnosed with depression and a social anxiety disorder at a very young age). Prior to being prescribed Effexor - I was on zoloft for a few years. Zoloft worked, but as time went on, started to loose it's effectiveness.  With Effexor I have more energy and feel that I can get through the day.I hope this medicine continues to work for anyone suffering <3",ATTORNEYSA
54,Effexor XR,Anxiety,8.0,Taken for 6 months to 1 year,"July 1, 2019",21,"I have been on Effexor for the past six months after weening off of Zoloft, which I had been on for years and it seemed to have lost effectiveness. I’ve had a generally positive response to it- I am a female late twenties on 150 MG/day extended release. Dry mouth and decreased libido are side effects I have experienced, but they are mild and aren’t a big enough deterrent to get off the med. I definitely can notice a huge improvement in my mood overall, even though I was prescribed this for anxiety it seems to help my depressive symptoms a bit more, with the exception of the week before my period. Just don’t miss your dose for more than 3-4 hours because that’s when I start feeling weird withdrawal side effects! Didn’t get that with Zoloft",L
55,Effexor XR,Anxiety,9.0,,"June 22, 2019",71,"I was absolutely hysterical, I got so anxious and depressed, I wanted to end my life. I put off taking medication for so long. I was hesitant to take effexor due to the reviews. Now that  I’ve been on it for almost a month I already feel better. It changed my life, I’m not anxious and I’m able to go out and do things. I do get dry mouth, insomnia, tiredness, and my appetite decreased.",Mj
56,Effexor XR,Anxiety,10.0,Taken for 1 to 6 months,"June 4, 2019",61,Helped me from the first time I took it.,Dan
57,Effexor XR,Anxiety,9.0,Taken for less than 1 month,"May 19, 2019",30,"Effexor was awesome for my anxiety and panic, but being a male , I had a very hard time in the bedroom. Could not finish. Unfortunately I had to go back to Pristiq for this reason.I've been on Pristiq for a long time and it's works quite good, when you compare it to Effexor XR, the Pristiq  just doesn't feel as good as . But it is a lot milder in its  side effects in the bedroom.Anyway I read that a lot of people are having a horrendous time getting off Effexor.My doctor advised me to straight swap Effexor 75mg for 50mg Pristiq next day and it worked great. I felt a bit sick in the stomach for a day, but that was it.Just allow yourself a day or two free days, just to be on the safe side.I've also done the same for 150mg Effexor to 100mg Pristiq.I've always tolerated Pristiq quite well.That's also how my doctor advised me to transition from Pristiq to Effexor as well. Just straight swap next day, also worked fine.Hope this helps.",Billy
58,Effexor XR,Anxiety,9.0,Taken for 1 to 6 months,"April 26, 2019",65,"I have been on Effexor XR 75mg for the past 4 months now for social anxiety/GAD. A sense of calm and relaxation has come over me. I have days where nothing seems to phase me and I couldn't care less attitude. For me this is a good thing as I use to worry constantly about small, stupid things. I  think this is called ""emotional blunting""I also seem to look people in the eye and maybe give them a smile. This drug takes awhile to kick in so I would suggest maybe sticking with it. I also take Mirtazapine 15mg at night,",EIRE DOD
59,Effexor XR,Anxiety,6.0,Taken for 5 to 10 years,"April 22, 2019",25,After starting Effexor (went up to 200mg) for my anxiety/panic attacks I felt great. No more anxiety or panic attacks at all and it was amazing. After having suffered soo much I thought the side effects were worth it at first. Then I gained 15 pounds. If I didn’t take it exactly at the same time every day I would get dizziness and headaches and often had headaches even if I properly took it. I had constipation so I had to take meds for that. Then after a while the stomach pains started and only got worst until I had to start taking meds for that too. So after 8 years I felt it wasn’t working as well as before for the anxiety and I was fed up of the side effects so I decided to change meds. Getting off of it was hard (lots of side effects) and had to be done VERY slowly (took months). Now been off it for 4 years and my stomach is still destroyed (heartburn & reflux) and I still need to take meds for my stomach!,Blueanx
60,Effexor XR,Anxiety,9.0,Taken for 1 to 6 months,"April 17, 2019",103,"I owe a great thank you to Effexor. My cons are vivid dreaming and minor sleep difficulties. But the pros for myself, outweigh the bad. For the first time in 10+ years my anxious thoughts and sweats are almost nonexistent. I enjoy the taste of food again. And I feel like I have more purpose, I don’t walk around with the I’m just here, useless cloud over me. I will continue to fight to feel right, Effexor has definitely gave me my footing.",STEEL
61,Effexor XR,Anxiety,1.0,Taken for less than 1 month,"March 18, 2019",34,"Stopped after first capsule. I had Nausea, headache, dizzy, disoriented, rise in blood pressure to 170/93, blurred vision, extreme fatigue, difficulty breathing, tightness in chest, caused onset of IBS. I couldn’t get out of bed for 36 hours.",jim7005
62,Effexor XR,Anxiety,9.0,Taken for 5 to 10 years,"March 6, 2019",58,"I have taken this drug for almost 10 years. Dosage has varied from 37.5mg to 225mg. It is very effective for my depression and anxiety. Right now 75mg is working well.You need to taper slooooowly off this med. Continue getting your regular dose, open the capsule and remove 2-3 beads at a time, each week. It might take a year or more, but you won’t feel the physical withdrawals (much). This method has helped me find the right dose for me, for now.Taper down very, very, very slowly.",Sher
63,Effexor XR,Anxiety,1.0,Taken for 2 to 5 years,"February 24, 2019",36,"Was on 150mg for the past 3 years. I tried to get off them earlier last year to no avail for the withdrawals from this drug seem to be incredibly dangerous and life halting. For 2 months now I have been going down in dosage from 75mg to 37.50mg and now 0 mg. Throbbing shocks in my head, convulsions, bad stomach pains, nausea, mentally destroyed - random crying and rage from anything that catches my emotional attention (dropping a pencil etc). I do not recommend this drug. It may have helped me get through some hard times but in my honest opinion I feel this should be illegal. I have had to take time off from work for I cannot function appropriately.",Jeremy
64,Effexor XR,Anxiety,3.0,Taken for 2 to 5 years,"February 12, 2019",25,"Suffered from anxiety from a kid. Didn't get diagnosed until I was in my 30's. Was on Celexa for a couple years but found that it never really kept the episodes away. Doctor decided a switch to Effexor might help. The electrical shocks and the way it made my nerves feel was something else for a good 1 month or two before is started to calm down.  Always feel on edge with this drug at 75 mg. Don't miss a dose or go to long between the 24 hours or you'll notice weird head episodes. I found taking it before bed was he best way for me. At one point doctor thought it might help going up to 150 but that sent me to hospital with serotonin syndrome, lasted 2 days. After 3 years I started having shaking and dizziness symptoms similar to someone with MS or Parkinsons along with other neurological issues. Noticing the symptoms are worse close to the time of needing to take the next dose.  Looking to get off the medication this year.",Levi
65,Effexor XR,Anxiety,9.0,Taken for 1 to 2 years,"January 22, 2019",70,"I came to be on this drug in January 2018. I suffered from panic attacks and GAD. I felt horrible, I lost all my motivation and I was scared being crazy. I started with Effexor XR 37.5 mg for a week. Then I switch to 75 mg XR. The first month was the worst. Dizziness, akathisia, more panic attacks, sleepiness, my nerves were cracking. After 3 weeks all the side effects were gone and I started to feel better. Every day a little better. Now I am a new person! My husband is happier than me! Psychotherapy improved the effect of the drug. I really suggest to complement the drug treatment with psychotherapy. What I suggest is to resist quitting in the first month...it's always darkest before the dawn!",sara90
66,Effexor XR,Anxiety,9.0,Taken for 1 to 2 years,"January 13, 2019",82,5 years ago I got panic attacks.Thought I was dying!  This created non stop anxiety insomnia etc.Couldn’t even function after this I was a wreck at 37 years old.This medication got me back into life.In about 3 weeks I was back on my feet.I bought a house and moved in with my girlfriend.  I was on this medication 75mg a day for one year.  Off for another year.  Back on for the next.  Then off again for a year.  Today I have anxiety keeping me up for last few nights.  I am starting on this medication again!  Without this medication I would have not had a great last 5 years! Also currently I am starting to meditate as science shows it will physically change your brain!  Wish everyone the best.  Please remind yourselves it will get better!,James bennett
67,Effexor XR,Anxiety,10.0,Taken for 6 months to 1 year,"January 12, 2019",20,"My panic attacks started in 2012 , I started taking Zoloft 50mg which was working well until 2018 when my panic attacks came back, and the worse was that my hands started shaking which I think can be side effects of Zoloft,  since June 2018 my psychiatrist prescribed me Effexor XR, started 37.5 mg for 1 week and then 75mg and increased it to 112.5mg since August 2018. I am very happy, and I feel that it is working. Side effects were little nausea (If I take it with food it is much less ), sometimes I have headaches and in summer I was sweating a lot and some times I feel tachycardia. I believe tolerating the side effects are much easier than having panic attacks. The only problem that I have is may hands are still shaking specially when I am doing delicate things,",Suzo
68,Effexor XR,Anxiety,1.0,Taken for less than 1 month,"December 11, 2018",17,I am a 39 yr old female I took effexor XR  @ 75 mg a day for the first and last time last night. I was prescribed this medicine for anxiety and panic attacks . I took the medicine about 8:30 by 9 I felt very weird and anxious I went to sleep and woke up for work in a horrible state. I felt like I was coming off hard drugs. I was and still am shakey and having a hard time just walking around and functioning.  I went to work and can't believe I drove they sent me straight home and followed me to make sure I made it safe. This medicine is way to intense for me it's 6 pm the next day and I still am struggling to get back to normal so I can work tomorrow.  This medicine isn't for everyone.,Zeppelin
69,Effexor XR,Anxiety,1.0,,"September 27, 2018",31,"I was taking Celexa for anxiety and when that stopped working effectively after three years my doctor put my on Effexor. I cannot express enough how much I disliked this drug. I took it at a high dose for a while and decided to cut the dose in half because I just felt numb. And then I crashed. I felt so many emotions in one day, I felt like a different person. All of my personal relationships were failing because I was just pushing people away. I’ve never felt depression before and I constantly felt alone in the dark with no light in sight. I honestly had no care in the world if I lived or died. So I stopped all together. I would rather feel my old anxiety than any of the negative emotions I felt on Effexor.  By day three with no meds I saw a light at the end of the tunnel. I’m now at a week clean and I’m starting to feel like me again. I will never touch this medication again.",Tori
70,Effexor XR,Anxiety,9.0,Taken for less than 1 month,"September 15, 2018",51,"I been on this medicine for two days due to peri menopause which is causing me to have blackout panic attacks. Dr started me on 75mg once a day. The second (no joke) I took this medication I was having a panic attack. It had almost an instant effect. The first day I was a bit dizzy and had diarrhea.  Woke up in the middle of the night having hot flashes. But no anxiety what so ever. Second day I took it at the exact same time. Not one single side effect. This drug is a life saver and changer.  I also have ADHD and been on Adderal XR 15mg for 18 years. I was worried about how these two pills would work together. All I can say is WOW!! Effexor XR and Adderal Xr together couldn't be a better combo. I'm a completely new person.  I wake up and take my Adderall and then about dinner time I take Effexor. I am now calm, have no more agitation and anxiety due to the Effexor, plus I can stay focused and alert all day due to my Adderall. I couldn't feel better. These two medications work hand and hand.",Nicole4477
71,Effexor XR,Anxiety,,Taken for less than 1 month,"September 8, 2018",26,"My doctor prescribed this for ongoing Anxiety, and it was HORRIBLE!!  I took one 37.5mg dose at around 9:30 pm.  At 2:30 am I was jolted awake from a bad dream.  I never have any trouble sleeping before but I suddenly had an overwhelming feeling that I needed to get up and go somewhere.  I paced around my house not understanding why I couldn't stop moving.  My heart was pounding and my body felt electrified.  I had this cold sensation that felt like ice water in my veins but I was sweating profusely.  My mind was racing but I felt confused over what was happening.  I finally woke my husband up, and he had to sit up with me for over an hour until the worst of it passed.  The next morning I had nausea and felt like I had the flu, shaking and chilled.  This was probably the worst I've felt in my life and although I've never done meth I imagine it feels somewhat similar to how I felt.  Please beware when trying this medication for the first time!",CA Mom of 4
72,Effexor XR,Anxiety,5.0,Taken for 1 to 6 months,"September 6, 2018",3,"Did not do much for chronic anxiety or depression, only really felt effects when forgot to take a dose. Very drastic withdrawal was felt.",Oneocinna
73,Effexor XR,Anxiety,10.0,Taken for 5 to 10 years,"June 27, 2018",60,"Effexor is the best thing ever. I suffer depression, anxiety and fibromyalgia. I've been on other medicines and never felt as good as I do now. Now life isn't always a bed if roses, but I can deal with things way better than I used to then I'm happy. People need to realize it takes time to get in your system to work and for about 3 weeks you may feel effects. But don't give up.",LOR
74,Effexor XR,Anxiety,10.0,,"June 15, 2018",92,"I am a 31 year old female and work as a lawyer. Effexor is the first medication I tried. I took it for 7 years and it worked great. I decided to stop a few years ago, because I thought it was affecting my libido. The reality is that I was just in a bad relationship and I wasn’t attracted to the man I was with.  Anyhow, I tried all sorts of medications afterwards including  Buspirone, Zoloft and Pristiq. I am now back to Effexor, the only medication that ever worked with my anxiety. It is just day 1, but all I can say is that for 7 years, it worked magic. Most of my anxiety symptoms were gone. When  off Effexor, anxiety slowly came back and manifested itself in the sneakiest ways.... it just takes over your life to a point where you can’t funtion anymore. I was at a point where I literally couldn’t function. Now I have hope. Finally I can go back to normal and enjoy life. I have a wonderful family, boyfriend and a challenging & interesting job.",NoName
