,drug,condition,rating,duration,review_date,upvotes,review,username
158,Effexor XR,Anxiety,10.0,,"November 13, 2015",69,"To Socanxiety. I have been on EffexorXR for over 10 years. (I also have short term memory loss so my doctor put me on Concerta, 36 mgs, which is the lowest dose and it is helping!) I am 59 years old and am happy and less anxious with taking effexor 225 mgs a day. I take 75mg pill before bed and am less anxious when I get up. Then I take the 150mg capsule in the morning. I still have times that I have anticipatory anxiety and use 10 mgs of Valium which helps. I am hoping when we retire and move south that I can lower the Effexor. Great med and I have tried many over the last 20 years!!",Nomoreanxietyplease1956
159,Effexor XR,Anxiety,1.0,Taken for less than 1 month,"November 6, 2015",28,"2.5 years after the birth of my child I realized I needed help for PPD/PPA.  My irritability and anger just kept getting worse and I would go days without leaving the house. I was put on Effexor XR 75mg. I only took one dose around 830 PM. I was up all night, jittery, restless, vivid dreams. The following day I was so out of it I feared I couldn't care for my child and had my SO come home. I was incredibly nauseated and jittery with sprqodic muscle spasms, my fingers were shaking a bit and I had heart palpitations. It was awful. Around 6 PM it started to go away but didn't completely until the following day. I will never take this medication again, it was very scary.",Kxhild
160,Effexor XR,Anxiety,9.0,,"September 14, 2015",83,"After dealing with social anxiety every day, avoiding situations, and constantly being tense I decided that medication was the choice for me.Effexor is the second drug I have tried. This medication has improved my social anxiety in a way that I never thought was possible. I enjoy talking with people and can't believe almost all of my anxiety has vanished. I have read that Effexor can be a slight stimulant, and I do notice this is a big reason I am more talkative and confident.NEGATIVES: My memory is way worse than it's ever been. I do not concentrate well when people are speaking and retaining the information is difficult. My worries are gone, but so are my thoughts about everything. Feel foggy. No other side effects",socanxiety
161,Effexor XR,Anxiety,10.0,,"August 16, 2015",108,"I tried Paroxetine, Prozac and Celexa and had no positive results so my doctor advised I try Effexor XR given it is a SNRI or different class of drug. Almost immediately < 1 Week I felt a positive mood change, my social anxiety and mild stuttering seem to dissipate and I felt balanced. I have been taking Effexor XR now for almost a month now and my anxiety has dropped right off that I feel my normal self again, I am a lot more social and I stutter hardly ever and I think more logically. The only down sides are that I do sleep more and find it harder getting up in the mornings for work and have noticed fluid retention around my abdomen. I do not mind these small side effects because this drug has really helped me get my life together. :)",MrPatrick
162,Effexor XR,Anxiety,9.0,,"August 9, 2015",99,I was on this medication for 2 years and I felt great..no anxiety.. I weaned off over 3 months and have totally been off for 3 month.. All my issues came back. Just started back today fingers crossed it works again. I should have never stopped taking. It was a life changer,Melissa114
163,Effexor XR,Anxiety,3.0,Taken for 6 months to 1 year,"July 24, 2015",26,"I was put on this medication for anxiety and depression as I had previously been on lexapro 15mg for 3 years and had consistently had a insatiable appetite. I saw a pyc specialising in perinatal depression as I changed whilst pregnant. I started on 37.5mg of Effexor but needed to constantly increase 75.5mg then 112.5 mg as My biggest complaint on this medication was extreme aggression. I would get so angry I doubted my ability to not harm my children. I obviously saw my doc who has taken me off it, withdrawal was ok till back down to 37.5 mg. Please don't take this medication try everything else before this- side effects for withdrawal are awful I've just got off it and switched to Zoloft and 2nd day in already feeling better.",SD-positive thinker
164,Effexor XR,Anxiety,4.0,Taken for 6 months to 1 year,"July 13, 2015",25,Was put on a high dose of 375mg and find it overestimulating not good for my anxiety,Anonymous
165,Effexor XR,Anxiety,9.0,,"June 21, 2015",80,"Effexor stopped my panic attacks almost completely.  It's also great for post-menopausal hot flashes.  Like others said, you can't miss a dose, but other than that it's amazing.  A total life-changer.",So Happy I Found This!
166,Effexor XR,Anxiety,9.0,,"June 4, 2015",76,"Downside of this med is the first few days, it's tough getting in a regular sleeping sync, it can cause nausea without food or with too much water at one time, and you can't go off abruptly or start taking large doses right away because it can have side effects.However, this medication leaves an unbelievable amount of satisfaction feeling after it takes effect.  It took effect on me instantly, but that's my body.  I take it midday or late morning after a good meal so it doesn't interrupt my sleep as much.  If you don't have slow release, splitting it up might be a good idea, with at least a few hours in between.  It prevents me from overeating, but it also prevents me from starving myself because if I don't eat enough I'll feel nauseated.",Munraito
167,Effexor XR,Anxiety,10.0,,"May 7, 2015",164,"Started on 37.5mg for a month. First two days were only side effects - I was a little jumpy, couldn't keep legs still, and had insomnia. That went away in 48 hours. Then it shifted to making me sleepy and fairly relaxed. However, I still had breakthrough anxiety crying and didn't feel much change in depression. Decided to up the dose and have been at 75mg for a while now. No side effects. This dose has obliterated my anxiety and helped with depression. All I feel is calm and relaxed. I am more outgoing and happy. Only thing I noticed, like so many others, is that it is tough to miss a dose. But, don't let that dissuade you from trying it. It really has been a miracle for me.",Atexun
168,Effexor XR,Anxiety,10.0,,"May 5, 2015",95,I've been on Effexor for anxiety for about 15 years.  It changed my life.  I tried Wellbutrin first but it made me even more anxiety ridden.  For a brief time I felt like the Effexor was not working as well so I switched to Pristiq.  Pristiq increased my anxiety so after about 6 months I switched back.  Within 3 days I felt almost completely better.,Helprec'd
169,Effexor XR,Anxiety,10.0,Taken for 1 to 6 months,"May 1, 2015",162,I have had anxiety and depression for years. Was on all different types of medicines. Even got so badly depressed and anxious that I was bedridden for almost 1 year. I got switched to Effexor and in a few days felt great! I cannot believe I spent all these years in darkness! This is the best medicine ever for me! I am not depressed and zero anxiety! I just wish I would have been on it earlier.,Sonjatx1
170,Effexor XR,Anxiety,8.0,Taken for 2 to 5 years,"April 25, 2015",68,Not perfect but pretty close. Switched from Paxil(no emotions)-> Wellbutrin(aka severe anorexia)->Effexor. Basically all medications were pretty decent at anxiety coverage. I found Paxil to be the best without thinking of anything but anxiety attacks. Wellbutrin to be the least effective. Effexor was somewhere in the middle while still letting me enjoy life with an occasional anxiety attack. Since I've been on Effexor I've had maybe 3-4 small anxiety attacks in the span of 2-3 years.,Pops91
171,Effexor XR,Anxiety,8.0,,"April 13, 2015",60,"You have to keep taking this medicine forever. The withdrawl is awful after a day. However, once you find your dose everything is fine. I don't recommend this medicine because its like a marriage with a messy long divorce. Its better to stay on it once youre on it. I am on 150 mg and it works for me. Don't try and go off",kevin1234
172,Effexor XR,Anxiety,10.0,,"March 17, 2015",144,"I started having panic attacks at age 10, always been a struggle, then started having really bad bouts of depression.  Things got to stage where I was just so tired of being scared all the time and finding it hard to function. I've been on many antidepressants through the years,   Lexapro I had been in for over 10 years,  phych weaned me off and put me on Effexor.   I actually can't believe this. It's only day 2 On 37.5mg to be increased to 75 next week,  but I swear I feel a calmness I haven't felt before, surely after 2 days I'm thinking this can't be right, but after reading some reviews I can see that others have had relief in a short time from this medicine. No side effects. Just feel calm. Feeling hopeful",Calamity017
173,Effexor XR,Anxiety,9.0,,"February 25, 2015",32,"Been on Effexor since July 2014. I take the lower dosage 2x a day as the higher one all at once made me feel sick. I have severe anxiety to the point where i didn't want to leave the house.   I am also on Ativan for moments i know when i panic...way better than Xanax.  I was on Paxil, Wellbutron...neither worked, made me feel like a zombie.  The only drawback with the Effexor is that I am exhausted!!",drea1973
174,Effexor XR,Anxiety,10.0,,"February 10, 2015",145,"This is by far the most effective antidepressant I have EVER taken. I have tried Prozac, Zoloft, and Celexa which all caused numerous unwanted side effects. I have been on Effexor XR for a month and in the beginning the only side effect I experienced was being sleepy. This went away after about a week. I can tell you after just one week my mood lifted and I have zero anxiety. Thank you Effexor XR.",Anonymous
175,Effexor XR,Anxiety,10.0,,"January 26, 2015",186,"I have been on Effexor XR for about a year, after switching from Paxil. It is a scary thing to read all these reviews, and question about whether you should or should not take it. I personally started for anxiety, and it has helped tremendously. To me having panic attacks is not a fun task, yes are there side effects but everything you put into your body does. Please try what your doctor recommends before you read all the reviews.",0521j0929d
176,Effexor XR,Anxiety,9.0,Taken for 6 months to 1 year,"December 23, 2014",122,"Update to review below. I have now been on Effexor XR for six months, and I can honestly say that it's worked wonders in eliminating my depression and obsessive thinking. I wasn't able to stay on the low 37.5mg dose, as I discovered that this is a starting dose only. I have been on 150 mg for about four months, and apparently this is the lowest effective dose for achieving a therapeutic effect for most disorders. My depression has gone, and I no longer have obsessive thoughts that were making daily life a living hell. The only drawback with Effexor XR is that it has low half life, which means that it doesn't stay in your system for long, and if you miss a dose you will feel withdrawal within a few hours. This medicine has been a life saver!",Rob C
177,Effexor XR,Anxiety,9.0,Taken for 1 to 2 years,"September 4, 2014",263,"Have been on Effexor xr 75mg for about 1 year now for anxiety & panic attacks. I had a constant odd pain in my stomach (like butterflys and hunger). I would sweat uncontrollably & get dizzy & faint if I was put in a situation I wasn't comfortable with. I went to a Dr. who diagnosed me with anxiety and put me onto Effexor. The first 3 days were hell, every bad review I read on Google I could relate to, I even ended up going to the ER one night as I felt so nauseous and felt like I was losing control and could not stop freaking out. The Dr told me to stick to it, and promised it would get better. I'm so glad I did. I feel that this medication has saved me. I can almost live a normal life again.",Anonymous
178,Effexor XR,Anxiety,9.0,Taken for less than 1 month,"August 27, 2014",172,"I've suffered severe anxiety/panic attacks my entire life. I've had Xanax, Valium, Prozac and Edronax over the cause of my years. I finally changed doctor, came off everything, to start where I'm at now. I began on 37.5mg over two weeks ago and noticed a difference straight away. Now on 75mg and getting better every single day. My panic attacks could cause me to pass out, so this is a huge leap in health for me. For those concerned about coming off Xanax, it's so worth the effort. I now feel like I'm getting my life back and I'm truly grateful.",starsoul50
179,Effexor XR,Anxiety,8.0,,"August 13, 2014",119,"Started taking Venlafaxine ER a year ago for anxiety. Started at 75mg daily and am currently on 150mg per day, and have been for about 8 months. It has helped a ton with the anxiety! While I am not completely clear from anxiety, it is much much better to handle. I did not gain any weight whatsoever. I do notice that if I forget to take it I feel a bit nauseous and lightheaded so I have set an alarm on my phone. I take both 75mg pills at one time so that it's done for the day. All in all, I would recommend!!",Blondegirl311
180,Effexor XR,Anxiety,8.0,,"August 9, 2014",309,"Have suffered from bouts of severe anxiety over the last few years that would leave me bedridden, suicidal, unable to work or eat. Tried Zoloft, Celexa, Lexapro, Cymbalta, Luvox and honestly thought nothing would ever work for me. All made me worse. Psych doctor wanted to try Effexor XR but I was worried about the withdrawing from it - after trying everything else I finally agreed. Has taken a month to feel a difference. I'm enjoying things again, not chewed up by horrible anxiety, I'm actually HAPPY?! 1st month on it was so challenging - very low, anxious, exhausted, nauseous. But now no side effects. I feel like a light's gone on. Like I am getting my life back. I could sob with relief. Truly believed I'd never get better, but here I am.",Mitra_
181,Effexor XR,Anxiety,10.0,Taken for less than 1 month,"August 8, 2014",180,"I have suffered with major depression my whole adult life. Have been on several types of antidepressants all of which left me feeling like a zombie. The first time I took Effexor I noticed a major swing in my moods it has been a total saviour for me. Two weeks ago I was in bad shape, today a week of Effexor I feel on top of the world . This medication with the help of family friends and councilor had without a doubt totally turned my life around now everything in my life is happy and positive. Without this medication my future would've been bleak to say the least.",Downout
182,Effexor XR,Anxiety,3.0,,"July 24, 2014",60,"I'm 19 and have suffered with anxiety for three years or so. Previously had been on Prozac and Lexapro which were both hellish. Began taking Effexor XR two months ago and started feeling better two weeks through but out of no where the medication not only ceased to work but actually made my anxiety a lot worse. Have horrible agitation, depression, irritability and insomnia. Pity I could really do with an antidepressant than works!",adam1994
183,Effexor XR,Anxiety,8.0,,"July 10, 2014",66,"Went on Effexor for panic disorder/social anxiety caused by OCD. It was debilitating and the symptoms really affected my ability to go through life. I had been on other meds, which did not do much, so I was genuinely surprised and happy when the Effexor made a noticeable difference in the frequency and severity of my panic attacks. I have a few moments of panic now and then, but nothing as bad as it was. OCD is still there, but does not cause me too much distress or interrupt my life as much as it used to (and Effexor is not meant to treat OCD anyway). The side effect that got me the most was tiredness, so I was put on Wellbutrin to balance that out, and it seems to be working for me. The other side effects are entirely bearable.",Maple Fritters
184,Effexor XR,Anxiety,8.0,Taken for less than 1 month,"July 8, 2014",87,"Switched to Effexor XR after having severe anxiety side effects with Prozac 20mg. With Prozac initial side effects, I didn't sleep for days, constant, ceaseless agitation and restlessness, ended up in ER for psych evaluation which has never happened to me before. Doctor switched me to Effexor XR 37.5 mg and on the second day I noticed that after taking the pill in the morning, by the afternoon I was much calmer, almost drowsy, which was an enormous relief after two weeks of severe anxiety. After two weeks on Effexor XR I'm doing much better; much less anxiety and worry. The PM drowsiness has gone too. I hope to stay on the low dose.",Rob C
185,Effexor XR,Anxiety,10.0,,"June 27, 2014",84,This is the only medicine that totally helps me.  I seldom have to take Alprazolam or Valium with the Effexor.  I tried switching to Cymbalta for nerve pain..what a mistake.  I am back on Effexor. ,LaniP392
186,Effexor XR,Anxiety,9.0,Taken for 1 to 6 months,"March 13, 2014",193,"I have been on Effexor XR 75mg for two months now, after previously being on Zoloft and Celexa. The two other medications were not effective for my anxiety and depression, and they tended to make me either tired or foggy regardless of the time of day that I took them. I expected the tiredness to wear off, but the foggy feeling never did. My doctor prescribed Effexor XR, and it has been very effective for both my depression and anxiety symptoms. I am not 100% perfect, and I still have anxiety, but in the appropriate moments. The moments of unreasonable anxiety attacks are fewer and far between since starting the medicine. I had no negative side effects, and I take it every morning at 9am.",SSKirby
187,Effexor XR,Anxiety,9.0,Taken for 10 years or more,"March 10, 2014",231,"I have been on Effexor for the past 10 years - I started having panic attacks as a child although I didn't know at the time what was going on - when I was 17 the doctor prescribed Valium that I took periodically when my anxiety got really bad - finally when I was 40 the doctor suggested I go on a very low dosage of Effexor (37.5mg) because he was sure I had generalized anxiety disorder - what a difference this has made in my life - felt""weird"" the first few weeks but now I have very little anxiety and really no side effects except maybe lower libido. I had no idea how much anxiety I had been living with all my life.",Happy in Canada
188,Effexor XR,Anxiety,1.0,Taken for 5 to 10 years,"October 23, 2013",55,"Had horrible side effects, did not sleep for 2 weeks. Developed tics. Felt like I was living a nightmare. Had to be hospitalized. They took me off Effexor. And I started Zoloft. Zoloft worked fantastic . Took Zoloft for a year. Been off meds for 9 years with no problems.",Jaded123
189,Effexor XR,Anxiety,10.0,,"September 12, 2013",147,"I have been on this medication for approximately 3 weeks now.  It is a God send for me.  I noticed results on day 2.  I have had recurring depressive episodes my entire adult life.  This episode I was unable to get out of bed, sleeping up to 14 hours a day, not going into work (thankfully I have a very understanding boss).  I was not suicidal this time, I actually think that I really didn't care enough to do anything about it.  My whole attitude was that, ""I just don't care.""  I have anxiety as well, but the episodes have always been well controlled with 1mg of Ativan.  I had the racing thoughts, inability to concentrate, unable to finish almost any task-if I even got as far to start one.  175mg of Effexor and I can finally function.",Dingdingding
190,Effexor XR,Anxiety,10.0,,"September 5, 2013",91,I was diagnosed with Celiac's disease 3 years ago although I probably had it for about 7 years. My body didn't absorb many nutrients so I had anxiety about everything. I am on high doses of B12 and Vit. D and the doctorthought I should try Effexor.  I first started on a small dose and then she tried me on 75 mg which is still a small dose. This really works for me. I'm not jittery or have negative thoughts.  I've only been on this for 6 months but everything seems okay.,BB11
191,Effexor XR,Anxiety,10.0,Taken for 1 to 6 months,"June 24, 2013",172,"I am from Canada, 24 year old female. I have always been a worrier but first experienced anxiety in my 4th year at University 3 years ago, I had a panic attack which then turned into panic disorder and generalized anxiety disorder. Effexor is a GREAT medication for me, my dose was raised way to quickly at the beginning, I went from 75mg to 150mg to 225mg in a month and a half and got horrible Effexor induced anxiety but when my GP realized what was going on she put me back to 75mg and then very slowly put me up to 112.5mg and I have been there for 2 months now and I think it is the perfect dose for me. I don't have intrusive thoughts or panic sensations. Be patient, it's worth it!",Devon1177
192,Effexor XR,Anxiety,10.0,Taken for less than 1 month,"May 15, 2013",109,Works well to stop my anxiety.  I can participate in life again and I am doing things that I used to do.   Started with 75 mg started to become more effective at 150 mg.  Some side effects but they are getting better with time.,Anonymous
193,Effexor XR,Anxiety,1.0,Taken for 6 months to 1 year,"April 19, 2013",28,This medicine did not work for me. ,vgailj
194,Effexor XR,Anxiety,8.0,Taken for 2 to 5 years,"April 8, 2013",81,"This medication has worked well for me in terms of controlling my anxiety and fear of having a panic attack.  However the side effects I have had to endure are not so pleasant.  I'm always tired and can sleep all day long.  As well, I have gained weight on this medication and trying to lose it is very hard.  It's like my metabolism has stopped working. I've been on this medicine for about 3 years now and considering weening off to try something else.",Anonymous
195,Effexor XR,Anxiety,10.0,Taken for 1 to 6 months,"March 19, 2013",184,"Effexor Saved Me After Many Failed Medicines.  Current Med Combo- Effexor 75 mg, Lamictal 200 mg, Abilify 5 mgIt saved me from wasting anymore time locked up in my house 24/7 and avoiding conversations, knocks at the door, people, telephone calls, and anything else involving socializing. I FINALLY LEAVE MY HOUSE. WILLINGLY and REGULARLY. Daily.  I NO LONGER FEAR APPLYING FOR JOBS. I NO LONGER FEAR THE POSSIBILITY OF HAVING A JOB because I would have to deal with people. I am willing and eager to go out with friends, family, acquaintances, meet new people. SIDE EFFECTS- Only Nightmares, which eventually become less and less and then go away after 2 months. Maybe a little unpleasant at first. Definitely bearable.It's not bad for everyone.",Pisces90
196,Effexor XR,Anxiety,8.0,Taken for 2 to 5 years,"January 5, 2013",92,"My doctor prescribed this for my anxiety due to perimenopause, 37 mg.  I was always tired on it so he increased it to 75mg xr.  I'm not as tired as I used to be and I no longer wake with anxiety and can sleep through the night.  My energy level is not as high as it used to be before Effexor.  My appetite has also increased.  I've heard this can be due to a combination of the Effexor and menopause.  If I skip a dose, I get headaches.",Montrose Girl
197,Effexor XR,Anxiety,10.0,,"January 3, 2013",72,"Effexor has been a wonderful and life changing medicine for me. I can also take it with my anticancer medicine Tamoxifen, which I could not do with Zoloft. It's great!",kat351
198,Effexor XR,Anxiety,8.0,Taken for 1 to 6 months,"December 3, 2012",114,"I have been on Effexor XR for about 3 months now (75mg), and it's done a great job of controlling my anxiety. For the first couple of days, my anxiety skyrocketed, but I supplemented with Ativan to help with that. then on the third day, I woke up and felt totally normal. It does make me a bit tired, but I also sleep better - and I do have very vivid dreams at times (not scary, just vivid). Also makes me a bit apathetic, but it's better than living in a constant state of anxiety.  I'd had bad reactions to Lexapro and Zoloft, so I was happy to find something that worked. I hope to come off someday, but for now, it's giving me what I need.",Anonymous
199,Effexor XR,Anxiety,8.0,,"August 6, 2012",108,"I took Effexor XR after I gave up on Lexapro (it didn't work for me, waited for a couple months). I started at 75 mg and 10 days later to 150 mg. I have been at 150 for about 5 months. I feel that I am at a stable point so I don't want to change anything for a while. My doctor said to start weening off but I don't think I'm ready yet. I had gone through a gut wrenching episode in my life that lasted for about 4 intense months of sleepless nights, hot sweats, heart palpitations, heavy chest, lack of concentration, and sadness. I felt as if I was at a doctor every other day trying to figure out what was wrong. My anxieties were so bad that I felt like exploding. Thankfully I waited it out and Effexor has helped.",alexander151
200,Effexor XR,Anxiety,7.0,Taken for 10 years or more,"July 28, 2012",83,"I have been on this medication for over 15 years. I can tell you that this is the absolute best medication for panic attacks, the problem is that I never had any panic attacks until I quit taking the pill after a year of use. I was prescribed this when I was 18 after being hospitalized as the result of several traumatic events. I started on 32 mg and eventually was bumped up to 150mg and then 225 mg. I weened off and survived the withdrawals and felt amazing seriously felt like the best moment of my life but about a year after I stopped taking it, the depression came back twice as bad. ",Dispicable me
