,drug,condition,rating,duration,review_date,upvotes,review,username
75,Effexor XR,Anxiety,10.0,Taken for 1 to 2 years,"June 6, 2018",71,"I am a long time general anxiety disorder (GAD)  and panic sufferer.  I went on effexor XR since celexa stopped working for me.   I love it.   I feel better, I feel more motivated.  I've lost 25lbs because I am out now out walking and just living my life with no worry or anxiety anymore.   I still have a little but nothing like it was.   My husband says I am so different for the better.  We are so happy since I took it.  My husband saids laughingly thank you effexor. lmao.  I have to agree. It works for me.",indigogirl
76,Effexor XR,Anxiety,,Taken for less than 1 month,"May 31, 2018",184,"Hello everyone. Ok I posted May 19 and this is my update. So I stopped sertraline and started taking Effexor 75 mg capsules. The Doctor advise to stop sertraline slowly so the first week I took Effexor 75 mg and half of sertraline which is 50 mg. The second week I took Effexor 75 mg  and setraline 25 mg. And now just Effexor . And now just 75 mg of Effexor (venlafaxine ) . I feel so much better . My anxiety has almost stopped and I remind my self to take deep breaths . I'm sleeping better and I’m pushing my self lot more. I refuse to sleep during the day and all that is helping me. I’m posting this because I know how it feels to feel helpless. So everyone keep pushing through this. Keep your head up, keep praying and keep positive. Love you all and good luck!!!!",Ypiscis
77,Effexor XR,Anxiety,10.0,Taken for less than 1 month,"May 19, 2018",24,"I have taken depression medicine few times in my life. I was on sertraline 50mg the first times and then it had to be 100 mg. This last time I took it like 4 months and it never kicked in, my doctor prescribed me Effexor 75mg capsules . This is my second day on them I feel little different I have a feeling they will work. ",Ypiscis
78,Effexor XR,Anxiety,,,"May 18, 2018",23,I have taken sertraline before on and off but when I get better I stop the medicine. First time 50 mg and then 100 mg . I have been depressed 5 times but now I been taking sertraline since January and it doesn't work. My doctor recommended me to switch to Effexor 75 mg capsules . Please wish me luck. I’m a mother of 2 and I need to function.,GY
79,Effexor XR,Anxiety,8.0,Taken for less than 1 month,"April 26, 2018",23,"I tried Effexor XR 75mg twice per day some time ago, in 2016 - but didn't like it so stopped after a couple of weeks or so.  I don't recall any side effects.  Lately I have just been having bad thoughts, sleeplessness and anxiety including vertigo and dream like states to almost passing out as well as attacks of sudden depression.  I started again on 75mg once per day, and I feel much more level and like I can deal with things.  Still finding my place on it, getting my concentration and focus back, hopefully before my next assignment is due ... sigh, but I am having a positive outcome thus far.",JR
80,Effexor XR,Anxiety,1.0,Taken for 1 to 6 months,"March 31, 2018",8,Gave me hypoglycemia upon wakening and panic attacks...at the lowest dosage of 37.5 mg when added on to Lexapro. Never again.,Dantheman93
81,Effexor XR,Anxiety,9.0,Taken for 10 years or more,"March 30, 2018",58,"I have been on and off this medication for years - it has been the one that has worked best for me always.  I will start to feel I need more and try something else, but I always come back to Effexor XR.  I take 37.5 mg.  I have NEVER had a zap or cried when going off the medication or forgetting a dose, although I am on a low dose.  It is what makes me feel the closest to normal of all the medications I have tried.  I do have to say that Paxil was the first med I ever tried and it totally removed all anxiety, which was what I needed at that time, but I put on 40 lbs with it and have struggled with that weight ever since.  I have come to understand that we all need a wee bit of anxiety in our lives or else what would be the catalyst to get out of bed or work out or be a better person.  But when the anxiety becomes unhealthy some of us we need the help that only a medication can give us.",Gergerbear
82,Effexor XR,Anxiety,5.0,,"March 30, 2018",11,People should say if they are male or female. It works differently on them. I think it works better for male,Lisa
83,Effexor XR,Anxiety,10.0,Taken for 5 to 10 years,"March 27, 2018",58,Had panic attacks for 21 years and eventually put on Effexor.  What a relief would not give these up for all the tea in China fantastic,Carmo
84,Effexor XR,Anxiety,9.0,,"March 5, 2018",46,"I developed severe IBS-D and OCD anxiety symptoms building into agoraphobia, which became progressively worse, to include suicidal thoughts and led to a legitimate nervous breakdown. My doctor prescribed Effexor supplemented for a short time with Clonazepam to get through this period and I was able to within a few weeks. An overlooked effect of this drug is that my stomach issues improved CONSIDERABLY (75mg), while Zoloft had made it worse. I highly recommend this for anyone with IBS-D or OCD type anxiety symptoms. It is very difficult to wean off of, but I am now pregnant and have come down to 37.5mg by going down 12mg every 2 weeks with minimal side effects. A perinatal specialist recommended I not completely go off, just wean down. Though the baby has not been born yet, I had a comprehensive ultrasound done to check for birth defects and everything looks very healthy. Good luck and I hope this helps!",Kris
85,Effexor XR,Anxiety,10.0,,"March 1, 2018",48,"I have been on this drug for 2 weeks and am already in love with it. I feel like it’s balancing out something in my brain that has been broken a long time. I feel like if I’m not constantly struggling and fighting to lose weight the pounds just pile on. When I stop exercising while sick I gain everything back. I also have depression and anxiety. Most pills make me feel like a zombie. So since starting this drug I have lost almost ten pounds in 2 weeks. And I haven’t even tried! I am less hungry, like if I’m not hungry food doesn’t even look good. I was on vacation for one of the weeks I’ve been on Effexor and didn’t eat the healthiest, but did eat less. I haven’t exercised either, except for a few days here and there. I know it takes longer to see the real effects of the drug, but I’m already less anxious and the weight is just falling off. No bad side effects except a little constipation and a slight head ache the first week.",Rose
86,Effexor XR,Anxiety,,,"January 26, 2018",10,I took one dose Effexor and stopped because it’s bringing me to my knees and can’t sleep for a day now,Ibrahimi
87,Effexor XR,Anxiety,5.0,,"January 3, 2018",9,"I'll just rate this middle. It helped with my mood and anxiety some but at some point I started getting side effects my psych said happen to people in withdrawal - but I was taking the dose I was prescribed everyday, which was 150mg after being 75mg. It started getting really hard to get up and I always felt like I was beaten by a bag of oranges everywhere every night at some point upon waking. I'd want to wake up and even try to roll onto the floor but opening up my eyes and getting up were just... hard.I  can't remember exactly what it was like but I truly did want to wake up. I would also just feel confused about simple things and had to really try to think to tell if I was sleepy at times or had low blood sugar since I have issues with *low* sugar levels",nicknamerd001
88,Effexor XR,Anxiety,,,"December 7, 2017",31,"I have been on Effexor for 3 years, it was a god send. My life was at its darkest and had many sad events happening at the same time, death of my mother, mother in law and beloved dog within a year. I was transferred from my job, and felt a great amount of anxiety and stress. Feeling of fear and dread on a daily basis, and feeling like I was having a heart attack many different times including at a family Christmas dinner. I was a 54 year old male, father of two that could not be weak, I was counted on by many loved ones, but felt like there was nothing I could do. So I met with my doctor, she was very open to what I was feeling and asked me what I thought was happening. I told her my symptoms and what I needed to do. Putting me on Effexor",Lower/slower
89,Effexor XR,Anxiety,10.0,,"November 30, 2017",53,I feel it's important to share because as a mom I was on line in the middle of the night searching for answers for my daughter. She is 13 and has anxiety. At 4 she had night terrors and then would pass out with any pain. She started to be difficult to take to school in 4th grade due to the fear of throwing up. She was put on Lexapro after my great hesitation as she was so young. It helped a little. When 7th grade hit her body was 2 seconds from fight or flight. Frequent panic attacks were long and exhausting. Long story short she had genetic testing done and Effexor was on her list of Med's that should work. She is like night and day after around four weeks. Its about finding the right med for you. Genetic testing is a start.,Jellybean04
90,Effexor XR,Anxiety,10.0,Taken for 2 to 5 years,"October 15, 2017",41,"I suffered from depression and anxiety all through university. Effexor helped me finish my degree and I couldn't be happier. Everyone can react differently, just pay attention to your body.",Monst
91,Effexor XR,Anxiety,10.0,,"September 29, 2017",63,"I was prescribed the Effexor ER for acute depression and anxiety after a death in the family and only took it for a month, but it made me sane and able to face every day as a teacher without crying randomly throughout the day. That was 2 years ago. I was prescribed it again for the same thing when my fiance passed away. I thought I was ready to stop taking it after 3 weeks but I found myself fighting back tears over small incidents like breaking a pen or a student asking me a simple question about the material. I started taking it again and it's been a life saver for me. I can still take the time to reminisce at night and grieve, although the tears seldomly come. If you aren't on it long then the withdrawal isn't bad at all. Hope this helps!:)",AshleyLeAnna
92,Effexor XR,Anxiety,2.0,Taken for less than 1 month,"August 27, 2017",26,"I was prescribed this for onset of anxiety and possible hormonal mood swings. I was not told by my doctor how it would make me feel or how hard coming off of it would be. I took one 37.5 mg capsule and was horrified that I was given this. I woke up at 2am with an anxiety attack for about the first hour. It then went into being wired, nauseous, shakey, weak, chills and sweating. 11 years ago I quit using meth and this was awful that I felt like I was on it again. I laid in bed the entire day, wide awake and ill. I never took another dose! And even one pill took at least another full day to leave my system. My nervous system is obviously sensitive and I could not handle this medication at all.",Took once and never again!!!
93,Effexor XR,Anxiety,10.0,,"August 22, 2017",127,"I started Effexor XR (generic version) about 3 weeks ago. I will admit, the bottle sat on my counter for a week before I took my first one, because the negative reviews terrified me. I finally took one and I am so glad I did! I have been on practically every anxiety/ depression med there is and had kind of lost hope with them working. I have also tried several different natural methods and they helped a little bit, but not nearly enough. I struggle mainly with anxiety and have for about 15 years now. By day 3, I had already noticed a difference. It's been 3 weeks & not only is my anxiety significantly better, I no longer have swollen joints or numbness in my hands & feet, I'm so much happier & way less stressed. Life changing!!",momof4minions
94,Effexor XR,Anxiety,10.0,Taken for 10 years or more,"August 18, 2017",89,"Effexor has been a Godsend for me. I went through every med out there to control my depression and anxiety attacks. I have been on it now for 11 years, and it's still working just fine. I'm not saying every day is roses and rainbows, but, if I can have 6 out of 7 days positive, it's a far cry better than 7 out of 7 horrible.",MudBug
95,Effexor XR,Anxiety,1.0,Taken for 6 months to 1 year,"August 13, 2017",28,"Only take Effexor if you want to be on it for life. The withdrawal lasted 3 months for me. I think my body and mind are permanently damaged from this drug. It helped anxiety by numbing me but at the same time, made me more depressed at times.",AB92
96,Effexor XR,Anxiety,9.0,Taken for 1 to 6 months,"August 11, 2017",66,"This medication strongly relieved my depression/anxiety. After having a horrible experience with sertraline, I was wary of trying a new drug. However, this drug has been a lifesaver and I'm so glad I continued to try medication. It made me functional and able to enjoy life again (--: I did experience some side effects for the first two months, including: lack of appetite, weight loss, sleep disturbances, and difficulty achieving orgasm. These effects faded though, and now the only time I experience anything negative is if I miss a dose. Do NOT try this medication if you cannot adhere to a strict regimen. The withdrawal symptoms after missing a dose are unpleasant. That said, don't be afraid of this drug! Take it as directed and it works.",Anonymous
97,Effexor XR,Anxiety,,,"July 27, 2017",157,"First off, I want to say I never take the time to write reviews however I do end up myself reading everyone else's so I hope this helps someone! I'm 22 Female, and for about 4 years suffered from anxiety. First it started off as panic anxiety then with failure of trying medications Prozac, Zoloft, and lexapro, my head was just so much worse. I could feel the chemical imbalance I began getting daily depression and anxiety to the point I'd worry 24/7. It ruined relationships & made me seem crazy. I finally got on Effexor last month. CHANGED MY LIFE. I feel NORMAL again. Happy, no anxiety, energetic. Only side effects were yawning, vivid dreams, & at first jaw pain. I highly suggest this with panic/daily anxiety/depression mix! My fears are gone",THISCHANGEDMYLIFEFORTHEBETTER
98,Effexor XR,Anxiety,9.0,Taken for 1 to 6 months,"July 13, 2017",52,I recommend it for those who struggle with fears panic attacks social anxiety. It's really helpful after 1 month u will find it very helpful- it  changed my life.,wisso
99,Effexor XR,Anxiety,9.0,,"July 1, 2017",63,I was on effexor 37.5 mg for 2 years. Worked wonders! I slowly weaned myself off it 6 months ago with minimal side effects. My anxiety has crept up on me again so I have decided to go back on it. I'm on a low dose but it works for me.,Sofieeeeee
100,Effexor XR,Anxiety,,,"June 2, 2017",49,"This changed my life. For 20 years I have been prescribed so many things and they all seemed to make me feel crazy. After having my son it got worse and I never wanted to leave the house. I have tried exercise, natural therapies, everything but I swear the chemicals are just not right in my head. I always felt lost, like every small thing mattered too much. I started on 75mg before sitting on 150mg for a year and a half. I have been so much happier and chilled out. Not worrying all the time. I have sleep apnea too so I am not sure if it's made my sleep worse as it's already pretty bad. My mind never stops. I felt myself losing control of my life lately due to huge stress at work and small kids. 225mg has evened me out and feel good :)",NikNak7
101,Effexor XR,Anxiety,1.0,,"April 30, 2017",38,I took this pill once at 37.5mg to start my regimen. I got serotonin syndrome and was hospitalized. Steer clear from this medicine.,Tari567
102,Effexor XR,Anxiety,7.0,Taken for 6 months to 1 year,"March 27, 2017",18,"It was efficient to have no anxiety. Except 2 weeks before my final exams, I""froze"" = I had anxiety attacks.The big side effect was that it was extremely difficult to reach an orgasm / ejaculation + I lost more than 50 % of sex pleasure. Not good for couple life. Also I sweat A LOT during the night + big traumatizing nightmares if you forget your pills +  I think I did sleep apnea + sleep paralysis. All those things at 75 mg. An other bad effect was that I became over confident / maniac.Also better to use Effexor than generics. The real brand seemed better for me",kentum
103,Effexor XR,Anxiety,5.0,Taken for 6 months to 1 year,"March 22, 2017",19,"I am taking 150 mg. I began at 75 with little effects. At 150..honestly I feel more anxious, yet medicated. I have been taking Effexor for 6 months.I  believe it does more for my depression, than for anxiety. My appetite is about the same. I seem to wake up irritated, and have to take Seroquel at night to sleep. I am going to give it a few more months, then will talk to my doctor about changing it, or adding something for anxiety.",Byrdy
104,Effexor XR,Anxiety,4.0,,"March 1, 2017",8,Average-- not satisfied -- symptoms continue,appy 53
105,Effexor XR,Anxiety,8.0,,"February 8, 2017",58,"Hi, I've been on Effexor for 2 weeks now.I feel a lot less anxious and generally happier.I've noticed some side effects, which I was expecting. So I thought I'd share my experience.Sweaty hands, blurred vision, nightmares, stomach ache / head ache, loss of appetite, weight loss, trouble sleeping, major increase of the the effects of alcohol. Those are just some of them.",firsttimeeffexor
106,Effexor XR,Anxiety,1.0,Taken for 6 months to 1 year,"January 27, 2017",77,"Before anyone agrees to taking Effexor (venlafaxine), please look at the withdrawl symptoms. The symptoms and experience has been likened to heroin or opiate addiction withdrawl. Please do your research and regardless of what your doctor tells you, THERE ARE ALTERNATIVES!I hope this helps someone.",TrySomethingElse
107,Effexor XR,Anxiety,10.0,,"January 26, 2017",47,I believe this medication saved my life. I did feel extremely sleepy at first while my dosage was being raised but that went away quickly. I have a new feeling of wanting to get up and do things that wasn't there before. I also feel a sense of calm and peacefulness. The only side effects so far that were troublesome is constipation and sometimes it's hard to concentrate if someone is speaking.,Ceriidwen
108,Effexor XR,Anxiety,10.0,,"January 20, 2017",107,"I had a nervous breakdown when I was 38, I literally felt as if I was going out of my mind. I had gotten pregnant when I was 21 and had terminated the pregnancy. I had a few years of depression with no meds . I left my Husband and two children and went and stayed with my Sister. She promptly took me to a Psychiatrist that put me on Effexor Xr 75 mg twice a day. He also gave me Xanax to help me with the breakdown. Effexor and my Dr.  saved my life. I have been on Effexor for 22 years. I sometimes feel the depression coming back and I now still have lots of Anxiety. but I take my Xanax and it helps. I have switched to Prozac, Brintellix, Lexapro . None of them work. I always go back to Effexor. I pray daily that God will heal me .",Coookie
109,Effexor XR,Anxiety,10.0,Taken for 5 to 10 years,"January 12, 2017",36,"If you want to live life on a drug, this worked!  But beware for when you come off!  Best bet is to supplement naturally.  Your body is lacking something that you can get in a better-for-you form.Withdrawal symptoms are terrible!",Anonymous
110,Effexor XR,Anxiety,5.0,Taken for 10 years or more,"January 5, 2017",42,"On Effexor for 14 years.  150 milligrams daily of the IR not the XR so I was taking 75mg 2 times per day.  In retrospect, the medicine worked for me for about a year and the other 13 were just maintenance years.  I also found since titrating from 150mg down to 9.75 mg that I feel human again.  Effexor solved zero problems for me and it simply numbed me to feeling strong emotion.  I also dropped 36 pounds since coming off of this medicine and feel a heck of a lot better.  I have been titrating since July of 2015 and my last titration to zero will be in 2 weeks.  As stated before, this stuff doesn't solve problems, it just numbs human emotion.  Me, like many other folks need to learn how to accept our emotions.  The answer isn't always a drug",Eagles16
111,Effexor XR,Anxiety,10.0,Taken for 10 years or more,"January 3, 2017",107,"I have been taking Effexor on and off for the past 10 years.  There is no better medicine for my anxiety than Effexor.  The trick with Effexor XR is that you need to know exactly how to take it and not to take more than what you really need.  I am now on a steady 37.5mg (minimum dose) and it works just fine.  My doctor tells me that that low dose is hardly therapeutic but it works just fine for me.  Of course I need to practice many anxiety relief techniques, especially the ones that help get you back to sleep, but overall, Effexor XR at 37.5 mg each morning takes the severe edge off my condition, I do the rest.It's a good mix.",Anonymous
112,Effexor XR,Anxiety,10.0,Taken for 6 months to 1 year,"December 27, 2016",91,"I've suffered from severe panic disorder since I was 10.  I am 45 now. I was on 200mg of Zoloft for 18 years. It took away my anxiety, but also took away any motivation. I was a zombie for all of those years and slept all the time. My new Dr. suggested switching to Effexor. I was afraid that it wouldn't work and my panic would come back. I was so wrong. After a week on 37.5 mg, my energy was back and anxiety still gone. I'm on 75mg. I can't believe I stayed on Zoloft so long! I can think and do things again! I don't sleep all the time. Everyone reacts differently. If this med doesn't work for you, I'm sure there is one that will. Wish I would've switched sooner. No side effects at all!",What's anxiety?
113,Effexor XR,Anxiety,6.0,,"December 27, 2016",29,"Was on this med for 5 years. Worked fine but not great. Stopped the panic attacks and gave me relief of every day nervousness that I was experiencing. Took months for the side effects to diminish when I first started taking it. What did not leave - insomnia, night sweats, lack of sex drive and poor orgasms (or no orgasms at all).",B123456
114,Effexor XR,Anxiety,10.0,,"December 15, 2016",81,I have had terrible anxiety driven depression my entire life. Effexor is an amazing medication. I waited until I was in my late 30's to do something about my anxiety/depression because of the stigma and fear of taking anything that might make me go crazy (the anxiety talking). I was a fool to wait so long. None of my fears materialized. As soon as I started the medication I began to feel better and better. I was also prescribed Kolozopin to act as a bridge to get through the anxiety until everything began to work and fall into place. Do NOTe wait hoping things will pass! I was convinced I was the worst case scenario and I got better. Just do it and get treated,RichGB55
115,Effexor XR,Anxiety,10.0,,"December 7, 2016",43,"Just an FYI.  Not all anxiety medications work for everyone.  This one works amazingly for me but works horribly for a good friend of mine.   She took a test to determine what medication was best for her and was able to find the best match.  If you are on a medication that isn't working don't give up hope, ask to do the test and try something until you find one that works for you.  If your doctor isn't accommodating look for another one.  Cheers.",feeling Way better
116,Effexor XR,Anxiety,9.0,,"December 3, 2016",76,"I have been taking Effexor XR for about 12 years now. I have spent my life fighting debilitating anxiety and depression. I would have panic attacks, horrible downward spiraling thoughts, extreme negativity, physical symptoms such as shaking, and could even lose touch with reality in severe episodes of depression. No amount of behavioral therapy and monitoring of a diet, exercise, or treatment plan would make a dent in my anxiety. Within weeks of taking Effexor XR, I finally had a chance to understand what it is like to live without terrible anxiety. I haven't really experienced any negative side effects, except perhaps hot flashes and night sweats. Life is finally manageable. I am thankful for every day I have, now, thanks to Effexor.",Nanci G
117,Effexor XR,Anxiety,9.0,,"December 1, 2016",36,I have major depression....was taking Prozac 40 mg a day and it just stopped working for me. I have started Effexor XR 150 mg twice a day with some sleeping pills at night....In such a short amount of time I feel so much better! Life changing better! Depression is horrible and all consuming and pray that every person trying to get help does....and at least for me I have found stimulants of any kind are not good....because the crash or comedown is more than I can handle with my underlying depression.,Invu4uraqt
118,Effexor XR,Anxiety,1.0,Taken for 1 to 6 months,"November 26, 2016",29,"I highly suggest people not try this medication. I was only on it for 8 weeks and had horrible memory problems that I am still working through. This medication has caused me to be out of work for going on 7 months now. The doctors keep telling me it not this medication, but I know it is since this is the only anxiety med I took that caused memory problems. The prescribing doctor made no mention of memory loss as a side effect. I am on a special diet now to stimulate my memory, along with going to therapy to get my memory back. Scariest time of my life. I feel like a zombie right now.",X
