,drug,condition,rating,duration,review_date,upvotes,review,username
42,Hydromorphone,Chronic Pain,7.0,Taken for 6 months to 1 year,"April 23, 2017",31,"Dilaudid (hydromorphone):I was experiencing pain in my hips like never before Because I had no insurance finding any relief meant a trip to ER. Finally I was approved for medicatation.  After waiting longer than I should of for care, I saw a doctor that said I have aseptic necrosis. What is this? It is interruption of blood supply. Without blood, the bone tissue dies and the bone collapses. Treatment is total hip replacement. I have had my right done. It was collapsed. Very painful! Now waiting on my left. That is not the end. My shoulders need replacement. I was prescribed 60 mg Hysingla ER (hydrocodone bitartate) . It was not for me. My doctor finally decided on dilaudid 4 mg. Thank god! Thinking he needs to up my dose. Much better now!",littletoughgal
43,Hydromorphone,Chronic Pain,9.0,,"April 15, 2017",22,"Exalgo (hydromorphone):Take 12mg Exalgo after being on Methodone, Tramadol, and Fentanyl. It is a miracle drug! The pain is so reduced I hardly ever need my breakthrough painkillers. Side effects have been negligible for me. I will never come off of this medication willingly, because I don't believe a better treatment for currently exists.",Tomlin_rex
44,Hydromorphone,Chronic Pain,8.0,,"April 10, 2017",21,"Dilaudid (hydromorphone):I have metastatic breast cancer. I found IV dilauded, self-administered thru my port to be the most effective pain management strategies I have had thus far. My doc and palliative care nurse are encouraging me to shift to using a pain pump for more continuous pain control and decrease side effects from varying levels of dilauded. I can see how dependency could be an issue. I'm not personally concerned because I have a terminal condition, however, especially because it does give me a feeling of well being and pain reduction is immediate that could be a problem for those with chronic pain.",Nece
45,Hydromorphone,Chronic Pain,3.0,Taken for 6 months to 1 year,"January 31, 2017",21,Dilaudid (hydromorphone):In my opinion its a weakist. Pain Management drug out there. I would have to take 10 4mg to get the slightest relief  and that's on top of  wearing a 100mcg patch  fentanyl.,Say NO to Dilaudid
46,Hydromorphone,Chronic Pain,2.0,,"January 23, 2017",20,"Dilaudid (hydromorphone):This medicine didn't work for me.Orally.",Suezer
47,Hydromorphone,Chronic Pain,10.0,Taken for 10 years or more,"January 17, 2017",18,Dilaudid (hydromorphone):Throughout a ten year battle with Ulcerative Colitis I have been on many I.V. pain meds. I.V.Dilaudid is my pain med of choice. I hate the oral version of this med. It literally does nothing for my pain. I.V. or nothing.,H3RM1T
48,Hydromorphone,Chronic Pain,10.0,Taken for 2 to 5 years,"December 26, 2016",18,"Dilaudid (hydromorphone):Had below knee amputation of my right leg due to infection of broken ankle. Having pain in my left leg, a ghost pain, but no problems in amputated leg. Doctor put me on 2mg Dilaudid to give me relief. I take it once a day before bedtime which lets me sleep. No side effects but sometimes I need a pill during the day too, and I can only get a certain number of pills per month and the pharmacy won't refill it any more frequently than once a month. Am going on a cruise in March, and am not a big drinker but wondering if one drink a day will be a problem with the 2mg Dilaudid at night only once a day. I read about bad interactions with alcohol and Dilaudid and don't want a bad interactionwith only one mixed drink. I'll ask the doctor too.",Dr. Allreeds
49,Hydromorphone,Chronic Pain,10.0,,"December 24, 2016",22,Dilaudid (hydromorphone):I got chronic pancreatitis and this serious GI disease and dilaudid has worked wonderful treating me of these problems.,Jazsy
50,Hydromorphone,Chronic Pain,10.0,Taken for 5 to 10 years,"November 28, 2016",18,"Dilaudid (hydromorphone):I broke my back in 02, i was sent home 4 hrs after being told i broke my back in 2 places.  It was a Saturday morning and i was handed 2 demerol pills and told to get a hold of my family doctor for full time pain management.  I was put on 8mg hydromorphone every 4 to 6 hours.After being told the fractures were mended, i had a whole bunch of uninary problems, and paralysis to parts of my body for a week to 5 months.  After being told everything had mended i tried to go back to work, i just couldnt wasnt enought pain control so dr added 150mcg/h of fentanyl.Now i only take the Hydromorphone for break through pain",Cherrie0777
51,Hydromorphone,Chronic Pain,9.0,Taken for 5 to 10 years,"October 25, 2016",9,"No stomach upset.No increase of dosing, I actually use half of what I was first prescribed, almost 5 years ago.  Can still function, allowing some quality of life.",Littledebbie55303
52,Hydromorphone,Chronic Pain,6.0,,"September 14, 2016",28,"Dilaudid (hydromorphone):In Sept 2006 I was in a bus accident had been in such pain nothing was working, my blood pressure would sky rocket do to the pain, nothing was helping until I got the Dilaudid IV in the hospital, I also have to take zofran for nausea. I had overgone 5 back surgeries in 10 years. I never needed pain medication until the bus accident.They tried tordol, morphine, percocet, but nothing helped. I was on a high dosage of Dilaudid for 3 years until my screws were removed in 11-2013. I have been going off dilaudid for 3 yrs now. I take 3.  4 mg tabs a day it takes almost 1 hour to work, but it only helps the pain for about 3-4 hours. This should only be used when nothing else will. I am so thankful.",BackPain2006
53,Hydromorphone,Chronic Pain,10.0,,"September 1, 2016",24,Dilaudid (hydromorphone):I have PCOS (polycystic ovarian syndrome) and endometriosis. When I am in the hospital they always give me a low dose 0.5mg in IV form and it takes the pain away for 3-4 hours. They tried morphine but that only last for literally 30 minutes. It makes me sleep good and the pain is gone for like I said 3-4 hours. IV push every 4 hours. It's a miracle drug!,ThatVeganChick74
54,Hydromorphone,Chronic Pain,8.0,,"July 25, 2016",11,"I have an intraethical Morphine Pump Implant now since 2002.   Hydromorphone was recommended as the 'break through pain' treatment.   I take, typically, a 2mg pill roughly every two to six hours and that appears adequate.   Unfortunately, in times of higher pain, when the pump appears inadequate, I have had to take more of the pills.   The more I use, the more I felt I needed to use them.   When I 'sucked it up' and endured a little higher than usual pain for a day or two, taking less Hydromorphone, I was then able to restart the pills and they had a better effect.   I guess to sum it up, taking a break from the pills once in a while ensured that they were still effective.",tough old guy
55,Hydromorphone,Chronic Pain,10.0,Taken for less than 1 month,"July 17, 2016",9,Best pain reliever I've ever used. The only negative is how quickly tolerance develops.,MikeSinOhio
56,Hydromorphone,Chronic Pain,10.0,,"June 22, 2016",36,Dilaudid (hydromorphone):I have severe fibromyalgia and possibly still undiagnosed endometriosis. I'm currently in the hospital (admitted) and they have been giving me 1mg of dilaudid every 4-5 hours for pain. It helps so much but eventually it wears off within the 3rd hour. This is through the IV. I have been sitting up and getting back to my self. The 2 cons: super drowsiness and it is addictive. I worry becoming dependent on it but at the same time it relieves my pain better than Norco.,SUPER EFFECTIVE AND IT HELPS
57,Hydromorphone,Chronic Pain,10.0,Taken for 1 to 2 years,"June 7, 2016",35,Dilaudid (hydromorphone):Loved it. I suffer from chronic pain from MS and back issues and this medication is very good for my pain. I take 4 8mg tabs a day along with opana 40mg and that seems to do the job,Crazyjaywithms
58,Hydromorphone,Chronic Pain,1.0,Taken for less than 1 month,"May 16, 2016",16,"Dilaudid-HP (hydromorphone):Given instead of Oxycodone was told it is much stronger/potent since I started requiring higher doses because my body became use to the dose. Did not help me made me nauseous and gave me a headache. I get the whole government trying to crack down on opiate abuse but for those of us that live in constant intolerable pain it is an endless battle to get pain relief wether it's from DR ,Insurance Companies , pharmaceutical companies manufacturing bad generics that don't work sometimes I feel it would be easier to well you can image",Pskeggy
59,Hydromorphone,Chronic Pain,7.0,Taken for less than 1 month,"May 1, 2016",15,"Exalgo (hydromorphone):I started taking Exalgo about 3 weeks ago after 20+ years of trying every other opiate and non-opiate pain med with little to no relief, especially once I became immune to them. I've been on disability since 2010 and been seeing a PM doc since about 2009 and in March he talked to me about trying an IR. I researched my insurance and when I saw him in April we decided on Exalgo 24mg per day with 15mg roxi backer. They seem to be working ok, but doc told me to take both 12mg caps in the am together which I did for about a week until I read here that others were taking them at 12 HR intervals  so I tried that and it seems as tho they are causing me to not sleep. I have been waking up about 4/4:30am every day since.  Anyone else having issues?",LORIDCOCHRAN
60,Hydromorphone,Chronic Pain,10.0,Taken for 6 months to 1 year,"April 28, 2016",33,Exalgo (hydromorphone):I was taking 80 mg. day of oxycodone (percocet 10 mg. + 325 acetaminophen per pill ) and finally found a pain doctor who is a psychiatrist and a neurologist as well as a pain mgmt. specialist and an addiction treatment specialist.  He asked how long the percocet worked for me.  I said 2 to 2 ½ hours.  He said based on the number of years I had taken it (4) and the increases of dosages over those years (beginning of 4 mg. 4 x day to 8 mg. 6 x day over 4 years) that I had become tolerant to oxycodone.  He put me on exalgo 32 mg. extended release once/day which is hydromorphone which is dilaudid and 4 mg. dilaudid/hydromorphone (the same drug but not timed release) for break through pain 4xday.  It was pretty amazing.  My pain just stopped.,tonyplake
61,Hydromorphone,Chronic Pain,,,"April 18, 2016",26,"Dilaudid (hydromorphone):After having 2 surgeries to my spine because of a fracture that was over looked. I had to be put on a morphine pump or what is known as a pain pump. This pump is placed within a pocket of fat that the doctors must fill ever 45 to 60 days. For several years I was given morphine into the pump. I do not recall any side affects to this. Due to the pain getting worse I made the request for a medication other than the morphine. I was placed then on Dilaudid/Clonidine which has been increased over the years. In February 2016 I started experiencing the side affects of withdrawal. My mouth stays dry, ears ringing, blood pressure increase to dangers levels. At the ER I was checked to see if I was having a stroke, with all test negative. BAD RX",gcassels
62,Hydromorphone,Chronic Pain,10.0,,"March 17, 2016",12,"I was first given hydromorphone while in the hospital with Pancreatitis and an acute gall bladder. This is a wonder drug! I was in more pain than any person should ever have, the first IV medication I was given was demerol, I didn't know it but I was hallucinating on the demerol  Well once they found out I was hallucinating they then put me on hydromorphone..OMG what a wonderful pain medication! I ended up with a PIC line since I was there so long and have terrible veins! So at this point the hydromorphone was given IV push. Literally once they started giving it to me I could count.. 1, 2, relief!!   Today, 8 years later I take 12 mg of hydromorphone every 3-4 hours for chronic pancreatitis and it is still the BEST pain medication.",BG2
63,Hydromorphone,Chronic Pain,1.0,Taken for less than 1 month,"January 28, 2016",20,Dilaudid (hydromorphone):My husband is in the hospital right now and they put a brand new knee in and he was doing pretty good until they gave him that drug.  It was horrible for him.  He was like a different  person.  He did not know where he was or even who we were.  He was screaming for someone to call the police.  I cannot imagine anyone taking that.  Norco 10 is the strongest thing he can take and that is just one pill when needed.  He took one dose of that and that is all....horrible experience for him.,Left knee revision
64,Hydromorphone,Chronic Pain,9.0,,"December 5, 2015",15,"After having been diagnosed with a rare type of multiple sclerosis called ""Malignant Primary Progressive Multiple Sclerosis"" (also known as Marbug Variant MS) there was not much for the doctors to do for me but to put me on a cocktail of pain medications that would 'hopefully' help to keep me comfortable while in the throws of relentless chronic pain. Eventually I was given Dilaudid 8mg oral tablet to help with the pain. It eventually stopped working as good so the dosage was increased to 16mg per 4 hours. And that is what I am currently taking. Because my rare form of MS has no treatments, no medications..it's just a progressive downward spiral. I'm now fully bedridden and a spectator of life. But I'm so grateful for dilaudid! Recommend",Grammy2014
65,Hydromorphone,Chronic Pain,10.0,,"November 28, 2015",59,"Dilaudid (hydromorphone):This is an incredible drug - I'm 25 and living with MS. Subsequently I have terrible spasms in back that are non-stop. I've been on this drug for over three years and have absolutely no complaints. I've tried 12 other pain meds before this - all of them making me very high, nauseated or sleepy. Then comes along Dilaudid - my doctor decided to try me on it because I was having such a hard time with all of the other drugs. From the moment I took the first dose I have been pain free - without any side effects what-so-ever.Because I have been on it for so long I have become tolerant to it so I have to begin the search for a new drug. Anyone looking for a pain med - this is the route to go.",tubaguy9008
66,Hydromorphone,Chronic Pain,10.0,,"September 21, 2015",37,"Exalgo (hydromorphone):The pain management Dr prescribed  morphine sulfate ( due to cost) rather than OxyContin . It was horrible. I felt loopy and sick with pain in my side . So a different Dr switched me to Exalgo SR .. What a relief! Ian finally thinking clearer . I take dilaudid for breakthrough pain and between the two , I am functioning much better. I think it is much better than OxyContin as well , because OxyContin always made me feel flushed and a bit dopey in a different kind of way. ( not as bad as morphine though) I am so glad I am getting pain relief without feel sick and doped up . I think Exalgo is a perfect match for me .",Ps91
67,Hydromorphone,Chronic Pain,8.0,,"September 16, 2015",42,Dilaudid (hydromorphone):Treats both the diarrhea and chronic pain that I have from Crohn's disease. Works great.,MikeyHasCrohns
68,Hydromorphone,Chronic Pain,10.0,,"September 8, 2015",29,"Dilaudid (hydromorphone):My luck I moved to a small town, small medicine to retire.I have Bilateral failed carpal tunnel with failed double revision and now with neuropathy in my hands.Herniated bulged disc in my lower back and another herniated bulged disc in my upper neck pushing against spinal cord.I have a torn right tendon in my knee,and that if I am really lucky I get  2 hours of sleep.I have beg my Dr. for Hyaluronic Acid Injection shot, (which for some reason he won't) And now their saying I might have  parkinson's. He had me on Dilaudid a few years back but it made me jumpy but I'll be asking for it again. Can you believe that he was trying to give me hydro's 10's for this? And this guy went to a top 10 School. Don't move to Wa. state.",Vader1212
69,Hydromorphone,Chronic Pain,7.0,Taken for 1 to 6 months,"September 1, 2015",13,Exalgo (hydromorphone):Very good and fast working,Who was that?
70,Hydromorphone,Chronic Pain,10.0,Taken for 10 years or more,"August 24, 2015",83,Dilaudid (hydromorphone):I think it should be a law for all pharmaceuticals that has anything to do with the production of hydromorphone or any other narcotic should be required to make a medication to wean you off of these  medications,wades3pets
71,Hydromorphone,Chronic Pain,9.0,,"August 10, 2015",4,For breakthrough pain works well   I take percodan regularly  [ 4 per day] and zanaflex 2 mgs  but sometimes pain goes beyond these and so i take dilaudid 4mgs  These help until the next round,grifmich
72,Hydromorphone,Chronic Pain,10.0,Taken for 1 to 2 years,"July 18, 2015",41,"Exalgo (hydromorphone):I am a 30y/o German automotive technician, when I was 18 I was hit by a drunk driver. Broke my lower back in 2 places,my hip and knee.  I was  taking 40mg OC and breakthru meds every 3 hrs , I was doing decent until in 2008 I was involved in a head on collision which broke my neck in 6 places. The pain form that was worse than anything I had experienced before. My dr increased my pain med doses, we tried everything from MS Contin to Opana ER, nothing was able to keep my pain under control for long. Being an automotive tech just added to the misery. Finally Exalgo came out and now 16mg/day with 2mg instant release dilaudid for breakthrough, my pain is finally controlled and I have my life back and don't have to take pills every few hours!",German automotive technician
73,Hydromorphone,Chronic Pain,9.0,Taken for less than 1 month,"July 12, 2015",29,"Exalgo (hydromorphone):This medication has improved my quality of life!!! I feel so much better when I take this medication.  My pain is down to a 3 from being a 10. Now if I can find a doctor to prescribe it for me, my life would be so much happier. Not having to suffer everyday....I wish.",Shitty
74,Hydromorphone,Chronic Pain,2.0,Taken for less than 1 month,"July 7, 2015",3,Does very little to deal with my pain.  I have both muscle and joint pain and it deals poorly with both.,JBtheCur
75,Hydromorphone,Chronic Pain,10.0,Taken for 2 to 5 years,"July 4, 2015",22,"Was diagnosed with three degenerative discs that have now compressed on top of each other at L-3, 4 & 5, creating horribly pinched nerves.  Started off with Vicodin, which helped for awhile.In 2006 was switched to Dilaudid 2mg, then 4mg, currently taking 8mg/ 4 times daily.  Wow, what a great pain killer! With the Vicodin, it dulled the pain but with the dilaudid, it's completely gone.  Makes living life enjoyable again.  It's great not to be in constant pain anymore!",staz
76,Hydromorphone,Chronic Pain,10.0,,"April 28, 2015",48,"Exalgo (hydromorphone):I am 5'. 105 lbs and was a carpenter for 6 years . I have a bad back 2 disc replaced in neck with a plate & 6 screws which gets cold and the pain goes right down my back . Have had 15 operations . Fibromyalgia and arthritis. Tried morphine and butane patches which made me sick. I take hydrocodone 10 mg 5 X day . Which only lasts 2 to 3 hrs. Grit my teeth the rest of the time (broken a few).  I  started Exalgo   12 mg  yesterday and I started feeling better in about 2 hrs.  This is a miracle, I don't hurt!  There were times I didn't think I could go on and now I have a new lease on life . I hope it continues to keep working ! Happy gal!",New York Gal
77,Hydromorphone,Chronic Pain,8.0,Taken for 5 to 10 years,"April 10, 2015",82,"Dilaudid (hydromorphone):Dilaudid has been beneficial to my daily activities. Without Dilaudid I literally cannot move. The chronic pain from fibromyalgia is indescribable. And every case is different, but it helps me.The only side effect that I must pay close attention to is headaches.... if I already have a headache, I don't take Dilaudid. It will make it worse. Once in a while, Dilaudid will cause a headache.",Rheacy
78,Hydromorphone,Chronic Pain,10.0,Taken for 1 to 6 months,"March 4, 2015",6,Worked for my neck pain,Cjk69
79,Hydromorphone,Chronic Pain,9.0,Taken for 1 to 2 years,"February 24, 2015",81,"Dilaudid (hydromorphone):Most effective opoid pain medication for me. Long story short, my spine is messed up from stem to stern: scoliosis, osteoarthritis, osteophytes, spinal stenosis etc. It all got much worse after my son was born which was when I was first put on the trial and error opoid rollercoaster. Tylenol 3 codeine quickly became ineffective, probably because I had up to this point been treating my pain with OTC medication (in Canada you can get low-dose Tylenol with codeine without a prescription) and I was put on Oxycodone (Percocet) which was an awful med: didn't last & withdrawal was hellish. Next up, Fentanyl patch, moderately effective but patch delivery was unreliable. Hydrocodone (Dilaudid) at last gave me some of my life and mobility back.",Canadienne
80,Hydromorphone,Chronic Pain,9.0,Taken for 1 to 6 months,"February 17, 2015",45,Dilaudid (hydromorphone):Works,LungCancerStg4
81,Hydromorphone,Chronic Pain,10.0,Taken for 1 to 6 months,"February 4, 2015",54,Dilaudid (hydromorphone):Finally0 found a medication with little side effects,paulieharris
82,Hydromorphone,Chronic Pain,10.0,Taken for 10 years or more,"January 30, 2015",71,"Dilaudid (hydromorphone):I suffer from a very rare migraine condition called hemiplegic migraines which are neurological migraines that cause stroke like symptoms. Unlike most people, I am unable to take most medications designed for migraines since in the small print of these meds it says do not administer to those with hemiplegic migraines. I have found that Dilaudid has been a God send when I have these migraines. Just 1 shot (ratio) of 2mg of Dilaudid combined with 2mg of promethazine and it puts me into a deep enough sleep where my brain can retrigger without any rebound migraine effects. It has proven to be very successful and useful!",Jenn Claus
83,Hydromorphone,Chronic Pain,10.0,Taken for 5 to 10 years,"January 29, 2015",86,"Dilaudid (hydromorphone):Dilaudid worked great for pain without all the side effects from other pain meds, but doctors are no longer willing to prescribe them. Probably due to all the abuse and how difficult the DEA is now making things for pharmacists who fill them and doctors prescribing them.",Anonymous
84,Hydromorphone,Chronic Pain,10.0,,"January 27, 2015",45,"Dilaudid (hydromorphone):Nothing else worked except this 2mg dose without side effects.It wore off after 6 hours. Given  post surgery use, but could have helped longer since everything else caused migraines.",Rotatorfix
85,Hydromorphone,Chronic Pain,10.0,Taken for less than 1 month,"December 19, 2014",56,Dilaudid (hydromorphone):It really makes most of the pain go away it takes a little bit for them to work but I'm on a low dose,lisawooten
86,Hydromorphone,Chronic Pain,10.0,,"December 15, 2014",83,Dilaudid (hydromorphone):When my migraine gets out of control this is the only medicine that kills it. The down side is that I have to go to the ER to get it and sometimes they give you a hard time as they think you are an addict.,Natisly
87,Hydromorphone,Chronic Pain,8.0,Taken for 5 to 10 years,"November 30, 2014",111,"Dilaudid (hydromorphone):After a failed back surgery, my orthopedic surgeons kept telling me I %u201Cshould%u201D be walking again. I could not get out of the wheel chair I had been in for over 12 weeks without assistance. And once out of it, I could not walk without severe pain. The docs eventually found bone fragments had been pushed INTO my spine rather than being removed before bone cement was used to repair my crushed vertebrae.  While they could %u201Ctry%u201D to remove them and redo the surgery, the chances of my not being able to walk, ever, were far too high to justify the risk of surgery. A brilliant pain management specialist in LA found the combination of Dilaudid and Morphine worked well for me. After starting pain medications, I was able to stand and eventually to walk again.",AZ Guy
88,Hydromorphone,Chronic Pain,10.0,Taken for 1 to 6 months,"September 28, 2014",45,"Exalgo (hydromorphone):Works great, does last 24hrs at the right dose. Give the medication time if you are switching from another pain medicine to Exalgo, for myself I was on morphine sulfate 90 mg and Oxycontin 40mg. It took almost 2 months to work @100%. I was just about to give the Exalgo up and go back to my morphine and Oxycontin but now I'm glad I waited it was worth the painful wait since I have such great pain relief. I take 48 mg of Exalgo now and 60mg of Oxycontin.",DrDPC
89,Hydromorphone,Chronic Pain,7.0,Taken for 1 to 6 months,"September 7, 2014",115,"Dilaudid (hydromorphone):I've been taking this in tablet form for failed back surgery, and CRPS in both legs up to the thigh. It doesn't relieve all the pain, but it relieves enough to get me through my day of being a full time stay-at-home single dad. I think I got better relief from the oxycodone I was on before, but it would only last 2-3 hours, whereas the Dilaudid lasts a solid 4 hours, so I get a little bit more time with my little guy where my pain is under control. Wish I could take the ER version, but due to gastric bypass, no ER tablets work on me... Can't say it's given me my life back, because I was a wind turbine technician when I became disabled, but I get enough relief to be with my son instead of on the bed in relentless agonising pain.",mat7401
90,Hydromorphone,Chronic Pain,,Taken for less than 1 month,"July 27, 2014",20,Exalgo (hydromorphone):Too strong,catten
