,drug,condition,rating,duration,review_date,upvotes,review,username
37,Oxycontin,Chronic Pain,8.0,,"August 22, 2016",36,"I was in a severe ATV accident when I was 15 (am now 18), and have currently had 26 surgeries mostly on my right hand. Once I was released a few months later, docs basically turned me from a 3 sport athlete to a living zombie. I was taking over 25-30 different medications everyday; mostly pain meds. I remember just poping them like candy. I was on 80mg of MS Contin x4 a day, 30mg oxycodone x5, 30mg morphine x3, 100mcg's fentanyl, 2mg Xanax x3, 4mg x4 Dilaudid and numerous other anti-depressants that I am still on to this day. I don't understand how doctors can prescribe such obscene amounts of opiates when it's pharmastists who study drug interactions as their profession. Am currently working to become a 3 fingered anesthesiologist :)",Nate-becarefulwhatyoutake
38,Oxycontin,Chronic Pain,4.0,Taken for 5 to 10 years,"June 28, 2016",41,I am really glad to see so many positive experiences. I just wish I could say the same. I have been on Oxycontin 40 mg for 6 years. I cannot say that I have found relief. I have peripheral neuropathy   and I take the Oxycontin 40 mg twice a day and Methadone 15 mg four times a day. I am in excruciating pain at least 8 eight hours a day and I have trouble sleeping and now I am having a problem with constipation. I don't really think it is the medications fault I think my dose is to low to handle the amount of pain I am in. My doctor will not prescribe anything stronger.,Elsie J
39,Oxycontin,Chronic Pain,9.0,,"March 26, 2016",75,"Im a ex flooring installer of 17 yrs (11 yrs non-union 6 union yrs) My back is wrecked, I have tears in 2 of my discs at L3/L4 and L4/L5 locations. I have no cartilage left anywhere in my lower back. My PCP put me thru the tests multiple MRI's/CT's injections, lots of predisone and then finally Norco. It took me a few days of being on Hydrocodone before the relief started, but relief it was! I gained much of my functionality back. I was moved up to the higher doses and then on to OxycontinER. Oxycontin had less side effects, and in general felt less wasted.Im now on 60mg x3 daily with 20mg IR 3x daily. Its been very helpful in my life.",RippedDiscs
40,Oxycontin,Chronic Pain,9.0,,"February 5, 2016",85,"I have 7 bulging disks, DDD and AS, on daily pain meds for 7 years. I requested a long acting pain med and had been on oxycodone IR 10mg. x 3 a day. Dr switched me to OxyContin 10 mg 4 per day. AMAZING RESULTS! I no longer feel drugged, I feel like myself again. The IR made me feel drugged and only lasted 3 hours, was a roller coaster all day long. I take 2 in the morning, 1 at 2 pm and 1 at 6 pm. and do not feel like I am on any medication at all, but the pain has gone from an 8 to a 2 (if I don't move) to maybe a 4 or 5 at worst. Able to clean house, shower, do many activities I was unable to do before. I feel so blessed that I have my life back. It seems to give me energy but no other side effects at all. No dry mouth either.",suzisavage54
41,Oxycontin,Chronic Pain,,,"February 5, 2016",48,I was wondering if anyone has noticed any difference in the Oxycontin since the formula has been changed from from OC to OP. Just curious after reading someone else's review.,Papa Mark
42,Oxycontin,Chronic Pain,10.0,,"February 1, 2016",118,Was taking 10mg oxycodone 6 times a day for an operation that went horribly wrong. I was always dizzy nauseous and tired.  Started ocycontin 20mg twice a day and changed my life.  Less percs feel almost normal. Now if the pharmacists wouldn't treat US like dirt life would be good. Highly recommend,Xop
43,Oxycontin,Chronic Pain,10.0,,"January 28, 2016",55,I have back surgery and the surgery and the medication I was on wasn't helping much. My doctor gave me OxyContin try and it's been a lifesaver for me. ,I can walk now
44,Oxycontin,Chronic Pain,8.0,,"January 24, 2016",78,I have been prescribed Oxycontin 60mg for well over 6 years now in just in the last 2 months I have gotten a refill  I know for a fact that either the manufacturer or where they get  their medication through there has been a shortage of the medication per the dosage compared to what it used to be. I don't know at what level this is occurring .  Whether this is another Government regulation that says if someone is prescribed 60mg tablets the manufacturer is only allowed to put 30mg in that tablet?  I have been on this same medication for a long time and starting December 2015 and January 2016 my medication has been shorted. My body goes through tremendous withdrawal symptoms each month I refill this medication.  I need an answer.,Madison2016
45,Oxycontin,Chronic Pain,9.0,Taken for 10 years or more,"January 24, 2016",63,I have been on Oxycontin since 2003 on a daily basis.  I have chronic abdominal discomfort because I had my large intestine removed due to chronic Ulcerative Colitis.  I also have had Degenerative Disc Disease  since 1998. I've had to have my right hip replaced due to an injury in 2008 and I have chronic sciatic nerve pain in my left hip that runs down to my foot. I found this drug to be more effective than any rehabilitation or needle injection that I've ever had. I have tried many different treatments like injections and physical rehab but I get the best pain relief from taking 3 - 60mg. Oxycontin every 8 hours and 10 mg. Oxycodone IR pills every 4 to 6 hours daily for increased pain and discomfort. The bad part is I lost most of my teeth.,Sunburn
46,Oxycontin,Chronic Pain,8.0,,"December 20, 2015",36,Would be nice if you could remove the ingredients that make it time release,Medard
47,Oxycontin,Chronic Pain,10.0,Taken for 5 to 10 years,"December 10, 2015",28,"Really helps get rid of my pain. Allowsme to function comfortably; since It makes me almost completely pain free, I sleep line a teenager. Prior to using this med, I used to wake up hourly because of pain. My only bad effect is that I get itchy every once in awhile.",Duke Jr.
48,Oxycontin,Chronic Pain,8.0,Taken for less than 1 month,"November 10, 2015",31,"2x10mg a day for fibromyalgia pain. It is not perfect, but takes the edge off.",Room_101
49,Oxycontin,Chronic Pain,10.0,Taken for 1 to 2 years,"September 6, 2015",35,"Hey! I've been been in 4   road accidents and has a neck fracture of the second cervical vertebra, and severe pain in his back and legs.  I have been taking oxycontin for about 1 and a half years.",Markus_88
50,Oxycontin,Chronic Pain,1.0,,"July 19, 2015",75,Was prescribed oxi due to back pain. Never took meds in the last 30 yrs of my life. I took only one of these and I'm laying on a gurney right now. Suffered a minor stroke. If it wasn't for my wife and her dillegence to call 911 id be dead right now. Watch the documary on Oxi then decide whether this drug is safe. The list of side affects is longer than my arm. Be wise and prudent before you decide to swallow any meds. Be safe,Mountain man 7
51,Oxycontin,Chronic Pain,10.0,Taken for less than 1 month,"July 15, 2015",43,Relief from fybro & arthritis,annoe
52,Oxycontin,Chronic Pain,10.0,,"July 15, 2015",74,"I have Fibromyalgia and major back problems.  Recently,  I visited the ER for my back, and they gave me Tylenol 3, which did nothing for my pain. I went to the doctor a few days later and told him I need something stronger, and he prescribed me 10mg of oxycontin twice per day.  I can only tolerate  taking one per day (any more makes me throw up), but since starting this medicine,  it has significantly reduced my all around pain levels by at least  85%! I am grateful for this medicine.",Victoria W.
53,Oxycontin,Chronic Pain,5.0,Taken for 5 to 10 years,"May 30, 2015",102,"I've had a chronic pain for over 9 years now due to fibromyalgia and rheumatoid after I had a neck fusion back in 2005. Every day I hav a lot of pain that I couldn't get out of bed without takin my med first. I'm on OxyContin 20 mg 2 a day every 12 hrs. and Percocet 10/325 4 a day for break through. OxyContin doesn't work for me real good it'll last about  3 to 4 hours then I have to take Percocet after for breakthrough to help my pain some more. So altogether with this 2 medication I still have a lot of pain that I'm coping with. I wish the doctor would increase the OxyContin but he doesn't want to so I have to live with all this pain everyday for almost 10 yrs. now, you know it's real bad to live with chronic pain everyday. SomeoneHelpMe.",BrandonYen
54,Oxycontin,Chronic Pain,6.0,,"May 9, 2015",42,"Some uncomfortable side effects like constipation. Other than that, the drug does an ok job with my Rheumatoid Arthritis pain.",jrf9597
55,Oxycontin,Chronic Pain,8.0,,"April 3, 2015",79,"The extended release Oxycontin works the same for pain relief as Percocet, but with barely any side effects.  Doesn't make me nearly as foggy or give me that euphoric feeling that Percocet does.  I can focus better during the day and sleep through the night without waking up needing more pills.",Mel Alanne
56,Oxycontin,Chronic Pain,9.0,,"March 9, 2015",56,"I have a bullet lodged in my back near my spine, this medication is very helpful in relieving the pain but use with caution I would not recommended this for daily use regardless of the severity of your pain.",Abu91
57,Oxycontin,Chronic Pain,9.0,Taken for 2 to 5 years,"January 30, 2015",57,Good for breakthrough pain..take 7 of the 30mg a day and use 2-75mcg of the Fentanyl Patches as well for Extended Relief. It has been my best regimen so far and I've tried a lot of different kinds and combination to ease my pain. It's hard though because you can tell how much it helps when you miss a pill.,Pain-n-simple
58,Oxycontin,Chronic Pain,5.0,Taken for less than 1 month,"January 27, 2015",31,This helped during oral surgery but made me sleepy...it did not help at all post surgery for rotator cuff surgery and gave me migraines. I felt like a zombie and had lucid dreams.,Rotatorfix
59,Oxycontin,Chronic Pain,10.0,Taken for 2 to 5 years,"January 16, 2015",65,"Initially it was beneficial in easing my chronic pain until I had a recent back operation. Now I am being brought down from a dosage of 120mg per day & now down to 25mg per day. Coming off it has been particularly stressful coping with the withdrawal factor but I have recognized the withdrawal symptoms & learning to cope with them on a daily basis with the help of my GP who has also become my counselor & is helping me with this painful regression of dosage. It has been a period of 4 mths so far & I am hopeful of being totally free of the medicine within that same time frame. Although it helped me to get through the pain until the operation, it has been a very painful process of withdrawal.  If possible, an alternative medication would be advisable",mausie
60,Oxycontin,Chronic Pain,8.0,Taken for 6 months to 1 year,"January 4, 2015",60,"I've been on Oxycontin for 8 months. I take it to help with RSD pain in my shoulder that radiates all down my arm and into my hand. I have trouble taking high doses of nerve medications like gabapentin, so a narcotic is necessary. It definitely helps a lot. However, it does not last 12 hrs. I have oxycodone for breakthrough pain. I also have tried taking 3 doses of Oxycontin a day (per Drs orders) and that keeps it from running out. The problem with a triple dose is drowsiness; I started to have trouble tolerating that. But, overall this has been a lifesaver for me.",Love the ocean
61,Oxycontin,Chronic Pain,7.0,,"July 6, 2014",68,"Use for Chronic pain. This is 4 Spinal Surgeries History. Have: Spinal Stenosis, DDD, Bone Chips & lots of Scar tissue.",Solid mike
62,Oxycontin,Chronic Pain,10.0,Taken for 5 to 10 years,"May 29, 2014",200,It is a real shame that the oxycontin ER has been reformulated. I started taking 40 mg 3 times a day 5 years ago after having to quit my job after 45 years of service and going on disability. It gave me so much relief that I was able to do things I was unable to do for a very long time. After the reformulation I went through real bad withdrawals because the medication was no longer as effective as it had been. I finally got through that and now I am struggling with all of the problems I had before I started taking it. I'm still taking it but I am suffering with severe fatigue and can barely get out of the bed in the morning and have very little energy. I can no longer work in my garden or walk my dogs & have to learn to live this way again!,beachwoman
63,Oxycontin,Chronic Pain,8.0,Taken for 2 to 5 years,"May 23, 2014",154,OxyContin  seems to work really well for pain. But there is that is a  few cons about this medicine for me is that my body would get used to to it and I would need to up the dose. I went from 10mg (2x a day) all the way up to 30  mg (2x a day) It has always only lasted tops 7 hours instead of the advertised 12. It without question has never lasted 12 hours. When I started taking this medicine by the 7 hour my legs would really be on fire again like clock work. So 2 pills would last 14 hours instead of 24 like the manufacturer says. So if you take this medicine make sure you get some breakthrough medicine. Make sure you take Exlax with this medicine. You will be constipated.,Dustinb85
64,Oxycontin,Chronic Pain,9.0,,"May 11, 2014",108,"I have chronic pancreatitis-cause unknown (I do not drink alcohol). The pain from this disease is constant and severe. I take Oxycontin 30 mg twice daily and it is very effective in controlling the pain and keeping it, for the most part, at a tolerable level (about 4-5 on the 1-10 pain scale). For occasional episodes of breakthrough pain, which can be very bad, I have oral Dilaudid 2 mg. I do not take this often, only when needed. It helps me avoid trips to the ER for pain control. Dilaudid is not often prescribed for home use. I'm under the care of a pain specialist. Neither my GI nor endocrinologist can prescribe schedule II narcotics. Chronic pancreatitis is one of the most painful diseases a person can have.",LauraLab1
65,Oxycontin,Chronic Pain,10.0,Taken for 1 to 2 years,"January 26, 2014",76,Only medicine that works properly.,bobertnobert
66,Oxycontin,Chronic Pain,9.0,Taken for 1 to 6 months,"January 15, 2014",136,"I have Rheumatoid and Osteoarthritis that affects everything in my body (organs and joints) but mainly my lower back. Spinal stenosis, bulging and degenerative discs, severe nerve damage from carpal tunnel in both hands, plus both hips and knees need surgery in the near future also. I take 80mg OxyContin 3 times daily plus Percocet 10mg 3 times daily for breakthrough pain. I have to take my pain medication first thing in the morning before I can take on my day. Have tried MS Contin and it worked fine, just did not last the 12 hours that they say it was suppose to it was more like 6 and Lortabs was like taking a placebo.",RedSouthGirl84
67,Oxycontin,Chronic Pain,10.0,Taken for 5 to 10 years,"October 20, 2013",67,"I suffer abdominal pain from 9 failed laparotomies to remove cysts and ovaries, im currently on 80mg Oxycontin 5 x a day, and Lyrica 2 x 450mg daily also for nerve damage this just takes the edge off it could be better but will try patch maybe all i need.....i suffer spinal probs as well neck as knees.......im a walking wounded so to speak lol.....",corina70
68,Oxycontin,Chronic Pain,10.0,Taken for 1 to 6 months,"October 14, 2013",132,"I have been on strong pain medication since 2006 due to 13 spinal surgeries. Fentanyl, MS Contin, Roxicodone, were all effective at 1 point, but side effects and tolerance levels caused me to switch to Oxycontin 40mg 3 times a day, with Roxicodone for break through pain. Finding the correct dosage to avoid withdrawal symptoms was difficult, but finally my body has adjusted. First time in a VERY long time I am almost pain-free, with the least amount of side effects I HIGHLY recommend giving it a try.",MRSDJMCW
69,Oxycontin,Chronic Pain,9.0,,"September 14, 2013",105,Degenerative Disc Disease. In 20 years I have been through all the medicines a regular doctor can write a prescription for. Once in pain management I started with 10 mg OxyContin twice a day then to 20mg twice a day. Now I am on OxyContin 20mg twice a day. OxyContin has worked for me in the long haul.,DogLover55
70,Oxycontin,Chronic Pain,10.0,,"September 13, 2013",102,I feel this medicine has helped with minimum side effects. I do not get a high or low feeling taking it. I have been able to do more with little pain. I have learned my limitations which was very important in order to not over do it that can cause more problems.,sherryms1
71,Oxycontin,Chronic Pain,7.0,Taken for 2 to 5 years,"September 2, 2013",69,"Fibromyalgia, Chronic Fatigue Syndrome, Arthritis, ileostomy to name a few. 10mg slow release morning and night and 15mg 4 x a day of immediate release also take other meds. My tiredness is caused by my condition, but life has been more bearable. Sadly no cure but I have some relief and can do small things like wee short trips on mobility scooter.",elliie
72,Oxycontin,Chronic Pain,10.0,,"August 31, 2013",45,Great,uncle jed
73,Oxycontin,Chronic Pain,8.0,,"August 11, 2013",124,"I suffer from degenerative arthritis in my lower spine, which is slowly making its way up my back. At first I was taking Oxynorm which is the same as OxyContin but in an instant release form. I began on 10mg a day, however due to tolerance issues this dosage quickly increased. Leaving me in a state where I was so stoned I might as well have been drunk. Concerned with that I spoke to my GP who changed me over to OxyContin, slow release. After 3 years, due once again to tolerance I am on 80mg 3x24hrs. The pain relief is awesome sometimes it's so effective I forget my backs stuffed. However some of the side effects are bad for instance I forget to breath, have trouble swallowing and the constipation is horrendous.",Gozzo
74,Oxycontin,Chronic Pain,1.0,Taken for less than 1 month,"July 29, 2013",50,"I've been on OxyContin 10mg 2x daily for about a month now and I stopped it about 2 days ago. I had gotten to where I didn't have the energy to do anything, getting out of bed was a tremendous chore and I have been waking up with a headache and going to bed with a headache. This is the second day off of it and I have a little more energy than I've had since I started it and I am hoping the headaches stop real soon. I made an appt to go back to my Dr. early to change.",Jerrie4364
75,Oxycontin,Chronic Pain,10.0,Taken for 5 to 10 years,"July 14, 2013",89,"I had knee replacement years ago, when they got in there it was a lot worse than what they thought, I ended up with steel from almost my hip to halfway down my shin. This has made the difference in me walking and being wheel chair bound. with Oxycontin I can shop, and do normal things. Without the pain relief it gives me I would be useless.",Oxy condone
76,Oxycontin,Chronic Pain,7.0,Taken for 2 to 5 years,"July 12, 2013",93,This medication is great for my chronic back pain. I have been on the same dose for over two years and it helped me get through most of the day just on two 20mg pills. Lately it has stopped working as well and I am having a lot of breakthrough pain as the OXycontin is extended release and from it working for almost 6 hours per dose it now only helps for about 2 hours. It is great if you are also given something for breakthrough pain but I cannot imagine being off of it to be honest. I have had severe chronic lower back pain due to a pinched nerve which causes shooting pain that goes up and down my spine and even causes my legs to go numb. I also have carpal tunnel in my right hand and fibromyalgia. Overall this medication has been very helpful.,dollface2u
77,Oxycontin,Chronic Pain,8.0,Taken for 5 to 10 years,"July 11, 2013",52,"I have been taking for about 7 years. Started at 10mg 2xs a day plus 7.5 mg Vicodin 3xs a day. Now taking 30mg 2xs a day and 7.5 mg Norco 3 to 4xs a day. Before they changed the formula, it worked a lot better. It does give pain relief but it doesn't last 12 hrs, like they claim. I have herniated disc in back also AVN in hips. Just had left hip totally replaced now I need right hip replaced before they will do surgery on my back.",Ozzymania1964
78,Oxycontin,Chronic Pain,9.0,Taken for 10 years or more,"June 2, 2013",54,I'm reading all these reviews and agree how effective this medicine is in dealing with chronic and cancer pain.  Was on it for 12 years for back and breast cancer pain. ,Anonymous
79,Oxycontin,Chronic Pain,9.0,Taken for 10 years or more,"May 23, 2013",63,The only side effect I've experienced is sleeplessness.,Anonymous
80,Oxycontin,Chronic Pain,10.0,,"May 12, 2013",48,It worked the best.,princefan29
81,Oxycontin,Chronic Pain,10.0,Taken for 2 to 5 years,"March 31, 2013",117,"My PM doc ran me through the gamut of long acting pain killers before settling on OxyContin.  When I started seeing this PM doc I had been taking 15 mg oxycodone (IR)  6 times a day and he told me we needed to get me on a long acting medicine. We tried Exalgo, Opana, Avinza, Nucynta, and Exalgo again. They all seemed to provide adequate pain relief, just not for the amount of time they claim to.  Back to old faithful.  OxyContin /oxycodone hasn't failed. me yet.",Thedeanius
82,Oxycontin,Chronic Pain,10.0,,"March 26, 2013",108,"I been on Oxycontin for 6 years now, of course my PM doc gave me the lowest dose and worked up from there. I am at the maximum amount they will give me which is 80mg 3 X a day plus, Oxy IR 30mgs 3 times a day plus Soma 350mg 3 times a day, it may seem like a lot but over the years my body developed a tolerance to this medicine but now I have been on this same dose for 3 years and it is perfect, no need to take anymore but the bad thing is the DEA inspected my docs office and asked him to switch all of his patients off of Oxycontin to morphine so now I am on the morphine. I am finding that it does not work as good as the Oxycontin.",Jake1219
83,Oxycontin,Chronic Pain,10.0,,"March 15, 2013",61,I suffer with Elhers Danlos .  This med Oxycontin has given me back my life.  I take 15mg twice day.  I can't get out of bed without it!,sammie1975
84,Oxycontin,Chronic Pain,10.0,,"January 9, 2013",86,"I used Oxycontin to deal with leg and terrible back pain.  I was taking Vicodin, and if I didn't get ahead of my pain, I ended up using as many as 8 a day.  All of the acetaminophen was damaging my liver.  When I switched insurance companies, I had a regular doctor and a new pain management doctor, who told me that the Oxycontin was a better medicine for chronic pain because it does not have the ups and downs that Vicodin has, because Vicodin only lasts about 4 hours.  I used the medicine for many years.  I now use the Fentanyl patch with great results!",Archer1234
85,Oxycontin,Chronic Pain,9.0,,"December 22, 2012",86,"I have been living with chronic knee and back pain since 1982 with having a total of 13 right and left knee surgeries.  I have degenerative joint disease throughout, the sacral vertebra in my spine have fused together and have injury in my back. I have been on multiple pain medications over the years and this medication helps me get through the day along with Flexerill. I have quit taking it for several months on end so I don't get addicted and did not have any side effects or withdrawal symptoms.  I did have high levels of pain, but anyone who lives with a chronic condition like ours understands this.  I have a great doctor who works with me trying to control it.",yorkielover64
86,Oxycontin,Chronic Pain,9.0,Taken for 1 to 2 years,"November 7, 2012",135,"I have chronic pain in my lower back, and this medication enables me to get out of bed each day and keep working. That said, I don't get the full 12hrs sustained release. For me its more like 9-10hrs relief before I feel it progressively wearing off (and supplement with a small dose of IR Oxycodone). Side effects? Finding the right dosage was tricky. Too little and I was in pain, but too much and I could barely keep my eyes open to function. I was fatigued the whole time and itchy all over. I've now found a stable balance between pain relief and side effects that is workable with the rest of my life. Overall, it's been a miracle medicine for me to relieve debilitating pain. I'm still in my 30's and am too young to be feeling 80 every day.",Anonymous
87,Oxycontin,Chronic Pain,3.0,Taken for 1 to 2 years,"October 2, 2012",25,Minimal relief with itching,Anonymous
88,Oxycontin,Chronic Pain,7.0,Taken for 2 to 5 years,"September 15, 2012",66,"I had 2 spinal fusions one on 5-5-10 and the 2nd one 11-11-11 and they both have failed. This is my 1st time being on oxycontin I was previously on 2 different strengths of oxycodone, which worked well for me but pain management wanted me to be on oxycontin and oxycodone and without my pain meds I can not get out of bed. I had 2 collapsed, bulging disc in my lower lumbar I started out with a cage and it never fused now I have a plate which is not taking. I have degenerative disc disease, sciatica, and many more problems I have more bulging disc and a cracked vertebra but I am really hesitant to have another back surgery due to the previous experiences.",SHORTIE33
89,Oxycontin,Chronic Pain,9.0,Taken for 5 to 10 years,"September 12, 2012",108,"I would just like to say that I have been taking Oxycontin along with other strong pain medication for years,   I have been blessed by doctors who understand what chronic pain can do to your life and not being afraid to prescribe what is needed.   Although I am still in chronic pain, I would not be able to get out of bed without these medications.   ",ellie1
