,drug,condition,rating,duration,review_date,upvotes,review,username
0,Oxycontin,Chronic Pain,,Taken for 10 years or more,"September 19, 2021",1,My father was on this drug along with many other prescribed from the GP. My dad had chronic back pain from scar tissue from a back operation when I was a young child in the 70s .My dad had been on this for 22-26yrs to my knowledge . My dad was hooked on these to survive daily life. Eventually dad got liver damage that is normally due to drink ( alcohol ) my dad didn’t drink & it was medication related. It went to the next stage & he got varices then liver cancer . Dad was lucky to be able to go on a waiting list for another liver. After 4 attempts rushing to be let down yet again .. this time dad was successful . Dad never properly recovered from his liver transplant & was left with herna x 3! Dad went on more meds including his previous meds and same thing again the new liver got damaged . Almost 5 years next month dad had his transplant & 3 months ago my dad died. He died from bleeding to death before us from two clots in his liver & his varices bleeding uncontrollably,Anonymous
1,Oxycontin,Chronic Pain,3.0,Taken for 5 to 10 years,"September 14, 2021",1,"I was on oxycodone, followed by oxycontin for 10 years , ending in 2018. I experienced severe claustrophobia. After getting off of Oxycontin (40mg x 4 per day) the claustrophobia disappeared. Most reported side effects do not include claustrophobia,  so I did not immediately make the connection. I used red Bali kratom 1mg capsules 6 times daily to reduce withdrawal symptoms. I eliminated Oxycontin first,  then the Fentanyl patch and finally the .5mg Methadone tablets over a 6 month period.  I would not suggest this drug to anyone other than a terminally ill patient. It robs you of your free will, your creativity and logic.",Filmmaker
2,Oxycontin,Chronic Pain,9.0,Taken for 10 years or more,"September 3, 2021",4,"Myself I am caught in the conflict of after been prescribed Oxycontin for years  like many others now told again for the 3rd time I got to be taken off the medicine like I should have never been given it to start with. My opinion is yes this medicine dose give me a quality of life yet being told by a doctor who I am to trust my life to that its wrong to been given this medicine leaves me questioning  what my life would be today had I never been prescribed it as somewhat suggested or if this medical choice is 100% political influenced cause if so, can I really trust a doctor that makes choices on my health or quality of life based on a political agenda ? That sure is a scary thought  .",Confused
3,Oxycontin,Chronic Pain,6.0,,"December 26, 2020",16,"I have chronic pain 24/7. it is so bad some days/nights I can't sleep, then fell asleep driving home from work.  A friend gave me some oxy 30, and started getting around better. But no doctor will give me any. The only otc that helps me is lots of indica.",larry
4,Oxycontin,Chronic Pain,10.0,,"December 21, 2020",296,"OxyContin was life restoring for me. I never got high and when my doctor left practice, I tapered myself off without any problems or addiction. Of course, I am suffering greatly because I have to deal with the severe intractable chronic pain again. I was hit twice by an 18-wheeler in the same accident. That, along with several autoimmune disorders, and two rare diseases keep me from participating in life. Unfortunately because some people choose to be stupid and take illicit drugs to get high, those with severe intractable chronic pain are made to suffer, even though we have the lowest rate of addiction and abuse 0.3%. Now it's nearly impossible to get adequate (or any) opioid pain mgmt!",JAS 21
5,Oxycontin,Chronic Pain,10.0,Taken for 2 to 5 years,"September 4, 2020",30,"OxyContin is the only pain killer that works better than Vicodin, Morphine, Tramadol, Codeine ect.",Rally
6,Oxycontin,Chronic Pain,9.0,Taken for 2 to 5 years,"July 18, 2020",33,OxyContin is the best pain relief I have tried.,ariellove
7,Oxycontin,Chronic Pain,6.0,Taken for less than 1 month,"May 5, 2020",49,"I was on 4 x 5mg Oxycodone IR for my pain. After a year or so, I felt I needed an extra pill to cover me for 24hrs. Doctor switched me to OxyNeo 2x 10mgs every 12 hours plus 5mg of Oxycodone for breakthrough if needed. The first 2 days I felt great, Oxyneo took care of the pain and I did not feel drowsy or tired. However after the 3rd day, I started feeling very aggitated and angry after I took my oxyneo. I'm not sure what's going on. Has anyone reacted like this to long acting oxycodone? Too bad because I liked this long acting one but feeling angry all day is not worth it either.",SD
8,Oxycontin,Chronic Pain,7.0,Taken for 10 years or more,"April 22, 2020",108,"My problems are like many that I've read on this site.  I take 20 mg. oxycodone (not oxycontin) x 4 daily.  It does enough so that I can have a life.  Still in pain, but as someone wrote, just tamping down the pain is all you can expect.  I just wonder why oxycodone worked when pure morphine did nothing for pain but going thru withdrawal from it was pure nightmare.  I have tried taking myself off oxycodone a few times because I feel ashamed about taking it, you know, can't just keep a stiff upper lip.  Withdrawal from oxycodone was a walk in the park.  How can you take a drug like morphine that has absolutely no effect while oxycodone does help some with fewer side effects.  It just doesn't make sense.  I have come to the conclusion that I am stuck on pain killers for the rest of my life and just don't talk about it.  Maybe they will develop a drug that kills the pain and doesn't cause addiction or dependence.  Why are we still taking drugs that haven't really changed in 60 years or so?",Veeta
9,Oxycontin,Chronic Pain,10.0,,"February 24, 2020",53,"I’m a registered nurse and home care in 2013 my car spun out and I had numerous injuries including a Trumatic brain injury, three fractured vertebrae, lacerated spleen, and three broken ribs. Since 2013 open till 2019 I had chronic pain day in day out around the clock even when I took Tylenol. One day I went to my doctor in tears because I try taking a night class but the driving and sitting in my car cause me too much pain. So she suggested I go to a pain center for treatment. Lo and behold I was prescribed 10 mg of oxycodone three times a day which I’ve been taking for over a year now and I wake up in the morning I take my medication I have level one pain which is basically not much.",Bentit696
10,Oxycontin,Chronic Pain,10.0,Taken for 2 to 5 years,"February 21, 2020",34,"My quality of life, after taking this drug,   is so much better.  I have had multiple surgeries on my back, and horrible arthritis this drug works wonders.",Amber
11,Oxycontin,Chronic Pain,,Taken for 10 years or more,"December 9, 2019",172,I've been taking 80mg IR oxycontin for 15yrs. With 30mg IR morpine I have stage 3 lung cancer and colon cancer. My pain doctor stop the 80s with no warning. I suffer for three months on withdrawals had to go to ER a lot.  My pain has increased and the pain doctor well do nothing. He scare of losing his licence. Now ER wants nothing to do with me. So I cry a lot seating at  home wishing somebody would do something.. I don't understand how they can't help me with the pain. I kNow they close down Purde all those billion the lawyers took but what us the people suffering from pain. Nobody cares about us.,Chiillychopper
12,Oxycontin,Chronic Pain,1.0,Taken for 10 years or more,"November 25, 2019",14,I been through  6 failed lower  back  operations  have 2 cages the do cut to large bones off my hip to put in the cages  he did not put the screws  in to hold the cages in he said  it was a tight fit what BS  I have 6 bad docs upper  back,BADBACKBARRY
13,Oxycontin,Chronic Pain,10.0,,"June 16, 2019",351,"My father has been on this drug for over 25 years and I have been by his side the entire 21 years I have been alive and I have never once seen him misuse the drug, sell it or abuse it in any way shape or form. He has 6 herniated disks in his back, a bad knee and a bad hip. He is able to run his business and be extremely productive when he has his medication as he is not in pain when he does. But the DEA has started cutting people down simply because some doctors and some patients abused it. Because of the few the majority are being hurt. I bet if the person at the DEA had anyone they know or themselves where in pain they would NEVER make such a careless move as to make doctors afraid to prescribe it in fear of losing their licence to practice. This drug is a miracle drug and I have seen so much good come from it. Especially my father being able to live a normal life with the medication (:",Limitless Beast
14,Oxycontin,Chronic Pain,8.0,,"January 25, 2019",59,"I have been on opiates for 15 years now, because of a degenerative condition on my C5 and C6 disks, and a  sterno-clavicular joint with constant sub-luxation and arthrosis. 3 years ago I was prescribed Oxycontin 20mg 2xdaily and for breakthrough pain I simply chew 1/3 to 1/2 of a 20mg Oxycontin tablet. Less side effects than morphine and much better pain management combined with Celecoxib and Paracetamol.  I do not overmedicate when I do not need it, since I had such bad experiences with tramadol addiction, that stuff was vile. Sometimes I take it a few weeks in a row and pause when I can to lessen the habituation and I never will get dependent. 42 pieces of 20mg Oxycontin tabs is enough for like 2 months of quality life as it very effectively takes the edge of the pain that I have every time I am standing or being active for more than a few hours in a row. Besides some pruritus (itching) from time to time and the occasional constipation I get from Oxycontin all is well. A 8+ out of 10 from me !",Some Guy
15,Oxycontin,Chronic Pain,10.0,Taken for 10 years or more,"January 16, 2019",292,"I am a 62 year old mom of 5, wife for 35 years.  About 20 years ago I was being treated for chronic bilateral back pain with sciatica, herniated disc, lumbar degenerative disc disease. That being said, I was prescribed 80 mg of Oxycontin 3 times daily with Oxycodone 30mg immediate release for break through pain. It was life saving!!!! I was able to function, work at our business, take care of my family and do everyday tasks. Now, because of the ""OPIOD CRISIS"", my Dr. tells me, I no longer can take this medication, and has taken me down to 30mg of Oxycontin 2 times per day and 20 mg  Oxycodone up to 2 times daily! BTW, since the very first diagnosis I described, I now have Scoliosis of  thoracolumbar spine and postural kyphosis of the thoracic region. So, from someone like myself, I don't abuse, sell, or give out my medication, why do I along with so many people like me, have to be taken off a medication that offers them to live a somewhat productive life with almost bearable pain???",Not Heard
16,Oxycontin,Chronic Pain,10.0,Taken for 2 to 5 years,"October 29, 2018",108,"My doctor prescribed OxyContin after I'd been hit by an 18 wheeler, rolled down an embankment, and fractured my spine. I'd been taking high doses of acetaminophen for years and had liver damage from Halothane gas and then acetaminophen. He wanted me to take a single dose opioid so that I wasn't taking more acetaminophen. Taking OxyContin was incredible. For the first time in years my pain was under control. I took it for 3 years... Until the ""guidelines"" went into effect. I successfully weaned myself off with no help and without incident. However, I've been bedridden for over two years because I've now exhausted all other things that have been suggested. Injections quit working, I've been to PT numerous times, taken anti seizure meds, psychotropic meds, and now I've given up. Unfortunately, I'm back to high doses acetaminophen just to take a shower or sit up and chat for 1/2 hr. ",Sarah
17,Oxycontin,Chronic Pain,2.0,,"September 18, 2018",45,I've been a chronic pain patient 5 years now. doctor said try Oxycontin. It would last longer. Tried it for a week. Bad Choice for me as  my pain in morning was a 10 but after trying this pill pain dropped to a 7 which is not terrible but it's not good.  Pills were supposed to last 12 hours nope. Bed time took pill and it helped me sleep. But I would wake up five times a night scratching myself. I think Oxycontin bad choice. The oxycodone fast-acting pills work better because they work super fast. Oxycontin not what advertised. I expected more out of this medication. I need fast acting meds period. I would say give Oxycontin a chance may work for you but don't get your hopes up like I did. On top of that most won't cover it because of the government. The government is pushing back and do not want anybody on these powerful medications And I can't afford to pay out of pocket at $3000 per 100 pills. that just can't happen and that is just way too much money . Especially if on Medicaid or Medicare that are disabled.,Rellik0078
18,Oxycontin,Chronic Pain,10.0,Taken for 10 years or more,"July 26, 2018",94,"This ""awful drug"" as reported by the media and the internet, has become the evil of prescription pain medication. But what you don't read or hear about is the thousands of people who's lives are made bearable by the use of this medication.  I have had multiple major surgeries following a lifting injury 18 years ago which left me with severe chronic pain caused from nerve damage during surgery. I have successfully taken 30 mg of oxycontin 3 x day for 15 years without ever needing to increase the dosage. The misconception is that pain medication will take away the pain...which is wrong. Pain medication should only be used to take the EDGE off the pain, not eliminate it. Oxycontin can be successfully used to take away enough of the pain over an 8-12 hour period for the patient to be able to at least function. Taking higher doses in order to eliminate the pain is where patients get in trouble, and can have fatal consequences.",Em
19,Oxycontin,Chronic Pain,10.0,,"July 23, 2018",59,"I was hit by an 18-wheeler. I fractured my spine. My doctor prescribed OxyContin because I'd been taking high doses of acetaminophen for years, which affected my liver. I took OxyContin successfully for 3 yrs 'til the US government decided chronic pain patients are expendable. I successfully weaned off of OxyContin, W/O ANY help!  My dr made sure I had enough to wean off b4 he left his practice. Reality: Only 0.3 percent of chronic pain pts ever become addicted. The US government has recently admitted to fraudulent and over stated numbers, elevated by over 50 percent! I've done every other treatment recommended by doctors, most incredibly expensive & invasive. Nothing worked & I've been bedridden for the past 3 plus yrs.",Gems21
20,Oxycontin,Chronic Pain,9.0,Taken for 5 to 10 years,"March 4, 2018",74,Only thing that actually worked on my chronic back pain and for broken collarbone. Too bad idiots make it harder on those of us who actually need pain relief.,cteevan
21,Oxycontin,Chronic Pain,5.0,Taken for 1 to 6 months,"December 29, 2017",77,"Severely hurt my neck all the way to my lower back. Was recently prescribed 30mg IR twice daily. I want to say this: For people suffering tremendous excruciating pain it is an amazing excellent medication because it takes my pain away right away. However, for me it is way to strong and can’t function on it and when taken at night I can’t wake up in the morning. I have made an appointment to go back to my doctor and go back on Vicodin. To anyone reading: please don’t abuse or take unless you really need it, and for those taking it just to get high out there, stop! You are ruining it for the responsible people suffering and are risking their well being for your selfish actions. I was responsible enough it was too strong for me. Please listen!!!",Xtozzz
22,Oxycontin,Chronic Pain,8.0,,"December 25, 2017",70,I find oxycontin very effective but it took some time to get it to where it was most effective. I found most surprising that higher doses caused more pain. My doctor is great. He worked WITH me to adjust it many up & down on dosage. Best of all WE were able to find a low dose of Oxycontin & Oxycodone combination that has worked consistently for over a year now without adjustments. Fiñd a doc that is also a real partner in your health care!!!!!,AmmAGator
23,Oxycontin,Chronic Pain,10.0,Taken for 10 years or more,"December 19, 2017",46,"Both meds Oxycontin & Roxicodone are some of the best pain meds on the market-HANDS DOWN! I've been on as much as two 80 mg Oxycontin & six Roxi 30's a day & was on that regiment for 8 years. I have had 5 back surgeries & have rods from the bottom of my neck to the top of my ass . I have all kinds of nerve damage in my left leg & feet & cramp something awful if I don't take meds. I took all that medicine with 3 Soma daily-3 zanex bars daily-100MG ZOLOFT DAILY-Neurontin 900mg daily-And as I said to start, both those pain meds are highly recommended & trust me, I have the experience lol",CANESRUS
24,Oxycontin,Chronic Pain,7.0,Taken for 10 years or more,"November 13, 2017",64,"Why are the reports for Public to read so jaded against the use of opiate medications? To many false reports of abuse in chronic pain patients are mixed with clearly reports of heroin abuse & deaths from heroin. My self & most chronic pain patients who are well educated on side effects before starting opiates all agree that the misuse of these Opiates would never enter our minds. When prescribed these drugs, it’s result is the re gift of our lives & functioning again.  It is something we’d never chance losing after suffering the complete loss of sanity from unending pain that effects our ability to function in every way that a normal human takes for granted of everyday, every minute of their day and of their life. I'm in my 17th years of receiving pain relief  fentenyl.",hottina44
25,Oxycontin,Chronic Pain,1.0,Taken for 1 to 6 months,"August 2, 2017",10,Been changed from oxynorm to shortec the packets are constantly pierced and tablets empty and doctors blame room temperature. Have moved them to various rooms and still having same issue,scatty
26,Oxycontin,Chronic Pain,10.0,,"June 22, 2017",40,"I was given oxycontin after morphine tablets didn't do much for the pain I was in. 90mg SR morphine and topped up with oramorph throughout the day. Then transferred onto oxycontin which was prescribed for me in a 40+20mg dose of slow release and topped up with the liquid form for through the day, but when I needed a repeat prescription I was told that I wouldn't be given any more. Even though I had taken these for over two months and the morphine for the four months previously. After reading some of the articles I shouldn't have been taken off these straight away. So much for being professional doctors or just wanting to save money over patients welfare..",Markus anthonio
27,Oxycontin,Chronic Pain,10.0,,"April 23, 2017",72,"I am a double amputee with both hips totally replaced. Degenerative arthritis was the reason for the replacements. I am 64 and oxycodone 10mg. three times daily returned my life to me after 11 surgeries. Four months ago, my PCD (primary care doctor said he could no longer prescribe them. I have been in a wheelchair since the removal. Being in a nursing facility was my only option. I get to see a pain management doctor soon and hope I can get my meds back, along with my life.",henqck
28,Oxycontin,Chronic Pain,2.0,,"April 4, 2017",95,"I have taken this drug for over 20 years for chronic pain.If I stop 1 person from starting this drug,  then this has been worth it.Initially it was the best pain reliever I ever tried. Problem is it is very addictive and stops working. The only way to sustain relief is to increase the dosage. I started at 60 MG and wound up at 200mg. Unfortunately at that dosage over  the years causes brain cell deterioration.  Remembering things becomes difficult, like family functions.  In time you become a walking zombie and numb to everything around you. You will lose interest in life and become drug sick if you Don't take your pill on time. Your relief will no longer be there because it stops working after time. I am off now and have my life back.",Sissynoor
29,Oxycontin,Chronic Pain,8.0,,"April 4, 2017",57,"Have had chronic pain since I was 14 (now 60). Have tried every RX suggested, multiple pain clinics, too many surgeries to count, exercise, meditation, acupuncture, hypnotherapy, with nothing gained but side effects or increasing tolerance. I have been taking Oxycontin for 10 yrs and have since been able to put the pain on a back burner and get back to my life. The 'pendulum swings' as they say, continued back & forth medical opinions on treatment of chronic pain. The insurance companies now seem to be in complete control again and cost becomes the number one consideration in prescribed treatment. Matters not what my Dr. says or recommends, the cost is such that as of this month I can no longer take Oxycontin. I am so tired, back to bed I go",2xpnsv2trt
30,Oxycontin,Chronic Pain,9.0,Taken for 1 to 2 years,"February 18, 2017",33,"I have severe lower back pain. It's mechanical and stretching helps but it's not enough to stop this kind of pain.I started on bupe but it was not enough. I tried Oxycodone at 10mg not helping. OxyContin that lasts many hours at around 40mg works. If I do stuff around the house or walk for a while I need to take 20mg oxycondone on top. I have done this for two years. I think this is a good drug. However, I'm thinking about going back to bupe as the stretching may have helped over the last year. I won't know unless I try.",J-James
31,Oxycontin,Chronic Pain,10.0,Taken for 1 to 2 years,"February 12, 2017",56,"For Chronic Pain: I take 40 mg oxycontin 3 times per day. I had c3-c7 laminectomy, fusion, two plates. Degenerative disc disease, osteoarthritis, rheumatoid arthritis, severe spinal stenosis, regional pain syndrome, bulging disks at t4-t5 and pinched spinal cord in 3 places with severe nerve damage. I was on Morphine Sulfate 30mg for 3 years, now I take the oxycontin with occasional breakthrough meds. I have found 90% of the time, if I take my meds at the same time every day it works just fine, with the occasional bad day here and there. Overall it has worked well for me. I have been on it for a year now.",Bear 75
32,Oxycontin,Chronic Pain,2.0,Taken for 1 to 6 months,"December 24, 2016",24,They don't work. I take 7.5 mg of percocet for break through pain. I've been in agonizing pain for a year. Possibly having surgery soon. Any suggestions to talk to my dr about . This is horrible with no quality of life.,Rpal
33,Oxycontin,Chronic Pain,5.0,Taken for 5 to 10 years,"December 19, 2016",38,"I have chronic back pain from degenerative disc disease. I have disc herniations from L-2, L-3 down to L-5, S-1; along with spinal stenosis-different moderations depending on the disc and spinal arthritis. To answer someone's question about how many OxyContin 80 ER pills can be prescribed per day. Legally, the answer is 4- 2 in the morning and 2 at night-which is what I receive; at one time they made 160mg OxyContin but they are no longer produced in the US.  To whomever said they were prescribed 8 of them a day- illegal or not from the US. It is an extended release medication meant to last 12 hours. I will be the first to say when they switched to the new for Formula, I didn't feel as though they were as effective and went from 2-4.",Nolamom2three
34,Oxycontin,Chronic Pain,10.0,Taken for 10 years or more,"November 10, 2016",32,"i am trying to get info on what the max dose should be-I was on eight 80mgs a day-new dr brought me down to three-its not enough-I have been pleading with him for 6 months now-I have been taking them since they first came out and 900 mgs of morphine b4 that-broke my back at 14 I have 6 fused vertebrae with 2 9"" herrington rods in my back-2 collapsed discs and full of arthritis I run out early every week I am 65-did all the other things -steroids hydro therapy etc etc-name it I tried I just need 1 pill back per day-any advice?",paulagy
35,Oxycontin,Chronic Pain,9.0,,"September 16, 2016",96,"I have been taking Oxy ER 20mg 3x day plus up to 8 Oxy IR 5mg for the past 7 years.  It has been a Godsend for me.  I was in bad car accident in 2008 in which I suffered from a bruised spinal cord plus it worsened already bad Degenerative Disc Disease,Arthritis and Spinal Stenosis. In June 2009 I had a spinal fusion on my neck levels 5-7.  After both I was left with horrible arm , shoulder and neck pain and mobility issues in my neck.  I work a lot on the computer and meeting with people,  If not for the medication I would not be able to work.  I still have some pain but it is more of a tolerable background pain instead of a full nerve toothache  Please folks use responsibly, many of us need it to live and function. I worry it will go away",Soccergal10
36,Oxycontin,Chronic Pain,10.0,,"August 29, 2016",35,"I've had orbital implants,kneck surgery, and I am a juvenile diabetic since I was a year old now I'm 50. the pain in my head,kneck, and right arm and the neuropathy in both feet r very very painful. I've been on doxycycline x 6 yrs. it works great but if your treating chronic pain take it when it's time don't wait till pain it at its worse it works consistently better.",Christine C.
