,drug,condition,rating,duration,review_date,upvotes,review,username
38,Divalproex sodium,Bipolar Disorder,9.0,Taken for 5 to 10 years,"March 28, 2020",10,"Depakote ER (divalproex sodium):Wonder drug for me, although I only use it as a rescue med if I get an inkling of mania. I don’t take it all the time because I gain weight and the hair loss is devastating. The upside is that it gives me curly hair (which also hides some of the hair loss). I lose about 50% of my hair volume. The curls slowly relax once I stop taking it. I still had waves two years after I stopped taking it full time. It’s the oddest thing. In addition to adding it as a rescue med, My doctor and I have carefully put together a drug cocktail that works for me. Effexor XR, Risperdal and bupropion. I don’t feel over medicated and it took years to get the formula right. Never stop trying new meds if you aren’t getting good results.",Blaise
39,Divalproex sodium,Bipolar Disorder,7.0,Taken for 2 to 5 years,"February 8, 2020",25,"Depakote (divalproex sodium):Was given a choice of Depakote or Lithium when diagnosed with bipolar three years ago. I chose Depakote while knowing nothing about it. I've had three manic episodes in my life and Depakote's brought me back down from every one. And since I have mixed episodes, they get really dangerous, so I probably owe Depakote my life. Only downside I've experienced is nausea and vomiting, it can hit pretty hard and out of nowhere sometimes. Made me want to stop the drug at one point, but for me the pros outweigh the cons.You have to get your blood tested every few months and it interacts with some other medications (like Lamictal) so take care.",nonenn
40,Divalproex sodium,Bipolar Disorder,1.0,Taken for less than 1 month,"February 4, 2020",24,"Depakote (divalproex sodium):First day of starting it had bad abdominal pains ,headaches , lower back pains,  spasticity in legs, dystonia , tired, ankles hurt,  tender muscles very sore . Blurry vision not happy at all. But lamictal also caused all of these side effects as well. I hate the bipolar meds they offer .",Cricky
41,Divalproex sodium,Bipolar Disorder,4.0,Taken for 1 to 2 years,"January 24, 2020",5,"Depakote ER (divalproex sodium):Starting dose of 250mg in the morning and 500mg at night keeps me in therapeutic range, and very effectively controls my bipolar type II with mixed episode, but even with 20mg Adderall extended release, I find my self incredibly drowsy and groggy in the morning. Unfortunately, this medication just doesn't agree with my brain chemistry, and I'm hoping to switch to lamictal soon.",Generic Name
42,Divalproex sodium,Bipolar Disorder,3.0,Taken for less than 1 month,"December 18, 2019",2,"The drug itself is fine, but the coating makes my body feel very sped up. When I soak the pill to get rid of the coating, I don't have that problem. When I take the drug from a different manufacturer, no problem. Need to use better ingredients!",ME
43,Divalproex sodium,Bipolar Disorder,2.0,Taken for 1 to 6 months,"November 29, 2019",16,"Depakote (divalproex sodium):I had a very rapidly fluctuating merry-go-round of symptoms, particularly psychotic type symptoms and Depakote didn't seem to have any effect. Cycling continued. It also made me physically slow and caused weight gain that mostly dropped after going off of it.",John
44,Divalproex sodium,Bipolar Disorder,7.0,Taken for 6 months to 1 year,"November 20, 2019",17,"Depakote (divalproex sodium):I take 1000 mg at night and 500 mg in the morning. And I'm always tired. I slept 15 hours last night and I'm still tired after drinking 3 cups of coffee. I have bipolar disorder 2 and I don't have manic episodes anymore. Still experience delusions but certainly less. I seem to have gained about 15-20 pounds. I also take 300 mg of seroquel, which can cause weight gain and drowsiness. If it weren't for weight gain, and drowsiness things would be good",Rain man
45,Divalproex sodium,Bipolar Disorder,1.0,Taken for 1 to 2 years,"November 15, 2019",19,"Depakote (divalproex sodium):I’ve noticed no change in my mood swings or manic tendencies on this drug. I still go through both; in fact, I’m concerned it could be causing me some insomnia. I’ve taken it for about a year, and in the last month I’ve dealt with major depression and mood swings, which bring me swiftly to paranoid thoughts and delusions.All in all, it’s done literally nothing it’s prescribed to do. Everyone will have different experience on different drugs, so take this with grain of salt.",Kb
46,Divalproex sodium,Bipolar Disorder,3.0,Taken for 1 to 2 years,"November 14, 2019",12,"Depakote (divalproex sodium):I haven't really had a major manic episode since I started depakote. However, it did not help me with normal agitation, violent thoughts, or anger.But trade-offs were weight gain, significant hair loss, and tremor.I was on 1250mg/d and decreased to 750mg/d. Cutting down didn't make me feel any difference.I wish this works out for most of you since this is one of the main therapies for maintenance.",So-so
47,Divalproex sodium,Bipolar Disorder,8.0,,"November 14, 2019",16,"Depakote (divalproex sodium):29 year old Male w/ Bipolar 1, 10 years on DepakoteDepakote was the first medication I was prescribed during a manic episode along with Seroquel, which I discontinued or use only for emergency mania/sleep at very low doses<25mg.  Depakote worked excellent for me for about 6 or 7 years as I was predominantly manic.  The last 3 years or so I have become depressed and hypomanic and I have found Depakote to be much less effective.  I switched to Lamictal and it appears to be working much better for depression.",Anonymous
48,Divalproex sodium,Bipolar Disorder,8.0,Taken for less than 1 month,"October 9, 2019",44,"Depakote ER (divalproex sodium):I must start off by saying everyone is different and will react different. My condition is unofficially diagnosed. But I was told when I was a teenager I was a maniac depressive with possible hormonal imbalance. Recently I have had two major mania events. Accelerated heart rate, palpitations, headaches, dizziness, fatigue, mood swings, confusion, and memory loss to name a few. The night I took this medication I felt it kick in. I felt great and had so much mental energy I didn't have before. It has been working for me. I suggest eating when you take this medication it can make you nauseous. I haven't seen any  side effects other than that. Each to their own though. Just wanted to post this to this forum to let you know if this doesn't work for you there is a medication that will work. Don't give up !",Mood Swing Mama
49,Divalproex sodium,Bipolar Disorder,6.0,Taken for 1 to 2 years,"September 28, 2019",98,"Depakote (divalproex sodium):If you like being devoid of emotions then Depakote might be for you and your bipolar disorer. Personally it makes me feel dead inside. No joy, No sorrow. Nothing. Some might like this numb to life feeling. I like the ebbs n flow of life. Seriously this has removed all emotion from my being. I enjoy nothing at the same time I don't dislike anything either.  Bad medicine stay clear",DonewithBigPharma
50,Divalproex sodium,Bipolar Disorder,3.0,Taken for 6 months to 1 year,"September 14, 2019",6,"Depakote ER (divalproex sodium):I was prescribed Depakote for mood stability with the benefit of possible migraine control. I noticed the slightest amount of difference in impulsivity, but looking back it was most likely due to other medication changes at the time. We increased the dose hoping for better results, but all  I received was side effects. I took one dose at night and the increased dose just made me incredibly ‘loopy’ and I wasn’t able to move properly as my body was incredibly weak. On the higher dose, the fact I wasn’t able to get out of bed without falling over and emotional mood swings made the slight benefits just not worth it. Once stopping the medication, I figured out that Depakote had increased the ringing in my ears (which luckily improved dramatically after a few months of not taking it). One benefit of this medication was that it was extremely easy to use, and if your body is able to tolerate it is absolutely worth giving it a go. After all, you never know until you try it!",Abbey
51,Divalproex sodium,Bipolar Disorder,7.0,Taken for 1 to 2 years,"August 19, 2019",26,"Depakote (divalproex sodium):Depakote has proved a good med to keep me from being manic, has twice Brought me down from mania, both times with increased dosage.Much more effective than antipsychotics alone, namely abilify, zyprexa and seroquel.Now I am on 2 grams a day, split into 1 gram doses twice a day. Great for mania, not for depression. I'm currently in a depressive episode, recently started another med for that, alongside the depakote.I struggle to control my appetite on Depakote, but eating healthy, wholesome meals helps me not to give in to unhealthy cravings.Good outweighs the bad for me :)",P. I. Staker
52,Divalproex sodium,Bipolar Disorder,8.0,Taken for 5 to 10 years,"July 20, 2019",18,"Depakote ER (divalproex sodium):have been taking Depakote 1500 mg for 2 years, find it calms me down, when anxiety is overwhelming.It is worth side effects  of weight gain, and hair loss.I keep taking regular dose and don't play around dosage. ",dave
53,Divalproex sodium,Bipolar Disorder,8.0,Taken for 1 to 6 months,"July 17, 2019",7,"56 yrs old first time to try treatment, diagnosed bipolar2 and ADHD.  I have a lifetime of destruction including from manic behaviors (law interaction's and have broken every major bone in my body) and depression including suicide attempts. Been  on  divalproex 1000 mg/day for about a month. Initially with Welbutrin, Welbutrin sent me immediately extreme manic and with shakes dry mouth ect. Changed from Welbutrin to sertraline (zoloft) low dose of 25mg/day also 100 mg amitriptyline for sleep. Honestly am very satisfied with the results as I entered treatment from VA suicide hotline. First time in my life where I feel I have any control over my own moods. Am sure I have adjustments to make but have some hope for a relatively stable future.  Don't wait as long as I did.",Aadee
54,Divalproex sodium,Bipolar Disorder,7.0,Taken for 1 to 6 months,"July 17, 2019",16,Depakote (divalproex sodium):I've been on it a few months for intermittent explosive disorder helps a little bit with my PTSD as well not bad though I have gained 10 lbs and I'm ok because I work out ,Demon
55,Divalproex sodium,Bipolar Disorder,10.0,,"June 26, 2019",103,"Depakote (divalproex sodium):Since I've started taking Depakote I've been feeling great. My mind can slow it's self down enough to give me time to process, and my moods are way easier to predict and control. I feel like a complete different person, in an insanely good way. Without any annoying side effects as well!",Dan
56,Divalproex sodium,Bipolar Disorder,6.0,Taken for 1 to 6 months,"June 10, 2019",5,Depakote ER (divalproex sodium):Not sure if Depakote is worth it. Rather take Seroquel XR.,JB34
57,Divalproex sodium,Bipolar Disorder,10.0,Taken for less than 1 month,"May 23, 2019",102,"Depakote (divalproex sodium):It’s only my first day taking this Depakote medication and I already love it. I took my first dose of 250mg before bed and it helped quiet my mind and didn’t experience any side effects. I took it in the morning with my lexapro and it helps getting rid of racing thoughts and anxiety. I also noticed I don’t have headaches anymore. It feels like a chill pill. I highly recommend you give Depakote a try and don’t let the list of side effects scare you, as I have experienced none so far. I am taking this for Bipolar Disorder 1.",John
58,Divalproex sodium,Bipolar Disorder,3.0,Taken for 1 to 6 months,"May 9, 2019",21,Depakote (divalproex sodium):Worked for a week after each increase in dose. After that the effects faded and it left me feeling numb. Good for the mania side for bipolar but not the depressive side - the side I struggle with.,Ja ja
59,Divalproex sodium,Bipolar Disorder,1.0,Taken for 1 to 2 years,"April 22, 2019",37,"Depakote (divalproex sodium):No way! Been on it twice in my life. I was extremely bloated beyond recognition and in a deep mental haze. I could barely function. My doctor kept saying you need to take care of yourself before you can care for your family. And she was right. I got off it, weight loss has been slow but I got my face back I looked like a hamster on it and I went up 5 pant sizes on this medication. I got my energy back. On this stuff I slept all day. Off this medication I am enrolled in school and on the path to a new career and I am able to be awake to live my life off this stuff. And care for my family.",Depanever
60,Divalproex sodium,Bipolar Disorder,10.0,Taken for 10 years or more,"March 17, 2019",29,Depakote (divalproex sodium):Depakote has worked amazing well for me for the past 2 decades.  I have changed over to something else for a short period of time when it became ineffective.  That has only happened 3 times in 17 years.  It is not the greatest drug when you have to get off of it.  You have to taper down very slowly.,Beach Babe
61,Divalproex sodium,Bipolar Disorder,,Taken for 10 years or more,"March 6, 2019",20,Depakote (divalproex sodium):Feel it's caused my essential tremors after 13 years.,tish
62,Divalproex sodium,Bipolar Disorder,3.0,,"February 24, 2019",3,"I have only been on Depakote Sodium 500 mg twice a day for 4 days for depression and so far I have no improvement. I have tremors. I am normally a talkative person, now I hardly say two words and even worse of all it has taken away my happiness. I don't smile laugh all I do is start crying and no emotions at all. Can I lower my dosage. I have no insurance to see my Doctor",Anonymous
63,Divalproex sodium,Bipolar Disorder,,Taken for 1 to 6 months,"February 9, 2019",23,"Depakote (divalproex sodium):Depakote has overall been a very good experience for me. I started it about two months ago and I have not had a manic episode since. I was on Lamictal for 8 years, I went all the way up to 500Mg and it touched on it and even caused motor tics the reason why I was able to last that long on it was because Klonopin was masking the symptoms... once I discontinued the motor tics vanished. I did not lose hair on the Depakote or have any nasty side effect but I did gain weight. Now its stable and I changed my diet and started exercising. It increases appetite and slows down metabolism especially in women... but overall I would say great medication! I no longer need the Klonopin either which became habit forming",RoxyMesh
64,Divalproex sodium,Bipolar Disorder,1.0,,"December 10, 2018",64,"Depakote (divalproex sodium):I was falsely diagnosed bipolar, which I think was the first issue. However, Depakote on a low dose (750 mg) did alleviate some racing thoughts and was effective. Once a doctor inappropriately put me on a high dose for someone who is not bipolar (over 1000 mg), I was a zombie! It made my depression significantly worse, I gained 50 lbs, slept all day and had no feelings. I am a talkative person by nature, and on this drug I barely uttered a word. I'm sure it may work for those with true mania, but I'd say if on too high of a dose, or even a low dose, weight gain is inevitable and sugar/carb cravings. I also just feel it dulls your ability to focus and suppresses happiness. Of course, that could've just been my depression. Just wanted to warn people either way.",kellymcnamara1994
65,Divalproex sodium,Bipolar Disorder,7.0,Taken for 1 to 6 months,"October 30, 2018",39,"Depakote (divalproex sodium):I've been on depakote for over a month now, it has really helped me. I was diagnosed with bipolar 2 at the age of 16, I'm 21 now. This was the first medicine that I have tried. I still get down and depressed sometimes, but it is nothing like I used to. All of my suicidal thoughts have stopped, I used to have them multiple times a day. Depakote has also help very well with my anger and aggression issue, I feel as if i can live a normal life now and handle tough situations better. I would definitely recommend this medicine for anyone dealing with bipolar disorder!",pres
66,Divalproex sodium,Bipolar Disorder,10.0,Taken for 2 to 5 years,"October 2, 2018",24,"Depakote ER (divalproex sodium):I am a guy who underwent 30 yrs of treatment for anxiety/depression until I was finally correctly diagnosed with BP2 and ADHD. Depakote ER 2000mg at night is my mainstay med. My default mixed states are well-controlled by Depakote. Xanax works as a rescue med at far lower doses than I took before Depakote. Early hair loss (now resolved), no weight gain. I take 20mg Dexedrine daily for ADHD; Depakote doesn't let it trigger hypomania. Ketamine infusions & nose spray cover the depressive side.",SF100
67,Divalproex sodium,Bipolar Disorder,8.0,Taken for 2 to 5 years,"September 17, 2018",15,"Depakote ER (divalproex sodium):I have had three severe manic episodes in my lifetime.  First was not diagnosed.  The 2nd severe mania hit in 02 and I was given zyprexa.  This took the edge off but I would wake up in the early morning manic again, once it wore off.  When depakote was added, I really came down.  I was Manic-episode free 15 yrs, w/ relapse in ‘17.  I was put on zyprexa and lithium but was still flying high and fast - complete manic.  Once high dose of depakote added, I came down for good.  This drug has been critical for resolving my manias.  My experience with it for long term treatment has not been good though - lost a lot of hair, and a lot of enthusiasm and felt like I was in a stupor.  I gained weight, but that has happened on all the useful drugs.",Alt jay
68,Divalproex sodium,Bipolar Disorder,10.0,Taken for less than 1 month,"September 13, 2018",42,"Depakote (divalproex sodium):Today is my second day on depakote. I was freezing yesterday and it was 80 degrees. I have been on gabapentin, lithium, celexa, wellbutrin, lexapro, and so many others. I tried to commit suicide 3 weeks ago and that’s when I decided enough was enough. As soon as my oldest started ninth grade I started sleeping on the couch, having crazy mood swings, and then my daughter graduated. I slept on that couch for 6 years. My husband worked 3rd shift and me day shift. I was self medicating with hydros then when I wanted to stop that I got addicted to Suboxone. I also have a thyroid disease and had no idea that played into it. I’ve weaned myself off all drugs and now they started me out 500 mg twice a day. And my thyroid medicine. This is going to be a long road but I know it will be worth it. Please don’t give up.",Stephie77
69,Divalproex sodium,Bipolar Disorder,1.0,Taken for 6 months to 1 year,"August 4, 2018",30,"Depakote (divalproex sodium):After the birth of my daughter I had a depressive episode,  I would like to note I was 40 pounds over weight after having my daughter, normal after childbirth. I delivered a healthy baby and my pregnancy had no complications and I had normal lab results on physicals before depakote. After being on it, I ballooned up another 40 pounds. The depakote messed with my thyroid issues, gave me obesity, sleeping about sixteen hours a day, mental fog, severe fatigue, depression, fatty liver diagnosis. I like walking every day and after the depabloat I could not get the energy to walk anymore. The doctor blamed everything on me, (wonderful doctor). Before depakote, I did not have any of these problems. So beware. The professionals can care less what the medication does to you. I wouldn’t take this medication again. This was all over the course of eight months. The doctors will blame you for every adverse side effect to cover their own bottoms when prescribing this crud of a medication.",Depabloater
70,Divalproex sodium,Bipolar Disorder,10.0,Taken for 2 to 5 years,"June 22, 2018",8,"I believe this medication is a blessing!I was started out at 500mg/am and 750/pm.Eventually I was taking 1500mg twice a day.My moods became level, my appetite came back, my sleep was restful, and I felt like the ""me"" I had been missing.",Queenie
71,Divalproex sodium,Bipolar Disorder,5.0,Taken for less than 1 month,"May 25, 2018",17,"Depakote (divalproex sodium):Been on Depakote and Prozac for three days. I take 20 mg prozac in the morning and 750mg depakote before bed. First day great..I felt better! My mood was noticably happy and I could actually think clearer without being agitated.  Second day had trouble sleeping, anxiety, tremors and a little hallucinations. Third day terrible nausea, panic attack, in the bathroom every 20 mins seems like, bedtime abdominal pain and diarrhea. I'm slowly coming off of this med now.",Jill
72,Divalproex sodium,Bipolar Disorder,1.0,Taken for less than 1 month,"May 12, 2018",10,Depakote ER (divalproex sodium):Terrible. Absolute poison. I would never  ever put that toxic waste in my blood stream again. Depakote is bad.,K
73,Divalproex sodium,Bipolar Disorder,7.0,Taken for 1 to 2 years,"April 26, 2018",7,"First, I was put on Divalproex during a hypomanic episode that wouldn't end even with five different psych drugs.  The Divalproex worked quickly to quell the hypomania, but at 1000 mg/day this drug's side effects were unbearable.  Chronic diarrhea, rapid weight gain of 30 pounds, shaking hands, finger tremors, excessive tiredness during the day, lack of coordination when walking, lack of concentration, & two thirds of my long hair fell out in clumps.  My psychiatrist started lowering the Divalproex gradually down to 500 mg/day, & she withdrew three of the other drugs also.  All the side effects subsided.  Now I'm just taking 500 mg Divalproex per day along with 40 mg Latuda & my moods have been really stable!",marCanada
74,Divalproex sodium,Bipolar Disorder,8.0,Taken for 1 to 6 months,"April 7, 2018",136,"Depakote (divalproex sodium):I'm bipolar ll. Recently started Depakote. Started out at 200 mg, now at 800 mg. So far so good. Will write another review in another month or two. I was terrified starting this medicine, but it has been great so far. I'm still not at my target dose, but it has already helped racing thoughts, depression and hypomania. I feel more hopeful, a lot calmer and less stressed out. NO WEIGHT GAIN AT ALL. Not even a single pound. I've actually lost weight. Side effects? The first week I felt more depressed, but it didn't last. Tiredness, nausea and a bit foggy after each increase. Easy peasy. I have tried 15 medicines including Lamotrigine, Trileptal, Abilify, Gabepentin and countless antidepressants. Nothing worked. Fingers crossed. Big hugs to all of you bipolars out there!",CyclingSarah
75,Divalproex sodium,Bipolar Disorder,10.0,Taken for 6 months to 1 year,"April 4, 2018",42,"Depakote ER (divalproex sodium):I am very pleased so far with my experience taking Depakote. Before Depakote, I was taking seroquel for quite some time (a couple years) and although I was happy on that medicine, I was way too tired. Luckily my solution was Depakote. All I can say is I have tried medicine for 4 years now and it has been a long journey! I will always remember my first time taking Depakote. Normally I get very fearful and panic the med will make me sick. Not Depakote. Instead, I felt immediately better, happy even, and giggled. Once that wore off, I felt normal and slept an hour or two after taking it. I enjoy how I still get tired on this medication like seroquel, but it does not overwhelm my senses with sedation, and fog my memory as much. If anything, I have never been more myself! Only thing is now sometimes I laugh too much.",Carala
76,Divalproex sodium,Bipolar Disorder,10.0,Taken for 10 years or more,"March 28, 2018",33,Depakote (divalproex sodium):Love it. 15+ years taking it,Tricia
77,Divalproex sodium,Bipolar Disorder,1.0,,"March 22, 2018",21,Depakote (divalproex sodium):Rubbish med. Ruins liver,alschuster
78,Divalproex sodium,Bipolar Disorder,1.0,,"March 19, 2018",23,"Depakote (divalproex sodium):This review is on behalf of my 16 year old son.  Manic Ups and downs for years, between  over the top excitement/happiness (rare and short lived) or anger/violence or full depression /sadness.  Just trying to help him level out. Has been moved on and off many different medications to try to find a fit.  Most recently Dr added depakote to his 900 mg lithium & 15 mg abilify.  First four days started with depakote 500 mg; then added another pill to 1000 mg. Started to have digestive issues and tremors but pulled through. Increased to 1500 mg 4 days later which led to more tremors and violent vomitting. Dr suggested splitting the doses am/pm.  Within 2 hours of taking the am dose the next day- same violent vomitting.  Confirmed no stomach bug. His body was unable to handle the level of Depakote. Now, No longer taking.I've read many positive reviews on this medication , but sadly ours is not one of them due to his  adverse reactions.",Still Looking for Answers
79,Divalproex sodium,Bipolar Disorder,10.0,Taken for 2 to 5 years,"February 7, 2018",34,"Depakote (divalproex sodium):I was diagnosed with depression and anxiety 35 years ago, but finally received a diagnosis on the bipolar spectrum two years ago at the age of 60. Depakote ER (2000mg at night) fixed things I didn't know were wrong and has stilled the ultradian cycling that was really my problem all along. I feel luck that the only side effects I have encountered are hair loss at first (now resolved) and occasional heartburn. It relieved most of my depressive and hypomanic symptoms within three weeks, but I just added Lamictal to help a little more with depressive symptoms. I take a complicated stack of meds to manage psych. symptoms, but Depakote is by far the most important.",sf100
