,drug,condition,rating,duration,review_date,upvotes,review,username
170,Divalproex sodium,Bipolar Disorder,10.0,,"October 15, 2013",101,"Depakote (divalproex sodium):Best medicine ever for me. Started with lithium after diagnosis for bipolar. Lithium gave terrible side effects so after switching to Depakote, life became much easier for a chemically challenged like me. Took almost 1 year before 100%.",Stacyesd
171,Divalproex sodium,Bipolar Disorder,9.0,Taken for 6 months to 1 year,"September 20, 2013",165,"Depakote (divalproex sodium):Tried all other bi-polar medicines throughout the past 10 yrs. This one has the least side effects of them all. People tell me my behavior has vastly improved on Depakote. It's hard for me to see myself through other peoples eyes. But, sometimes maybe I should. Personally, for me, Depakote has been a life saver, I didn't want to live with it but find I can not live without it.",crazytoo
172,Divalproex sodium,Bipolar Disorder,7.0,Taken for 10 years or more,"September 3, 2013",93,"Depakote (divalproex sodium):I have been on Depakote for 10 years. I can tell that it does calm me down. As most people are saying in this forum it does make me very tired. The symptoms that I have had for 10 years are extra sweating, (it seems to be coming from my scalp and down my face). Weight gain that I can't seem to lose, and I'm wondering if anyone else has a ringing or drumming in one or both ears. I've been to many Doctors just about my ear but they can't find anything wrong. ",Sweaty Mom
173,Divalproex sodium,Bipolar Disorder,1.0,Taken for less than 1 month,"September 1, 2013",41,Depakote (divalproex sodium):I took Depakote for bipolar and the very first night I had very vivid dreams which turned into nightmares and audio visual hallucinations.  It's been 3 days and my dreams are not back to normal yet.I've read the reviews and it seems to work for most people. I haven't gotten a good night's sleep.My doctor put me back on Trileptal 300 mgs twice a day.,40 yr old woman
174,Divalproex sodium,Bipolar Disorder,10.0,Taken for 5 to 10 years,"August 24, 2013",48,Depakote ER (divalproex sodium):This medicine has been great for me.  I do not feel any side effects.  I actually lost 25 pounds... I had been on lithium for 28 years.,Anita Key
175,Divalproex sodium,Bipolar Disorder,,,"August 24, 2013",31,"Depakote (divalproex sodium):I've been on Depakote for 10 days. I also take 250mgs of quetiapine 50 mgs. My psychiatrist is reluctant to diagnose bipolar but seems to be treating me for it. I feel calmer so far on Depakote, but still feel a bit down. I was a bit high my psychiatrist said I wasn't manic.",soul queen
176,Divalproex sodium,Bipolar Disorder,,,"August 22, 2013",110,"Depakote (divalproex sodium):I was just newly diagnosed with bi-polar.  I started feeling the effects of my antidepressants as they made me feel too euphoric and unhinged.  There are days when I feel as though I can conquer the world and nothing can stand in my way and days when I feel low, as though the world is on top of me.  Sometimes, I can laugh and then cry out of nowhere.  It's like a roller-coaster ride that seems to get out of control.  Anyway, I tried the lamotrigine and I could feel that it was stabilizing me, but it caused brain zaps.  Now I am on Depakote @ 250 mg twice daily and I feel really good.  It just depends on your system.  Everyone is different.  You have to find what is right for you.",Totally Sarcastic
177,Divalproex sodium,Bipolar Disorder,3.0,Taken for 6 months to 1 year,"August 12, 2013",45,"Depakote (divalproex sodium):I started up on 250mg and ended up at 1500mg.  I noticed very subtle effects if any.  Hard to remember, I went through a lot and was on Seroquel also at the time.  Seemed to have a slight calming effect.  However after time it raised my liver enzymes and lowered my platelet count (which is a potential side effect)  So I went off of it.  I don't have many hypomanic episodes and never a manic episode so I don't know why my dose got that high.  Didn't notice anything significant.  Gained 20 lbs, made me sick and tired.  Wasn't for me.",Patient67
178,Divalproex sodium,Bipolar Disorder,6.0,,"August 10, 2013",38,"Depakote (divalproex sodium):Could not afford Abilify out of pocket, started back on Depakote. I had no problem with gain weight. I do however find I tend to be a little more moody but less frequently. I take with bupropion XR. Seems to be a decent cocktail. Not too potent, and not under effective. I like how it does not create a sedative effect like antipsychotics.",fifi87
179,Divalproex sodium,Bipolar Disorder,8.0,Taken for 5 to 10 years,"July 25, 2013",41,Depakote (divalproex sodium):Has helped in manic episodes a little but still experience depressional relapses and moodiness.,braziej
180,Divalproex sodium,Bipolar Disorder,7.0,,"July 19, 2013",48,"Depakote (divalproex sodium):Have been  Bipolar since 89. I have been on Depakote for 9 years, 500 mg x 3. I went from 210lbs to 304lbs. I have been on just about everything over the years. A little bit lethargic, but this seems to have stabilized me the best.",mouseman76
181,Divalproex sodium,Bipolar Disorder,6.0,Taken for 2 to 5 years,"July 18, 2013",49,"Depakote (divalproex sodium):For mood stabilization, depakote worked out well for me, but it also helped me gain about 50 lbs! Once I started slowly switching off it, the pounds started coming off.",Brutalfashion
182,Divalproex sodium,Bipolar Disorder,8.0,Taken for less than 1 month,"June 2, 2013",38,Depakote (divalproex sodium):I've been on this for 3 weeks now. It has definitely helped my mania. But I'm still very depressed. I've been having very vivid nightmares. Which is strange because I take medicine for those. I also take Ambien and citolopram. I feel like that's a lot of chemicals in my body. I am a drinker but that hasn't seemed to affect anything. My side effects are pretty much exactly what I've been told and read up on. With the exception of the bad dreams. Blood work must be fine. Doc hasn't called. So far so good.,Rach88
183,Divalproex sodium,Bipolar Disorder,7.0,,"May 15, 2013",82,"Depakote (divalproex sodium):I've been on Depakote for almost a year now. I also take Paxil and Wellbutrin. I gained around 10lbs right from the start. My weight has seemed to have stayed steady the last few months. It's extremely hard to lose it. I have been through a lot of different medications to try and treat bipolar disorder. Even with the medicines I'm on, I'm still depressed and like I don't matter. I'm very sleepy and can lay down and take a nap at any time. I started taking B Complex because I stay so sleepy. My new concern is memory. I can't think of words and dates or names like movie stars very fast and it concerns me. ",Anne78
184,Divalproex sodium,Bipolar Disorder,8.0,,"April 25, 2013",62,"Depakote ER (divalproex sodium):I was recently hospitalized during a manic episode.  I have been treated for bipolar going on 20 years ( I'm 41). I have been on Zyprexa and other medicines for anxiety.  I am a rapid cycler (frequent manic episodes). I have tried all the meds from A-Z. It's been a awhile since I've tried Depakote, but it's the first thing they put me on in the hospital.  It's been 15 days I think it's ok, but when I lay down I feel like weights are holding me to the bed and I seem to get disorientated as to my location in the house ( weird right??). When I get up all is fine again. If anyone has experienced this please share, it would really help.  Let's face it ""regular"" people would freak just having this discussion.",Stacey M
185,Divalproex sodium,Bipolar Disorder,9.0,Taken for 5 to 10 years,"March 2, 2013",42,Depakote ER (divalproex sodium):Depakote ER is the only medicine I can take for my bi-polar. I have side effects to every medicine I've been on for bi-polar. I can't take the generic. It really bothers my stomach. It doesn't do much for depression. Anything I take for depression makes me manic. I have been on almost medications on the market. I have to learn to live with depression and work my hardest to accept it. I've been living with bi-polar for 38 years. I wish that the brand name wasn't so expensive. It's very hard for me to afford but it must come before food if necessary.,Kirdar
186,Divalproex sodium,Bipolar Disorder,10.0,,"March 1, 2013",70,"Depakote (divalproex sodium):I am on the 500 X 2 ER and people tell me I'm alot more calmer and they see the change, I guess I was on the depressed side of the spectrum. It may also be that I am on Celexa as well. At first I was severely drowsy, but after about seven months in it kicks in. As far as weight gain goes same there no changes. Hair loss? Was already losing it. I have been on lithium and that didn't work, tried Tegretrol as well, come to find out I am allergic, so if I can feel normal and blood tests on liver and kidney comes back fine, hey I will give Depakote 2 big thumbs up with a normal life.",jdk123777
187,Divalproex sodium,Bipolar Disorder,9.0,Taken for less than 1 month,"February 15, 2013",132,"Depakote (divalproex sodium):I have to say some of side effect's to DEPAKOTE ARE TOUGH!  But the SIDE EFFECTS TO MY CONDITION IS & could be way worse-  So I've been sticking to it & working through The SIDE EFFECTS. It's DEFINITELY a miracle pill-  I am only at 3 weeks but I've never felt calm- NO racing thoughts & I feel HAPPIER- & I only have LITTLE anxiety at this time. Before, most weeks I'd end up in ER 3 x's DUE TO A PANIC ATTACK. SIDE EFFECTS: headache, staring, head feels funny like a electric shock, nauseous. My lips & tongue are twitching. Instant cold & clammy feeling. BUT I LOVE THE CALMNESS & all theses side effects have gone away & I feel like I am living like I've never lived! This medicine is AMAZING.",MANIC MISTY :)
188,Divalproex sodium,Bipolar Disorder,5.0,Taken for 1 to 6 months,"January 19, 2013",39,"Depakote ER (divalproex sodium):It did help a bit, but you really have to watch out for side effects. I recommend starting a mood journal if you haven't already while taking this medicine. It made me very violent without realizing it.",Eli Kaito
189,Divalproex sodium,Bipolar Disorder,8.0,Taken for less than 1 month,"December 19, 2012",70,"Depakote (divalproex sodium):Just been diagnosed with Bi Polar Disorder after goodness knows how many years of episodes. Took my shrink the best part of 2 years to finally diagnose me after many different anti depressants, sleepless nights, racing thoughts, and wild partying till the early hours (sometimes on my own!!!). Just started on Depakote 3 weeks ago initally on 500mg per day which didn't help my mania, now on 500mg morning, and 500mg evening which calms me down, helps me sleep, deals with my irritability and mania, and generally slows me down. I have found that I get eye jolts ... fuzziness, but for the first time in 3 years (when it all started back up!), I am beginning to feel ""NORMAL"". We'll see how it goes.  My consultant has mentioned Lithium also.",Lindalouthenoo
190,Divalproex sodium,Bipolar Disorder,8.0,Taken for 10 years or more,"November 12, 2012",7,"I have bipolar 2. Been on this medicine at 500 mgs 2x daily for 12  years. I have not experienced weight gain. I have experienced some hair loss (not enough to be that noticeable as my hair is short and thick. I have experienced hand tremors. My treatment regimen includes gabapentin 200mgs 2x daily, Wellbutrin 150mgs morning and Imovane 0.75mgs at night for sleep. Apart from 2 major crashes approx. 5 years apart from each other this treatment regimen has kept me sane. I do still struggle with bouts of depression and anxiety but am able to cope. Up until past year I have been able to work full time and go to school part time. My treatment plan works for the most part. Tried other Meds but keep coming back to this.",Misslill
191,Divalproex sodium,Bipolar Disorder,9.0,,"October 15, 2012",61,"Depakote (divalproex sodium):This medication has kept me stable for 4 years. I am now 23 and was on 1000mgs at night. I recently went down as my bloodtests came back to high. So I went back down to 700mg and had another manic episode. I am now in the process of finding a antipsychotic to go with it. I have managed to stay 110 lbs for 4 years with a healthy diet and exercise. The only side effects I had were major hair loss, slight tremors, and nausea. All of which have passed within a year",Anonymous
192,Divalproex sodium,Bipolar Disorder,8.0,Taken for 5 to 10 years,"October 14, 2012",74,"Depakote (divalproex sodium):I am a female, first diagnosed at age 19 with bipolar disorder. They first tried Zyprexa which I had a horrible reaction to. The Depakote made me feel like a zombie for months, until it brought me back down to ""normal"". I stayed on approx 500 mg/day for almost 6 years, then backing down to 250mg until I stopped. I had started to feel depressed at 31 and was put on Lexapro, this led to a manic episode within a few months. Alas I am back on Depakote 500mg/ day. It has saved me. Luckily no significant weight gain besides 10 lbs I lost being manic!) but I do work out and try to eat healthy.",GlowChick
193,Divalproex sodium,Bipolar Disorder,9.0,,"October 3, 2012",70,"Depakote (divalproex sodium):Depakote has been a life saver for me. I take 250mg in the morning and 500mg at bedtime. Weight gain was minimal. 5 lbs that I have lost recently by going on the South Beach Diet. I also take 200mg Zoloft. I sleep okay, but usually need a nap in the afternoon. I look forward to my life now instead of just existing.",Anonymous
194,Divalproex sodium,Bipolar Disorder,7.0,,"June 20, 2012",51,"Depakote (divalproex sodium):Manic bi-polarism for 7  years.  Know I'm a type ""A"" person,  Depokote, Effexer, zanix.  I come from the medical field, lab and had seen people come in for blood work on everything from lithium to thorazine.  I have (with M.D. agreement) backed down from 500mg ER Depokote, to 250mg ER every evening along with a sleeping pill. The sleeping pill is new, so next time I will give the name.  When ""they"" found me, I was so gone into what we call our ""BLACK HOLE"". I truly have no idea what all they tried....BUT the Depakote, according to my wife (Nurse for 34 yrs)was my marriage and life saver.",Anonymous
195,Divalproex sodium,Bipolar Disorder,10.0,Taken for 6 months to 1 year,"June 17, 2012",5,"Divalproex 500 mg taken 2 times daily along with Welbutrin 75mg 2 times daily has been a life changer for me. I have tolerated both medication well. The divalproex did not cause any weight gain. In fact, with a better control of my mood I saw much better and more consistent workouts. I lost 5 to 10lbs. My physician started me on 500mg a day for a couple of weeks and then to 500mg 2 times daily to stabilize my mood before introducing the Wellbutrin. It was a 6 to 8 week process, but well worth it. I would highly recommend the combination to anyone with mild bipolar.",mdabandit
196,Divalproex sodium,Bipolar Disorder,6.0,Taken for 1 to 6 months,"June 14, 2012",42,"Depakote (divalproex sodium):I am 20 and on 750 mg of Depakote a day. Gained 10-15 pounds within the first month of taking this medication, but now my weight is remaining stable. I am eating healthier and running each day though. When I first started taking it, I was so restless/anxious, I had to pace around like mad. It took about 3 weeks to really end my mania in combination with 2 mg risperidone. I am experiencing easy bruising now. Sleeping 10 hours a night. Have an irregular period. In general I move more slowly. I am cloudy in the morning. I don't get upset with my family anymore.",Anonymous
197,Divalproex sodium,Bipolar Disorder,8.0,Taken for less than 1 month,"June 1, 2012",77,Depakote (divalproex sodium):I am 29 and just diagnosed with Bipolar after a horrible manic depression cycle. Its worked great to stablize my moods but I'm scared after reading everyone's weight gain stories! I will have to hitch up my diet and exercise plan more. One thing I noticed that I didn't see anyone else write is that I have these horrible and extremely vivid dreams - they seem to be my fears realized. But they are so vivid and real that they hang over me all day. Has anyone else experienced this?,Anonymous
198,Divalproex sodium,Bipolar Disorder,4.0,Taken for 1 to 6 months,"May 10, 2012",26,Depakote (divalproex sodium):I am currently on Depakote. I was put on Depakote while I was in the hospital after having an acute anger episode. It worked the at first but now I am getting highly irritable for no reason and am bruising easily and it is very unusual bruising. I want to get off of it because I am having a lot of episodes. More than ever before. I have been on Abilify and Prozac and now this. Nothings working that well.,RageFilledTeen
199,Divalproex sodium,Bipolar Disorder,7.0,Taken for 6 months to 1 year,"May 8, 2012",25,Depakote (divalproex sodium):Worked well to keep me stable but caused significant weight gain 50 pounds.,Katan
200,Divalproex sodium,Bipolar Disorder,8.0,,"January 22, 2012",23,Depakote (divalproex sodium):General tiredness with the medication but no manic episodes. I guess the trade-off is fair.,Anonymous
201,Divalproex sodium,Bipolar Disorder,8.0,,"December 16, 2011",22,Depakote (divalproex sodium):This has helped me for years. Had weight gain when first started but have identified the issues and work towards balancing.,efloyd105
202,Divalproex sodium,Bipolar Disorder,1.0,,"December 10, 2011",35,"Depakote (divalproex sodium):When I started this I was 135 pounds. When ended this I was 198 pounds. Went to the gym all the time, ate healthy and didn't eat fats and I still gained. And this was not working to stop me from sleeping too much. I was also on Seroquel that made me sleep like 12 to 14 hours. When the doctor took me off this I went from 198 and now I am 145 and went off Seroquel. Now I don't sleep too much.",Pepsigirl 1972
203,Divalproex sodium,Bipolar Disorder,3.0,,"December 6, 2011",26,"Depakote (divalproex sodium):I was prescribed this for a mood disorder they couldn't pin down (didn't know where on the bipolar spectrum I fell, I suppose) as well as sleeping issues.I became very jaded, too jaded. I didn't get any more sleep than usual, and my previously sun-sensitive skin is now showing minor allergic reactions to sunlight. I haven't been on it for years, and the allergy is still there.It did nothing for me and just made it harder for me to operate in the typically diurnal society of today. Not a positive experience.",semi-vampire
204,Divalproex sodium,Bipolar Disorder,8.0,,"December 3, 2011",50,"Depakote (divalproex sodium):Been on this medicine for more than ten years. The 8/10 is for it is due to its overall minor side effects over time, and its very powerful effects when not taken CONSISTENTLY. BE ADVISED. This medication works best when taken at the exact time(s) everyday and I have experienced all other symptoms people have described as bothersome but this is not the typical take it to be a walking zombie pill. I also don't think people realize how much they are moving when manic and when on this medication, you calm down. So it's completely natural to want to sit around all day and watch T.V. I also have gained weight and have difficulty shedding the pounds, however I would rather be SANE and curvy. I weighed 130lbs starting, NOW am 178lbs.",Anonymous
205,Divalproex sodium,Bipolar Disorder,8.0,,"November 24, 2011",44,"Depakote (divalproex sodium):I was diagnosed with bipolar type II almost 2 months ago at age 40. It was long over due.  My psychiatrist started me on Depakote 250 mg twice a day and Wellbutrin SR 150 mg in the morning. Also take trazodone or Ambien to sleep.  I can tell that my moods are much more stable on Depakote, no more hypomania and staying up a week at a time. It's a relief to get back to much more normal, but I do miss the hypomania in many ways (I work full time, have a family and go to graduate school for a double masters degree-- hypomania was great with those things at once).  I am still on Depakote 250 mg twice a day. Depakote will change my life as long as my body tolerates it. I'm trying to deal with the ravenous appetite. Up 10 lbs already.",elsrn
206,Divalproex sodium,Bipolar Disorder,1.0,,"November 21, 2011",20,"Depakote (divalproex sodium):After I started this medication, I gained 10 pounds in 2 weeks. After taking this for 3 months, I went from 212 to 265 pounds. I hadn't changed my eating habits, so I was annoyed that I had to work hard to lose the 53 pounds I gained on this medication. ",Anonymous
207,Divalproex sodium,Bipolar Disorder,1.0,,"November 18, 2011",33,"Depakote (divalproex sodium):I have been Bipolar for 20 years and have tried many medicines, with Depakote and Lithium being the worst. I also needed antidepressants too. I went from 117 lbs to 225 lbs in 2 years on Depakote and being a zombie I did not notice the huge weight gain. I switched to Lamictal and Effexor and felt so much better. I started a daily exercise program and was able to cut down on food and lost over 100 lbs within 2 years.",Anonymous
208,Divalproex sodium,Bipolar Disorder,7.0,,"November 4, 2011",38,Depakote (divalproex sodium):Depakote made some gain weight? It made me lose about 15 pounds all fat and I got chiseled abs I haven't had since 18. I stopped all substance intake including caffeine. ,erogla
209,Divalproex sodium,Bipolar Disorder,8.0,,"October 30, 2011",21,"Depakote (divalproex sodium):I was prescribed 1 week ago and seen an immediate improvement although I started feeling more anxious all day so I am now on Xanax instead of Klonopin, which I was originally on. I started with 500mg for 3 days then 1000 and now 1500 but I feel much more stable but I definitely feel hungry all the time. I was on Lamictal previously and I believe that made my disorder worse. I feel great now.",Anonymous
210,Divalproex sodium,Bipolar Disorder,6.0,,"October 24, 2011",40,"Depakote ER (divalproex sodium):I've been on DEpakote ER for about 7 years and regularly for 5 years before.   I am a rapid cycler I think.  Currently prescribed 2000mg/day (1000 in the morning and 1000 in the evening).  I notice weight gain (though could be due to less nightly manic behavior and age), some upset stomach at times, overall, I think it stabilizes me.   Caffeine does make me feel more alive when on ER.  Otherwise feel quite lethargic, apathetic, less motivated.  I tend to feel more like I am depressed when taking this medicine. Will look into combination of Anti-depressive.  ",whollottamanicactivityhere
211,Divalproex sodium,Bipolar Disorder,3.0,,"October 10, 2011",25,"Depakote (divalproex sodium):I am an active person with a healthy, gluten/dairy-free diet and within the first 2 months I gained nearly 40 pounds. I was crying all of the time, fatigued, and then my hair started falling out. It also lead to a suicide attempt.Depakote may work very well for some, but for me it was worse than disease. Aother downside was the cost. With insurance it was nearly 150.00 dollars a month.",pdxbridges
212,Divalproex sodium,Bipolar Disorder,1.0,,"August 21, 2011",25,"Depakote (divalproex sodium):I have been taking this medicine for 3 weeks.  During the three weeks I have experienced severe mood swings to the point of psychosis.  I have had irritability on a daily basis and worsening of depression.  The psychosis has made me stop taking the medicine.  I had been on Seroquel for years and because of a huge weight gain, I stopped taking it.  I don't know where to go from here.",Anonymous
213,Divalproex sodium,Bipolar Disorder,7.0,,"August 2, 2011",36,Depakote (divalproex sodium):I take 2500mg Depakote per day for rapid cycling bipolar disorder and it works very well. I've been taking this dose for 4 years. Few side effects apart from the inevitable weight gain and some hair loss. Depakote keeps the mood swings away for good and doesn't impair my movements or thoughts. I prefer this mood stabilizer. ,Aladdinsane
214,Divalproex sodium,Bipolar Disorder,10.0,,"July 12, 2011",35,"Depakote (divalproex sodium):I use Depakote 500 mg twice daily, and felt improvement in the first 10 days, my mood is stable and my severe anxiety has disappeared. Also I see improvement in OCD and I now can better focus. I'm also on Seroquel 100mg twice daily.",qwerty_lv
215,Divalproex sodium,Bipolar Disorder,7.0,,"July 11, 2011",34,"Depakote (divalproex sodium):I was finally diagnosed with bipolar disorder early this year after spending most of my life not knowing what was going on with me. I was prescribed Depakote at 750mg a day to start with. I'd never had any other medication so cannot compare it to anything else but without it I don't think I would be here now. I got that bad with my mood swings becoming so severe. Yes, I've put on a little weight but I'd rather that than go back to how I was. Yes at times I'm still hyper and then exhausted for a few days, still better than being erratic and bouncing off the walls for days/weeks on end. I know it wont work for everyone but I'm doing much better with it.",Eko moon
216,Divalproex sodium,Bipolar Disorder,,,"June 5, 2011",1,I find myself coming to your blog more and more often to the point where my visits are almost daily now!,cavapaidway
