,drug,condition,rating,duration,review_date,upvotes,review,username
0,Depakote,Epilepsy,1.0,Taken for 2 to 5 years,"March 31, 2022",0,"I'm epileptic I have been having seizures since my early teens I’m 52 now I was born with a tumor in my brain. The tumor has been removed but the damage of the scar tissue is causing me to have seizures. I have been taking Depakote 2000mg a day and I take with it Keppra 1000mg a day for 2 years and the side effects suck, I can’t sleep, I stutter, I’m always anxious and have tremors.  I have my ups and downs mood swings, I lost my hair, I’m easily angered or frustrated and nervous. I also have high blood pressure now and have to take high blood pressure meds. I smoke THC and CBD to help. I’m usually nauseous and I have digestive problems if you know what I mean. I still have seizures mainly blackouts I haven’t had a grandmal seizure for a bit. But I would like to know if anyone came down with high blood pressure when started taking the meds?",Eddie
1,Depakote,Epilepsy,1.0,Taken for less than 1 month,"February 22, 2022",0,"This is the worst drug I have ever taken. I started off with double vision, muscle weakness and unstability so I could not walk, and dizziness. I fell and broke three ribs. I had hallucinations, aggressive behavior, anxiety, mood changes and paranoia. I was in the hospital when all this happened and they kept giving it to me. I tried to escape the hospital and the goon squad stopped me. One night I was convinced I was going to be kidnapped.  I had to go to rehab to learn how to walk with a walker. The rehab doctor cut the dosage and my mental health improved. They kept giving me opiates for my back pain. I also had other side effects such as back pain, runny nose, difficulty sleeping and constipation. When I finally got home I quit taking this stuff. In about four weeks I was back to normal.",topaz1456
2,Depakote,Epilepsy,3.0,Taken for 1 to 6 months,"February 1, 2022",0,My son was keppra for four years. The keppra stopped working. So the neurologists prescribed depakote and now he won’t go to school. Two months. hBefore e was a happy and well adjusted boy.,Mom of 15 year
3,Depakote,Epilepsy,10.0,Taken for 10 years or more,"January 27, 2022",0,"I have been taking 1000mg daily (500mg every 12 hour), for 12 years since I was diagnosed with Idiopathic Epilepsy. I had both petit mal and grand mal seizures. This was the first medicine the doctor prescribed to me and it is working. The only time I had a seizure was when I tried reducing my dosage to half without talking to my doctor. Once I got back to my regular dosage I got no more seizures. I do consume chocolate and caffeinated tea liberally, coffee (no more than a cup a day) and occasionally alcohol (but never in large doses) and this has not caused any seizures in my case while taking this medicine. Although I do have a milder form of epilepsy and most certainly I do not recommend or believe that doing this is safe for every epilepsy patient, this could be very dangerous or fatal for some, I just know my limits well. I had mild side effects from this medicine, such as the occasional tremors when tired but nothing more. I am satisfied with it.",Anonymous
4,Depakote,Epilepsy,1.0,Taken for 1 to 6 months,"August 16, 2021",0,"WORST EXPERIENCE. I suffer with epilepsy and was prescribed this with various medications due to my active seizures that regularly happens 2-3 times a month when I was still in high school (age 14-18)This medication didn't help at all. Instead it messed up my mood. I was a teenager when I was first prescribed with it and it drove me crazy as I wasn't able to handle the side effects. My friends and teachers felt bad and most can tell the sudden mood changes when I'm taking it. One time the teacher actually thought I was consuming an illegal drug / alcohol. Side effects: 1. Didnt help with my seizure at all 2. Super Aggressive (Reduces depression but makes you aggressive) 3. Weird sleeping patterns 4. Bad memory. Really effects your memory 5. Increases heart rate and anxiety 6. Hallucinations For those suffering with epilepsy, I recommend another drug because I think depakote focuses more for moods (bipolar n depression) instead of seizures.",Mbap123
5,Depakote,Epilepsy,10.0,Taken for 10 years or more,"June 19, 2021",1,I have been on depakote since 1990. It is the one and only drug that has managed to stop my grandmal seizures. I had brain cancer in 1989 and was put on several other anti seizure medications that didn’t work or had horrific side effects  before finally being put on depakote. It has saved the quality of my life immensely. I highly recommend it.,Survivor89
6,Depakote,Epilepsy,4.0,,"November 15, 2020",10,"Lost a couple years if my life to this drug Depakote .  If you start acting irrationally, or you cognitive ability deteriorates, or you start shaking stop taking this drug.",Joe
7,Depakote,Epilepsy,10.0,Taken for 10 years or more,"November 2, 2020",3,Hi I been taking medication for past 17 years for a seizure disorder. I must say medication seems to work great very minimal episodes. Only side effect I had. Has been  severe hair loss.,Jm717
8,Depakote,Epilepsy,10.0,Taken for 10 years or more,"September 16, 2020",3,"I have had epilepsy for 40+ years now.  About 15 - 20 years ago, my neurologist switchedme from Dilantin, to Depakote, Zonegran, and Phenobarbital (I used to get fever con-vulsions.).   I have been seizure free since.",1teppy
9,Depakote,Epilepsy,1.0,Taken for 5 to 10 years,"September 10, 2020",12,"This drug Depakote gave me side effects I gained 50 lbs, hair fell out and tremors. Was put on it for migraines initially but after 2 years migraines turned into seizures. I question if the drug didn't cause my seizures.",TLN
10,Depakote,Epilepsy,5.0,,"July 25, 2020",1,Due to seizures I’ve been on different meds starting with Carbamazepine/Tegretol for 25yrs then a neurologist switched me to Keppra and Depakote. My question is to all who have taken these meds... have you ever been diagnosed with High Blood Pressure because of these meds.,Ep
11,Depakote,Epilepsy,10.0,,"June 30, 2020",8,Been on Valproic  Acid for 30 yrs.  No seizures.  Wouldn't go off it for anything.  No side effects.,Bluewater
12,Depakote,Epilepsy,6.0,Taken for 2 to 5 years,"May 20, 2020",15,If you want to lower your IQ 50 points take Depakote,Alex
13,Depakote,Epilepsy,6.0,Taken for 2 to 5 years,"April 30, 2020",7,I have been taking Depakote a while now I've been seizure free for years however I feel this drug has some side effects I feel depression can't sleep most nights . I'm thinking of talking to my doctor and get off this drug honestly I don't want any drug . I wanna try to go drug free and hope for the best.,Jb316
14,Depakote,Epilepsy,3.0,Taken for 1 to 6 months,"February 20, 2020",2,Not sure if this drug caused me to get into a car accident triggered by a dizzy spell or not. Initially doctors thought I was having seizures at age 53. I had to consult with three neurologists before one came to the conclusion I didn’t fit the clinical context of seizures. The only credible diagnosis seemed to be adrenal insufficiency causing blackouts. I may have had an underlying undiagnosed issue but would be very cautious with this drug.,Mr. Misdiagnosed
15,Depakote,Epilepsy,8.0,Taken for less than 1 month,"December 9, 2019",3,I just recently started taking Depakote for seizures. I was on keppra 1000mg 2x daily I was losing a lot of weight 150 to 129. I had a seizure that caused full body paralysis. Usually only happened on the left side of body. I suffered 2 strokes then started having seizures after 1 year ago. I was diagnosed with a blood disorder that causes clots hence the strokes. Then seizures. Neurologist diagnosed me with what they call Todd's Palsy then just recently had a bad seizure with black outs and full body paralysis she also diagnosed me with FND Functional Neurological disorder brain isn't sending right signals to tell my body parts what to do. Slow slurred speech. Memory issues word searching when speaking. So we changed med to Depikote as I was losing a lot of weight. I was a week away of signing my DNR. Because how thin I was. Mind u I'm only 48yrs old.,Rosco
16,Depakote,Epilepsy,,Taken for less than 1 month,"September 22, 2019",12,"I was on depakote when i was 16 or 17 for my epilepsy it was effective for my seizures but I started having hideous dark thoughts and was worreid about my own safety this was 2 weeks after starting depakote it really freaked me out. I told my parents and my doctors and they took me off of depakote as soon as it was out of my system these thoughts went away""",katiedee
17,Depakote,Epilepsy,,Taken for less than 1 month,"September 22, 2019",5,i was on depakote when i was 16 or 17 for my epilepsy i started having suicidal thoughts 2 weeks after starting depakote it really freaked me out. i told my parents and my doctors and they took me off of depakote as soon as it was out of my system the suicidal thoughts went away,katiedee
18,Depakote,Epilepsy,10.0,Taken for 10 years or more,"August 13, 2019",94,"I have been taking 1 Depakote 500mg ER Brand tablet daily for 28 years (I am 40). Used to treat Juvenile Myoclonic Epilepsy. This medication has been a tremendous blessing for me as it has controlled my seizures for the last 26 years. I’ve had no side effects but I will mention that I was very active as a child playing sports and continued to spend many hours a week lifting and exercising all through HS and college. I continue to exercise at least 3 days a week. I mention my exercise habits for a reason. I have noticed through the times when we had our children and I wasn’t getting good sleep and not able to exercise as much that I began to notice some possible side effects related to the medication( slight tremors, lethargy, remembering names) when I started back exercising all the side effects went away.  I am a practicing pharmacist and married with 2 healthy children.  I realize that my story may be somewhat unique but I decided to share to give another long term patient experience.",Philrx
19,Depakote,Epilepsy,1.0,Taken for 2 to 5 years,"April 24, 2019",10,Depakote causes extreme tremors and weight gain.  The first week I got off the med I lost 20 pounds.,joe
20,Depakote,Epilepsy,4.0,Taken for 1 to 2 years,"August 4, 2018",13,Makes me so drowsy all the time.  I'm on 1000mg a day. Gained 40 pounds. Affects my work and grad school. Slows down my brain and gives me anxiety. Icing on the cake is I’m balding now at age 24,Joey245
21,Depakote,Epilepsy,2.0,,"April 18, 2018",12,"I have been epileptic since birth. I have been on Depakote ER for over 20 years. I am now on 2500 mg a day(1000mg in the am and 1500 in the pm) for nearly a year at this dose. Thought there was just something wrong me not meaning my epilepsy meds or my epilepsy. I was reading all the comments here and I am definitely going to speak with my neurologist about taking me off my Depakote ER and possibly put a different epilepsy medicine. I was reading through here and many side effects others was or is having with Depakote. I was like oh my goodness that is the same as me. I have much confusion, literally loosing my memory, can't concentrate or focus, migraine headaches have got so bad since I been on this medicine - I cant remember a complete week with no migraines .Everything always so hazy looking, I still have seizures back though they didn't go away  the whole time of about 2 years of being on Depakote. I always feel weak and drained, tired all the time ,I switch back and forth from sleepin gway to much to being tired but not able to sleep at all.",Lisa
22,Depakote,Epilepsy,2.0,Taken for 5 to 10 years,"April 18, 2018",12,"Take 500 mg daily of Depakote. I have taken other epilepsy medications in the past that never caused symptoms quite like Depakote. Memory loss, tiredness, depression, if I forget to take it boom aura then seizure. Or a lot of times a bit after taking it boom severe auras. My doctor however still thinks this medication is the best fit for me. I don't think so. Absolutely hate the side effects of this medication.",Mary R
23,Depakote,Epilepsy,2.0,,"July 24, 2017",29,"I used to have a wonderful smart son.  About 12 years ago, I noticed changes starting to take affect in his life.  He was becoming agitated, he was loosing his memory, he had no energy.   I was told this was due to his having so many seizures.   I just this week, after having a really bad week a few weeks ago, the doctor decided to take him off of this medication in a hospital controlled setting.  After one day of not taking this medication, I am starting to see the personality of my son come back.  He had gotten to the point that he made terrible decisions, he was depressed often, he was confused and was loosing his memory and his ability to talk and remember words.   I'm sorry, but the benefits of controlling seizures was not worth this.",J A J
24,Depakote,Epilepsy,10.0,,"July 14, 2017",29,Have taken this med for 28+ years with no seizures during this time.  I have experienced no side effects except that my hair has become very curly.  Lots of compliments!  No down side.  I am seizure free.  No other med has worked for me.,Heroncrest
25,Depakote,Epilepsy,3.0,,"November 23, 2016",17,"It was bad. It made me gain weight. It made me have tremors ,which will never completely go away now.I couldn't hold plates or hold cups without shaking. My head started shaking. My new Neurologist took me off of them. I was on them for over 20 yrs. I would strongly think about other meds before taking this one considering the side affect can't go away immediately or not at all .",Annloss1970
26,Depakote,Epilepsy,1.0,,"July 21, 2016",35,"I have nothing good to say about this drug, zero. After doing some reading, it said that depakote normally is recommended in doses up to 1000 mg a day. I was taking 3000 mg a day for 20 years. My whole life was turned upside down by it. It affected my life in so many ways. First of all, at the dose I was taking, it had so many negative side effects, it was amazing I made it through college and graduated. The side effects at the dose I was taking were very severe. The side effects were depression, weight gain, foot drop, stuttering, tremor, and kept you in a constant haze. I had all these  exponentially worse than people who take smaller doses. This was the worst drug imaginable and should be banned by the FDA.",Shan 22
27,Depakote,Epilepsy,10.0,Taken for 1 to 6 months,"February 28, 2016",36,"This medicine took 3 weeks to fully kick in. I had the side effect of increased appetite, but I haven't gained any weight because I eat a low carb diet and workout 4 times a week. I do not have any side effects anymore and this mostly controls my temporal lobe epilepsy.",Anonymous
28,Depakote,Epilepsy,1.0,Taken for 5 to 10 years,"January 4, 2016",28,"I currently take Zonegran --I love love love it!!!---Prior to this I took Depakote--for me this drug sucked-- I was lethargic, my hair fell out in clumps I went from weighing 225lbs to 389lbs  and I developed Sleep apnea.  I was taking 500 mg of Depakote four times per day---2000mg of this stuff-- I had several seizures in my sleep one where I fractured my ankle on the bed frame. The weight was the worst I could not control it. I wish I could submit a picture of myself while being on this stuff. After I got off this drug I lost 160lbs. My dad saw the b4 pic and didn't know who I was. Maybe this works for some, but not for me I would never take this again!!!",Wildreign
29,Depakote,Epilepsy,6.0,,"October 15, 2015",24,"Be careful. My experience put me in the emergency room BUT my friend takes it and has had a fantastic experience. every person can have a different reaction, know the risks and definitely do a lot of research.",Katie Cl
30,Depakote,Epilepsy,10.0,Taken for 10 years or more,"September 30, 2015",35,"Before I came to the US I was taking other medications for epilepsy but upon dealing with a US doctor he recommended 2000 mg of Depakote daily. I immediately  went to the library and checked the side effects, which were considerable. I asked the doctor if I could take a smaller dose but he didn't think it wise. I decided to take matters into my own hands and reduce my dosage. I have been taking 250 mg now for 35 years with no seizures. Early on I found that when I took long flights to Asia and missed sleep and became dehydrated I would increase my dosage and then when I came back home I would slowly lower it again. I don't believe I am suffering from any side effects of this drug.",Nick351
31,Depakote,Epilepsy,7.0,,"September 20, 2015",16,"I was on Depakote for 1 year following 3 Grand Mal seizures that had been brought on by starting fluoxetine.  Fluoxetine, and most SSRIs, carry the risk of seizures.  They hit me hard and without warning, so I was on Depakote for a year after the final seizure and after stopping fluoxetine.  It does what it is supposed to do.  I had no more seizures; however, I gained over 20 lbs quickly.  The weight came back off once I was off the Depakote, but you will most likely put on weight with this medication.",APelicano
32,Depakote,Epilepsy,8.0,Taken for 10 years or more,"July 24, 2015",9,Can't afford to take it.  Its working I've been free of seizure for a long time ,James  McKee
33,Depakote,Epilepsy,4.0,Taken for 10 years or more,"June 13, 2015",21,"I gave this drug a 4 because of what it did to me, and what they didn't mention at the time, also because what it did to a friend of mines daughter, as far as a seizure drug and mood stabilizer a perfect drug.  controls most seizure in people. But I was on this drug for over 10 years . No one said it could affect my bone density at the time.  At 29 I got diagnosed with osteoporosis. I am not happy. I have multiple back issues now and spinal fractures. They did not heal correctly and I am in constant pain. I have to be on at least 3000mg Vitamin d3 for life.  My friend is older and her daughter was born with brain abnormalities",perky1983
34,Depakote,Epilepsy,10.0,Taken for 2 to 5 years,"March 4, 2015",28,"Hi, I'm 24 years old and I've been epileptic for about 12 years. I've seen my fair share of doctors and I was either too medicated or ignored, so remember, the doctor isn't always right. I recently found my current doctor about 3 years ago and she has gone above and beyond for me. I am currently seizure free and can drive. I currently take 1000mg Depakote ER a day 200 mg of Topamax a day to balance out the weight gain. I do have a slight problem with my hair, it won't grow, but that's okay.",Happygurl
35,Depakote,Epilepsy,10.0,,"August 26, 2014",40,"Started with Depakote upon being diagnosed with Juvenile Myoclonic Epilepsy in my teens.  I took it for years without issue.  I decided to switch to Keppra XR because of potential liver issues with Depakote and the somewhat tiresome redundancy of labwork related to Depakote use.  Keppra XR did not work for me as my memory began growing progressively worse and I could not think clearly.  I also began losing my train of thought mid sentence fairly often.  Switched back to Depakote ER, and am feeling much better mentally.  The quarterly labwork is not a big deal when compared to being in a mind fog for over a year.  That's my experience, hope everyone finds what's right for them.  P.S. I do not take generics, noticeably more side effects.",BuilderB
36,Depakote,Epilepsy,7.0,,"March 14, 2014",34,"Taking Depakote for grand mal seizures since I was 12. I'm 28 it has always worked unless I don't take it. It thinned out my hair, made me gain 15 lbs and makes me really tired.  I take 1000 mg a day. It is very toxic for your liver, you really should not drink on it! Working out helps with battling the tiredness. Hoping to switch to Lamictal again. I hate the side effects but it works great for grand mal seizures!",linseygrl75
37,Depakote,Epilepsy,,Taken for 10 years or more,"February 15, 2014",26,I was put on Depakote when I was 17 when I started to have seizures due to head trauma from a motorcycle accident. Initially my dose was higher I don't remember exactly how high but then I was lowered to Depakote ER 500mg once a day. As long as I took my medicine and didn't drink as much as before and got regular sleep I did not have any seizures. When I've ran out of the medication and went out and drank (like an idiot) I had a seizure the next day. This happened to me like 3 times but it's my own fault. Anyway as long as I take it daily and control any other factors that could cause a seizure I'm seizure free. I've never had a seizure while taking this. First side effects were slight hair loss which stopped. But I did gain weight.,hekhek26
38,Depakote,Epilepsy,5.0,Taken for 10 years or more,"August 16, 2013",20,I was on Depakote for many years and in 2001 I had a case of a high fever which was finally diagnosed as Drug Related Hepatitis after 3+ weeks in the hospital and having almost every test under the sun.  After I was taken off Depakote my fever went down and I lost approximately 15 pounds.,Anonymous
39,Depakote,Epilepsy,6.0,Taken for less than 1 month,"May 31, 2013",24,"I take this medicine for unexplained seizures. The doctor said they were caused by severe panic attacks. I don't know. It has helped a lot. But the side effects are terrible. Stomach burning, nausea, itching, drowsiness, and much more. I take 1000mg dose.",chandlaaz
40,Depakote,Epilepsy,10.0,,"March 9, 2013",18,Great. Has made seizures controlled.,Anonymous
41,Depakote,Epilepsy,9.0,Taken for 10 years or more,"January 16, 2013",35,"I have been on Depakote for 15 years, I have epilepsy juvenile myoclonic. No side effects for me. I really like this medicine. It makes me feel safe all the time.",NRu
42,Depakote,Epilepsy,8.0,Taken for 10 years or more,"November 16, 2012",27,"Hair loss, extreme fatigue, weight gain, hands trembling and sometimes ringing in ears.",JRM50
43,Depakote,Epilepsy,,Taken for 6 months to 1 year,"August 23, 2012",19,"On the morning of June 23nd, I awoke with a terrible seizure (my first). Throughout the day I got progressively worse, went into the doctors office and the following morning, had slipped into a deep coma. In this coma I apparently continued these seizures. Depakote was used through my nasogastric (NG) tube and it seemed to help a lot. My only issue now is some trembling which is more noticeable when I'm weaker or more tired. Overall, the use of this medicine has been very beneficial. ",Anonymous
44,Depakote,Epilepsy,8.0,,"November 22, 2011",8,"This medicine has been generally been quite effective in controlling my seizures, once I controlled for other factors like sleep, caffeine, etc.  I gained 10% or so of my body weight in the winter, but I'm pretty confident if I work harder I can reverse that (by more regular workouts and more careful fat and especially carb intake).  ",Anonymous
45,Depakote,Epilepsy,9.0,,"July 14, 2011",25,"I have taken Depakote for 13 years. Tried Dilantin and Lamictol at one point. They never fully stopped the seizure activity. Once I have learned to take my pills faithfully and have the correct dose it has become a HUGE BLESSING in my life. I am ""normal"". I have some of the side effect (weight gain, depression, hair falls out) but to me it is worth it to lead a normal functioning life. I also went through pregnancy on Depakote and I have a healthy 2 year old.",Anonymous
46,Depakote,Epilepsy,10.0,,"June 10, 2011",29,"I have used Depakote for the past 13 years now, 500 mg per day.  The only side effects were nausea and anxiety for the first day or two.  At that point, I was taking 1000 mg.  My neurologist pulled back the dosage to 750 mg and later 500 mg.  I've never had weight gain as a result of it and notice no ill effects with light drinking.  I did stop taking Depakote for about 6 months about 10 years ago and soon thereafter had a petit mal seizure.  I immediately went back on Depakote and haven't had an issue since.  Really couldn't be more satisfied with this medicine.",SFL
47,Depakote,Epilepsy,9.0,,"July 27, 2010",13,"I have no problems with this medicine not working, unless I forget to take my medicine! I am not sure if it causes you to have seizures - that you normally wouldn't have had, (if you hadn't forgotten your dose), or not? I think for me, yes it does. So, for myself, if I miss a few doses- a seizure is bound to happen!",sjm426
48,Depakote,Epilepsy,3.0,,"June 19, 2010",14,It made my hair fall out.,Anonymous
49,Depakote,Epilepsy,2.0,,"April 28, 2010",20,"Depakote was the first epilepsy medication I ever took, and it did work in controlling my seizures; I never had a single one while on it. However, every single ""lesser"" side effect on the drugs.com description sheet happened to me. I became depressed, I gained weight, my body clock went totally haywire, and my periods, which were already irregular, became even more so. I attributed most of this to me just being in middle school (I was in 7th grade at the time), but most of it stopped after my doctor switched me to Lamictal a few months later. ",Anonymous
50,Depakote,Epilepsy,8.0,,"March 26, 2010",18,"I was put on Depakote originally to control my seizures.  I loved it.   Then when I found out it also was used as a medicine for bipolar disorder, I was thrilled.  However, then the love affair ended.  My husband and I went to a Reproductive Endocrinologist  and found out that it commonly caused women to have Polycystic Ovarian Syndrome, or PCOS.  I now have it, and am taking medicine for diabetes, which PCOS can lead to.  I still wish that I could take it because it really helped with my seizures, and also helped with my bipolar disorder.",Anonymous
